stn_code,sampling_date,state,location,agency,type,so2,no2,rspm,spm,location_monitoring_station,pm2_5,date
1,1/9/2013,Uttar Pradesh,Agra,Central Pollution Control Board,Sensitive Area,2.0,35.0,216.0,,"Taj Mahal, Agra",,2013-09-01
1.0,1/5/1987,Uttar Pradesh,Agra,Central Pollution Control Board,Sensitive,10.9,30.7,,152.0,,,1987-05-01
10,1/2/1987,West Bengal,Howrah,West Bengal Pollution Control Board,Industrial,100.4,105.0,,643.0,,,1987-02-01
100,M011989,Gujarat,Ahmedabad,Gujarat Pollution Control Board,Industrial Area,70.3,67.9,,398.0,,,1989-01-01
10001.0,January - M011994,Tamil Nadu,Madras,TNPC,Industrial Area,138.6,15.8,,0.0,,,1994-01-01
10002.0,January - M011994,Tamil Nadu,Madras,TNPC,Industrial Area,26.9,13.5,,0.0,,,1994-01-01
10003.0,January - M011994,Tamil Nadu,Madras,TNPC,Industrial Area,14.5,15.4,,0.0,,,1994-01-01
101,M011989,Gujarat,Ahmedabad,Gujarat Pollution Control Board,Industrial Area,49.0,115.9,,274.0,,,1989-01-01
102,M011989,Gujarat,Ahmedabad,Gujarat Pollution Control Board,"Residential, Rural and other Areas",74.0,48.3,,339.0,,,1989-01-01
103,M011989,Gujarat,Ahmedabad,Gujarat Pollution Control Board,"Residential, Rural and other Areas",26.7,37.5,,289.0,,,1989-01-01
104.0,M091989,Bihar,Dhanbad,Bihar Pollution Control Board,"Residential, Rural and other Areas",25.7,25.8,,145.0,,,1989-09-01
105.0,M041989,Kerala,Cochin,Kerala Pollution Control Board,Industrial Area,3.1,32.1,,172.0,,,1989-04-01
106.0,M021989,Chandigarh,Chandigarh,Central Pollution Control Board,Industrial Area,16.7,47.8,,196.0,,,1989-02-01
107.0,M021989,Chandigarh,Chandigarh,Central Pollution Control Board,"Residential, Rural and other Areas",7.0,30.2,,194.0,,,1989-02-01
108.0,M021989,Chandigarh,Chandigarh,Central Pollution Control Board,"Residential, Rural and other Areas",16.7,63.0,,,,,1989-02-01
109,1/4/2011,Uttar Pradesh,Lucknow,Uttar Pradesh State Pollution Control Board,"Residential, Rural and other Areas",9.0,34.0,203.0,,"Kapoor Hotel, Hazratganj, Lucknow",,2011-04-01
109.0,M021989,Uttar Pradesh,Lucknow,Uttar Pradesh  Pollution Control Board,,20.5,,,414.0,,,1989-02-01
11,1/1/1987,West Bengal,Howrah,West Bengal Pollution Control Board,Industrial,26.9,72.9,,778.0,,,1987-01-01
110.0,M021989,Uttar Pradesh,Lucknow,Uttar Pradesh  Pollution Control Board,,2.5,,,183.0,,,1989-02-01
111.0,March - M031990,Uttar Pradesh,Lucknow,Uttar Pradesh  Pollution Control Board,,,,,1.0,,,1990-03-01
112.0,February - M021990,Uttar Pradesh,Lucknow,Uttar Pradesh  Pollution Control Board,,,,,447.0,,,1990-02-01
113,1/4/2011,Uttar Pradesh,Lucknow,Uttar Pradesh State Pollution Control Board,Industrial Area,10.0,37.0,150.0,,"Talkatora, Lucknow",,2011-04-01
113.0,M061989,Uttar Pradesh,Lucknow,Uttar Pradesh  Pollution Control Board,,,,,300.0,,,1989-06-01
114.0,M041989,Daman & Diu,Daman Diu & Nagar,Central Pollution Control Board,Industrial Area,,14.2,,157.0,,,1989-04-01
115.0,M011989,Daman & Diu,Daman Diu & Nagar,Central Pollution Control Board,"Residential, Rural and other Areas",1.8,3.5,,25.0,,,1989-01-01
116.0,M041989,Daman & Diu,Daman Diu & Nagar,Central Pollution Control Board,"Residential, Rural and other Areas",9.6,9.6,,180.0,,,1989-04-01
117,January - M011990,Himachal Pradesh,Paonta Sahib,Himachal Pradesh  Pollution Control Boar,Industrial Area,,25.2,,197.0,,,1990-01-01
118,January - M011990,Himachal Pradesh,Paonta Sahib,Himachal Pradesh  Pollution Control Boar,Industrial Area,4.2,9.9,,240.0,,,1990-01-01
119,April - M041990,Himachal Pradesh,Parwanoo,Himachal Pradesh  Pollution Control Boar,Industrial Area,6.7,3.9,,287.0,,,1990-04-01
120.0,January - M011991,Meghalaya,Shillong,MEPB,,1.7,20.5,,47.0,,,1991-01-01
121.0,January - M011991,Meghalaya,Shillong,MEPB,,9.3,23.5,,65.0,,,1991-01-01
122.0,June - M061990,Madhya Pradesh,Bhopal,Madhya Pradesh  Pollution Control Board,"Residential, Rural and other Areas",42.6,60.0,,743.0,,,1990-06-01
123.0,June - M061990,Madhya Pradesh,Bhopal,Madhya Pradesh  Pollution Control Board,Industrial Area,23.2,32.0,,386.0,,,1990-06-01
124.0,June - M061990,Madhya Pradesh,Bhopal,Madhya Pradesh  Pollution Control Board,"Residential, Rural and other Areas",22.5,37.6,,303.0,,,1990-06-01
125.0,June - M061990,Madhya Pradesh,Bhopal,Madhya Pradesh  Pollution Control Board,"Residential, Rural and other Areas",11.1,42.9,,97.0,,,1990-06-01
126.0,April - M041990,Madhya Pradesh,Indore,Madhya Pradesh  Pollution Control Board,"Residential, Rural and other Areas",14.1,19.5,,462.0,,,1990-04-01
127.0,April - M041990,Madhya Pradesh,Indore,Madhya Pradesh  Pollution Control Board,Industrial Area,22.7,30.5,,571.0,,,1990-04-01
128.0,April - M041990,Madhya Pradesh,Indore,Madhya Pradesh  Pollution Control Board,"Residential, Rural and other Areas",14.3,18.9,,427.0,,,1990-04-01
129.0,April - M041990,Madhya Pradesh,Satna,Madhya Pradesh  Pollution Control Board,"Residential, Rural and other Areas",,,,253.0,,,1990-04-01
13,1/1/1987,West Bengal,Haldia,CMEC,Residential,,38.2,,201.0,,,1987-01-01
130.0,April - M041990,Madhya Pradesh,Satna,Madhya Pradesh  Pollution Control Board,Industrial Area,,,,536.0,,,1990-04-01
131.0,April - M041990,Madhya Pradesh,Indore,Madhya Pradesh  Pollution Control Board,"Residential, Rural and other Areas",10.3,14.0,,419.0,,,1990-04-01
132,January - M011990,Himachal Pradesh,Parwanoo,Himachal Pradesh  Pollution Control Boar,"Residential, Rural and other Areas",,34.7,,105.0,,,1990-01-01
133.0,February - M021990,Maharashtra,Nagpur,,Industrial Area,23.3,49.2,,,,,1990-02-01
134.0,March - M031990,Maharashtra,Nagpur,,"Residential, Rural and other Areas",23.5,44.5,,,,,1990-03-01
135.0,March - M031990,Maharashtra,Nagpur,,Industrial Area,22.3,39.2,,,,,1990-03-01
136.0,March - M031990,Maharashtra,Nagpur,,Industrial Area,16.8,63.0,,353.0,,,1990-03-01
137.0,February - M021990,Maharashtra,Pune,,Industrial Area,22.9,71.9,,232.0,,,1990-02-01
138.0,March - M031990,Maharashtra,Pune,,"Residential, Rural and other Areas",8.6,32.3,,185.0,,,1990-03-01
139,17/01/2012,Uttar Pradesh,Gajraula,Uttar Pradesh State Pollution Control Board,"Residential, Rural and other Areas",28.0,32.0,108.5,,"Indira Chowk, J.P. Nagar, Gajraula",,2012-01-17
139.0,April - M041990,Uttar Pradesh,Gajroula,,"Residential, Rural and other Areas",24.0,7.5,,216.0,,,1990-04-01
14,1/9/1987,West Bengal,Haldia,CMEC,Industrial,,56.3,,340.0,,,1987-09-01
140,16/01/2012,Uttar Pradesh,Gajraula,Uttar Pradesh State Pollution Control Board,Industrial Area,21.0,35.0,83.0,,"Raunaq Auto Ltd, J.P. Nagar, Gajraula",,2012-01-16
140.0,April - M041990,Uttar Pradesh,Gajroula,,Industrial Area,33.0,12.3,,240.0,,,1990-04-01
141,7/11/2013,Uttar Pradesh,Kanpur,National Environmental Engineering Research Institute,"Residential, Rural and other Areas",9.0,17.0,115.0,,"Agriculture University, C.S. Azad Agriculatural University, Crop Physiological Departme",,2013-11-07
141.0,February - M021990,Uttar Pradesh,Kanpur,,"Residential, Rural and other Areas",4.2,7.1,,160.0,,,1990-02-01
142.0,February - M021990,Uttar Pradesh,Kanpur,,"Residential, Rural and other Areas",9.0,11.8,,469.0,,,1990-02-01
143.0,February - M021990,Uttar Pradesh,Kanpur,,Industrial Area,6.3,10.6,,320.0,,,1990-02-01
144,January - M011990,Delhi,Delhi,,"Residential, Rural and other Areas",34.2,52.1,,263.0,,,1990-01-01
145,January - M011990,Delhi,Delhi,,Industrial Area,21.7,36.0,,277.0,,,1990-01-01
146,January - M011990,Delhi,Delhi,,"Residential, Rural and other Areas",44.3,56.7,,393.0,,,1990-01-01
147.0,January - M011990,Kerala,Cochin,,"Residential, Rural and other Areas",8.3,11.6,,,,,1990-01-01
148.0,January - M011990,Kerala,Cochin,,"Residential, Rural and other Areas",7.7,7.8,,104.0,,,1990-01-01
149.0,January - M011990,Kerala,Cochin,,Industrial Area,9.8,6.4,,91.0,,,1990-01-01
15,1/3/1987,West Bengal,Haldia,CMEC,Industrial,97.9,108.9,,353.0,,,1987-03-01
150.0,February - M021990,Andhra Pradesh,Hyderabad,,"Residential, Rural and other Areas",4.8,17.4,,,,,1990-02-01
151.0,February - M021990,Andhra Pradesh,Hyderabad,,Industrial Area,3.1,7.0,,,,,1990-02-01
152.0,February - M021990,Andhra Pradesh,Hyderabad,,"Residential, Rural and other Areas",6.2,28.5,,,,,1990-02-01
153,February - M021990,Gujarat,Ahmedabad,NEER,"Residential, Rural and other Areas",17.2,6.5,,201.0,,,1990-02-01
154,February - M021990,Gujarat,Ahmedabad,,Industrial Area,41.8,8.0,,,,,1990-02-01
155,February - M021990,Gujarat,Ahmedabad,,"Residential, Rural and other Areas",52.4,12.1,,,,,1990-02-01
156.0,January - M011990,Rajasthan,Jaipur,,"Residential, Rural and other Areas",7.4,41.4,,403.0,,,1990-01-01
157.0,January - M011990,Rajasthan,Jaipur,,"Residential, Rural and other Areas",5.0,30.8,,265.0,,,1990-01-01
158.0,January - M011990,Rajasthan,Jaipur,,Industrial Area,5.5,21.0,,137.0,,,1990-01-01
159.0,January - M011990,Tamil Nadu,Madras,,"Residential, Rural and other Areas",20.8,31.2,,98.0,,,1990-01-01
16.0,1/2/1987,Rajasthan,Kota,Rajasthan Pollution Control Board,Residential,,,,77.0,,,1987-02-01
160.0,January - M011990,Tamil Nadu,Madras,,"Residential, Rural and other Areas",10.1,9.5,,88.0,,,1990-01-01
161.0,January - M011990,Tamil Nadu,Madras,,Industrial Area,20.6,17.0,,169.0,,,1990-01-01
162,April - M041990,West Bengal,Calcutta,,Industrial Area,24.1,26.7,,523.0,,,1990-04-01
163,April - M041990,West Bengal,Calcutta,,"Residential, Rural and other Areas",22.0,43.4,,372.0,,,1990-04-01
164,April - M041990,West Bengal,Calcutta,,"Residential, Rural and other Areas",14.7,16.2,,109.0,,,1990-04-01
165.0,January - M011990,Maharashtra,Nagpur,,Industrial Area,13.1,14.2,,190.0,,,1990-01-01
166.0,January - M011990,Maharashtra,Nagpur,,"Residential, Rural and other Areas",9.0,20.0,,362.0,,,1990-01-01
167.0,January - M011990,Maharashtra,Nagpur,,"Residential, Rural and other Areas",14.5,16.2,,,,,1990-01-01
168.0,March - M031990,Maharashtra,Bombay,,"Residential, Rural and other Areas",29.1,28.0,,286.0,,,1990-03-01
169.0,March - M031990,Maharashtra,Bombay,,"Residential, Rural and other Areas",24.9,55.9,,233.0,,,1990-03-01
17.0,1/1/1987,Rajasthan,Kota,Rajasthan Pollution Control Board,Industrial,,,,102.0,,,1987-01-01
170.0,January - M011990,Maharashtra,Bombay,,Industrial Area,105.0,49.7,,504.0,,,1990-01-01
171.0,August - M081990,Bihar,Jamshedpur,,Industrial Area,61.5,19.2,,107.0,,,1990-08-01
172.0,August - M081990,Bihar,Jamshedpur,,Industrial Area,18.4,13.4,,127.0,,,1990-08-01
173.0,August - M081990,Bihar,Jamshedpur,,"Residential, Rural and other Areas",72.6,32.4,,99.0,,,1990-08-01
174.0,August - M081990,Bihar,Jamshedpur,,"Residential, Rural and other Areas",82.2,50.1,,153.0,,,1990-08-01
175.0,July - M071990,Maharashtra,Pune,,Industrial Area,16.2,26.8,,195.0,,,1990-07-01
176.0,January - M011991,Punjab,Jalandhar,Punjab Pollution Control Board,,22.0,60.9,,84.0,,,1991-01-01
177.0,January - M011991,Punjab,Jalandhar,Punjab Pollution Control Board,,31.0,78.0,,111.0,,,1991-01-01
178.0,January - M011991,Punjab,Jalandhar,Punjab Pollution Control Board,,,,,81.0,,,1991-01-01
179.0,June - M061991,Kerala,Trivendrum,Kerala Pollution Control Board,,1.9,6.5,,103.0,,,1991-06-01
18.0,21-01-87,Rajasthan,Kota,Rajasthan Pollution Control Board,Sensitive,,,,42.0,,,1987-01-21
180.0,June - M061991,Kerala,Trivendrum,Kerala Pollution Control Board,,4.6,6.0,,112.0,,,1991-06-01
181.0,June - M061991,Kerala,Trivendrum,Kerala Pollution Control Board,,3.1,10.4,,74.0,,,1991-06-01
182.0,June - M061991,Kerala,Trivendrum,Kerala Pollution Control Board,,2.6,10.2,,86.0,,,1991-06-01
184,14-01-10,Jammu & Kashmir,Jammu,Jammu & Kashmir State Pollution Control Board,"Residential, Rural and other Areas",9.0,17.0,85.0,,"Regional Office, Jammu",,2010-01-14
185.0,May - M051991,Kerala,Kozhikode,Kerala Pollution Control Board,,6.6,20.9,,121.0,,,1991-05-01
186.0,May - M051991,Kerala,Kozhikode,Kerala Pollution Control Board,,12.5,33.3,,277.0,,,1991-05-01
187.0,January - M011991,Kerala,Kotttayam,Kerala Pollution Control Board,"Residential, Rural and other Areas",,,,231.0,,,1991-01-01
188.0,April - M041991,Kerala,Kottayam,Kerala Pollution Control Board,Industrial Area,4.8,60.4,,557.0,,,1991-04-01
189,March - M031991,Gujarat,Vapi,Gujarat Pollution Control Board,,17.4,20.1,,286.0,,,1991-03-01
19.0,1/1/1987,Rajasthan,Kota,Rajasthan Pollution Control Board,Industrial,,,,70.0,,,1987-01-01
190,March - M031991,Gujarat,Vapi,Gujarat Pollution Control Board,,36.2,22.6,,368.0,,,1991-03-01
191.0,April - M041991,Uttar Pradesh,Varanasi,Uttar Pradesh  Pollution Control Board,,37.2,73.2,,1234.0,,,1991-04-01
192.0,January - M011991,Uttar Pradesh,Varanasi,Uttar Pradesh  Pollution Control Board,,,,,,,,1991-01-01
193.0,January - M011991,Assam,Guwahati,ASPB,,14.0,22.6,,43.0,,,1991-01-01
194.0,January - M011991,Assam,Guwahati,ASPB,,8.0,17.3,,69.0,,,1991-01-01
195.0,January - M011991,Assam,Guwahati,ASPB,,13.6,7.5,,28.0,,,1991-01-01
196,January - M011991,Haryana,Yamuna Nagar,Haryana Pollution Control Board,Industrial Area,,,,277.0,,,1991-01-01
198.0,March - M031991,Madhya Pradesh,Jabalpur,Madhya Pradesh  Pollution Control Board,Industrial Area,8.9,20.6,,172.0,,,1991-03-01
199.0,January - M011992,Madhya Pradesh,Jabalpur,Madhya Pradesh  Pollution Control Board,,5.3,57.4,,0.0,,,1992-01-01
2.0,1/9/1987,Uttar Pradesh,Agra,Uttar Pradesh Pollution Control Board,Residential,14.8,,,373.0,,,1987-09-01
20.0,1/2/1987,Rajasthan,Kota,Rajasthan Pollution Control Board,Residential,,,,175.0,,,1987-02-01
200.0,January - M011992,Madhya Pradesh,Korba,Madhya Pradesh  Pollution Control Board,,14.6,11.6,,0.0,,,1992-01-01
20001.0,January - M011994,Tamil Nadu,Tuticorin,TNPC,Industrial Area,,8.0,,0.0,,,1994-01-01
20005.0,January - M011994,Tamil Nadu,Tuticorin,TNPC,Industrial Area,,7.2,,0.0,,,1994-01-01
20006.0,January - M011994,Tamil Nadu,Tuticorin,TNPC,Industrial Area,,5.5,,0.0,,,1994-01-01
201.0,January - M011992,Madhya Pradesh,Korba,Madhya Pradesh  Pollution Control Board,,10.2,5.9,,0.0,,,1992-01-01
202.0,January - M011992,Andhra Pradesh,Hyderabad,Andhra Pradesh  Pollution Control Board,,14.6,4.4,,190.0,,,1992-01-01
203.0,January - M011992,Andhra Pradesh,Hyderabad,Andhra Pradesh  Pollution Control Board,,35.8,12.5,,261.0,,,1992-01-01
205.0,September - M091991,Tamil Nadu,Tuticorin,Tamil Nadu Pollution Control Board,,,,,194.0,,,1991-09-01
206.0,December - M121991,Tamil Nadu,Tuticorin,Tamil Nadu Pollution Control Board,,8.2,5.4,,47.0,,,1991-12-01
207.0,December - M121991,Tamil Nadu,Tuticorin,Tamil Nadu Pollution Control Board,,8.0,12.4,,44.0,,,1991-12-01
208.0,November - M111991,Uttar Pradesh,Kanpur,Uttar Pradesh  Pollution Control Board,,16.8,13.6,,374.0,,,1991-11-01
209.0,May - M051991,Uttar Pradesh,Kanpur,Uttar Pradesh  Pollution Control Board,,5.3,9.2,,436.0,,,1991-05-01
21,5/2/1987,Gujarat,Surat,Gujarat Pollution Control Board,Residential,6.7,6.9,,167.0,,,1987-02-05
210.0,April - M041991,Bihar,Patna,Bihar Pollution Control Board,,17.5,24.1,,256.0,,,1991-04-01
211.0,August - M081991,Bihar,Patna,Bihar Pollution Control Board,,18.7,26.4,,221.0,,,1991-08-01
212,1/2/2012,Uttar Pradesh,Kanpur,Uttar Pradesh State Pollution Control Board,"Residential, Rural and other Areas",7.34,45.15,184.18,,"Forest & Training Centre, Kidwai Nagar, Kanpur",,2012-02-01
212.0,January - M011993,Uttar Pradesh,Kanpur,Uttar Pradesh  Pollution Control Board,,21.4,17.7,,,,,1993-01-01
213.0,February - M021992,Maharashtra,Chandarpur,Maharashtra Pollution Control Board,,14.8,45.0,,,,,1992-02-01
214.0,April - M041992,Maharashtra,Chandarpur,Maharashtra Pollution Control Board,,12.5,38.4,,,,,1992-04-01
215.0,January - M011993,Uttar Pradesh,"Noida, Ghaziabad",Uttar Pradesh  Pollution Control Board,,,,,530.0,,,1993-01-01
216.0,January - M011994,Uttar Pradesh,"Noida, Ghaziabad",Uttar Pradesh  Pollution Control Board,,,,,591.0,,,1994-01-01
217.0,January - M011992,Assam,Guwahati,ASPB,,38.3,67.3,,160.0,,,1992-01-01
218.0,January - M011992,Assam,Guwahati,ASPB,,4.5,10.6,,33.0,,,1992-01-01
219.0,March - M031992,Rajasthan,Alwar,Rajasthan Pollution Control Board,,14.0,90.7,,192.0,,,1992-03-01
22,18-05-87,Gujarat,Surat,Gujarat Pollution Control Board,Industrial,7.9,8.9,,164.0,,,1987-05-18
220,May - M051992,Gujarat,Vapi,Gujarat Pollution Control Board,,35.2,23.8,,160.0,,,1992-05-01
221,August - M081992,Gujarat,Vapi,Gujarat Pollution Control Board,,,,,82.0,,,1992-08-01
222.0,October - M101992,Madhya Pradesh,Raipur,Madhya Pradesh  Pollution Control Board,,61.8,32.2,,176.0,,,1992-10-01
223.0,14-01-10,Chhattisgarh,Raipur,Chattisgarh Environment Conservation Board,Industrial Area,19.0,49.0,,,M/S Wool Worth India Pvt. Ltd. Sarora Raipur,,2010-01-14
224.0,January - M011993,Uttar Pradesh,Ghaziabad,Uttar Pradesh  Pollution Control Board,,,,,166.0,,,1993-01-01
225.0,January - M011993,Uttar Pradesh,Ghaziabad,Uttar Pradesh  Pollution Control Board,,,,,190.0,,,1993-01-01
226.0,January - M011992,Odisha,Rourkela,Orissa Pollution Control Board,,10.2,44.5,,308.0,,,1992-01-01
227.0,January - M011992,Odisha,Rourkela,Orissa Pollution Control Board,,7.6,29.1,,214.0,,,1992-01-01
228.0,September - M091992,Odisha,Rourkela,Orissa Pollution Control Board,,1.5,0.0,,0.0,,,1992-09-01
229.0,May - M051992,Odisha,Rourkela,Orissa Pollution Control Board,,24.0,29.7,,155.0,,,1992-05-01
23,5/5/1987,Gujarat,Surat,Gujarat Pollution Control Board,Residential,8.1,18.5,,580.0,,,1987-05-05
230.0,April - M041993,Maharashtra,Pune,Maharashtra Pollution Control Board,,25.7,36.7,,,,,1993-04-01
231.0,January - M011992,Odisha,Nalco,Orissa Pollution Control Board,,,,,339.0,,,1992-01-01
232.0,January - M011992,Andhra Pradesh,Vishakhapatnam,Andhra Pradesh  Pollution Control Board,,52.6,89.6,,679.0,,,1992-01-01
233.0,January - M011992,Andhra Pradesh,Vishakhapatnam,Andhra Pradesh  Pollution Control Board,,55.8,33.8,,245.0,,,1992-01-01
234.0,January - M011992,Andhra Pradesh,Vishakhapatnam,Andhra Pradesh  Pollution Control Board,,33.4,31.7,,320.0,,,1992-01-01
235.0,June - M061992,Dadra & Nagar Haveli,Daman,Central Pollution Control Board,,5.2,6.1,,75.0,,,1992-06-01
237.0,January_1995,Tamil Nadu,Coimbatore,Tamil Nadu Pollution Control Board,,6.0,16.0,,55.0,,,1995-01-01
238.0,February_1995,Tamil Nadu,Coimbatore,Tamil Nadu Pollution Control Board,,5.1,15.8,,78.0,,,1995-02-01
239.0,September - M091994,Tamil Nadu,Tuticorin,Tamil Nadu Pollution Control Board,,3.7,17.8,,80.0,,,1994-09-01
240.0,September - M091994,Tamil Nadu,Tuticorin,Tamil Nadu Pollution Control Board,,6.4,20.9,,68.0,,,1994-09-01
241.0,January - M011992,Andhra Pradesh,Vishakhapatnam,Andhra Pradesh  Pollution Control Board,,43.6,30.8,,334.0,,,1992-01-01
242.0,July - M071992,Assam,Guwahati,ASPB,,,,,8.0,,,1992-07-01
243.0,March - M031992,Rajasthan,Alwar,Andhra Pradesh  Pollution Control Board,,14.5,119.9,,476.0,,,1992-03-01
244.0,May_1995,Punjab,Patiala,Punjab Pollution Control Board,,,,,,,,1995-05-01
245.0,1/2/2010,Chhattisgarh,Bhilai,Chattisgarh Environment Conservation Board,Industrial Area,14.0,32.0,169.0,,"M.P. Laghu Udyog Nigam, Bhilai",,2010-02-01
246,December - M121993,Goa,Panjim,Goa Pollution Control Board,,16.2,32.8,,,,,1993-12-01
246.0,1/1/2010,Madhya Pradesh,Nagda,Madhya Pradesh State Pollution Control Board,"Residential, Rural and other Areas",26.7,30.2,100.0,149.0,"Grasim Kalyan Kendra, Nagda",,2010-01-01
247,October - M101993,Gujarat,Bharuch,Gujarat Pollution Control Board,,5.7,6.9,,,,,1993-10-01
247.0,1/2/2004,Madhya Pradesh,Bhopal,Madhya Pradesh State Pollution Control Board,"Residential, Rural and other Areas",5.2,10.2,35.0,60.0,"Government Nutan Subhash Higher Sec. School, T.T. Nagar, Bhopal",,2004-02-01
248,October - M101993,Gujarat,Bharuch,Gujarat Pollution Control Board,,1.7,49.7,,,,,1993-10-01
248.0,1/2/2004,Madhya Pradesh,Jabalpur,Madhya Pradesh State Pollution Control Board,"Residential, Rural and other Areas",2.0,13.2,248.0,83.0,"Vijay Nagar, Jabalpur",,2004-02-01
249.0,October - M101993,Chhattisgarh,Korba,Chattisgarh Environment Conservation Board,"Residential, Rural and other Areas",10.4,6.4,,,,,1993-10-01
250.0,June - M061993,Rajasthan,Alwar,Rajasthan Pollution Control Board,,37.4,76.5,,,,,1993-06-01
252,April - M041993,Gujarat,Ankleshwar,Gujarat State Pollution Control Board,Industrial Area,26.4,13.8,,,,,1993-04-01
253,April - M041993,Gujarat,Ankleshwar,Gujarat State Pollution Control Board,"Residential, Rural and other Areas",17.8,22.7,,,,,1993-04-01
254.0,December - M121993,Maharashtra,Aurangabad,Maharashtra State Pollution Control Board,,7.8,13.7,,147.0,,,1993-12-01
255.0,December - M121993,Maharashtra,Aurangabad,Maharashtra State Pollution Control Board,,15.1,14.5,,123.0,,,1993-12-01
256,July - M071993,Gujarat,Rajkot,Gujarat State Pollution Control Board,Industrial Area,0.5,1.5,,,,,1993-07-01
257,August - M081993,Gujarat,Rajkot,Gujarat State Pollution Control Board,Industrial Area,14.7,5.4,,,,,1993-08-01
258,1/3/2012,Uttar Pradesh,Ghaziabad,Uttar Pradesh State Pollution Control Board,Industrial Area,31.0,42.0,246.0,,"M/s Atlas Cycles Industries Ltd, Sahibabad Industrial Area, Ghaziabad",,2012-03-01
258.0,February - M021993,Uttar Pradesh,Ghaziabad,Uttar Pradesh State Pollution Control Board,Industrial Area,,,,173.0,,,1993-02-01
259.0,July - M071994,Maharashtra,Nashik,"K.R.T.Arts,B.H.Commerce and A.M. Science College","Residential, Rural and other Areas",14.3,25.7,,90.0,,,1994-07-01
260.0,January_1995,Tamil Nadu,Coimbatore,Tamilnadu State Pollution Control Board,"Residential, Rural and other Areas",1.1,2.7,,32.0,,,1995-01-01
261.0,January - M011996,Tamil Nadu,Coimbatore,TNPC,Industrial Area,0.0,0.2,,9.0,,,1996-01-01
263.0,February - M021994,Chandigarh,Chandigarh,Chandigarh Pollution Control Committee,"Residential, Rural and other Areas",4.6,17.7,,209.0,,,1994-02-01
264.0,June - M061994,Chandigarh,Chandigarh,Chandigarh Pollution Control Committee,"Residential, Rural and other Areas",1.4,18.1,,147.0,,,1994-06-01
265.0,January_1995,Maharashtra,Dombivli,Maharashtra State Pollution Control Board,Industrial Area,,,,,,,1995-01-01
266.0,December - M121994,Maharashtra,Dombivli,MAPB,,54.5,21.0,,,,,1994-12-01
267.0,April - M041994,Maharashtra,Chandrapur,Maharashtra State Pollution Control Board,"Residential, Rural and other Areas",13.9,34.6,,190.0,,,1994-04-01
268,January_1995,Himachal Pradesh,Damtal,Himachal Pradesh State Environment Proection & Pollution Control Board,"Residential, Rural and other Areas",,,,169.0,,,1995-01-01
269.0,April - M041994,Maharashtra,Nashik,MAPB,Industrial Area,15.7,20.1,,393.0,,,1994-04-01
270.0,April - M041994,Maharashtra,Nashik,MAPB,,6.9,21.7,,90.0,,,1994-04-01
271,January_1995,Himachal Pradesh,Damtal,Himachal Pradesh State Environment Proection & Pollution Control Board,"Residential, Rural and other Areas",,,,258.0,,,1995-01-01
272.0,January_1995,Rajasthan,Jodhpur,RPCB,"Residential, Rural and other Areas",38.1,37.6,,372.0,,,1995-01-01
273.0,December - M121993,Rajasthan,Jodhpur,Rajasthan State Pollution Control Board,"Residential, Rural and other Areas",46.6,50.6,,,,,1993-12-01
274.0,January_1995,Rajasthan,Jodhpur,Rajasthan State Pollution Control Board,Industrial Area,35.1,38.5,,339.0,,,1995-01-01
275,December - M121994,Haryana,Dharuhera,Haryana State Pollution Control Board,Industrial Area,37.8,32.1,,339.0,,,1994-12-01
276.0,June - M061994,Uttar Pradesh,Lucknow,UPPB,,23.5,22.5,,322.0,,,1994-06-01
277.0,June - M061994,Uttar Pradesh,Lucknow,UPPB,,22.5,21.1,,300.0,,,1994-06-01
278.0,January - M011994,Uttar Pradesh,Noida,UPPB,,,,,491.0,,,1994-01-01
279.0,August - M081994,Rajasthan,Alwar,RJPB,,17.6,69.2,,231.0,,,1994-08-01
280.0,June - M061996,Maharashtra,Nashik,"K.R.T.Arts,B.H.Commerce and A.M. Science College","Residential, Rural and other Areas",15.4,16.0,,190.0,,,1996-06-01
281.0,December - M121994,Maharashtra,Chandrapur,Maharashtra State Pollution Control Board,Industrial Area,59.5,65.8,,80.0,,,1994-12-01
282.0,November - M111994,Maharashtra,Pune,ESPU,,8.1,8.5,,79.0,,,1994-11-01
283.0,December - M121994,Maharashtra,Pune,ESPU,,31.4,15.0,,204.0,,,1994-12-01
284.0,September_1995,Bihar,Patna,Bihar Sate Pollution Control Board,"Residential, Rural and other Areas",37.8,39.6,,424.0,,,1995-09-01
287.0,January_1995,Maharashtra,Nagpur,Visveshwaraya National Institute Of Technology,"Residential, Rural and other Areas",12.9,20.4,,226.0,,,1995-01-01
288.0,January_1995,Maharashtra,Nagpur,Visveshwaraya National Institute Of Technology,Industrial Area,20.9,23.8,,152.0,,,1995-01-01
289.0,January_1995,Maharashtra,Nagpur,VRCE,"Residential, Rural and other Areas",17.2,21.6,,275.0,,,1995-01-01
29.0,10/3/1987,Kerala,Cochin,Kerala Pollution Control Board,Industrial,,2.9,,,,,1987-03-10
290.0,January - M011996,Maharashtra,Pune,ESPU,Industrial Area,42.6,49.3,,230.0,,,1996-01-01
291.0,May_1995,Rajasthan,Chittorgarh,RJPB,Industrial Area,,,,,,,1995-05-01
293.0,February_1995,Rajasthan,Udaipur,Rajasthan State Pollution Control Board,"Residential, Rural and other Areas",,,,213.0,,,1995-02-01
294.0,February_1995,Rajasthan,Udaipur,Rajasthan State Pollution Control Board,"Residential, Rural and other Areas",,,,258.0,,,1995-02-01
295.0,February_1995,Rajasthan,Udaipur,Rajasthan State Pollution Control Board,Industrial Area,,,,474.0,,,1995-02-01
296.0,January_1995,Rajasthan,Jaipur,Rajasthan State Pollution Control Board,"Residential, Rural and other Areas",9.0,30.0,,176.0,,,1995-01-01
297.0,January_1995,Rajasthan,Jaipur,Rajasthan State Pollution Control Board,Industrial Area,9.6,37.3,,175.0,,,1995-01-01
298.0,January_1995,Rajasthan,Jaipur,Rajasthan State Pollution Control Board,"Residential, Rural and other Areas",5.3,27.7,,151.0,,,1995-01-01
299.0,January - M011997,Maharashtra,Solapur,"Walchand Institute of Technology, Solapur",Industrial Area,22.7,41.4,,251.0,,,1997-01-01
3.0,1/1/1987,Uttar Pradesh,Agra,Uttar Pradesh Pollution Control Board,Industrial,16.1,,,141.0,,,1987-01-01
30.0,4/5/1988,Kerala,Cochin,Kerala Pollution Control Board,Industrial Area,,,,79.0,,,1988-05-04
300.0,January - M011997,Maharashtra,Solapur,"Walchand Institute of Technology, Solapur","Residential, Rural and other Areas",21.1,56.8,,262.0,,,1997-01-01
30001.0,January - M011994,Tamil Nadu,Coimbatore,TNPC,Industrial Area,8.6,22.1,,0.0,,,1994-01-01
30003.0,January - M011994,Tamil Nadu,Coimbatore,TNPC,Industrial Area,0.0,23.8,,0.0,,,1994-01-01
30004.0,January - M011994,Tamil Nadu,Coimbatore,TNPC,Industrial Area,,,,0.0,,,1994-01-01
301.0,January - M011996,Punjab,Gobindgarh,Punjab State Pollution Control Board,Industrial Area,23.9,42.6,,485.0,,,1996-01-01
302.0,January - M011996,Punjab,Gobindgarh,Punjab State Pollution Control Board,"Residential, Rural and other Areas",25.2,44.2,,505.0,,,1996-01-01
303.0,January - M011998,Maharashtra,Thane,Thane Municipal Corporation,"Residential, Rural and other Areas",27.5,19.0,,217.0,,,1998-01-01
304.0,January - M011998,Maharashtra,Thane,Thane Municipal Corporation,"Residential, Rural and other Areas",41.0,43.4,,427.0,,,1998-01-01
305.0,January - M011998,Maharashtra,Thane,Thane Municipal Corporation,Industrial Area,23.7,49.0,,164.0,,,1998-01-01
306.0,January - M011998,Tamil Nadu,Madurai,Tamilnadu State Pollution Control Board,"Residential, Rural and other Areas",,30.6,,100.0,,,1998-01-01
307.0,January - M011998,Tamil Nadu,Madurai,Tamilnadu State Pollution Control Board,Industrial Area,7.9,16.5,,158.0,,,1998-01-01
308.0,January - M011998,Tamil Nadu,Madurai,Tamilnadu State Pollution Control Board,"Residential, Rural and other Areas",6.6,26.7,,351.0,,,1998-01-01
309.0,February - M021998,Tamil Nadu,Salem,Tamilnadu State Pollution Control Board,"Residential, Rural and other Areas",20.2,8.9,,167.0,,,1998-02-01
31.0,4/5/1988,Kerala,Cochin,Kerala Pollution Control Board,Industrial Area,,,,88.0,,,1988-05-04
311.0,January - M011999,Kerala,Palakkad,Kerala State Pollution Control Board,Industrial Area,5.2,8.4,,124.0,,,1999-01-01
312.0,June - M061999,Maharashtra,Pune,University of Pune,Industrial Area,17.8,24.1,,165.0,,,1999-06-01
313.0,June - M061999,Maharashtra,Pune,Maharashtra Pollution Control Board,,37.8,48.0,,158.0,,,1999-06-01
314.0,July - M071999,Maharashtra,Nagpur,Visveshwaraya National Institute Of Technology,"Residential, Rural and other Areas",6.2,13.6,,88.0,,,1999-07-01
317.0,1/6/2003,Nagaland,Dimapur,Nagaland State Pollution Control Board,"Residential, Rural and other Areas",,,115.0,209.0,,,2003-06-01
318.0,1/6/2003,Nagaland,Dimapur,Nagaland State Pollution Control Board,"Residential, Rural and other Areas",,,86.0,189.0,,,2003-06-01
319,August - M082002,Gujarat,Jamnagar,Gujarat State Pollution Control Board,"Residential, Rural and other Areas",18.2,18.9,,169.0,,,2002-08-01
32.0,4/5/1988,Kerala,Cochin,Kerala Pollution Control Board,Industrial Area,,,,98.0,,,1988-05-04
320.0,1/4/2010,Rajasthan,Udaipur,Rajasthan State Pollution Control Board,"Residential, Rural and other Areas",5.06,40.41666667,112.0,318.3333333,"Ambamata, Udaipur.",,2010-04-01
321.0,1/2/2010,Rajasthan,Udaipur,Rajasthan State Pollution Control Board,Industrial Area,6.197499999999999,32.605,119.0,,"Regional Office,MIA,Udaipur",,2010-02-01
322.0,1/1/2004,Odisha,Bhubaneswar,Odisha State Pollution Control Board,"Residential, Rural and other Areas",2.0,21.08,123.67,175.33,"SPCB Building, Bhubaneshwar",,2004-01-01
323,1/3/2013,Uttar Pradesh,Agra,Uttar Pradesh State Pollution Control Board,"Residential, Rural and other Areas",10.0,17.0,235.0,,"Regional Office, Bodla, Agra",,2013-03-01
323.0,1/1/2004,Uttar Pradesh,Agra,Uttar Pradesh State Pollution Control Board,"Residential, Rural and other Areas",9.0,10.0,,10.0,"Regional Office, Bodla, Agra",,2004-01-01
324,1/1/2013,Uttar Pradesh,Agra,Uttar Pradesh State Pollution Control Board,Industrial Area,10.0,21.0,224.0,,"Nunhai, Agra",,2013-01-01
324.0,1/2/2004,Uttar Pradesh,Agra,Uttar Pradesh State Pollution Control Board,Industrial Area,9.0,9.6,,9.0,"Nunhai, Agra",,2004-02-01
325.0,1/2/2004,Rajasthan,Kota,Rajasthan State Pollution Control Board,"Residential, Rural and other Areas",6.0,35.0,123.0,162.0,"Samcore Glass Ltd., Kota",,2004-02-01
326.0,1/3/2004,Rajasthan,Kota,Rajasthan State Pollution Control Board,"Residential, Rural and other Areas",6.0,35.0,140.0,225.0,"Municipal Corporation Building, Kota",,2004-03-01
327,1/5/2004,Goa,Panaji,Goa State Pollution Control Board,"Residential, Rural and other Areas",2.0,24.7,,207.0,"Infront of Old GSPCB premises, Patto, Panaji, Goa",,2004-05-01
328.0,1/3/2011,Karnataka,Mysore,Karnataka State Pollution Control Board,Industrial Area,12.0,26.0,43.0,,"KSPCB Bldg. Hebbal Ind. Area, Mysore",,2011-03-01
33.0,4/5/1988,Kerala,Cochin,Kerala Pollution Control Board,,,,,88.0,,,1988-05-04
330,1/2/2004,Haryana,Faridabad,Haryana State Pollution Control Board,"Residential, Rural and other Areas",8.7,25.7,174.0,297.0,"Regional Office, Haryana State Pollution Control Board",,2004-02-01
331,1/6/2004,Haryana,Faridabad,Haryana State Pollution Control Board,Industrial Area,8.8,27.8,180.0,307.0,"Shivalic Global Industries, Faridabad",,2004-06-01
332,1/12/2004,Jharkhand,Jharia,Jharkhand State Pollution Control Board,Industrial Area,13.0,69.7,233.0,245.0,"M.A.D.A., Jharia",,2004-12-01
332.0,4/6/2010,Jharkhand,Jharia,Jharkhand State Pollution Control Board,Industrial Area,17.52,41.43,257.98,316.82,"M.A.D.A., Jharia",,2010-06-04
333,1/4/2010,Gujarat,Vadodara,Gujarat State Pollution Control Board,"Residential, Rural and other Areas",21.0,37.0,78.0,,"Dandia Bazaar, Vadodara",,2010-04-01
334,1/1/2010,Gujarat,Vadodara,Gujarat State Pollution Control Board,Industrial Area,24.0,42.0,139.0,,"CETP Nandesari, Vadodara",,2010-01-01
335.0,1/1/2004,Punjab,Ludhiana,Punjab State Pollution Control Board,"Residential, Rural and other Areas",23.0,56.0,364.0,,"PPCB Office Building, Ludhiana",,2004-01-01
337.0,1/1/2004,Puducherry,Pondicherry,Puducherry Pollution Conrol Committee,"Residential, Rural and other Areas",24.0,18.0,32.0,41.0,"Chamber Of Commerce, Pondicherry",,2004-01-01
338.0,1/4/2010,Kerala,Kochi,Kerala State Pollution Control Board,"Residential, Rural and other Areas",3.0,16.0,39.0,,"Ernakulum South, Kochi",,2010-04-01
339,1/1/2004,Himachal Pradesh,Parwanoo,Himachal Pradesh State Environment Proection & Pollution Control Board,Industrial Area,3.0,16.0,,200.0,"AC Office Building, Parwanoo",,2004-01-01
34,9/1/1987,Himachal Pradesh,Shimla,Himachal Pradesh  Pollution Control Boar,Sensitive,,,,142.0,,,1987-01-09
340.0,1/7/2004,Meghalaya,Shillong,Meghalaya State Pollution Control Board,"Residential, Rural and other Areas",3.8,24.8,91.0,119.0,"State Tuberculosis Hospital, Shillong",,2004-07-01
342.0,1/4/2010,Madhya Pradesh,Satna,Madhya Pradesh State Pollution Control Board,"Residential, Rural and other Areas",2.7,6.3,124.0,161.0,"Regional Office MPPCB,Dharwari GaliNo.5,House No.318, Satna",,2010-04-01
343.0,1/4/2010,Madhya Pradesh,Satna,Madhya Pradesh State Pollution Control Board,Industrial Area,2.9,6.5,232.0,280.0,"Sub-divisional Office E/M Light Machniery, Satna",,2010-04-01
345,1/4/2011,Delhi,Delhi,National Environmental Engineering Research Institute,Industrial Area,23.0,52.0,219.0,,"Mayapuri Industrial Area, Delhi",,2011-04-01
346.0,1/6/2010,Kerala,Kochi,National Environmental Engineering Research Institute,"Residential, Rural and other Areas",13.0,19.0,88.0,,"CSIR Complex, Kochi",,2010-06-01
347,1/5/2010,Gujarat,Ahmedabad,National Environmental Engineering Research Institute,"Residential, Rural and other Areas",13.0,18.0,66.0,,"AZL Behrampura, Ahmadabad",,2010-05-01
348,1/4/2011,West Bengal,Kolkata,National Environmental Engineering Research Institute,"Residential, Rural and other Areas",37.0,84.0,179.0,,"Kasba, Kolkata",,2011-04-01
349.0,1/1/2004,Maharashtra,Mumbai,National Environmental Engineering Research Institute,"Residential, Rural and other Areas",,,,106.7,"Worli, Mumbai",,2004-01-01
35,9/1/1987,Himachal Pradesh,Shimla,Himachal Pradesh  Pollution Control Boar,Residential,,,,295.0,,,1987-01-09
351,1/2/2004,Jharkhand,Jamshedpur,Jharkhand State Pollution Control Board,Industrial Area,49.0,56.0,211.0,412.0,"Bistupur Vehical Testing Centre, Jamshedpur",,2004-02-01
351.0,1/2/2010,Jharkhand,Jamshedpur,Jharkhand State Pollution Control Board,Industrial Area,36.0,48.0,169.0,,"Bistupur Vehical Testing Centre, Jamshedpur",,2010-02-01
353.0,1/4/2010,Punjab,Jalandhar,Punjab State Pollution Control Board,"Residential, Rural and other Areas",12.0,22.0,143.0,,"Municipal Council Tubewell No. 27, Jalandhar",,2010-04-01
355.0,5/2/2011,Punjab,Jalandhar,Punjab State Pollution Control Board,Industrial Area,10.7,23.3,152.0,,"M/s Punjab Maltex Pvt. Ltd. Sports and Surgical Complex, Kapurthala Road, Jalandhar",,2011-02-05
357.0,1/4/2010,Kerala,Thiruvananthapuram,Kerala State Pollution Control Board,Industrial Area,18.1,20.62,86.33,96.33333333,"HiTech Chackai, Thiruvananthapuram",,2010-04-01
358.0,14-01-10,Kerala,Thiruvananthapuram,Kerala State Pollution Control Board,"Residential, Rural and other Areas",6.67,31.5,48.0,56.66666667,"Sasthamangalam, Thiruvananthapuram",,2010-01-14
359.0,1/1/2010,Kerala,Kozhikode,Kerala State Pollution Control Board,Industrial Area,2.0,13.55,30.0,70.66666667,"Nallalam, Kozhikode",,2010-01-01
36,3/2/1987,Goa,Ponda,Goa Pollution Control Board,,1.1,6.0,,59.0,,,1987-02-03
360.0,1/1/2010,Kerala,Kozhikode,Kerala State Pollution Control Board,"Residential, Rural and other Areas",2.0,8.85,42.33333333,81.33333333,"Kozhikode City, Kozhikode",,2010-01-01
361.0,1/5/2010,Kerala,Kottayam,Kerala State Pollution Control Board,Industrial Area,4.65,14.90333333,35.1,36.96666667,Vadavathoor,,2010-05-01
362,1/3/2011,Uttar Pradesh,Varanasi,Uttar Pradesh State Pollution Control Board,"Residential, Rural and other Areas",17.0,19.0,133.0,,"Regional Office, Jawahar Nagar, Varanasi.",,2011-03-01
362.0,1/1/2004,Uttar Pradesh,Varanasi,Uttar Pradesh State Pollution Control Board,"Residential, Rural and other Areas",14.0,16.0,105.0,222.0,"Regional Office, Jawahar Nagar, Varanasi.",,2004-01-01
364.0,19-01-04,Chhattisgarh,Korba,Chattisgarh Environment Conservation Board,"Residential, Rural and other Areas",13.7,20.3,178.0,186.0,"HIG 21,22.Near Ghantaghar, M.P. Extension, Korba",,2004-01-19
365.0,1/2/2004,Andhra Pradesh,Hyderabad,Andhra Pradesh State Pollution Control Board,"Residential, Rural and other Areas",2.8,12.3,57.0,131.0,Jublee Hills Hyderabad,,2004-02-01
366.0,1/4/2011,Tamil Nadu,Thoothukudi,Tamilnadu State Pollution Control Board,"Residential, Rural and other Areas",6.0,9.0,71.0,,"AVM Jewellery Building, Tuticorin",,2011-04-01
367,1/8/2004,Gujarat,Vapi,Gujarat State Pollution Control Board,Industrial Area,18.56,33.52,148.0,182.0,"GEB, IIIrd Phase, GIDC, Vapi",,2004-08-01
368.0,1/12/2010,Chhattisgarh,Raipur,Chattisgarh Environment Conservation Board,"Residential, Rural and other Areas",15.0,45.0,334.0,,"New HIG-9, Hirapur, Raipur",,2010-12-01
369,1/2/2012,Uttar Pradesh,Ghaziabad,Uttar Pradesh State Pollution Control Board,Industrial Area,29.0,36.0,224.5,,"Bulandshaar Road Industrial Area, Ghaziabad",,2012-02-01
369.0,1/2/2004,Uttar Pradesh,Ghaziabad,Uttar Pradesh State Pollution Control Board,Industrial Area,,35.0,,35.0,"Bulandshaar Road Industrial Area, Ghaziabad",,2004-02-01
37,24-03-87,Goa,Vasco,Goa Pollution Control Board,Industrial,1.2,14.3,,,,,1987-03-24
370.0,1/1/2004,Odisha,Rourkela,Odisha State Pollution Control Board,"Residential, Rural and other Areas",3.83,9.42,89.0,154.33,"Regional Office, ORPB, Rourkela",,2004-01-01
371.0,1/1/2004,Andhra Pradesh,Visakhapatnam,Andhra Pradesh State Pollution Control Board,"Residential, Rural and other Areas",12.0,33.0,78.0,129.0,"Police Barracks, Visakhapatnam",,2004-01-01
372.0,1/1/2004,Rajasthan,Alwar,Rajasthan State Pollution Control Board,"Residential, Rural and other Areas",7.0,16.0,145.0,294.0,"Regional Office, Rajasthan State Pollution Control Board, Alwar",,2004-01-01
373.0,1/3/2004,Rajasthan,Alwar,Rajasthan State Pollution Control Board,Industrial Area,6.0,12.0,171.0,249.0,"Gaurav Solvex Ltd. MIA, Alwar",,2004-03-01
374,1/1/2010,Gujarat,Rajkot,Gujarat State Pollution Control Board,"Residential, Rural and other Areas",11.0,15.0,50.0,,"Regional Offce, Rajkot",,2010-01-01
375.0,1/6/2010,Tamil Nadu,Coimbatore,Tamilnadu State Pollution Control Board,"Residential, Rural and other Areas",,,88.0,120.5,"Poniarajapuram, On the top of DEL, Coimbatore",,2010-06-01
376.0,1/2/2004,Rajasthan,Jodhpur,Rajasthan State Pollution Control Board,"Residential, Rural and other Areas",5.0,16.0,112.0,307.0,Maha Mandir Police Thane. Jodhpur.,,2004-02-01
377,1/3/2011,Uttar Pradesh,Lucknow,Uttar Pradesh State Pollution Control Board,"Residential, Rural and other Areas",8.0,33.0,207.0,,"Mahanagar, Lucknow",,2011-03-01
377.0,1/2/2004,Uttar Pradesh,Lucknow,Uttar Pradesh State Pollution Control Board,"Residential, Rural and other Areas",18.9,32.8,170.0,281.0,"Mahanagar, Lucknow",,2004-02-01
378,1/3/2011,Uttar Pradesh,Noida,Uttar Pradesh State Pollution Control Board,Industrial Area,9.0,45.0,147.0,,"Gee-Pee Electroplating and Engineering Works, NOIDA.",,2011-03-01
378.0,1/2/2004,Uttar Pradesh,Noida,Uttar Pradesh State Pollution Control Board,Industrial Area,13.9,159.0,55.0,76.0,"Gee-Pee Electroplating and Engineering Works, NOIDA.",,2004-02-01
379.0,1/2/2004,Maharashtra,Pune,University of Pune,"Residential, Rural and other Areas",34.0,93.0,588.0,238.0,"Nal Stop, Pune",,2004-02-01
38.0,27-01-87,Tamil Nadu,Madras,Tamil Nadu Pollution Control Board,Industrial,0.5,0.3,,82.0,,,1987-01-27
381.0,1/1/2004,Maharashtra,Pune,University of Pune,"Residential, Rural and other Areas",30.0,80.0,495.0,202.0,"Swargate, Pune",,2004-01-01
382,1/3/2004,Jharkhand,Jamshedpur,Jharkhand State Pollution Control Board,Industrial Area,41.0,51.0,209.0,378.0,"Golmuri Vehicle Testing Centre, Jamshedpur",,2004-03-01
382.0,1/4/2010,Jharkhand,Jamshedpur,Jharkhand State Pollution Control Board,Industrial Area,38.0,50.0,166.0,,"Golmuri Vehicle Testing Centre, Jamshedpur",,2010-04-01
383,5/4/2004,West Bengal,Durgapur,West Bengal State Pollution Control Board,Industrial Area,,57.5,186.7,402.3,"Dew India Limited, PCBL More, Durgapur",,2004-04-05
384,5/4/2004,West Bengal,Durgapur,West Bengal State Pollution Control Board,Industrial Area,,63.7,135.3,249.7,"Kwality Hotel, Benachiti, Durgapur",,2004-04-05
385,5/4/2004,West Bengal,Durgapur,West Bengal State Pollution Control Board,"Residential, Rural and other Areas",,34.5,115.3,217.3,"PCBL Club, Biddhanagar, Durgapur",,2004-04-05
386,5/4/2004,West Bengal,Asansol,West Bengal State Pollution Control Board,Industrial Area,,72.6,200.0,314.7,"Asansol Municipal Corporation, Asansol",,2004-04-05
387.0,6/1/2004,Andhra Pradesh,Visakhapatnam,Andhra Pradesh State Pollution Control Board,Sensitive Area,11.0,30.0,82.0,122.0,"INS-Virabahu, Naval Area, Visakhapatnam",,2004-01-06
388.0,6/1/2004,Andhra Pradesh,Visakhapatnam,Andhra Pradesh State Pollution Control Board,"Residential, Rural and other Areas",8.0,30.0,75.0,119.0,"Seethammadhara, Visakhapatnam",,2004-01-06
389.0,1/2/2010,Andhra Pradesh,Tirupati,Andhra Pradesh State Pollution Control Board,Sensitive Area,4.0,9.0,33.0,,"Regional Science Centre, Chittoor Bypass Road, Tirupati",,2010-02-01
39.0,4/1/1987,Karnataka,Mysore,Karnataka Pollution Control Board,Residential,19.8,,,61.0,,,1987-01-04
390,1/4/2010,Haryana,Hisar,Haryana State Pollution Control Board,"Residential, Rural and other Areas",7.0,6.0,136.0,,"Urban Estate - II, Hissar",,2010-04-01
391,1/4/2012,Uttar Pradesh,Kanpur,Uttar Pradesh State Pollution Control Board,"Residential, Rural and other Areas",5.0,21.0,234.0,,"Dabauli, Kanpur",,2012-04-01
391.0,19-04-04,Uttar Pradesh,Kanpur,Uttar Pradesh State Pollution Control Board,"Residential, Rural and other Areas",6.0,17.0,169.0,269.0,"Dabauli, Kanpur",,2004-04-19
392.0,10/7/2011,Punjab,Jalandhar,Punjab State Pollution Control Board,Industrial Area,13.7,23.8,119.0,,"Focal Point, Jalandhar",,2011-07-10
393.0,31-05-04,Andhra Pradesh,Hyderabad,Andhra Pradesh State Pollution Control Board,"Residential, Rural and other Areas",2.7,27.5,87.0,308.0,"Paradise, Hyderabad",,2004-05-31
394.0,31-05-04,Andhra Pradesh,Hyderabad,Andhra Pradesh State Pollution Control Board,"Residential, Rural and other Areas",2.9,21.0,101.0,365.3,"Charminar, Hyderabad",,2004-05-31
395,1/3/2012,Uttar Pradesh,Kanpur,Uttar Pradesh State Pollution Control Board,Industrial Area,6.72,29.57,210.07,,"Jajmau,Kanpur",,2012-03-01
395.0,7/1/2004,Uttar Pradesh,Kanpur,Uttar Pradesh State Pollution Control Board,Industrial Area,11.0,22.0,134.0,224.0,"Jajmau,Kanpur",,2004-01-07
396.0,1/2/2010,Maharashtra,Chandrapur,Maharashtra State Pollution Control Board,"Residential, Rural and other Areas",57.0,75.0,65.0,167.0,"Nagar Parishad, Chandrapur",,2010-02-01
397,1/5/2011,Uttar Pradesh,Lucknow,Uttar Pradesh State Pollution Control Board,"Residential, Rural and other Areas",9.0,34.0,205.0,,"Aminabad, Lucknow",,2011-05-01
397.0,9/1/2004,Uttar Pradesh,Lucknow,Uttar Pradesh State Pollution Control Board,"Residential, Rural and other Areas",16.3,28.7,162.0,264.0,"Aminabad, Lucknow",,2004-01-09
398,1/3/2011,Uttar Pradesh,Lucknow,Uttar Pradesh State Pollution Control Board,"Residential, Rural and other Areas",8.0,31.0,196.0,,"Chandganj Garden, Lucknow",,2011-03-01
398.0,12/3/2004,Uttar Pradesh,Lucknow,Uttar Pradesh State Pollution Control Board,"Residential, Rural and other Areas",19.1,36.7,,356.0,"Chandganj Garden, Lucknow",,2004-03-12
399,1/1/2013,Uttar Pradesh,Firozabad,Uttar Pradesh State Pollution Control Board,Industrial Area,13.0,35.0,231.0,,"Center for Development of Glass Industry ( CDGI), Firozabad",,2013-01-01
399.0,9/3/2004,Uttar Pradesh,Firozabad,Uttar Pradesh State Pollution Control Board,Industrial Area,26.7,39.2,,33.0,"Center for Development of Glass Industry ( CDGI), Firozabad",,2004-03-09
4.0,1/2/1987,Uttar Pradesh,Agra,Uttar Pradesh  Pollution Control Board,Residential,17.0,,,150.0,,,1987-02-01
40.0,4/10/1987,Karnataka,Mysore,Karnataka Pollution Control Board,Industrial,27.3,21.3,,84.0,,,1987-10-04
400,1/2/2013,Uttar Pradesh,Firozabad,Uttar Pradesh State Pollution Control Board,"Residential, Rural and other Areas",14.0,33.0,239.0,,"Tilak Nagar, Firozabad",,2013-02-01
400.0,9/1/2004,Uttar Pradesh,Firozabad,Uttar Pradesh State Pollution Control Board,"Residential, Rural and other Areas",20.0,30.8,,25.0,"Tilak Nagar, Firozabad",,2004-01-09
401,1/3/2013,Uttar Pradesh,Firozabad,Uttar Pradesh State Pollution Control Board,"Residential, Rural and other Areas",13.0,35.0,295.0,,"Raza ka Tal, Firozabad",,2013-03-01
401.0,9/2/2004,Uttar Pradesh,Firozabad,Uttar Pradesh State Pollution Control Board,"Residential, Rural and other Areas",10.7,46.0,,28.0,"Raza ka Tal, Firozabad",,2004-02-09
402,9/3/2004,Jharkhand,Ranchi,Jharkhand State Pollution Control Board,"Residential, Rural and other Areas",16.0,,187.0,231.0,"Albert Ekka Chowk, Main Road, Ranchi",,2004-03-09
402.0,1/2/2010,Jharkhand,Ranchi,Jharkhand State Pollution Control Board,"Residential, Rural and other Areas",21.0,37.0,225.0,,"Albert Ekka Chowk, Main Road, Ranchi",,2010-02-01
403,1/4/2011,Uttar Pradesh,Noida,Uttar Pradesh State Pollution Control Board,"Residential, Rural and other Areas",10.0,48.0,165.0,,"Regional Office, UP Pollution Control Board, E-12/1, Sector - 1, Noida",,2011-04-01
403.0,10/5/2004,Uttar Pradesh,Noida,Uttar Pradesh State Pollution Control Board,"Residential, Rural and other Areas",30.7,30.7,,31.0,"Regional Office, UP Pollution Control Board, E-12/1, Sector - 1, Noida",,2004-05-10
404.0,9/3/2004,Karnataka,Bangalore,Karnataka State Pollution Control Board,Industrial Area,18.0,64.0,38.33,106.0,"KHB Industrial Area, Near R.R. Founders, Yelahanka, Bangalore",,2004-03-09
405.0,25-09-04,Karnataka,Bangalore,Karnataka State Pollution Control Board,Industrial Area,23.0,34.0,74.0,146.0,"Peenya Industrial Area, Bangalore",,2004-09-25
406.0,15-09-04,Karnataka,Bangalore,Karnataka State Pollution Control Board,Sensitive Area,8.0,50.0,77.33,136.0,"Victoria Hospital, Bangalore",,2004-09-15
407.0,20-08-04,Chhattisgarh,Korba,Chattisgarh Environment Conservation Board,"Residential, Rural and other Areas",15.2,23.3,230.0,263.0,"I.T.I., Rampur, Korba",,2004-08-20
408.0,1/4/2010,Rajasthan,Jaipur,Rajasthan State Pollution Control Board,"Residential, Rural and other Areas",6.0,40.0,323.0,433.0,"Office of District Education Officer, Chandpole, Jaipur",,2010-04-01
409.0,1/3/2010,Rajasthan,Jaipur,Rajasthan State Pollution Control Board,"Residential, Rural and other Areas",5.4700000000000015,37.64,398.0,567.0,"Regional Office ( North), RSPCB, Vidyadhar Nagar, Jaipur",,2010-03-01
41.0,27-03-87,Karnataka,Mysore,Karnataka Pollution Control Board,Industrial,19.1,9.4,,51.0,,,1987-03-27
410.0,1/1/2010,Rajasthan,Jaipur,Rajasthan State Pollution Control Board,Industrial Area,5.659999999999998,31.51,83.0,119.0,"RIICO Office, M.I.A., Jaipur",,2010-01-01
411.0,1/1/2010,Rajasthan,Jodhpur,Rajasthan State Pollution Control Board,"Residential, Rural and other Areas",5.15,20.51666667,109.33333329999999,387.0,"Office of Housing Board, Chopasani Road, Jodhpur",,2010-01-01
412.0,1/7/2010,Rajasthan,Jodhpur,Rajasthan State Pollution Control Board,"Residential, Rural and other Areas",6.433333333000001,24.31666667,145.0,330.6666667,"Shastri Nagar Police Thana, Jodhpur",,2010-07-01
413.0,1/2/2010,Rajasthan,Jodhpur,Rajasthan State Pollution Control Board,Industrial Area,6.5,24.81666667,117.66666670000001,341.3333333,"DIC Office, Industrial Estate, Jodhpur",,2010-02-01
414,3/1/2010,Haryana,Hisar,Haryana State Pollution Control Board,"Residential, Rural and other Areas",2.0,5.0,96.0,,"Guru Jambehswar University,Hissar",,2010-01-03
415,1/9/2013,Uttar Pradesh,Agra,Central Pollution Control Board,Sensitive Area,2.0,48.0,348.0,,"DIC Nunhai, Agra",,2013-09-01
415.0,1/2/2011,Uttar Pradesh,Agra,Central Pollution Control Board,Sensitive Area,2.0,24.0,260.0,,"DIC Nunhai, Agra",,2011-02-01
416,1/9/2013,Uttar Pradesh,Agra,Central Pollution Control Board,Sensitive Area,2.0,36.0,149.0,,"Etmad-uddaulah, Agra",,2013-09-01
416.0,1/1/2011,Uttar Pradesh,Agra,Central Pollution Control Board,Sensitive Area,2.0,22.0,143.0,,"Etmad-uddaulah, Agra",,2011-01-01
417,13-01-13,Uttar Pradesh,Agra,Central Pollution Control Board,Sensitive Area,2.0,20.0,256.0,,"Rambagh, Agra",,2013-01-13
417.0,1/3/2011,Uttar Pradesh,Agra,Central Pollution Control Board,Sensitive Area,2.0,14.0,208.0,,"Rambagh, Agra",,2011-03-01
419.0,1/1/2010,Kerala,Thiruvananthapuram,Kerala State Pollution Control Board,Sensitive Area,6.619999999999999,27.13,55.0,63.66666667,"PRS Hospital, Thiruvanathapuram",,2010-01-01
42,6/1/1987,Haryana,Faridabad,Haryana Pollution Control Board,Residential,43.2,24.1,,,,,1987-01-06
420.0,1/11/2010,Punjab,Naya Nangal,Punjab State Pollution Control Board,"Residential, Rural and other Areas",7.0,14.0,82.0,,"M/s Punjab Alkalis & Chemicals Ltd., Naya Nangal",,2010-11-01
421.0,1/12/2010,Punjab,Naya Nangal,Punjab State Pollution Control Board,"Residential, Rural and other Areas",7.0,14.0,,167.0,"M/s NFL Guest House,Naya Nangal",,2010-12-01
422.0,21-09-10,Punjab,Ludhiana,Punjab State Pollution Control Board,"Residential, Rural and other Areas",7.0,28.0,125.0,,"Bharat Nagar Chowk, Ludhiana",,2010-09-21
423.0,1/4/2010,Odisha,Bhubaneswar,Odisha State Pollution Control Board,"Residential, Rural and other Areas",2.0,18.46666667,103.0,254.0,"IRC Vilage, Bhubaneshwar",,2010-04-01
424.0,1/2/2010,Odisha,Bhubaneswar,Odisha State Pollution Control Board,"Residential, Rural and other Areas",2.0,24.53333333,223.0,428.0,"Capital Police Station, Bhubaneshwar",,2010-02-01
425.0,8/3/2010,Odisha,Cuttack,Odisha State Pollution Control Board,"Residential, Rural and other Areas",2.0,14.93333333,34.0,81.33333333,"R.O. Cuttack Office, Surya Vihar, Cuttack",,2010-03-08
426.0,1/4/2010,Odisha,Cuttack,Odisha State Pollution Control Board,"Residential, Rural and other Areas",3.4,35.03333333,183.0,427.33333330000005,"Roof of Traffic Tower, Badambadi, Cuttack",,2010-04-01
427.0,2/1/2010,Odisha,Sambalpur,Odisha State Pollution Control Board,"Residential, Rural and other Areas",3.7,20.5,51.3,128.7,"Roof of Filter Plant, PHD Office, Modipara, sambalpur",,2010-01-02
428.0,1/4/2010,Odisha,Balasore,Odisha State Pollution Control Board,"Residential, Rural and other Areas",2.0,12.5,95.0,190.33333330000002,"Sahadevkhunta, Balasore",,2010-04-01
429.0,1/2/2010,Odisha,Berhampur,Odisha State Pollution Control Board,"Residential, Rural and other Areas",2.0,12.75,69.0,155.0,"Regional Office, Berhampur",,2010-02-01
43,9/1/1987,Haryana,Faridabad,Haryana Pollution Control Board,Industrial,46.8,,,,,,1987-01-09
431.0,1/3/2011,Karnataka,Hubli,Karnataka State Pollution Control Board,"Residential, Rural and other Areas",3.0,12.0,91.0,,"Rani Chennamma Circle, Hubli",,2011-03-01
432.0,1/4/2011,Karnataka,Dharwad,Karnataka State Pollution Control Board,Industrial Area,3.0,12.0,90.0,,"Lakkamanahalli Industrial Area, Dharwar",,2011-04-01
435,9/2/2004,Goa,Vasco,Goa State Pollution Control Board,Industrial Area,2.0,4.5,22.0,93.0,"Above the Fire Brigade Station, Near Birth 5A & 6A of Mormugao,Port Trust, Vasco",,2004-02-09
439.0,1/2/2011,Uttar Pradesh,Kanpur,Central Pollution Control Board,"Residential, Rural and other Areas",2.0,28.0,103.0,,"Vikas Nagar, Kanpur",,2011-02-01
44,1/10/2004,Jharkhand,Dhanbad,Jharkhand State Pollution Control Board,"Residential, Rural and other Areas",11.1,42.18,196.0,135.0,R.O. Dhanbad,,2004-10-01
44.0,3/9/1987,Bihar,Dhanbad,Bihar Pollution Control Board,Residential,,30.5,,172.0,,,1987-09-03
445.0,6/4/2012,Maharashtra,Dombivli,Maharashtra State Pollution Control Board,Industrial Area,49.0,90.0,129.0,,"Ambernath Municipal Council Office, Ambernath",,2012-04-06
447.0,16-01-10,Chhattisgarh,Raipur,Chattisgarh Environment Conservation Board,"Residential, Rural and other Areas",16.0,45.0,311.0,,"Yatayat Thana, Near Jai Stambh Chowk, Raipur",,2010-01-16
448.0,1/12/2010,Nagaland,Dimapur,Nagaland State Pollution Control Board,"Residential, Rural and other Areas",2.0,7.0,72.0,175.0,"Dhobinala, Dimapur, Nagaland",,2010-12-01
449,1/1/2010,Himachal Pradesh,Baddi,Himachal Pradesh State Environment Proection & Pollution Control Board,Industrial Area,4.0,15.0,135.0,,"Industry Department Office Building, Baddi",,2010-01-01
45.0,24-03-87,Bihar,Jharia,Bihar Pollution Control Board,Industrial,47.2,32.8,,514.0,,,1987-03-24
450.0,1/5/2010,Mizoram,Aizawl,Mizoram State Pollution Control Board,"Residential, Rural and other Areas",2.0,4.5,40.33333333,84.0,"Khatla, M.G-Road, Roof  Top of  Mizoram SPCB",,2010-05-01
451.0,1/5/2010,Mizoram,Aizawl,Mizoram State Pollution Control Board,"Residential, Rural and other Areas",2.0,4.5,24.33333333,51.33333333,"Laipuitlang, Residence of  Er. Dunglena, Chairman, MPCB",,2010-05-01
452.0,1/5/2010,Mizoram,Aizawl,Mizoram State Pollution Control Board,"Residential, Rural and other Areas",2.0,5.45,47.33333333,95.0,"Bawngkawn , Roof  Top of  Mr.K.L. Beremas residence.",,2010-05-01
457.0,4/5/2011,Karnataka,Bangalore,Karnataka State Pollution Control Board,"Residential, Rural and other Areas",21.0,21.0,123.0,,"Yeshwanthpura, Bangalore",,2011-05-04
458.0,1/4/2011,Karnataka,Hassan,Karnataka State Pollution Control Board,"Residential, Rural and other Areas",6.0,23.0,53.0,,"Narashima Raja Circle, Hassan",,2011-04-01
459.0,1/4/2011,Karnataka,Gulbarga,Karnataka State Pollution Control Board,Sensitive Area,7.0,10.0,69.0,,"Government Hospital, Gulbarga",,2011-04-01
46,13-01-04,Jharkhand,Sindri,Jharkhand State Pollution Control Board,Industrial Area,8.9,45.8,267.0,34.0,"BIT, Sindri",,2004-01-13
46.0,30-03-87,Bihar,Sindri,Bihar Pollution Control Board,Industrial,66.7,30.4,,451.0,,,1987-03-30
460.0,1/4/2011,Karnataka,Belgaum,Karnataka State Pollution Control Board,Industrial Area,2.0,11.0,26.0,,"Karnataka SPCB Office Building, Belgaum",,2011-04-01
461,1/1/2010,Himachal Pradesh,Kala Amb,Himachal Pradesh State Environment Proection & Pollution Control Board,Industrial Area,5.0,59.0,342.0,,Kala Amb Industrial Area,,2010-01-01
462.0,1/2/2010,Andhra Pradesh,Vijayawada,Andhra Pradesh State Pollution Control Board,"Residential, Rural and other Areas",3.0,9.0,71.0,,"Benz Circle, Vijayawada",,2010-02-01
463.0,1/2/2010,Chandigarh,Chandigarh,Chandigarh Pollution Control Committee,"Residential, Rural and other Areas",2.0,20.0,66.0,,"IMTECH Sector 39, Chandigarh",,2010-02-01
464.0,1/2/2010,Chandigarh,Chandigarh,Chandigarh Pollution Control Committee,"Residential, Rural and other Areas",2.0,10.0,98.0,,"Kaimbwala Village, Chandigarh",,2010-02-01
465.0,1/5/2010,Andhra Pradesh,Ramagundam,Andhra Pradesh State Pollution Control Board,"Residential, Rural and other Areas",7.0,25.0,102.0,,"RTC Bus Depot, Karim Nagar, Ramagundam",,2010-05-01
466.0,1/2/2010,Andhra Pradesh,Kurnool,Andhra Pradesh State Pollution Control Board,"Residential, Rural and other Areas",4.0,9.0,145.0,,"Mourya Inn, Kurnool",,2010-02-01
467.0,1/1/2010,Andhra Pradesh,Visakhapatnam,Andhra Pradesh State Pollution Control Board,"Residential, Rural and other Areas",7.0,37.0,78.0,,"Ganapuram Area, Visakhapatnam",,2010-01-01
468.0,1/11/2010,Andhra Pradesh,Patancheru,Andhra Pradesh State Pollution Control Board,"Residential, Rural and other Areas",14.0,20.0,89.0,,"Police Station, Medak, Patencheru",,2010-11-01
469.0,1/2/2010,Andhra Pradesh,Vijayawada,Andhra Pradesh State Pollution Control Board,Industrial Area,5.0,14.0,96.0,,"Autonagar, Vijayawada",,2010-02-01
47,1/1/1987,Gujarat,Baroda,Gujarat Pollution Control Board,Residential,17.9,18.3,,249.0,,,1987-01-01
470.0,1/3/2011,Andhra Pradesh,Hyderabad,Andhra Pradesh State Pollution Control Board,Sensitive Area,4.2,17.9,74.0,193.0,"Zoo Park, Hyderabad",,2011-03-01
471.0,2/1/2010,Odisha,Talcher,Odisha State Pollution Control Board,Industrial Area,14.16666667,28.01666667,97.66666667,246.66666669999998,"Coal Field Area, Talcher",,2010-01-02
472,1/1/2010,West Bengal,Kolkata,West Bengal State Pollution Control Board,Industrial Area,10.6,96.0,155.0,321.6666667,"Dunlop Bridge, Kolkata",,2010-01-01
473,1/2/2010,West Bengal,Kolkata,West Bengal State Pollution Control Board,"Residential, Rural and other Areas",14.6,128.5,167.0,341.3333333,"Moulali, Kolkata",,2010-02-01
474,1/3/2010,West Bengal,Kolkata,West Bengal State Pollution Control Board,"Residential, Rural and other Areas",13.1,116.8,129.3333333,266.0,"Salt lake, Kolkata",,2010-03-01
475,1/4/2010,West Bengal,Kolkata,West Bengal State Pollution Control Board,"Residential, Rural and other Areas",9.5,108.7,137.0,260.6666667,"Minto Park, Kolkata",,2010-04-01
476,1/3/2010,West Bengal,Kolkata,West Bengal State Pollution Control Board,Industrial Area,12.6,117.9,188.66666669999998,339.6666667,"Behala Chowrasta,Kolkata",,2010-03-01
477,1/11/2010,West Bengal,Kolkata,West Bengal State Pollution Control Board,"Residential, Rural and other Areas",10.2,117.4,164.66666669999998,356.3333333,"Baishnabghata,Kolkata",,2010-11-01
478.0,1/5/2010,Madhya Pradesh,Gwalior,Madhya Pradesh State Pollution Control Board,"Residential, Rural and other Areas",,,203.0,312.0,"Maharaj Bada, Gwalior",,2010-05-01
479.0,20-01-10,Madhya Pradesh,Gwalior,Madhya Pradesh State Pollution Control Board,"Residential, Rural and other Areas",9.7,20.2,215.0,292.0,"Dindayal Nagar, Gwalior",,2010-01-20
48,1/1/1987,Gujarat,Baroda,Gujarat Pollution Control Board,Residential,14.5,9.0,,229.0,,,1987-01-01
482,1/1/2010,Jammu & Kashmir,Jammu,Jammu & Kashmir State Pollution Control Board,"Residential, Rural and other Areas",11.0,17.0,164.0,,"M.A. Stadium, Jewel Chowk, Jammu",,2010-01-01
483.0,1/2/2010,Punjab,Gobindgarh,Punjab State Pollution Control Board,"Residential, Rural and other Areas",24.0,46.0,232.0,,"United Rolling Mills, Mandi Gobindgarh",,2010-02-01
484.0,1/1/2010,Punjab,Khanna,Punjab State Pollution Control Board,"Residential, Rural and other Areas",5.0,32.0,237.0,,"AS School, Khanna",,2010-01-01
485.0,1/2/2010,Punjab,Khanna,Punjab State Pollution Control Board,Industrial Area,8.0,31.0,236.0,,"Markfed Vanaspati, Khanna",,2010-02-01
486.0,1/4/2010,Punjab,Amritsar,Punjab State Pollution Control Board,"Residential, Rural and other Areas",13.0,36.0,221.0,,"A-1,Platers, Amritsar",,2010-04-01
487.0,1/1/2010,Punjab,Amritsar,Punjab State Pollution Control Board,Industrial Area,14.0,37.0,191.0,,"Nagina Soap Factory, Batala Road, Amritsar",,2010-01-01
488.0,1/4/2011,Karnataka,Mangalore,Karnataka State Pollution Control Board,Industrial Area,20.0,20.0,102.0,,"Stides Premises, Baikampady Industrial Area, Mangalore",,2011-04-01
489.0,25-11-10,Maharashtra,Lote,Maharashtra State Pollution Control Board,"Residential, Rural and other Areas",26.0,20.0,99.0,168.0,"Chalke Wadi, Lote",,2010-11-25
49,1/2/1987,Gujarat,Baroda,Gujarat Pollution Control Board,Industrial,40.2,21.0,,221.0,,,1987-02-01
490.0,11/2/2010,Maharashtra,Lote,Maharashtra State Pollution Control Board,Industrial Area,25.0,13.0,130.0,179.0,"Pump House, CETP, Lote",,2010-02-11
491.0,1/1/2010,Maharashtra,Navi Mumbai,Maharashtra State Pollution Control Board,"Residential, Rural and other Areas",11.0,38.0,84.0,192.0,"Terrace of Meghe College of Engineering, Airoli, TTC, Navi Mumbai",,2010-01-01
492.0,1/4/2010,Maharashtra,Navi Mumbai,Maharashtra State Pollution Control Board,"Residential, Rural and other Areas",9.0,26.0,129.0,288.0,"Terrace of Dr. D.Y. Patil College, Nerul, TTC Navi Mumbai",,2010-04-01
493.0,1/2/2010,Maharashtra,Navi Mumbai,Maharashtra State Pollution Control Board,Industrial Area,28.0,42.0,224.0,442.0,"Terrace of MPCB Central Lab, Mhape, TTC Navi Mumbai",,2010-02-01
494.0,1/1/2010,Maharashtra,Navi Mumbai,Maharashtra State Pollution Control Board,"Residential, Rural and other Areas",10.0,50.0,98.0,246.0,"Terrace of MSEB Power Station, Kharghar, Taloja Navi Mumbai",,2010-01-01
495.0,1/2/2010,Maharashtra,Navi Mumbai,Maharashtra State Pollution Control Board,"Residential, Rural and other Areas",14.0,33.0,70.0,125.0,"Panvel Residential Area, Taloja, Navi Mumbai",,2010-02-01
496.0,1/4/2010,Maharashtra,Navi Mumbai,Maharashtra State Pollution Control Board,Industrial Area,24.5,81.66666667,225.66666669999998,608.6666667000001,"Terrace of MIDC Collom Faciolity Building, MIDC Taloja Navi Mumbai",,2010-04-01
5.0,7/1/1987,Uttar Pradesh,Agra,Uttar Pradesh  Pollution Control Board,Industrial,,,,143.0,,,1987-01-07
50,1/2/1987,Gujarat,Baroda,Gujarat Pollution Control Board,Residential,20.9,17.8,,187.0,,,1987-02-01
504.0,1/1/2010,Punjab,Dera Bassi,Punjab State Pollution Control Board,Industrial Area,10.0,20.0,231.0,,"M/s Punjab Chemicals and Crop Protection Ltd., Bhanakarpur Road, Derabassi",,2010-01-01
505.0,1/2/2010,Punjab,Dera Bassi,Punjab State Pollution Control Board,Industrial Area,10.0,19.0,,217.0,"M/s Winsome Yarns Ltd., Barwala Road, Derabassi",,2010-02-01
506.0,1/1/2010,Punjab,Bathinda,Punjab State Pollution Control Board,Industrial Area,10.0,18.0,250.0,,"M/s Bathinda Dist Coop Milk Producers Union Ltd., Dabwali Road, Bathinda",,2010-01-01
507,3/1/2010,Jammu & Kashmir,Jammu,Jammu & Kashmir State Pollution Control Board,Industrial Area,14.0,14.0,205.0,,"Bari Brahamana Industrial Area, Jammu",,2010-01-03
508.0,1/4/2010,Maharashtra,Kolhapur,Maharashtra State Pollution Control Board,"Residential, Rural and other Areas",7.0,8.0,57.0,122.0,"University Campus, Shivaji University, Kolhapur",,2010-04-01
509.0,1/1/2010,Maharashtra,Kolhapur,Maharashtra State Pollution Control Board,"Residential, Rural and other Areas",17.0,20.0,107.0,303.0,"Ruikar Trust, Dabholkar Corner, S.T. Stand,Kolhapur",,2010-01-01
51,1/1/1987,Gujarat,Baroda,Gujarat Pollution Control Board,Industrial,26.7,17.7,,156.0,,,1987-01-01
510.0,1/2/2010,Maharashtra,Kolhapur,Maharashtra State Pollution Control Board,"Residential, Rural and other Areas",13.0,14.0,86.0,209.0,"Mahadwar Road, Near Mahalaxmi Temple, Kolhapur",,2010-02-01
511.0,1/1/2010,Maharashtra,Aurangabad,Maharashtra State Pollution Control Board,"Residential, Rural and other Areas",11.0,22.0,120.0,378.0,"S.B.E.S. College, Aurangabad",,2010-01-01
512.0,1/4/2010,Maharashtra,Aurangabad,Maharashtra State Pollution Control Board,Sensitive Area,7.0,21.0,79.0,191.0,"Bibi-Ka-Maqbara, Aurangabad",,2010-04-01
513.0,2/3/2010,Maharashtra,Aurangabad,Maharashtra State Pollution Control Board,"Residential, Rural and other Areas",7.805,25.16833333,106.93333329999999,286.7966667,"C.A.D.A. Office, Aurangabad",,2010-03-02
514.0,1/4/2010,Madhya Pradesh,Singrauli,Madhya Pradesh State Pollution Control Board,"Residential, Rural and other Areas",16.7,19.9,59.0,286.0,"N.T.P.C., Vidyanagar, Singrauli",,2010-04-01
515.0,1/1/2010,Madhya Pradesh,Singrauli,Madhya Pradesh State Pollution Control Board,"Residential, Rural and other Areas",19.8,26.4,77.0,368.0,"Jayant Township, Singrauli",,2010-01-01
516.0,1/2/2010,Madhya Pradesh,Singrauli,Madhya Pradesh State Pollution Control Board,"Residential, Rural and other Areas",8.7,10.2,37.0,168.0,"Waidhan, Singrauli",,2010-02-01
517,1/4/2013,Uttar Pradesh,Jhansi,Uttar Pradesh State Pollution Control Board,"Residential, Rural and other Areas",9.0,26.0,136.0,,"Jail Chauraha, Jhansi",,2013-04-01
517.0,1/5/2010,Uttar Pradesh,Jhansi,Uttar Pradesh State Pollution Control Board,"Residential, Rural and other Areas",10.566666670000002,29.16666667,121.66666670000001,255.33333330000002,"Jail Chauraha, Jhansi",,2010-05-01
518,1/4/2013,Uttar Pradesh,Jhansi,Uttar Pradesh State Pollution Control Board,"Residential, Rural and other Areas",7.0,18.0,125.0,,"Veeranga Nagar, Jhansi",,2013-04-01
518.0,1/5/2010,Uttar Pradesh,Jhansi,Uttar Pradesh State Pollution Control Board,"Residential, Rural and other Areas",7.716666667,25.66666667,99.0,208.0,"Veeranga Nagar, Jhansi",,2010-05-01
519.0,1/1/2010,Assam,Guwahati,Assam State Pollution Control Board,"Residential, Rural and other Areas",12.0,18.0,227.0,,"ITI Building, Gopinath Nagar, Guwahati",,2010-01-01
52.0,5/3/1987,Maharashtra,Pune,Maharashtra Pollution Control Board,Industrial,18.2,35.8,,,,,1987-03-05
520.0,1/4/2010,Assam,Bongaigaon,Assam State Pollution Control Board,"Residential, Rural and other Areas",8.0,19.0,63.0,,"Barpara Office Building, Bongaigaon",,2010-04-01
523.0,1/1/2010,Madhya Pradesh,Dewas,Madhya Pradesh State Pollution Control Board,"Residential, Rural and other Areas",9.4,14.8,74.0,162.0,"Vikas Nagar, Dewas",,2010-01-01
524.0,5/5/2010,Madhya Pradesh,Dewas,Madhya Pradesh State Pollution Control Board,"Residential, Rural and other Areas",14.4,23.9,86.0,260.0,"Dewas Metal Section, Dewas",,2010-05-05
525.0,1/4/2010,Madhya Pradesh,Dewas,Madhya Pradesh State Pollution Control Board,Industrial Area,11.3,19.3,78.0,217.0,"EID Perry (I) Limited, Dewas",,2010-04-01
526.0,1/4/2010,Madhya Pradesh,Ujjain,Madhya Pradesh State Pollution Control Board,"Residential, Rural and other Areas",7.6,9.2,39.0,66.0,"Regional Office, Ujjain",,2010-04-01
527.0,1/1/2010,Madhya Pradesh,Ujjain,Madhya Pradesh State Pollution Control Board,Industrial Area,13.3,14.7,110.0,229.0,"District Office, Ujjain",,2010-01-01
528.0,1/2/2010,Madhya Pradesh,Ujjain,Madhya Pradesh State Pollution Control Board,Sensitive Area,11.4,12.3,41.0,86.0,"Mahakal Temple, Ujjain",,2010-02-01
529.0,01-06-14,Madhya Pradesh,Ujjain,Madhya Pradesh State Pollution Control Board,"Residential, Rural and other Areas",13.0,13.0,112.0,,"Chamunda Mata Chouraha, Ujjain",,2014-06-01
53.0,5/2/1987,Maharashtra,Pune,Maharashtra Pollution Control Board,,,10.4,,,,,1987-02-05
530,1/2/2010,Himachal Pradesh,Kala Amb,Himachal Pradesh State Environment Proection & Pollution Control Board,"Residential, Rural and other Areas",2.0,16.0,165.0,,Kala Amb Town,,2010-02-01
531,1/4/2011,Delhi,Delhi,Central Pollution Control Board,"Residential, Rural and other Areas",4.0,38.0,109.0,,"Pritampura, Delhi",,2011-04-01
532.0,1/1/2010,Madhya Pradesh,Sagar,Madhya Pradesh State Pollution Control Board,"Residential, Rural and other Areas",3.1,15.3,,167.0,"Pt.Deendayal Nagar, Housing Board Colony, Sagar",,2010-01-01
534,22/09/2011,Uttar Pradesh,Khurja,Uttar Pradesh State Pollution Control Board,Industrial Area,33.0,34.0,173.0,,"Central Glass & Ceramic Research Institute (CGCRI),Khurja",,2011-09-22
534.0,1/7/2010,Uttar Pradesh,Khurja,Uttar Pradesh State Pollution Control Board,Industrial Area,39.0,30.0,290.0,399.0,"Central Glass & Ceramic Research Institute (CGCRI),Khurja",,2010-07-01
535,1/12/2011,Uttar Pradesh,Khurja,Uttar Pradesh State Pollution Control Board,"Residential, Rural and other Areas",25.0,28.0,145.0,,"Ahirpara, Khurja",,2011-12-01
535.0,1/7/2010,Uttar Pradesh,Khurja,Uttar Pradesh State Pollution Control Board,"Residential, Rural and other Areas",33.5,23.5,155.0,273.0,"Ahirpara, Khurja",,2010-07-01
536.0,1/1/2010,Assam,Tezpur,Assam State Pollution Control Board,"Residential, Rural and other Areas",5.0,13.0,109.0,,"Tezpur Office Building, Tezpur",,2010-01-01
537.0,1/3/2012,Assam,Sivasagar,Assam State Pollution Control Board,"Residential, Rural and other Areas",6.0,15.0,117.0,,"Sibasagar Office Building, Sibasagar",,2012-03-01
538.0,1/1/2010,Assam,Dibrugarh,Assam State Pollution Control Board,"Residential, Rural and other Areas",8.0,15.0,45.0,,"Dibrugarh Office Building, Dibrugarh",,2010-01-01
539.0,1/6/2010,Assam,Golaghat,Assam State Pollution Control Board,"Residential, Rural and other Areas",8.0,17.0,78.0,,"Golaghat Office Building, Golaghat",,2010-06-01
54.0,16-06-87,Maharashtra,Pune,Maharashtra Pollution Control Board,Residential,,9.2,,,,,1987-06-16
541.0,1/1/2010,Assam,Guwahati,Assam State Pollution Control Board,"Residential, Rural and other Areas",11.0,18.0,154.0,,"Near Pragjyotish College, Santipur, Guwahati",,2010-01-01
542.0,1/5/2010,Assam,Bongaigaon,Assam State Pollution Control Board,"Residential, Rural and other Areas",4.0,14.0,119.0,,"Campus of Oil India Ltd. PS-6, Bongaigaon, Chirang",,2010-05-01
546.0,1/3/2012,Kerala,Kochi,National Environmental Engineering Research Institute,Industrial Area,5.0,8.7,24.0,,"Carborandum Universal Company, Kochi",,2012-03-01
547.0,1/2/2010,Maharashtra,Amravati,Maharashtra State Pollution Control Board,"Residential, Rural and other Areas",15.0,15.0,137.0,,"Rajkamal Square, Family Planning Centre Building of Vaneeta Samaj, Dts Amravati",,2010-02-01
548.0,1/4/2010,Maharashtra,Amravati,Maharashtra State Pollution Control Board,"Residential, Rural and other Areas",9.0,12.0,76.0,,"Electronics and Tel. Dept., Govt College of Engineering, Amravati Dist.",,2010-04-01
549.0,1/1/2010,Maharashtra,Amravati,Maharashtra State Pollution Control Board,Industrial Area,12.0,13.5,113.33333329999999,,"M/s Apurva Oil and Industries Pvt. Ltd., A-23, MIDC, Amravati Dist.",,2010-01-01
55,9/2/1987,Delhi,Delhi,Central Pollution Control Board,Industrial,16.4,17.2,,371.0,,,1987-02-09
550,1/3/2011,Uttar Pradesh,Meerut,Uttar Pradesh State Pollution Control Board,"Residential, Rural and other Areas",5.0,37.0,122.0,,"Begum Bridge, Meerut",,2011-03-01
550.0,1/2/2010,Uttar Pradesh,Meerut,Uttar Pradesh State Pollution Control Board,"Residential, Rural and other Areas",13.15,54.15,252.66666669999998,496.0,"Begum Bridge, Meerut",,2010-02-01
551,1/1/2011,Uttar Pradesh,Meerut,Uttar Pradesh State Pollution Control Board,"Residential, Rural and other Areas",5.0,36.0,109.0,,"Thana Railway Road, Meerut",,2011-01-01
551.0,1/1/2010,Uttar Pradesh,Meerut,Uttar Pradesh State Pollution Control Board,"Residential, Rural and other Areas",4.8,49.75,115.5,503.0,"Thana Railway Road, Meerut",,2010-01-01
552.0,07-02-15,Odisha,Keonjhar,Odisha State Pollution Control Board,"Residential, Rural and other Areas",2.0,12.0,146.0,,"Regional Office, Keonjhar",104.0,2015-02-07
553,1/4/2011,Uttar Pradesh,Varanasi,Uttar Pradesh State Pollution Control Board,"Residential, Rural and other Areas",18.0,20.0,138.0,,"Sigra, Varanasi",,2011-04-01
553.0,3/5/2010,Uttar Pradesh,Varanasi,Uttar Pradesh State Pollution Control Board,"Residential, Rural and other Areas",18.516,21.0,127.45666670000001,397.0666667,"Sigra, Varanasi",,2010-05-03
554,1/3/2012,Uttar Pradesh,Allahabad,Uttar Pradesh State Pollution Control Board,"Residential, Rural and other Areas",3.0,39.0,378.67,,Square crossing circle of Laxmi Talkies,,2012-03-01
554.0,1/4/2010,Uttar Pradesh,Allahabad,Uttar Pradesh State Pollution Control Board,"Residential, Rural and other Areas",2.7,32.88333333,162.33333330000002,439.0,Square crossing circle of Laxmi Talkies,,2010-04-01
555,1/3/2012,Uttar Pradesh,Allahabad,Uttar Pradesh State Pollution Control Board,"Residential, Rural and other Areas",3.0,21.0,283.0,,Bharat Yantra Nigam Ltd,,2012-03-01
555.0,1/4/2010,Uttar Pradesh,Allahabad,Uttar Pradesh State Pollution Control Board,"Residential, Rural and other Areas",2.0,17.3,222.33333330000002,435.0,Bharat Yantra Nigam Ltd,,2010-04-01
558.0,2/1/2010,Dadra & Nagar Haveli,Khadoli,"Daman Diu, Dadra & Nagar Heveli Pollution Control Committee",Industrial Area,7.0,17.0,85.0,,"Khadoli Industrial Area, Village- Khadoli, Silvassa",,2010-01-02
56,9/2/1987,Delhi,Delhi,Central Pollution Control Board,Industrial,2.5,12.8,,506.0,,,1987-02-09
560,2/9/2010,Daman & Diu,Daman,"Daman Diu, Dadra & Nagar Heveli Pollution Control Committee",Industrial Area,7.0,17.0,56.0,,"Kadaiya Industrial Area, Village- Kadaiya, Daman (Industrial Area)",,2010-09-02
560.0,2/2/2010,Daman & Diu,Daman,"Daman Diu, Dadra & Nagar Heveli Pollution Control Committee",Industrial Area,7.0,17.0,64.0,,"Kadaiya Industrial Area, Village- Kadaiya, Daman (Industrial Area)",,2010-02-02
562.0,1/4/2010,Kerala,Kochi,Kerala State Pollution Control Board,"Residential, Rural and other Areas",5.0,18.0,74.0,,"FCI, OEN Connectors Office Building",,2010-04-01
563,12/1/2010,Himachal Pradesh,Baddi,Himachal Pradesh State Environment Proection & Pollution Control Board,"Residential, Rural and other Areas",2.0,7.0,81.0,,Housing Board,,2010-01-12
564,1/6/2010,Himachal Pradesh,Baddi,Himachal Pradesh State Environment Proection & Pollution Control Board,Industrial Area,3.0,11.0,92.0,,AHC,,2010-06-01
565,1/2/2010,Himachal Pradesh,Nalagarh,Himachal Pradesh State Environment Proection & Pollution Control Board,"Residential, Rural and other Areas",5.0,15.0,,,Municipal Council  MC,,2010-02-01
566.0,1/9/2010,Assam,Daranga,Assam State Pollution Control Board,"Residential, Rural and other Areas",5.0,17.0,126.0,,"Daranga, Baska district, BATAD,Assam near Sandoop Jhankar town of Bhutan",,2010-09-01
567.0,1/5/2010,Assam,Silcher,Assam State Pollution Control Board,"Residential, Rural and other Areas",8.0,16.0,48.0,,"Office building of RLO, near Ithkola Market, Ghaniwala road",,2010-05-01
568.0,1/12/2010,Meghalaya,Byrnihat,Meghalaya State Pollution Control Board,Industrial Area,46.81666666999999,14.23333333,143.33333330000002,,"Export Promotion Industrial Park (EPIP). Byrnihat,Ri-Bhoi dist Meghalaya",,2010-12-01
569.0,1/5/2010,Maharashtra,Mahad,Maharashtra State Pollution Control Board,"Residential, Rural and other Areas",25.0,28.0,85.0,173.0,"Terrace of water treatment plant, Bhirwadi, Mahad",,2010-05-01
57,9/3/1987,Delhi,Delhi,Central Pollution Control Board,Industrial,0.5,2.8,,528.0,,,1987-03-09
570.0,1/2/2010,Maharashtra,Mahad,Maharashtra State Pollution Control Board,Industrial Area,11.0,25.0,118.0,191.0,"Terrace of Environment Health Safty (EHS) building of M/s Privi organics Ltd , Unit no.",,2010-02-01
571.0,1/2/2010,Maharashtra,Mahad,Maharashtra State Pollution Control Board,"Residential, Rural and other Areas",12.0,21.0,110.0,181.0,"Terrace of Mahad Nagar Parishad , Mahatma Phule Hall & vegetable market Mahad",,2010-02-01
572.0,1/3/2010,Maharashtra,Roha,Maharashtra State Pollution Control Board,Industrial Area,16.0,29.0,184.0,301.0,"Terrace of Roha Industrial Association office, Roha",,2010-03-01
573.0,1/3/2010,Maharashtra,Roha,Maharashtra State Pollution Control Board,"Residential, Rural and other Areas",16.0,34.0,148.0,232.0,"Terrace of Filter House of MIDC Water works, Roha",,2010-03-01
574.0,1/3/2011,Maharashtra,Sangli,Maharashtra State Pollution Control Board,"Residential, Rural and other Areas",14.0,25.0,76.0,,"SRO, MPCB Sangli",,2011-03-01
575.0,1/2/2011,Maharashtra,Sangli,Maharashtra State Pollution Control Board,"Residential, Rural and other Areas",13.0,39.0,96.0,,"Sangli- Miraj Primary school Building, Sangli",,2011-02-01
576.0,1/2/2010,Maharashtra,Sangli,Maharashtra State Pollution Control Board,Industrial Area,17.0,33.0,119.0,133.0,"Krishna Valley School, Sangli",,2010-02-01
577.0,1/2/2010,Andhra Pradesh,Nalgonda,Andhra Pradesh State Pollution Control Board,"Residential, Rural and other Areas",5.0,25.0,91.0,,"Beside Regional Office, APPCB Nalgonda",,2010-02-01
578.0,16/01/2012,Andhra Pradesh,Kakinada,Andhra Pradesh State Pollution Control Board,"Residential, Rural and other Areas",,,49.0,,"Top of the Office Building Ramanayyapeta, Kakinada",,2012-01-16
579.0,1/5/2010,Andhra Pradesh,Warangal,Andhra Pradesh State Pollution Control Board,"Residential, Rural and other Areas",2.0,13.0,85.0,,"KUDA Office, Hanumakonda, Warangal Dist.",,2010-05-01
58,9/3/1987,Delhi,Delhi,Central Pollution Control Board,Industrial,25.8,10.4,,487.0,,,1987-03-09
580.0,1/2/2010,Andhra Pradesh,Nellore,Andhra Pradesh State Pollution Control Board,"Residential, Rural and other Areas",2.0,12.0,62.0,,"Venkatareddy nagar, Vedayapalem, Nellore",,2010-02-01
581.0,1/2/2010,Andhra Pradesh,Khammam,Andhra Pradesh State Pollution Control Board,"Residential, Rural and other Areas",2.0,12.0,79.0,,"CER Club,S.C.C.L. township, writter basti, Kothagudem, Khammam Dist.",,2010-02-01
582.0,2/3/2010,Andhra Pradesh,Chittoor,Andhra Pradesh State Pollution Control Board,Sensitive Area,4.0,9.0,36.0,,"GNC Toll Gate Tirumala , Chittoor Dist.",,2010-03-02
583.0,1/1/2010,Andhra Pradesh,Guntur,Andhra Pradesh State Pollution Control Board,"Residential, Rural and other Areas",2.0,11.0,83.0,,"Near Hindu College, Market Road, Guntur",,2010-01-01
584.0,1/2/2013,Andhra Pradesh,Visakhapatnam,Andhra Pradesh State Pollution Control Board,Industrial Area,5.0,9.0,91.0,,"Pedagantyada (V), Gajuwada (M), Visakhapatnam",,2013-02-01
585.0,1/1/2010,Andhra Pradesh,Visakhapatnam,Andhra Pradesh State Pollution Control Board,Industrial Area,10.0,28.0,109.0,,"Coastal Waste Management Project (RAMKY) Pharma City, Parawada (M), Visakhapatnam",,2010-01-01
586.0,1/3/2010,Assam,Margherita,Assam State Pollution Control Board,"Residential, Rural and other Areas",14.0,23.0,88.0,,"Coal India Office Complex, Margherita,Tinsukia,Assam",,2010-03-01
587.0,1/2/2010,Assam,Lakhimpur,Assam State Pollution Control Board,"Residential, Rural and other Areas",9.0,17.0,160.0,,"Bazar Patti, North Lakhimpur Town,Lakhimpur, Assam",,2010-02-01
588.0,1/12/2010,Meghalaya,Dawki,Meghalaya State Pollution Control Board,"Residential, Rural and other Areas",8.450000000000001,16.08333333,123.33333329999999,,"Terrace building, Dawki, Jaintia Hills District, Meghalaya",,2010-12-01
59,9/2/1987,Delhi,Delhi,Central Pollution Control Board,Residential,6.5,9.3,,488.0,,,1987-02-09
590.0,1/1/2010,Punjab,Dera Baba,Punjab State Pollution Control Board,"Residential, Rural and other Areas",10.0,12.0,97.0,,C-PYTE Building at Dera Baba Nanak,,2010-01-01
591,1/2/2010,West Bengal,Durgapur,West Bengal State Pollution Control Board,Industrial Area,10.9,79.2,317.3333333,644.3333332999999,"DMC Water Works, Angadpur",,2010-02-01
592,1/1/2010,West Bengal,Asansol,West Bengal State Pollution Control Board,Industrial Area,9.8,74.7,284.6666667,585.0,"Burnpur Town Department, Burnpur",,2010-01-01
593,1/2/2010,West Bengal,Asansol,West Bengal State Pollution Control Board,Industrial Area,12.0,90.5,339.0,700.0,"Kangsabati Spinning Mill, Barjora",,2010-02-01
594.0,1/1/2010,Assam,Tinsukia,Assam State Pollution Control Board,"Residential, Rural and other Areas",5.0,11.0,133.0,,"Digboi Carbon Factory Campus, Borguri, Tinsukia",,2010-01-01
595.0,1/1/2010,Assam,Nagaon,Assam State Pollution Control Board,"Residential, Rural and other Areas",8.0,18.0,261.0,,"Water Resources Division Office Campus, Christian Patty, near Nagaon College",,2010-01-01
596.0,18-08-10,Assam,Guwahati,Assam State Pollution Control Board,"Residential, Rural and other Areas",6.0,14.0,,,"Khanapara, Central Dairy, Guwahati, Dist Kamrup",,2010-08-18
597.0,19-03-10,Assam,Nalbari,Assam State Pollution Control Board,"Residential, Rural and other Areas",7.0,18.0,201.0,,"Campus of PWD Rural Division, near Gordon Boy's GS School, Dist- Nalbari",,2010-03-19
598.0,1/6/2011,Karnataka,Bangalore,Karnataka State Pollution Control Board,Sensitive Area,7.0,18.0,43.0,,"Department of Environmental Science, Jnanabharathi Campus, Bangalore University",,2011-06-01
599.0,1/1/2010,Punjab,Patiala,Punjab State Pollution Control Board,"Residential, Rural and other Areas",7.0,13.0,,163.0,"Fire Brigade Station, Bahera Road, Patiala",,2010-01-01
6,1/3/2012,Uttar Pradesh,Anpara,Uttar Pradesh State Pollution Control Board,Industrial Area,18.0,28.0,144.0,,"Anpara Colony, Sonabhadra, Anpara",,2012-03-01
6.0,2/4/1987,Uttar Pradesh,Anpara,Uttar Pradesh  Pollution Control Board,Industrial,,,,487.0,,,1987-04-02
60,9/1/1987,Delhi,Delhi,Central Pollution Control Board,Residential,8.6,16.2,,323.0,,,1987-01-09
600.0,1/2/2010,Punjab,Patiala,Punjab State Pollution Control Board,Industrial Area,8.0,15.0,,164.0,"Ceylon Industries, Factory Area, Patiala",,2010-02-01
602.0,8/10/2010,Assam,Guwahati,Assam State Pollution Control Board,"Residential, Rural and other Areas",7.0,12.0,40.0,,"Guwahati University Campus, Dist- Kamrup, Guwahati",,2010-10-08
603.0,9/3/2010,Assam,Guwahati,Assam State Pollution Control Board,"Residential, Rural and other Areas",6.0,14.0,62.0,,"Boargaon, Dist- Kamrup,Guwahati",,2010-03-09
604.0,14-07-10,Assam,Sivasagar,Assam State Pollution Control Board,"Residential, Rural and other Areas",7.0,16.0,16.0,,"ONGC Colony, Sivasagar",,2010-07-14
605.0,20-07-10,Assam,Tinsukia,Assam State Pollution Control Board,"Residential, Rural and other Areas",8.0,19.0,27.0,,"Borguri, Tinsukia",,2010-07-20
607.0,23-11-10,Assam,Silcher,Assam State Pollution Control Board,"Residential, Rural and other Areas",5.0,13.0,39.0,,"Janiganj, Silcher",,2010-11-23
608.0,7/8/2010,Meghalaya,Tura,Meghalaya State Pollution Control Board,"Residential, Rural and other Areas",2.0,7.183333332999999,44.23333333,,"Office building of Add Chief Engineer,PHED, Araimille, Tura West Garo Hills District",,2010-08-07
609.0,7/6/2010,Nagaland,Kohima,Nagaland State Pollution Control Board,"Residential, Rural and other Areas",2.0,4.5,18.0,33.0,"Opposite NST Office, Kohima",,2010-06-07
61.0,13-03-87,Punjab,Ludhiana,Punjab Pollution Control Board,Industrial,,,,192.0,,,1987-03-13
610.0,8/6/2010,Nagaland,Kohima,Nagaland State Pollution Control Board,"Residential, Rural and other Areas",2.0,5.0,62.0,90.0,"Opposite War Cemetery, Kohima",,2010-06-08
611.0,1/7/2010,Jharkhand,Dhanbad,Jharkhand State Pollution Control Board,Industrial Area,15.0,36.0,198.0,,"CGM Office, Kusunda, Dist- Dhanbad",,2010-07-01
612.0,1/6/2010,Jharkhand,Dhanbad,Jharkhand State Pollution Control Board,Industrial Area,15.165,35.08,190.4,242.18,"EMTI, Bastacola, Dist- Dhanbad",,2010-06-01
614.0,1/2/2010,Jharkhand,Saraikela Kharsawan,Jharkhand State Pollution Control Board,"Residential, Rural and other Areas",35.0,49.0,250.0,,"RO Building, Adityapur, Dist- Saraikela Kharsawan",,2010-02-01
615.0,1/4/2010,Jharkhand,West Singhbhum,Jharkhand State Pollution Control Board,Industrial Area,19.0,39.0,561.0,,"Barajamda, Taurian Guest House, Dist- West Singhbhum",,2010-04-01
617.0,1/4/2010,Kerala,Alappuzha,Kerala State Pollution Control Board,Industrial Area,2.0,5.0,93.0,,"DC Mills Pathirapally, Alappuzha",,2010-04-01
618.0,1/1/2010,Kerala,Alappuzha,Kerala State Pollution Control Board,"Residential, Rural and other Areas",2.0,5.0,63.0,,"District Office, Alissery Road, Alappuzha",,2010-01-01
619.0,1/3/2011,Kerala,Pathanamthitta,Kerala State Pollution Control Board,"Residential, Rural and other Areas",2.0,14.0,23.0,,"Near District Office KSPCB, Makkamkunnu, Pathanamthitta",,2011-03-01
62.0,1/9/1987,Punjab,Ludhiana,Punjab Pollution Control Board,Residential,,,,723.0,,,1987-09-01
620.0,1/4/2010,Kerala,Kollam,Kerala State Pollution Control Board,Industrial Area,4.0,12.0,45.0,,"KMML Chavara, Kollam",,2010-04-01
621.0,1/4/2010,Kerala,Kollam,Kerala State Pollution Control Board,"Residential, Rural and other Areas",2.0,16.0,98.0,,"KSPCB, District Office, Kadappakada, Kollam",,2010-04-01
622.0,1/4/2011,Kerala,Wayanad,Kerala State Pollution Control Board,Sensitive Area,2.0,10.0,31.0,,"Sulthan Bathery, Wayanad",,2011-04-01
623.0,1/1/2010,Kerala,Malappuram,Kerala State Pollution Control Board,Industrial Area,2.0,4.5,36.85896667,60.36293333,"Kakkanchery, near KINFRA, Malappuram",,2010-01-01
624.0,1/3/2011,Kerala,Thissur,Kerala State Pollution Control Board,"Residential, Rural and other Areas",2.0,7.0,7.0,,"KSPCB, District Office, Poonkunnam, Thrissur",,2011-03-01
625,1/3/2011,Uttarakhand,Haldwani,Uttarakhand Environment Protection and Pollution Control Board,"Residential, Rural and other Areas",,,152.0,,"Govt. Women Hospital, Haldwani",,2011-03-01
626,1/3/2011,Uttarakhand,Rudrapur,Uttarakhand Environment Protection and Pollution Control Board,Industrial Area,,,195.0,,"Sidcul Office, Rudrapur",,2011-03-01
627,1/3/2011,Uttarakhand,Kashipur,Uttarakhand Environment Protection and Pollution Control Board,"Residential, Rural and other Areas",,,172.0,,"BSNL Office, Kashipur",,2011-03-01
628,1/3/2011,Goa,Curchorem,Goa State Pollution Control Board,"Residential, Rural and other Areas",11.0,23.0,115.0,69.17,"Curchorem, Goa",,2011-03-01
629,1/3/2011,Goa,Usgao,Goa State Pollution Control Board,"Residential, Rural and other Areas",9.0,29.0,248.0,105.0,"Usgao Plae, Junction",,2011-03-01
63.0,1/2/1987,Punjab,Ludhiana,Punjab Pollution Control Board,Residential,,,,614.0,,,1987-02-01
630,1/4/2011,Goa,Codli,Goa State Pollution Control Board,"Residential, Rural and other Areas",18.0,32.0,106.0,32.39,"Codli Tisk, Goa",,2011-04-01
631,1/4/2011,Goa,Honda,Goa State Pollution Control Board,"Residential, Rural and other Areas",14.0,26.0,132.0,45.86,"Honda Junction, Goa",,2011-04-01
632,1/4/2011,Goa,Bicholim,Goa State Pollution Control Board,"Residential, Rural and other Areas",12.0,23.0,90.0,20.61,"Bicholim, Goa",,2011-04-01
633,1/4/2011,Goa,Amona,Goa State Pollution Control Board,"Residential, Rural and other Areas",16.0,29.0,89.0,27.29,"Amona, Goa",,2011-04-01
634,1/4/2011,Goa,Assanora,Goa State Pollution Control Board,"Residential, Rural and other Areas",12.0,22.0,92.0,24.97,"Assanora Junction, Goa",,2011-04-01
635,1/4/2011,Uttarakhand,Haridwar,Uttarakhand Environment Protection and Pollution Control Board,Industrial Area,,,185.5966667,,"SIDCUL, Haridwar",,2011-04-01
636,1/4/2011,Uttarakhand,Rishikesh,Uttarakhand Environment Protection and Pollution Control Board,"Residential, Rural and other Areas",,,113.0,,"Nagar Palika Parishad, Rishikesh",,2011-04-01
637,1/11/2011,Uttarakhand,Dehradun,Uttarakhand Environment Protection and Pollution Control Board,"Residential, Rural and other Areas",,,111.0,,Himalaya Drug Co. Near ISBT,,2011-11-01
638.0,1/5/2010,Maharashtra,Chandrapur,Maharashtra State Pollution Control Board,Industrial Area,16.0,14.0,225.0,690.0,"MIDC, Tadali, Chandrapur",,2010-05-01
639.0,1/6/2010,Maharashtra,Chandrapur,Maharashtra State Pollution Control Board,"Residential, Rural and other Areas",22.0,55.0,154.0,382.0,"Muncipal Council, Ballarshah, Chandrapur",,2010-06-01
64.0,3/7/1988,Puducherry,Pondichery,Central Pollution Control Board,"Residential, Rural and other Areas",6.0,4.9,,116.0,,,1988-07-03
640.0,1/6/2010,Maharashtra,Chandrapur,Maharashtra State Pollution Control Board,Industrial Area,44.0,64.0,129.0,287.0,"Gadchandur Gram Panchayat, Rajura, Chandrapur",,2010-06-01
641.0,1/1/2010,Maharashtra,Latur,Maharashtra State Pollution Control Board,Industrial Area,9.0,16.0,70.0,126.0,"MIDC, Water Works, Latur",,2010-01-01
642.0,1/4/2010,Maharashtra,Latur,Maharashtra State Pollution Control Board,"Residential, Rural and other Areas",6.0,16.0,112.0,435.0,"Shyamnagar, Terrence of Keshavraj Vidyalaya, Latur",,2010-04-01
643.0,27-04-10,Maharashtra,Latur,Maharashtra State Pollution Control Board,"Residential, Rural and other Areas",12.0,20.0,178.0,334.0,"Ganjgolai, Terrance of Siddheshwar Sahkari Bank, Latur",,2010-04-27
644.0,2/1/2010,Maharashtra,Jalgaon,Maharashtra State Pollution Control Board,"Residential, Rural and other Areas",24.0,51.0,148.0,209.0,"Sub R. O. Office, Old B. J. Market, Jalgaon",,2010-01-02
645.0,2/5/2010,Maharashtra,Jalgaon,Maharashtra State Pollution Control Board,"Residential, Rural and other Areas",17.0,48.0,139.0,197.0,"Girna water tank, Ramanand Nagar, Jalgaon",,2010-05-02
646.0,1/5/2011,Maharashtra,Jalgaon,Maharashtra State Pollution Control Board,Industrial Area,25.0,52.0,169.0,,"MIDC Office, Jalgaon",,2011-05-01
647.0,1/4/2010,Maharashtra,Ulhasnagar,Maharashtra State Pollution Control Board,"Residential, Rural and other Areas",40.0,40.0,86.0,86.0,"Smt. C. H. M. College Campus, Ulhasnagar",,2010-04-01
648.0,1/6/2010,Maharashtra,Ulhasnagar,Maharashtra State Pollution Control Board,"Residential, Rural and other Areas",58.0,75.0,171.0,171.0,"Octroi Naka, Pawai-Chowk, Vithalwadi, Ulhasnagar",,2010-06-01
649.0,2/2/2010,Maharashtra,Badlapur,Maharashtra State Pollution Control Board,Industrial Area,55.0,110.0,150.0,199.0,"BIWA House, Badlapur",,2010-02-02
65.0,1/1/2010,Chhattisgarh,Bhilai,Chattisgarh Environment Conservation Board,"Residential, Rural and other Areas",12.0,26.0,112.0,,"Visak Hostel, Sector-4, Bhilai",,2010-01-01
650,1/2/2010,West Bengal,South Suburban,West Bengal State Pollution Control Board,"Residential, Rural and other Areas",9.5,87.1,129.6666667,262.6666667,"Baruipur, South Suburban",,2010-02-01
651,1/2/2010,West Bengal,South Suburban,West Bengal State Pollution Control Board,Industrial Area,9.8,91.9,118.33333329999999,251.0,"Amtala, South Suburban",,2010-02-01
652,1/1/2010,West Bengal,South Suburban,West Bengal State Pollution Control Board,"Residential, Rural and other Areas",9.9,84.0,119.0,272.6666667,"Tollygunge, South Suburban",,2010-01-01
653,1/4/2010,West Bengal,Barrackpore,West Bengal State Pollution Control Board,"Residential, Rural and other Areas",20.2,114.5,289.6666667,522.3333333,"Dum Dum, Barrackpore",,2010-04-01
654,1/4/2010,West Bengal,Barrackpore,West Bengal State Pollution Control Board,Industrial Area,24.9,107.2,315.6666667,486.66666669999995,"Khardah, Barrackpore",,2010-04-01
655,1/4/2010,West Bengal,Barrackpore,West Bengal State Pollution Control Board,Industrial Area,15.3,87.7,208.0,384.6666667,"Barrackpore, Barrackpore",,2010-04-01
656,1/2/2010,West Bengal,Sankrail,West Bengal State Pollution Control Board,Industrial Area,15.7,110.2,212.33333330000002,408.6666667,"Dhulagarh, Sankrail",,2010-02-01
657,1/2/2010,West Bengal,Sankrail,West Bengal State Pollution Control Board,Industrial Area,16.4,95.0,183.33333330000002,354.3333333,"Sankrail, Sankrail",,2010-02-01
658,1/2/2010,West Bengal,Sankrail,West Bengal State Pollution Control Board,"Residential, Rural and other Areas",8.2,62.2,183.0,328.3333333,"Amta, Sankrail",,2010-02-01
659,1/2/2010,West Bengal,Sankrail,West Bengal State Pollution Control Board,"Residential, Rural and other Areas",21.7,123.6,209.0,367.3333333,"Bagnan, Sankrail",,2010-02-01
66.0,M011989,Madhya Pradesh,Bhilai,Madhya Pradesh  Pollution Control Board,Industrial Area,0.5,16.2,,151.0,,,1989-01-01
660,1/1/2010,West Bengal,Raniganj,West Bengal State Pollution Control Board,Industrial Area,8.7,72.7,242.0,,"Mangalpur, Raniganj",,2010-01-01
661,1/1/2010,West Bengal,Raniganj,West Bengal State Pollution Control Board,Industrial Area,10.2,75.2,274.6666667,568.0,"Jamuria, Raniganj",,2010-01-01
662,1/1/2010,West Bengal,Raniganj,West Bengal State Pollution Control Board,Industrial Area,12.3,88.8,398.0,802.0,"Raniganj, Raniganj",,2010-01-01
663,1/6/2010,West Bengal,Haldia,West Bengal State Pollution Control Board,Industrial Area,10.9,55.2,131.0,295.0,"Bhabanipur, Haldia",,2010-06-01
664,1/6/2010,West Bengal,Haldia,West Bengal State Pollution Control Board,Industrial Area,11.3,50.1,68.0,181.0,"Bhunia Raichak, Haldia",,2010-06-01
665,1/4/2011,Himachal Pradesh,Sunder Nagar,Himachal Pradesh State Environment Proection & Pollution Control Board,"Residential, Rural and other Areas",2.0,5.0,67.0,,"Regional Laboratory, HPSPCB, BBMB Colony, Sunder Nagar, Distt. Mandi",,2011-04-01
666,1/10/2012,Himachal Pradesh,Sunder Nagar,Himachal Pradesh State Environment Proection & Pollution Control Board,"Residential, Rural and other Areas",,,28.0,,"Office premises of Muncipal Council, NH-21, Sunder Nagar, Distt. Mandi",,2012-10-01
667,5/2/2011,Himachal Pradesh,Una,Himachal Pradesh State Environment Proection & Pollution Control Board,"Residential, Rural and other Areas",2.0,7.0,33.0,,"Regional Office, Una",,2011-02-05
668,5/3/2011,Himachal Pradesh,Una,Himachal Pradesh State Environment Proection & Pollution Control Board,Industrial Area,2.0,7.0,46.0,,"DIC Building, Mehatpur, Una",,2011-03-05
669.0,1/8/2013,Chhattisgarh,Bilaspur,Chattisgarh Environment Conservation Board,"Residential, Rural and other Areas",6.0,21.0,,,"Regional Office, CECB Vyapar Vihar, Bilashpur",,2013-08-01
67.0,1/1/2010,Chhattisgarh,Bhilai,Chattisgarh Environment Conservation Board,"Residential, Rural and other Areas",5.0,16.0,91.0,,"R.O., 5/32 Banglow Office Building, Bhilai",,2010-01-01
670,7/11/2011,Himachal Pradesh,Manali,Himachal Pradesh State Environment Proection & Pollution Control Board,"Residential, Rural and other Areas",,,52.0,,"Nehru Park, Manali, District Kullu",,2011-11-07
671,10/4/2011,Himachal Pradesh,Manali,Himachal Pradesh State Environment Proection & Pollution Control Board,"Residential, Rural and other Areas",2.0,7.0,152.0,,"Office building HPSPCB, Hadimba Road, Manali, District Kullu",,2011-04-10
672.0,1/3/2013,Karnataka,Domlur,Karnataka State Pollution Control Board,"Residential, Rural and other Areas",7.0,12.0,59.0,,"Vittal Medi health Care Pvt Ltd, Domlur",,2013-03-01
673.0,8/2/2011,Karnataka,Davangere,Karnataka State Pollution Control Board,Industrial Area,9.0,12.0,80.0,,"KSPCB Office Premises, Devengere",,2011-02-08
674.0,6/8/2011,Karnataka,Davangere,Karnataka State Pollution Control Board,"Residential, Rural and other Areas",10.0,14.0,49.0,,"Mothi Talkies P.B. Road, Devengere",,2011-08-06
675.0,1/1/2013,Karnataka,Ranebennur,Karnataka State Pollution Control Board,Industrial Area,4.0,8.0,72.0,,"HPF Ltd., Water intake well, Ranebennur",,2013-01-01
676.0,1/3/2013,Karnataka,Mandya,Karnataka State Pollution Control Board,"Residential, Rural and other Areas",10.0,22.0,49.0,,"KSPCB Office Premises, Mandya",,2013-03-01
677.0,4/8/2013,Karnataka,Raichur,Karnataka State Pollution Control Board,"Residential, Rural and other Areas",6.0,9.0,65.0,,"KSPCB Office Premises, Raichur",,2013-08-04
678.0,03-04-15,Karnataka,Bijapur,Karnataka State Pollution Control Board,"Residential, Rural and other Areas",2.0,5.0,166.0,,"KSPCB Office Premises, Bijapur",,2015-04-03
679.0,3/4/2013,Karnataka,Chitradurga,Karnataka State Pollution Control Board,"Residential, Rural and other Areas",3.0,5.0,19.0,,"KSPCB Office Premises, Chitradurga",,2013-04-03
68.0,24-10-87,Odisha,Talcher,Orissa Pollution Control Board,Industrial,,,,303.0,,,1987-10-24
680.0,1/3/2013,Karnataka,Shimoga,Karnataka State Pollution Control Board,Industrial Area,6.0,10.0,42.0,,"The VISL, Oxygen Plant, Shimoga",,2013-03-01
683.0,4/3/2013,Karnataka,Kolar,Karnataka State Pollution Control Board,"Residential, Rural and other Areas",5.0,10.0,62.0,,"KSPCB Office Premises, Kolar",,2013-03-04
684.0,8/7/2013,Karnataka,Bidar,Karnataka State Pollution Control Board,"Residential, Rural and other Areas",6.0,12.0,50.0,,"KSPCB Office Premises, Bidar",,2013-07-08
685.0,01-03-14,Karnataka,Tumkur,Karnataka State Pollution Control Board,"Residential, Rural and other Areas",7.0,16.0,112.0,,"Tumkur University, Tumkur",,2014-03-01
686.0,11/4/2011,Odisha,Bhubaneswar,Odisha State Pollution Control Board,"Residential, Rural and other Areas",2.0,17.0,121.0,,"Patrapada, Bhubneswar",,2011-04-11
687.0,11/2/2011,Odisha,Bhubaneswar,Odisha State Pollution Control Board,"Residential, Rural and other Areas",2.0,46.0,133.0,,"Water works, Palasuni, Bhubneswar",,2011-02-11
688.0,12/5/2011,Odisha,Bhubaneswar,Odisha State Pollution Control Board,"Residential, Rural and other Areas",2.0,40.4,122.66666670000001,,Chandrasekharpur. Bhubneswar,,2011-05-12
689.0,3/7/2012,Odisha,Balasore,Odisha State Pollution Control Board,"Residential, Rural and other Areas",2.0,11.0,82.33,,"DIC, Office, Angaragadia",,2012-07-03
69.0,3/3/1988,Odisha,Talcher,Orissa Pollution Control Board,Industrial Area,,,,178.0,,,1988-03-03
690.0,18/06/2012,Odisha,Balasore,Odisha State Pollution Control Board,Industrial Area,6.0,22.0,105.33,,"Rasulpur, Near Balgopalpur Industrial Area",,2012-06-18
691.0,01-03-14,Odisha,Paradeep,Odisha State Pollution Control Board,Industrial Area,10.0,13.0,140.0,,Over the STP of M/s IFFCO Ltd.,73.0,2014-03-01
692.0,01-03-14,Odisha,Paradeep,Odisha State Pollution Control Board,"Residential, Rural and other Areas",10.0,13.0,176.0,,Over the Guest House of M/s PPL,75.0,2014-03-01
693.0,01-03-14,Odisha,Paradeep,Odisha State Pollution Control Board,"Residential, Rural and other Areas",7.0,12.0,200.0,,Near Overhead Water Tank of M/s PPT,65.0,2014-03-01
694.0,01-02-14,Odisha,Kalinga Nagar,Odisha State Pollution Control Board,Industrial Area,2.0,11.0,91.0,,Over the Guest House of M/s NINL,,2014-02-01
695.0,01-02-14,Odisha,Kalinga Nagar,Odisha State Pollution Control Board,"Residential, Rural and other Areas",2.0,11.0,123.0,,"Roof of maintenance Office of M/s NINL, Duburi",,2014-02-01
696.0,2/4/2013,Odisha,Rourkela,Odisha State Pollution Control Board,"Residential, Rural and other Areas",5.0,30.0,98.0,,"Over the roof of Dalmia Research Institute, Rajgangpur",,2013-04-02
697.0,1/2/2013,Odisha,Cuttack,Odisha State Pollution Control Board,"Residential, Rural and other Areas",2.0,18.0,96.0,,"Near Barabati Stadium, Tulasipur",,2013-02-01
698.0,1/8/2013,Meghalaya,Nongstoin,Meghalaya State Pollution Control Board,"Residential, Rural and other Areas",2.0,5.0,29.0,,"Office Premises of the O/o SDO, PHED, Nongstoin",,2013-08-01
699.0,15-01-13,Meghalaya,Khliehriat,Meghalaya State Pollution Control Board,"Residential, Rural and other Areas",2.0,12.0,54.0,,"Office Premises of the O/o BDO, C & RD Block, Khliehriat",,2013-01-15
7,1/2/2012,Uttar Pradesh,Renusagar,Uttar Pradesh State Pollution Control Board,Industrial Area,17.0,26.0,128.0,,"Renusagar Colony, Sonabhadra, Anpara",,2012-02-01
7.0,1/2/1987,Uttar Pradesh,Anpara,Uttar Pradesh  Pollution Control Board,Industrial,40.1,53.4,,472.0,,,1987-02-01
70.0,29-09-87,Odisha,Angul,Orissa Pollution Control Board,Residential,,,,,,,1987-09-29
700.0,4/4/2011,Maharashtra,Akola,Maharashtra State Pollution Control Board,"Residential, Rural and other Areas",8.0,9.0,128.0,,"L.R.T. Commerce College, Ratanlal Plot, Civil Lines, Akola",,2011-04-04
701.0,4/6/2011,Maharashtra,Akola,Maharashtra State Pollution Control Board,Industrial Area,12.0,14.0,165.0,,"MIDC Water Work, Phash-II, MIDC Akola",,2011-06-04
702.0,1/6/2012,Maharashtra,Akola,Maharashtra State Pollution Control Board,"Residential, Rural and other Areas",8.0,10.0,156.67,,"College Of Engineering and Technology, Akola",,2012-06-01
703.0,5/4/2011,Maharashtra,Nanded,Maharashtra State Pollution Control Board,"Residential, Rural and other Areas",41.0,42.0,56.0,,"Ganesh Nagar, Nanded",,2011-04-05
704.0,5/6/2011,Maharashtra,Nanded,Maharashtra State Pollution Control Board,"Residential, Rural and other Areas",65.0,59.0,86.0,,"Mutha Chowk, Vazirabad, Nanded",,2011-06-05
705.0,5/2/2011,Maharashtra,Nanded,Maharashtra State Pollution Control Board,Industrial Area,102.0,102.0,141.0,,"Industrial Area, MIDC, CIDCO, Nanded",,2011-02-05
706.0,4/1/2011,Maharashtra,Jalna,Maharashtra State Pollution Control Board,"Residential, Rural and other Areas",9.0,30.0,94.0,,"Bachat Bhawan, Near S P Office, Jalna",,2011-01-04
707.0,4/5/2011,Maharashtra,Jalna,Maharashtra State Pollution Control Board,Industrial Area,8.0,29.0,157.0,,"Krishidhan Seeds Ltd, MIDC Area, Jalna",,2011-05-04
708.0,9/1/2011,Maharashtra,Pune,Maharashtra State Pollution Control Board,"Residential, Rural and other Areas",61.0,58.0,24.0,,"Bank of Baroda Building, Near Pimpri-Chinchwad M.C. Building",,2011-01-09
71.0,18-11-87,Tamil Nadu,Madras,Tamil Nadu Pollution Control Board,Industrial,19.9,1.0,,63.0,,,1987-11-18
710.0,11/1/2011,Maharashtra,Nashik,Maharashtra State Pollution Control Board,"Residential, Rural and other Areas",27.0,28.0,99.0,,"MPCB Sub R.O. Udyog Bhawan, Nashik",,2011-01-11
711.0,5/1/2012,Maharashtra,Nagpur,Maharashtra State Pollution Control Board,"Residential, Rural and other Areas",11.0,33.0,49.0,,"MPCB Office Premises, Civil Lines, Nagpur",,2012-01-05
712,1/8/2011,Uttar Pradesh,Moradabad,Uttar Pradesh State Pollution Control Board,"Residential, Rural and other Areas",11.0,15.0,156.0,,"Hindu College, Main Gate, Buddh Bazar, Station Road",,2011-08-01
713,1/2/2011,Uttar Pradesh,Moradabad,Uttar Pradesh State Pollution Control Board,"Residential, Rural and other Areas",7.0,20.0,151.0,,"Central Police Hospital, Police traning Centre, Civil Lines",,2011-02-01
714,23/01/2012,Uttar Pradesh,Bareilly,Uttar Pradesh State Pollution Control Board,"Residential, Rural and other Areas",9.0,21.0,173.0,,"IVRI Izatnagar, Bareilly",,2012-01-23
714.0,1/3/2011,Uttar Pradesh,Bareilly,Uttar Pradesh State Pollution Control Board,"Residential, Rural and other Areas",15.0,262.0,,,"IVRI Izatnagar, Bareilly",,2011-03-01
715,23/01/2012,Uttar Pradesh,Bareilly,Uttar Pradesh State Pollution Control Board,"Residential, Rural and other Areas",13.0,24.0,310.0,,"Petrol Pump, Civil Lines, Near Prabha Cinema",,2012-01-23
715.0,1/3/2011,Uttar Pradesh,Bareilly,Uttar Pradesh State Pollution Control Board,"Residential, Rural and other Areas",19.0,380.0,,,"Petrol Pump, Civil Lines, Near Prabha Cinema",,2011-03-01
716,26/07/2011,Uttar Pradesh,Saharanpur,Uttar Pradesh State Pollution Control Board,"Residential, Rural and other Areas",30.0,20.0,36.0,,"Library Roof, IIT Roorkee, Saharanpur Campus",,2011-07-26
717,1/9/2011,Uttar Pradesh,Saharanpur,Uttar Pradesh State Pollution Control Board,"Residential, Rural and other Areas",27.0,20.0,51.0,,"UPCL S.E. Office, Near Clock Tower, Saharanpur",,2011-09-01
718,4/1/2011,Uttar Pradesh,Rai Bareilly,Uttar Pradesh State Pollution Control Board,"Residential, Rural and other Areas",5.0,8.0,174.0,,"Ahmadnagar Town Hall Colony Gulab Road, Rai Bareilly",,2011-01-04
719,21/06/2011,Uttar Pradesh,Rai Bareilly,Uttar Pradesh State Pollution Control Board,"Residential, Rural and other Areas",7.3,9.5,120.3,,"Khoya Mandi, Tiraha Lucknow Road, Rai Bareilly",,2011-06-21
72.0,18-11-87,Tamil Nadu,Madras,Tamil Nadu Pollution Control Board,Industrial,14.2,1.7,,162.0,,,1987-11-18
720,22/06/2011,Uttar Pradesh,Rai Bareilly,Uttar Pradesh State Pollution Control Board,Industrial Area,7.0,8.4,212.3,,"E-23, Ind. Area, Amawan Road, Rai Bareilly",,2011-06-22
721,1/6/2012,Uttar Pradesh,Kanpur,Uttar Pradesh State Pollution Control Board,"Residential, Rural and other Areas",2.0,10.0,207.0,,"I.I.T. Campus, Kanpur",,2012-06-01
721.0,1/1/2011,Uttar Pradesh,Kanpur,Uttar Pradesh State Pollution Control Board,"Residential, Rural and other Areas",8.0,5.0,97.0,,"I.I.T. Campus, Kanpur",,2011-01-01
722,1/4/2012,Uttar Pradesh,Kanpur,Uttar Pradesh State Pollution Control Board,"Residential, Rural and other Areas",15.0,49.0,468.0,,"Dada Nagar, Kanpur",,2012-04-01
722.0,1/7/2011,Uttar Pradesh,Kanpur,Uttar Pradesh State Pollution Control Board,"Residential, Rural and other Areas",48.0,8.0,253.0,,"Dada Nagar, Kanpur",,2011-07-01
723,1/2/2012,Uttar Pradesh,Kanpur,Uttar Pradesh State Pollution Control Board,"Residential, Rural and other Areas",2.0,28.0,154.0,,"Ramadevi, Kanpur",,2012-02-01
723.0,4/1/2011,Uttar Pradesh,Kanpur,Uttar Pradesh State Pollution Control Board,"Residential, Rural and other Areas",5.0,34.0,117.0,,"Ramadevi, Kanpur",,2011-01-04
724,2/5/2011,Uttar Pradesh,Mathura,Uttar Pradesh State Pollution Control Board,"Residential, Rural and other Areas",,,203.0,,"R.O. UPPCB, 65 Baldevpuri, Maholi Road, Mathura",,2011-05-02
725,2/6/2011,Uttar Pradesh,Mathura,Uttar Pradesh State Pollution Control Board,Industrial Area,29.0,34.0,209.0,,"CETP, Industrial Area, Mathura",,2011-06-02
726,11/3/2011,Uttar Pradesh,Unnao,Uttar Pradesh State Pollution Control Board,"Residential, Rural and other Areas",10.0,33.0,153.0,,"H. No. 5, Krishna Nagar, Unnao",,2011-03-11
727,11/1/2011,Uttar Pradesh,Unnao,Uttar Pradesh State Pollution Control Board,Industrial Area,12.0,36.0,116.0,,"ICA Building, Industrial Area, Site 10, Unnao",,2011-01-11
728,3/1/2012,Uttar Pradesh,Gorakhpur,Uttar Pradesh State Pollution Control Board,"Residential, Rural and other Areas",,,,,"M. M.M. Engineering College, Gorakhpur",,2012-01-03
728.0,29/08/2011,Uttar Pradesh,Gorakhpur,Uttar Pradesh State Pollution Control Board,"Residential, Rural and other Areas",14.0,27.0,38.0,,"M. M.M. Engineering College, Gorakhpur",,2011-08-29
729,3/1/2012,Uttar Pradesh,Gorakhpur,Uttar Pradesh State Pollution Control Board,Industrial Area,26.0,60.0,137.0,,"India Glycol Ltd. Gida, Gorakhpur",,2012-01-03
729.0,24/08/2011,Uttar Pradesh,Gorakhpur,Uttar Pradesh State Pollution Control Board,Industrial Area,25.0,53.0,59.0,,"India Glycol Ltd. Gida, Gorakhpur",,2011-08-24
73.0,17-11-87,Tamil Nadu,Madras,Tamil Nadu Pollution Control Board,Residential,12.1,0.9,,143.0,,,1987-11-17
730,3/1/2012,Uttar Pradesh,Gorakhpur,Uttar Pradesh State Pollution Control Board,"Residential, Rural and other Areas",25.0,46.0,118.0,,"Jalkal, Muncipal Corporation, Golghar, Gorakhpur",,2012-01-03
730.0,1/2/2011,Uttar Pradesh,Gorakhpur,Uttar Pradesh State Pollution Control Board,"Residential, Rural and other Areas",26.0,45.0,88.0,,"Jalkal, Muncipal Corporation, Golghar, Gorakhpur",,2011-02-01
731.0,20/12/2011,Mizoram,Champhai,Mizoram State Pollution Control Board,"Residential, Rural and other Areas",2.0,4.5,16.66666667,,"D.T.O Office Building, Kahrawt veng, Champhai",,2011-12-20
732.0,31/12/2011,Mizoram,Champhai,Mizoram State Pollution Control Board,"Residential, Rural and other Areas",2.0,6.448333333,113.33333329999999,,"Lalzidinga building, Champhai Vengthlang, Champhai",,2011-12-31
733.0,21/12/2011,Mizoram,Kolasib,Mizoram State Pollution Control Board,"Residential, Rural and other Areas",2.0,4.5,75.66666667,,"H. Lalthuama Building, Near D.C. Office, Project Veng, Kolasib",,2011-12-21
734.0,21/12/2011,Mizoram,Kolasib,Mizoram State Pollution Control Board,"Residential, Rural and other Areas",2.0,5.366666667,74.0,,"Synod Bookroom, Building Diakkawn, Kolasib",,2011-12-21
735.0,22/12/2011,Mizoram,Lunglei,Mizoram State Pollution Control Board,"Residential, Rural and other Areas",2.0,4.5,26.0,,"Thangkhuma Building, Salem Veng, Lunglei",,2011-12-22
736.0,22/12/2011,Mizoram,Lunglei,Mizoram State Pollution Control Board,"Residential, Rural and other Areas",2.0,4.5,43.33333333,,"K.Lalliantluanga, Chanmari I, Lunglei",,2011-12-22
737.0,31/12/2011,Mizoram,Aizawl,Mizoram State Pollution Control Board,"Residential, Rural and other Areas",2.0,4.5,82.0,,"Dawrpui Y.M.A, Building, Dawrpui, Aizawl",,2011-12-31
738.0,31/12/2011,Mizoram,Aizawl,Mizoram State Pollution Control Board,"Residential, Rural and other Areas",2.0,4.5,30.66666667,,"Lengpui Airport, Residential Quarter (Type-III), Model Veng, Lengpui, Aizawl",,2011-12-31
739.0,4/3/2013,Andhra Pradesh,Vijayawada,Andhra Pradesh State Pollution Control Board,"Residential, Rural and other Areas",5.0,22.0,123.0,,"Police Control Room, Krishna District Vijaywada",,2013-03-04
74.0,17-11-87,Tamil Nadu,Madras,Tamil Nadu Pollution Control Board,Residential,20.8,1.6,,139.0,,,1987-11-17
740.0,6/3/2013,Andhra Pradesh,Nalgonda,Andhra Pradesh State Pollution Control Board,Industrial Area,5.0,17.0,50.0,,"Administrative Building of M/s Srini Pharmaceuticals Ltd, Choutuppal, Nalgonda District",,2013-03-06
741.0,3/6/2013,Andhra Pradesh,Warangal,Andhra Pradesh State Pollution Control Board,"Residential, Rural and other Areas",4.0,10.0,57.0,,"Mee Seva Center, Muncipal Office Building, Warangal",,2013-06-03
742.0,1/3/2013,Andhra Pradesh,Chittoor,Andhra Pradesh State Pollution Control Board,"Residential, Rural and other Areas",4.0,9.0,58.0,,"Near Nutrine Confectionery, Palamaner Road, Chittor",,2013-03-01
743.0,3/3/2013,Andhra Pradesh,Khammam,Andhra Pradesh State Pollution Control Board,"Residential, Rural and other Areas",5.0,19.0,72.0,,"Jalasoudha, Khammam",,2013-03-03
744.0,01-01-14,Telangana,Sangareddy,Andhra Pradesh State Pollution Control Board,Industrial Area,1.8,66.3,99.0,,"APIIC Building, IDA, Pashamylaram",54.0,2014-01-01
745.0,1/3/2013,Andhra Pradesh,Hyderabad,Andhra Pradesh State Pollution Control Board,Industrial Area,5.0,44.0,158.0,,"Industrial Association office, IDA, Jeedimetla",,2013-03-01
746.0,10/3/2013,Andhra Pradesh,Nizamabad,Andhra Pradesh State Pollution Control Board,"Residential, Rural and other Areas",5.0,11.0,41.0,,Nizamabad Town,,2013-03-10
748.0,1/3/2013,Andhra Pradesh,Ananthapur,Andhra Pradesh State Pollution Control Board,"Residential, Rural and other Areas",4.0,9.0,69.0,,"Kamalanagar, Ananthapur",,2013-03-01
749.0,1/3/2013,Andhra Pradesh,Kadapa,Andhra Pradesh State Pollution Control Board,Industrial Area,4.0,9.0,57.0,,"Near ICL Industries, Yerrangunta, Kadapa District",,2013-03-01
75.0,5/10/1988,Tamil Nadu,Turicorin,Tamil Nadu Pollution Control Board,"Residential, Rural and other Areas",1.0,8.0,,59.0,,,1988-10-05
750.0,3/2/2013,Andhra Pradesh,Eluru,Andhra Pradesh State Pollution Control Board,"Residential, Rural and other Areas",,,105.0,,"ASRAM Diagnostic Center, Eluru",,2013-02-03
751.0,1/1/2013,Andhra Pradesh,Srikakulam,Andhra Pradesh State Pollution Control Board,Industrial Area,2.0,5.0,107.0,,"IDA, Pydibheemavaram, Srikakulam",,2013-01-01
752.0,4/1/2013,Andhra Pradesh,Vizianagaram,Andhra Pradesh State Pollution Control Board,Industrial Area,5.0,11.0,71.0,,"Industrial Growth Centre, Bobbili, Vizianagaram",,2013-01-04
753.0,1/3/2013,Andhra Pradesh,Ongole,Andhra Pradesh State Pollution Control Board,"Residential, Rural and other Areas",5.0,16.0,59.0,,"Near Court Centre, Ongole, Parkasam District",,2013-03-01
754.0,03-02-15,Telangana,Kothur,Andhra Pradesh State Pollution Control Board,Industrial Area,5.0,10.0,73.0,,"Kothur, Mahaboobnagar District",,2015-02-03
755.0,5/3/2013,Andhra Pradesh,Karimnagar,Andhra Pradesh State Pollution Control Board,"Residential, Rural and other Areas",4.0,15.0,97.0,,"DIC Building, Karimnagar",,2013-03-05
756.0,8/3/2013,Andhra Pradesh,Sangareddy,Andhra Pradesh State Pollution Control Board,"Residential, Rural and other Areas",5.0,11.0,31.0,,"Muncipal office, Sangareddy",,2013-03-08
757.0,15-01-13,Andhra Pradesh,Rajahmundry,Andhra Pradesh State Pollution Control Board,Industrial Area,,,108.0,,"Staff Club Building, M/s A.P. Paper Mill, Rajahmundry",,2013-01-15
758.0,8/3/2013,Andhra Pradesh,Sangareddy,Andhra Pradesh State Pollution Control Board,Industrial Area,13.0,21.0,171.0,,"Hetero Lab Unit-I, Gaddapotharam, Zinnaram (M), Medak District",,2013-03-08
759.0,24-07-13,Tamil Nadu,Cuddalore,Tamilnadu State Pollution Control Board,"Residential, Rural and other Areas",7.0,15.0,29.0,,Eachangadu Villagae,,2013-07-24
76.0,6/1/1988,Punjab,Ludhiana,Punjab Pollution Control Board,Industrial Area,,,,579.0,,,1988-01-06
760.0,25-07-13,Tamil Nadu,Cuddalore,Tamilnadu State Pollution Control Board,Industrial Area,5.0,14.0,37.0,,"SIPCOT Industrial Complex, Cuddalore",,2013-07-25
761.0,26-07-13,Tamil Nadu,Cuddalore,Tamilnadu State Pollution Control Board,"Residential, Rural and other Areas",8.0,14.0,31.0,,"District Environmental Engineer Office, Imperial Road, Cuddalore",,2013-07-26
762.0,8/1/2013,Tamil Nadu,Mettur,Tamilnadu State Pollution Control Board,"Residential, Rural and other Areas",8.0,27.0,48.0,,"Raman Nagar, Mettur",,2013-01-08
763.0,8/2/2013,Tamil Nadu,Mettur,Tamilnadu State Pollution Control Board,Industrial Area,9.0,29.0,45.0,,"SIDCO Industrial Complex, Mettur",,2013-02-08
764.0,1/7/2013,Tamil Nadu,Chennai,Tamilnadu State Pollution Control Board,"Residential, Rural and other Areas",6.0,15.0,60.0,,"Adyar, Chennai",,2013-07-01
765.0,18-01-13,Tamil Nadu,Chennai,Tamilnadu State Pollution Control Board,"Residential, Rural and other Areas",9.0,43.0,96.0,,"Anna Nagar, Chennai",,2013-01-18
766.0,1/8/2013,Tamil Nadu,Chennai,Tamilnadu State Pollution Control Board,"Residential, Rural and other Areas",9.0,60.0,98.0,,"Thiyagaraya Nagar, Chennai",,2013-08-01
767.0,1/7/2013,Tamil Nadu,Chennai,Tamilnadu State Pollution Control Board,"Residential, Rural and other Areas",9.0,32.0,92.0,,"Kilpauk, Chennai",,2013-07-01
768.0,07-04-15,Tamil Nadu,Chennai,Tamilnadu State Pollution Control Board,"Residential, Rural and other Areas",17.0,23.0,98.0,,"Vallalar Nagar, Chennai",,2015-04-07
769.0,9/4/2012,Tamil Nadu,Trichy,Tamilnadu State Pollution Control Board,"Residential, Rural and other Areas",11.0,17.0,96.0,,"Gandhi Market, Trichy",,2012-04-09
77.0,11/2/1988,Karnataka,Bangalore,Karnataka Pollution Control Board,Industrial Area,37.2,15.2,,220.0,,,1988-02-11
770.0,9/3/2012,Tamil Nadu,Trichy,Tamilnadu State Pollution Control Board,"Residential, Rural and other Areas",10.0,15.0,88.0,,"Main Guard Gate, Tirchy",,2012-03-09
771.0,9/6/2012,Tamil Nadu,Trichy,Tamilnadu State Pollution Control Board,"Residential, Rural and other Areas",8.0,14.0,38.0,,"Bishop Heber College, Tirchy",,2012-06-09
772.0,7/9/2012,Tamil Nadu,Trichy,Tamilnadu State Pollution Control Board,"Residential, Rural and other Areas",9.0,15.0,45.0,,"Golden Rock, Trichy",,2012-09-07
773.0,9/5/2012,Tamil Nadu,Trichy,Tamilnadu State Pollution Control Board,"Residential, Rural and other Areas",12.0,18.0,113.0,,"Central Bus Stand, Trichy",,2012-05-09
774,1/2/2013,Goa,Margao,Goa State Pollution Control Board,"Residential, Rural and other Areas",7.0,13.0,79.0,35.9,Margao Town,,2013-02-01
775,1/1/2013,Goa,Mapusa,Goa State Pollution Control Board,"Residential, Rural and other Areas",12.0,14.0,74.0,24.58,Mapusa Town,,2013-01-01
776,1/2/2013,Goa,Ponda,Goa State Pollution Control Board,"Residential, Rural and other Areas",7.0,12.0,55.0,,Ponda Town,,2013-02-01
777,1/4/2013,Goa,Sanguem,Goa State Pollution Control Board,"Residential, Rural and other Areas",12.0,16.0,55.0,30.26,"Near Railway Station at Kalem, Sanguem",,2013-04-01
778,1/2/2013,Goa,Tilamol,Goa State Pollution Control Board,"Residential, Rural and other Areas",13.0,16.0,90.0,,"Quepem, Tilamol",,2013-02-01
78.0,11/3/1988,Karnataka,Bangalore,Karnataka Pollution Control Board,Industrial Area,77.9,32.0,,142.0,,,1988-03-11
780,1/2/2013,Goa,Kundaim,Goa State Pollution Control Board,Industrial Area,7.0,12.0,52.0,28.7,Kundaim Industrial Estate,,2013-02-01
781,02-01-15,Goa,Cuncolim,Goa State Pollution Control Board,Industrial Area,4.0,8.0,44.0,,Cuncolim Industrial Estate,13.0,2015-01-02
782.0,06-01-15,Meghalaya,Umsning,Meghalaya State Pollution Control Board,Industrial Area,2.0,11.0,103.0,,"Umiam Industrial Complex, Ri-Bhoi District",,2015-01-06
784.0,07-07-14,Puducherry,Karaikal,Puducherry Pollution Conrol Committee,"Residential, Rural and other Areas",6.0,9.0,16.0,,"B.Ed College (PKCE), Nehru Nagar, Karaikal",,2014-07-07
785.0,07-04-14,Puducherry,Karaikal,Puducherry Pollution Conrol Committee,"Residential, Rural and other Areas",20.0,10.0,31.0,,"Govt. Tourist Home, Kovilpathu, Karaikal",,2014-04-07
786.0,07-05-14,Puducherry,Karaikal,Puducherry Pollution Conrol Committee,Industrial Area,10.0,8.0,45.0,,"M/s Puducherry Power Corporation Limited, Polagam, T.R. Pattinam, Karaikal",,2014-05-07
787.0,18-07-14,Arunachal Pradesh,Itanagar,Arunachal Pradesh State Pollution Control Board,"Residential, Rural and other Areas",2.0,5.0,250.0,,Compound of PCCF's Office building,,2014-07-18
788.0,17-07-14,Arunachal Pradesh,Naharlagun,Arunachal Pradesh State Pollution Control Board,"Residential, Rural and other Areas",2.0,5.0,86.0,,Compound of APSPCB office building,,2014-07-17
789.0,01-01-15,Punjab,Sangrur,Punjab State Pollution Control Board,"Residential, Rural and other Areas",,14.0,93.0,,"Gurudwara Gangsar Sahib Village Kilabharian, District Sangrur",,2015-01-01
79.0,11/2/1988,Karnataka,Bangalore,Karnataka Pollution Control Board,"Residential, Rural and other Areas",27.2,20.3,,392.0,,,1988-02-11
790.0,01-01-15,Punjab,Faridkot,Punjab State Pollution Control Board,"Residential, Rural and other Areas",,11.0,75.0,,"Gurudwara Guru ki Dhab, Jaitu Kotkapura Road, Village Guru Ki Dhab",,2015-01-01
791.0,10-01-15,Punjab,Amritsar,Punjab State Pollution Control Board,"Residential, Rural and other Areas",7.0,13.0,62.0,,"Shriguru Harkishan Public School, Village Rasulpur Kalan, District Amritsar",,2015-01-10
792.0,02-01-15,Punjab,Hoshiarpur,Punjab State Pollution Control Board,"Residential, Rural and other Areas",7.0,12.0,63.0,,"Govt. Senior Sec. School, Mukandpur, Nawashahar, Shahid Bhagat Singh Nagar",,2015-01-02
794,01-01-15,Himachal Pradesh,Dharamshala,Himachal Pradesh State Environment Proection & Pollution Control Board,"Residential, Rural and other Areas",2.0,8.0,43.0,,Kotwali Bazar Dharamshala,,2015-01-01
795,01-07-15,Himachal Pradesh,Dharamshala,Himachal Pradesh State Environment Proection & Pollution Control Board,"Residential, Rural and other Areas",2.0,5.0,26.0,,"Daari, Dharamshala",,2015-07-01
796.0,06-02-15,Madhya Pradesh,Bhopal,Madhya Pradesh State Pollution Control Board,"Residential, Rural and other Areas",2.0,26.0,135.0,,"Kolar Thana, Kolar Road, Bhopal",112.0,2015-02-06
797.0,02-02-15,Madhya Pradesh,Bhopal,Madhya Pradesh State Pollution Control Board,"Residential, Rural and other Areas",6.0,47.0,118.0,,"AKVN Office, Industrial Area Mandideep, Raisen",99.0,2015-02-02
798.0,05-03-15,Madhya Pradesh,Jabalpur,Madhya Pradesh State Pollution Control Board,Industrial Area,15.0,35.0,109.0,,Udaipur Beverage Racchai,47.0,2015-03-05
799.0,01-01-15,Madhya Pradesh,Chhindwara,Madhya Pradesh State Pollution Control Board,"Residential, Rural and other Areas",6.0,30.0,81.0,,"HIG -33, Front of Geetanali Park Housing Board Colony, Chadangaon",,2015-01-01
8,1/1/1987,West Bengal,Howrah,West Bengal Pollution Control Board,Industrial,103.4,148.0,,968.0,,,1987-01-01
80.0,11/3/1988,Karnataka,Bangalore,Karnataka Pollution Control Board,Industrial Area,23.1,13.4,,356.0,,,1988-03-11
800.0,05-01-15,Madhya Pradesh,Chhindwara,Madhya Pradesh State Pollution Control Board,Industrial Area,8.0,34.0,94.0,,"Hindustan Unileaver, Narsinghpur Road",,2015-01-05
801.0,06-01-15,Madhya Pradesh,Amlai,Madhya Pradesh State Pollution Control Board,Industrial Area,11.0,13.0,56.0,,HJI,,2015-01-06
802.0,05-01-15,Madhya Pradesh,Amlai,Madhya Pradesh State Pollution Control Board,Industrial Area,17.0,26.0,76.0,,OPM,,2015-01-05
803.0,05-01-15,Madhya Pradesh,Pithampur,Madhya Pradesh State Pollution Control Board,Industrial Area,9.0,18.0,123.0,,"Vikas Bhavan, Sector-2, Ind. Area, Pithampur",,2015-01-05
804.0,08-01-15,Madhya Pradesh,Pithampur,Madhya Pradesh State Pollution Control Board,Industrial Area,,,145.0,,"RCC Over Head Tank No. 1, Sector-3, Ind. Area, Pithampur",,2015-01-08
805,03-11-15,Uttar Pradesh,Allahabad,Uttar Pradesh State Pollution Control Board,"Residential, Rural and other Areas",2.0,36.0,210.0,,"Sewage Pumping Stations, Alopibagh",,2015-11-03
806,03-11-15,Uttar Pradesh,Allahabad,Uttar Pradesh State Pollution Control Board,"Residential, Rural and other Areas",1.0,35.0,213.0,,"Co-operative Bank, Jhonstonganj",,2015-11-03
807,05-11-15,Uttar Pradesh,Allahabad,Uttar Pradesh State Pollution Control Board,"Residential, Rural and other Areas",2.0,37.0,247.0,,"Parag Dairy, Rambagh",,2015-11-05
81.0,11/2/1988,Karnataka,Bangalore,Karnataka Pollution Control Board,"Residential, Rural and other Areas",26.3,11.2,,150.0,,,1988-02-11
813,05-01-15,Gujarat,Ahmedabad,Gujarat State Pollution Control Board,RIRUO,14.0,20.0,88.0,,"Reliable Products, 61/62 Ilaben estate,PIRANA DUMP SITE,NAROL",35.0,2015-01-05
814,05-01-15,Gujarat,Ahmedabad,Gujarat State Pollution Control Board,RIRUO,14.0,22.0,91.0,,"Bhagavathi Estate ,KEVAL KANTA ROAD,RAKHIYAL",35.0,2015-01-05
815,05-01-15,Gujarat,Vadodara,Gujarat State Pollution Control Board,RIRUO,14.0,20.0,93.0,,"GIDC OFFICE TERRACE, GIDC ESTATE JHAGADIA",38.0,2015-01-05
816.0,02-01-15,Odisha,Konark,Odisha State Pollution Control Board,"Residential, Rural and other Areas",2.0,10.0,37.0,,"Konark police station, Konark",,2015-01-02
817.0,02-09-15,Odisha,Puri,Odisha State Pollution Control Board,"Residential, Rural and other Areas",2.0,11.0,43.0,,"Sadar Police Station, Puri",,2015-09-02
818.0,03-09-15,Odisha,Puri,Odisha State Pollution Control Board,"Residential, Rural and other Areas",2.0,11.0,44.0,,Town Police,,2015-09-03
819.0,02-01-15,Odisha,Kalinga Nagar,Odisha State Pollution Control Board,Industrial Area,2.0,10.0,85.0,,Roof of RO OFFICE BUILDING,34.0,2015-01-02
82.0,13-06-88,Madhya Pradesh,Nagda,Madhya Pradesh  Pollution Control Board,Industrial Area,16.5,7.3,,262.0,,,1988-06-13
83.0,6/4/1988,Madhya Pradesh,Nagda,Madhya Pradesh  Pollution Control Board,"Residential, Rural and other Areas",27.7,12.2,,223.0,,,1988-04-06
84.0,6/2/1988,Madhya Pradesh,Nagda,Madhya Pradesh  Pollution Control Board,"Residential, Rural and other Areas",16.7,8.1,,272.0,,,1988-02-06
85.0,February - M021990,Uttar Pradesh,Kanpur,Uttar Pradesh  Pollution Control Board,"Residential, Rural and other Areas",,,,378.0,,,1990-02-01
86,1/4/2012,Uttar Pradesh,Kanpur,Uttar Pradesh State Pollution Control Board,Industrial Area,8.84,40.1,242.0,,"M/S Associated Chem Pvt Ltd, Fazalganj, Kanpur",,2012-04-01
86.0,June - M061990,Uttar Pradesh,Kanpur,Uttar Pradesh  Pollution Control Board,Industrial Area,11.1,13.8,,499.0,,,1990-06-01
87.0,June - M061990,Uttar Pradesh,Kanpur,Uttar Pradesh  Pollution Control Board,"Residential, Rural and other Areas",12.6,16.5,,427.0,,,1990-06-01
89,1/2/2004,Uttarakhand,Dehradun,Uttarakhand Environment Protection and Pollution Control Board,"Residential, Rural and other Areas",17.0,21.0,152.0,265.0,"Clock Tower, PWD Guest House, Dehradun",,2004-02-01
89.0,M031989,Uttar Pradesh,Dehradoon,Uttar Pradesh  Pollution Control Board,"Residential, Rural and other Areas",27.6,32.9,,729.0,,,1989-03-01
9,1/2/1987,West Bengal,Howrah,West Bengal Pollution Control Board,Industrial,92.1,112.1,,531.0,,,1987-02-01
90,1/4/2010,Uttarakhand,Dehradun,Uttarakhand Environment Protection and Pollution Control Board,Industrial Area,,,92.34,178.02,"Raipur Road, Near parag Diary, Dehradun",,2010-04-01
90.0,M011989,Uttar Pradesh,Dehradoon,Uttar Pradesh  Pollution Control Board,Industrial Area,19.1,19.2,,820.0,,,1989-01-01
91.0,M021989,Madhya Pradesh,Bhilai,Madhya Pradesh  Pollution Control Board,Industrial Area,22.3,25.0,,294.0,,,1989-02-01
92.0,21-09-88,Puducherry,Pondichery,PNPB,"Residential, Rural and other Areas",7.8,8.9,,87.0,,,1988-09-21
93.0,17-08-88,Puducherry,Pondichery,PNPB,Industrial Area,19.0,17.5,,67.0,,,1988-08-17
94.0,March - M031990,Maharashtra,Nagpur,Maharashtra Pollution Control Board,"Residential, Rural and other Areas",18.8,37.7,,,,,1990-03-01
95.0,January - M011992,Andhra Pradesh,Hyderabad,Andhra Pradesh  Pollution Control Board,,20.0,64.6,,353.0,,,1992-01-01
97,M041989,Gujarat,Ahmedabad,Gujarat Pollution Control Board,Industrial Area,7.4,47.0,,464.0,,,1989-04-01
98,1/6/2012,Uttar Pradesh,Kanpur,Uttar Pradesh State Pollution Control Board,"Residential, Rural and other Areas",7.0,44.0,182.0,,"Deputy Ka Parao, Kanpur",,2012-06-01
98.0,June - M061990,Uttar Pradesh,Kanpur,Uttar Pradesh  Pollution Control Board,"Residential, Rural and other Areas",12.2,15.3,,783.0,,,1990-06-01
99,M051989,Gujarat,Surat,Gujarat Pollution Control Board,Industrial Area,7.8,6.1,,312.0,,,1989-05-01
SAMP,06-01-15,Gujarat,ANKLESHWAR,Gujarat State Pollution Control Board,RIRUO,13.0,20.0,91.0,,"GIDC OFFICE TERRACE, GIDC ESTATE JHAGADIA,ANKLESHWAR",37.0,2015-01-06
750.0,01-01-14,Andhra Pradesh,Eluru,Andhra Pradesh State Pollution Control Board,"Residential, Rural and other Areas",,,98.0,,"ASRAM Diagnostic Center, Eluru",,2014-01-01
233.0,01-01-15,Andhra Pradesh,Visakhapatnam,Andhra Pradesh State Pollution Control Board,Industrial Area,9.0,18.0,46.0,,"Industrial Estate, Marripalem, Visakhapatnam",,2015-01-01
542.0,01-02-14,Assam,Bongaigaon,Assam State Pollution Control Board,"Residential, Rural and other Areas",6.0,13.0,56.0,,"Campus of Oil India Ltd. PS-6, Bongaigaon, Chirang",,2014-02-01
233.0,01-02-15,Andhra Pradesh,Visakhapatnam,Andhra Pradesh State Pollution Control Board,Industrial Area,6.0,11.0,39.0,,"Industrial Estate, Marripalem, Visakhapatnam",,2015-02-01
748.0,01-03-14,Andhra Pradesh,Ananthapur,Andhra Pradesh State Pollution Control Board,"Residential, Rural and other Areas",4.0,9.0,111.0,,"Kamalanagar, Ananthapur",,2014-03-01
233.0,01-03-15,Andhra Pradesh,Visakhapatnam,Andhra Pradesh State Pollution Control Board,Industrial Area,7.0,15.0,90.0,,"Industrial Estate, Marripalem, Visakhapatnam",,2015-03-01
750.0,01-04-14,Andhra Pradesh,Eluru,Andhra Pradesh State Pollution Control Board,"Residential, Rural and other Areas",,,97.0,,"ASRAM Diagnostic Center, Eluru",,2014-04-01
233.0,01-04-15,Andhra Pradesh,Visakhapatnam,Andhra Pradesh State Pollution Control Board,Industrial Area,11.0,18.0,90.0,,"Industrial Estate, Marripalem, Visakhapatnam",,2015-04-01
708.0,01-05-14,Maharashtra,Pune,Maharashtra State Pollution Control Board,"Residential, Rural and other Areas",22.0,82.0,127.0,,"Bank of Baroda Building, Near Pimpri-Chinchwad M.C. Building",,2014-05-01
233.0,01-05-15,Andhra Pradesh,Visakhapatnam,Andhra Pradesh State Pollution Control Board,Industrial Area,8.0,19.0,49.0,,"Industrial Estate, Marripalem, Visakhapatnam",,2015-05-01
748.0,01-06-14,Andhra Pradesh,Ananthapur,Andhra Pradesh State Pollution Control Board,"Residential, Rural and other Areas",4.0,9.0,118.0,,"Kamalanagar, Ananthapur",,2014-06-01
233.0,01-06-15,Andhra Pradesh,Visakhapatnam,Andhra Pradesh State Pollution Control Board,Industrial Area,9.0,14.0,45.0,,"Industrial Estate, Marripalem, Visakhapatnam",,2015-06-01
750.0,01-07-14,Andhra Pradesh,Eluru,Andhra Pradesh State Pollution Control Board,"Residential, Rural and other Areas",,,98.0,,"ASRAM Diagnostic Center, Eluru",,2014-07-01
233.0,01-07-15,Andhra Pradesh,Visakhapatnam,Andhra Pradesh State Pollution Control Board,Industrial Area,6.0,15.0,34.0,,"Industrial Estate, Marripalem, Visakhapatnam",,2015-07-01
520.0,01-08-14,Assam,Bongaigaon,Assam State Pollution Control Board,"Residential, Rural and other Areas",7.0,16.0,34.0,,"Barpara Office Building, Bongaigaon",,2014-08-01
233.0,01-08-15,Andhra Pradesh,Visakhapatnam,Andhra Pradesh State Pollution Control Board,Industrial Area,6.0,11.0,56.0,,"Industrial Estate, Marripalem, Visakhapatnam",,2015-08-01
748.0,01-09-14,Andhra Pradesh,Ananthapur,Andhra Pradesh State Pollution Control Board,"Residential, Rural and other Areas",4.0,9.0,87.0,,"Kamalanagar, Ananthapur",,2014-09-01
233.0,01-09-15,Andhra Pradesh,Visakhapatnam,Andhra Pradesh State Pollution Control Board,Industrial Area,6.0,14.0,40.0,,"Industrial Estate, Marripalem, Visakhapatnam",,2015-09-01
750.0,01-10-14,Andhra Pradesh,Eluru,Andhra Pradesh State Pollution Control Board,"Residential, Rural and other Areas",,,103.0,,"ASRAM Diagnostic Center, Eluru",,2014-10-01
233.0,01-10-15,Andhra Pradesh,Visakhapatnam,Andhra Pradesh State Pollution Control Board,Industrial Area,7.0,20.0,38.0,,"Industrial Estate, Marripalem, Visakhapatnam",,2015-10-01
748.0,01-11-14,Andhra Pradesh,Ananthapur,Andhra Pradesh State Pollution Control Board,"Residential, Rural and other Areas",4.0,9.0,85.0,,"Kamalanagar, Ananthapur",,2014-11-01
233.0,01-11-15,Andhra Pradesh,Visakhapatnam,Andhra Pradesh State Pollution Control Board,Industrial Area,8.0,22.0,22.0,,"Industrial Estate, Marripalem, Visakhapatnam",,2015-11-01
106.0,01-12-14,Chandigarh,Chandigarh,Chandigarh Pollution Control Committee,Industrial Area,2.0,37.0,116.0,,"Modern Foods, Industrial Area, Chandigarh",,2014-12-01
233.0,01-12-15,Andhra Pradesh,Visakhapatnam,Andhra Pradesh State Pollution Control Board,Industrial Area,9.0,14.0,70.0,,"Industrial Estate, Marripalem, Visakhapatnam",,2015-12-01
757.0,02-01-14,Andhra Pradesh,Rajahmundry,Andhra Pradesh State Pollution Control Board,Industrial Area,16.0,23.0,67.0,,"Staff Club Building, M/s A.P. Paper Mill, Rajahmundry",,2014-01-02
389.0,02-01-15,Andhra Pradesh,Tirupati,Andhra Pradesh State Pollution Control Board,Sensitive Area,5.0,10.0,56.0,,"Regional Science Centre, Chittoor Bypass Road, Tirupati",,2015-01-02
623.0,02-02-14,Kerala,Malappuram,Kerala State Pollution Control Board,Industrial Area,2.0,9.0,88.0,,"Kakkanchery, near KINFRA, Malappuram",,2014-02-02
389.0,02-02-15,Andhra Pradesh,Tirupati,Andhra Pradesh State Pollution Control Board,Sensitive Area,5.0,11.0,56.0,,"Regional Science Centre, Chittoor Bypass Road, Tirupati",,2015-02-02
748.0,02-03-14,Andhra Pradesh,Ananthapur,Andhra Pradesh State Pollution Control Board,"Residential, Rural and other Areas",5.0,10.0,100.0,,"Kamalanagar, Ananthapur",,2014-03-02
389.0,02-03-15,Andhra Pradesh,Tirupati,Andhra Pradesh State Pollution Control Board,Sensitive Area,5.0,11.0,62.0,,"Regional Science Centre, Chittoor Bypass Road, Tirupati",,2015-03-02
757.0,02-04-14,Andhra Pradesh,Rajahmundry,Andhra Pradesh State Pollution Control Board,Industrial Area,21.0,36.0,68.0,,"Staff Club Building, M/s A.P. Paper Mill, Rajahmundry",,2014-04-02
193.0,02-04-15,Assam,Guwahati,Assam State Pollution Control Board,"Residential, Rural and other Areas",13.0,22.0,220.0,,"Head Office, Bamunimaidan, Guwahati",,2015-04-02
520.0,02-05-14,Assam,Bongaigaon,Assam State Pollution Control Board,"Residential, Rural and other Areas",9.0,16.0,35.0,,"Barpara Office Building, Bongaigaon",,2014-05-02
193.0,02-05-15,Assam,Guwahati,Assam State Pollution Control Board,"Residential, Rural and other Areas",6.0,14.0,92.0,,"Head Office, Bamunimaidan, Guwahati",,2015-05-02
748.0,02-06-14,Andhra Pradesh,Ananthapur,Andhra Pradesh State Pollution Control Board,"Residential, Rural and other Areas",5.0,10.0,95.0,,"Kamalanagar, Ananthapur",,2014-06-02
193.0,02-06-15,Assam,Guwahati,Assam State Pollution Control Board,"Residential, Rural and other Areas",7.0,13.0,67.0,,"Head Office, Bamunimaidan, Guwahati",,2015-06-02
757.0,02-07-14,Andhra Pradesh,Rajahmundry,Andhra Pradesh State Pollution Control Board,Industrial Area,18.0,24.0,72.0,,"Staff Club Building, M/s A.P. Paper Mill, Rajahmundry",,2014-07-02
193.0,02-07-15,Assam,Guwahati,Assam State Pollution Control Board,"Residential, Rural and other Areas",6.0,11.0,67.0,,"Head Office, Bamunimaidan, Guwahati",,2015-07-02
567.0,02-08-14,Assam,Silcher,Assam State Pollution Control Board,"Residential, Rural and other Areas",6.0,17.0,175.0,,"Office building of RLO, near Ithkola Market, Ghaniwala road",,2014-08-02
595.0,02-08-15,Assam,Nagaon,Assam State Pollution Control Board,"Residential, Rural and other Areas",8.0,14.0,89.0,,"Water Resources Division Office Campus, Christian Patty, near Nagaon College",,2015-08-02
748.0,02-09-14,Andhra Pradesh,Ananthapur,Andhra Pradesh State Pollution Control Board,"Residential, Rural and other Areas",5.0,10.0,101.0,,"Kamalanagar, Ananthapur",,2014-09-02
389.0,02-09-15,Andhra Pradesh,Tirupati,Andhra Pradesh State Pollution Control Board,Sensitive Area,5.0,10.0,63.0,,"Regional Science Centre, Chittoor Bypass Road, Tirupati",,2015-09-02
757.0,02-10-14,Andhra Pradesh,Rajahmundry,Andhra Pradesh State Pollution Control Board,Industrial Area,11.0,15.0,63.0,,"Staff Club Building, M/s A.P. Paper Mill, Rajahmundry",,2014-10-02
538.0,02-10-15,Assam,Dibrugarh,Assam State Pollution Control Board,"Residential, Rural and other Areas",7.0,13.0,131.0,,"Dibrugarh Office Building, Dibrugarh",,2015-10-02
748.0,02-11-14,Andhra Pradesh,Ananthapur,Andhra Pradesh State Pollution Control Board,"Residential, Rural and other Areas",5.0,10.0,103.0,,"Kamalanagar, Ananthapur",,2014-11-02
389.0,02-11-15,Andhra Pradesh,Tirupati,Andhra Pradesh State Pollution Control Board,Sensitive Area,4.0,10.0,56.0,,"Regional Science Centre, Chittoor Bypass Road, Tirupati",,2015-11-02
520.0,02-12-14,Assam,Bongaigaon,Assam State Pollution Control Board,"Residential, Rural and other Areas",7.0,15.0,59.0,,"Barpara Office Building, Bongaigaon",,2014-12-02
389.0,02-12-15,Andhra Pradesh,Tirupati,Andhra Pradesh State Pollution Control Board,Sensitive Area,5.0,11.0,55.0,,"Regional Science Centre, Chittoor Bypass Road, Tirupati",,2015-12-02
750.0,03-01-14,Andhra Pradesh,Eluru,Andhra Pradesh State Pollution Control Board,"Residential, Rural and other Areas",,,112.0,,"ASRAM Diagnostic Center, Eluru",,2014-01-03
193.0,03-01-15,Assam,Guwahati,Assam State Pollution Control Board,"Residential, Rural and other Areas",7.0,14.0,61.0,,"Head Office, Bamunimaidan, Guwahati",,2015-01-03
460.0,03-02-14,Karnataka,Belgaum,Karnataka State Pollution Control Board,Industrial Area,2.0,9.0,,,"Karnataka SPCB Office Building, Belgaum",,2014-02-03
787.0,03-02-15,Arunachal Pradesh,Itanagar,Arunachal Pradesh State Pollution Control Board,"Residential, Rural and other Areas",2.0,5.0,99.0,,Compound of PCCF's Office building,,2015-02-03
748.0,03-03-14,Andhra Pradesh,Ananthapur,Andhra Pradesh State Pollution Control Board,"Residential, Rural and other Areas",5.0,10.0,84.0,,"Kamalanagar, Ananthapur",,2014-03-03
193.0,03-03-15,Assam,Guwahati,Assam State Pollution Control Board,"Residential, Rural and other Areas",7.0,15.0,151.0,,"Head Office, Bamunimaidan, Guwahati",,2015-03-03
757.0,03-04-14,Andhra Pradesh,Rajahmundry,Andhra Pradesh State Pollution Control Board,Industrial Area,19.0,36.0,59.0,,"Staff Club Building, M/s A.P. Paper Mill, Rajahmundry",,2014-04-03
389.0,03-04-15,Andhra Pradesh,Tirupati,Andhra Pradesh State Pollution Control Board,Sensitive Area,5.0,11.0,62.0,,"Regional Science Centre, Chittoor Bypass Road, Tirupati",,2015-04-03
520.0,03-05-14,Assam,Bongaigaon,Assam State Pollution Control Board,"Residential, Rural and other Areas",8.0,15.0,55.0,,"Barpara Office Building, Bongaigaon",,2014-05-03
677.0,03-05-15,Karnataka,Raichur,Karnataka State Pollution Control Board,"Residential, Rural and other Areas",5.0,11.0,94.0,,"KSPCB Office Premises, Raichur",,2015-05-03
748.0,03-06-14,Andhra Pradesh,Ananthapur,Andhra Pradesh State Pollution Control Board,"Residential, Rural and other Areas",5.0,10.0,81.0,,"Kamalanagar, Ananthapur",,2014-06-03
389.0,03-06-15,Andhra Pradesh,Tirupati,Andhra Pradesh State Pollution Control Board,Sensitive Area,5.0,12.0,71.0,,"Regional Science Centre, Chittoor Bypass Road, Tirupati",,2015-06-03
757.0,03-07-14,Andhra Pradesh,Rajahmundry,Andhra Pradesh State Pollution Control Board,Industrial Area,14.0,23.0,59.0,,"Staff Club Building, M/s A.P. Paper Mill, Rajahmundry",,2014-07-03
193.0,03-07-15,Assam,Guwahati,Assam State Pollution Control Board,"Residential, Rural and other Areas",6.0,10.0,65.0,,"Head Office, Bamunimaidan, Guwahati",,2015-07-03
587.0,03-08-14,Assam,Lakhimpur,Assam State Pollution Control Board,"Residential, Rural and other Areas",9.0,18.0,106.0,,"Bazar Patti, North Lakhimpur Town,Lakhimpur, Assam",,2014-08-03
389.0,03-08-15,Andhra Pradesh,Tirupati,Andhra Pradesh State Pollution Control Board,Sensitive Area,5.0,12.0,61.0,,"Regional Science Centre, Chittoor Bypass Road, Tirupati",,2015-08-03
748.0,03-09-14,Andhra Pradesh,Ananthapur,Andhra Pradesh State Pollution Control Board,"Residential, Rural and other Areas",5.0,10.0,87.0,,"Kamalanagar, Ananthapur",,2014-09-03
567.0,03-09-15,Assam,Silcher,Assam State Pollution Control Board,"Residential, Rural and other Areas",4.0,9.0,50.0,,"Office building of RLO, near Ithkola Market, Ghaniwala road",,2015-09-03
757.0,03-10-14,Andhra Pradesh,Rajahmundry,Andhra Pradesh State Pollution Control Board,Industrial Area,12.0,20.0,70.0,,"Staff Club Building, M/s A.P. Paper Mill, Rajahmundry",,2014-10-03
193.0,03-10-15,Assam,Guwahati,Assam State Pollution Control Board,"Residential, Rural and other Areas",7.0,12.0,80.0,,"Head Office, Bamunimaidan, Guwahati",,2015-10-03
748.0,03-11-14,Andhra Pradesh,Ananthapur,Andhra Pradesh State Pollution Control Board,"Residential, Rural and other Areas",5.0,10.0,63.0,,"Kamalanagar, Ananthapur",,2014-11-03
193.0,03-11-15,Assam,Guwahati,Assam State Pollution Control Board,"Residential, Rural and other Areas",10.0,14.0,90.0,,"Head Office, Bamunimaidan, Guwahati",,2015-11-03
520.0,03-12-14,Assam,Bongaigaon,Assam State Pollution Control Board,"Residential, Rural and other Areas",8.0,14.0,67.0,,"Barpara Office Building, Bongaigaon",,2014-12-03
193.0,03-12-15,Assam,Guwahati,Assam State Pollution Control Board,"Residential, Rural and other Areas",8.0,13.0,82.0,,"Head Office, Bamunimaidan, Guwahati",,2015-12-03
757.0,04-01-14,Andhra Pradesh,Rajahmundry,Andhra Pradesh State Pollution Control Board,Industrial Area,13.0,18.0,56.0,,"Staff Club Building, M/s A.P. Paper Mill, Rajahmundry",,2014-01-04
233.0,04-01-15,Andhra Pradesh,Visakhapatnam,Andhra Pradesh State Pollution Control Board,Industrial Area,8.0,18.0,27.0,,"Industrial Estate, Marripalem, Visakhapatnam",,2015-01-04
520.0,04-02-14,Assam,Bongaigaon,Assam State Pollution Control Board,"Residential, Rural and other Areas",7.0,16.0,79.0,,"Barpara Office Building, Bongaigaon",,2014-02-04
233.0,04-02-15,Andhra Pradesh,Visakhapatnam,Andhra Pradesh State Pollution Control Board,Industrial Area,10.0,15.0,47.0,,"Industrial Estate, Marripalem, Visakhapatnam",,2015-02-04
748.0,04-03-14,Andhra Pradesh,Ananthapur,Andhra Pradesh State Pollution Control Board,"Residential, Rural and other Areas",5.0,10.0,92.0,,"Kamalanagar, Ananthapur",,2014-03-04
233.0,04-03-15,Andhra Pradesh,Visakhapatnam,Andhra Pradesh State Pollution Control Board,Industrial Area,6.0,11.0,110.0,,"Industrial Estate, Marripalem, Visakhapatnam",,2015-03-04
757.0,04-04-14,Andhra Pradesh,Rajahmundry,Andhra Pradesh State Pollution Control Board,Industrial Area,14.0,21.0,54.0,,"Staff Club Building, M/s A.P. Paper Mill, Rajahmundry",,2014-04-04
233.0,04-04-15,Andhra Pradesh,Visakhapatnam,Andhra Pradesh State Pollution Control Board,Industrial Area,14.0,24.0,62.0,,"Industrial Estate, Marripalem, Visakhapatnam",,2015-04-04
566.0,04-05-14,Assam,Daranga,Assam State Pollution Control Board,"Residential, Rural and other Areas",5.0,14.0,72.0,,"Daranga, Baska district, BATAD,Assam near Sandoop Jhankar town of Bhutan",,2014-05-04
233.0,04-05-15,Andhra Pradesh,Visakhapatnam,Andhra Pradesh State Pollution Control Board,Industrial Area,6.0,9.0,53.0,,"Industrial Estate, Marripalem, Visakhapatnam",,2015-05-04
748.0,04-06-14,Andhra Pradesh,Ananthapur,Andhra Pradesh State Pollution Control Board,"Residential, Rural and other Areas",5.0,10.0,104.0,,"Kamalanagar, Ananthapur",,2014-06-04
233.0,04-06-15,Andhra Pradesh,Visakhapatnam,Andhra Pradesh State Pollution Control Board,Industrial Area,7.0,13.0,43.0,,"Industrial Estate, Marripalem, Visakhapatnam",,2015-06-04
757.0,04-07-14,Andhra Pradesh,Rajahmundry,Andhra Pradesh State Pollution Control Board,Industrial Area,15.0,20.0,60.0,,"Staff Club Building, M/s A.P. Paper Mill, Rajahmundry",,2014-07-04
233.0,04-07-15,Andhra Pradesh,Visakhapatnam,Andhra Pradesh State Pollution Control Board,Industrial Area,6.0,9.0,34.0,,"Industrial Estate, Marripalem, Visakhapatnam",,2015-07-04
542.0,04-08-14,Assam,Bongaigaon,Assam State Pollution Control Board,"Residential, Rural and other Areas",7.0,14.0,43.0,,"Campus of Oil India Ltd. PS-6, Bongaigaon, Chirang",,2014-08-04
233.0,04-08-15,Andhra Pradesh,Visakhapatnam,Andhra Pradesh State Pollution Control Board,Industrial Area,7.0,16.0,62.0,,"Industrial Estate, Marripalem, Visakhapatnam",,2015-08-04
748.0,04-09-14,Andhra Pradesh,Ananthapur,Andhra Pradesh State Pollution Control Board,"Residential, Rural and other Areas",5.0,10.0,117.0,,"Kamalanagar, Ananthapur",,2014-09-04
233.0,04-09-15,Andhra Pradesh,Visakhapatnam,Andhra Pradesh State Pollution Control Board,Industrial Area,7.0,18.0,46.0,,"Industrial Estate, Marripalem, Visakhapatnam",,2015-09-04
757.0,04-10-14,Andhra Pradesh,Rajahmundry,Andhra Pradesh State Pollution Control Board,Industrial Area,14.0,18.0,102.0,,"Staff Club Building, M/s A.P. Paper Mill, Rajahmundry",,2014-10-04
233.0,04-10-15,Andhra Pradesh,Visakhapatnam,Andhra Pradesh State Pollution Control Board,Industrial Area,8.0,20.0,72.0,,"Industrial Estate, Marripalem, Visakhapatnam",,2015-10-04
748.0,04-11-14,Andhra Pradesh,Ananthapur,Andhra Pradesh State Pollution Control Board,"Residential, Rural and other Areas",5.0,10.0,92.0,,"Kamalanagar, Ananthapur",,2014-11-04
193.0,04-11-15,Assam,Guwahati,Assam State Pollution Control Board,"Residential, Rural and other Areas",10.0,15.0,90.0,,"Head Office, Bamunimaidan, Guwahati",,2015-11-04
597.0,04-12-14,Assam,Nalbari,Assam State Pollution Control Board,"Residential, Rural and other Areas",7.0,16.0,103.0,,"Campus of PWD Rural Division, near Gordon Boy's GS School, Dist- Nalbari",,2014-12-04
233.0,04-12-15,Andhra Pradesh,Visakhapatnam,Andhra Pradesh State Pollution Control Board,Industrial Area,10.0,19.0,67.0,,"Industrial Estate, Marripalem, Visakhapatnam",,2015-12-04
757.0,05-01-14,Andhra Pradesh,Rajahmundry,Andhra Pradesh State Pollution Control Board,Industrial Area,13.0,18.0,56.0,,"Staff Club Building, M/s A.P. Paper Mill, Rajahmundry",,2014-01-05
389.0,05-01-15,Andhra Pradesh,Tirupati,Andhra Pradesh State Pollution Control Board,Sensitive Area,5.0,25.0,54.0,,"Regional Science Centre, Chittoor Bypass Road, Tirupati",,2015-01-05
520.0,05-02-14,Assam,Bongaigaon,Assam State Pollution Control Board,"Residential, Rural and other Areas",7.0,15.0,41.0,,"Barpara Office Building, Bongaigaon",,2014-02-05
193.0,05-02-15,Assam,Guwahati,Assam State Pollution Control Board,"Residential, Rural and other Areas",8.0,14.0,71.0,,"Head Office, Bamunimaidan, Guwahati",,2015-02-05
748.0,05-03-14,Andhra Pradesh,Ananthapur,Andhra Pradesh State Pollution Control Board,"Residential, Rural and other Areas",5.0,10.0,96.0,,"Kamalanagar, Ananthapur",,2014-03-05
538.0,05-03-15,Assam,Dibrugarh,Assam State Pollution Control Board,"Residential, Rural and other Areas",8.0,14.0,138.0,,"Dibrugarh Office Building, Dibrugarh",,2015-03-05
757.0,05-04-14,Andhra Pradesh,Rajahmundry,Andhra Pradesh State Pollution Control Board,Industrial Area,14.0,21.0,54.0,,"Staff Club Building, M/s A.P. Paper Mill, Rajahmundry",,2014-04-05
339,05-04-15,Himachal Pradesh,Parwanoo,Himachal Pradesh State Environment Proection & Pollution Control Board,Industrial Area,2.0,,60.0,,"AC Office Building, Parwanoo",,2015-04-05
520.0,05-05-14,Assam,Bongaigaon,Assam State Pollution Control Board,"Residential, Rural and other Areas",6.0,14.0,39.0,,"Barpara Office Building, Bongaigaon",,2014-05-05
787.0,05-05-15,Arunachal Pradesh,Itanagar,Arunachal Pradesh State Pollution Control Board,"Residential, Rural and other Areas",,,75.0,,Compound of PCCF's Office building,,2015-05-05
748.0,05-06-14,Andhra Pradesh,Ananthapur,Andhra Pradesh State Pollution Control Board,"Residential, Rural and other Areas",5.0,10.0,74.0,,"Kamalanagar, Ananthapur",,2014-06-05
519.0,05-06-15,Assam,Guwahati,Assam State Pollution Control Board,"Residential, Rural and other Areas",5.0,12.0,78.0,,"ITI Building, Gopinath Nagar, Guwahati",,2015-06-05
757.0,05-07-14,Andhra Pradesh,Rajahmundry,Andhra Pradesh State Pollution Control Board,Industrial Area,15.0,20.0,60.0,,"Staff Club Building, M/s A.P. Paper Mill, Rajahmundry",,2014-07-05
396.0,05-07-15,Maharashtra,Chandrapur,Maharashtra State Pollution Control Board,"Residential, Rural and other Areas",4.0,16.0,38.0,,"Nagar Parishad, Chandrapur",,2015-07-05
542.0,05-08-14,Assam,Bongaigaon,Assam State Pollution Control Board,"Residential, Rural and other Areas",9.0,14.0,46.0,,"Campus of Oil India Ltd. PS-6, Bongaigaon, Chirang",,2014-08-05
193.0,05-08-15,Assam,Guwahati,Assam State Pollution Control Board,"Residential, Rural and other Areas",6.0,9.0,65.0,,"Head Office, Bamunimaidan, Guwahati",,2015-08-05
748.0,05-09-14,Andhra Pradesh,Ananthapur,Andhra Pradesh State Pollution Control Board,"Residential, Rural and other Areas",5.0,10.0,50.0,,"Kamalanagar, Ananthapur",,2014-09-05
389.0,05-09-15,Andhra Pradesh,Tirupati,Andhra Pradesh State Pollution Control Board,Sensitive Area,4.0,10.0,63.0,,"Regional Science Centre, Chittoor Bypass Road, Tirupati",,2015-09-05
757.0,05-10-14,Andhra Pradesh,Rajahmundry,Andhra Pradesh State Pollution Control Board,Industrial Area,14.0,18.0,102.0,,"Staff Club Building, M/s A.P. Paper Mill, Rajahmundry",,2014-10-05
193.0,05-10-15,Assam,Guwahati,Assam State Pollution Control Board,"Residential, Rural and other Areas",8.0,12.0,81.0,,"Head Office, Bamunimaidan, Guwahati",,2015-10-05
748.0,05-11-14,Andhra Pradesh,Ananthapur,Andhra Pradesh State Pollution Control Board,"Residential, Rural and other Areas",5.0,10.0,82.0,,"Kamalanagar, Ananthapur",,2014-11-05
233.0,05-11-15,Andhra Pradesh,Visakhapatnam,Andhra Pradesh State Pollution Control Board,Industrial Area,15.0,22.0,34.0,,"Industrial Estate, Marripalem, Visakhapatnam",,2015-11-05
520.0,05-12-14,Assam,Bongaigaon,Assam State Pollution Control Board,"Residential, Rural and other Areas",10.0,17.0,53.0,,"Barpara Office Building, Bongaigaon",,2014-12-05
389.0,05-12-15,Andhra Pradesh,Tirupati,Andhra Pradesh State Pollution Control Board,Sensitive Area,5.0,10.0,63.0,,"Regional Science Centre, Chittoor Bypass Road, Tirupati",,2015-12-05
757.0,06-01-14,Andhra Pradesh,Rajahmundry,Andhra Pradesh State Pollution Control Board,Industrial Area,13.0,18.0,56.0,,"Staff Club Building, M/s A.P. Paper Mill, Rajahmundry",,2014-01-06
193.0,06-01-15,Assam,Guwahati,Assam State Pollution Control Board,"Residential, Rural and other Areas",7.0,12.0,77.0,,"Head Office, Bamunimaidan, Guwahati",,2015-01-06
520.0,06-02-14,Assam,Bongaigaon,Assam State Pollution Control Board,"Residential, Rural and other Areas",6.0,13.0,54.0,,"Barpara Office Building, Bongaigaon",,2014-02-06
389.0,06-02-15,Andhra Pradesh,Tirupati,Andhra Pradesh State Pollution Control Board,Sensitive Area,5.0,11.0,59.0,,"Regional Science Centre, Chittoor Bypass Road, Tirupati",,2015-02-06
748.0,06-03-14,Andhra Pradesh,Ananthapur,Andhra Pradesh State Pollution Control Board,"Residential, Rural and other Areas",5.0,10.0,81.0,,"Kamalanagar, Ananthapur",,2014-03-06
597.0,06-03-15,Assam,Nalbari,Assam State Pollution Control Board,"Residential, Rural and other Areas",7.0,14.0,139.0,,"Campus of PWD Rural Division, near Gordon Boy's GS School, Dist- Nalbari",,2015-03-06
757.0,06-04-14,Andhra Pradesh,Rajahmundry,Andhra Pradesh State Pollution Control Board,Industrial Area,14.0,21.0,54.0,,"Staff Club Building, M/s A.P. Paper Mill, Rajahmundry",,2014-04-06
389.0,06-04-15,Andhra Pradesh,Tirupati,Andhra Pradesh State Pollution Control Board,Sensitive Area,5.0,11.0,65.0,,"Regional Science Centre, Chittoor Bypass Road, Tirupati",,2015-04-06
193.0,06-05-14,Assam,Guwahati,Assam State Pollution Control Board,"Residential, Rural and other Areas",6.0,12.0,100.0,,"Head Office, Bamunimaidan, Guwahati",,2014-05-06
193.0,06-05-15,Assam,Guwahati,Assam State Pollution Control Board,"Residential, Rural and other Areas",7.0,14.0,103.0,,"Head Office, Bamunimaidan, Guwahati",,2015-05-06
748.0,06-06-14,Andhra Pradesh,Ananthapur,Andhra Pradesh State Pollution Control Board,"Residential, Rural and other Areas",5.0,10.0,61.0,,"Kamalanagar, Ananthapur",,2014-06-06
389.0,06-06-15,Andhra Pradesh,Tirupati,Andhra Pradesh State Pollution Control Board,Sensitive Area,5.0,11.0,68.0,,"Regional Science Centre, Chittoor Bypass Road, Tirupati",,2015-06-06
757.0,06-07-14,Andhra Pradesh,Rajahmundry,Andhra Pradesh State Pollution Control Board,Industrial Area,15.0,20.0,60.0,,"Staff Club Building, M/s A.P. Paper Mill, Rajahmundry",,2014-07-06
193.0,06-07-15,Assam,Guwahati,Assam State Pollution Control Board,"Residential, Rural and other Areas",6.0,10.0,63.0,,"Head Office, Bamunimaidan, Guwahati",,2015-07-06
587.0,06-08-14,Assam,Lakhimpur,Assam State Pollution Control Board,"Residential, Rural and other Areas",6.0,14.0,41.0,,"Bazar Patti, North Lakhimpur Town,Lakhimpur, Assam",,2014-08-06
389.0,06-08-15,Andhra Pradesh,Tirupati,Andhra Pradesh State Pollution Control Board,Sensitive Area,5.0,12.0,63.0,,"Regional Science Centre, Chittoor Bypass Road, Tirupati",,2015-08-06
748.0,06-09-14,Andhra Pradesh,Ananthapur,Andhra Pradesh State Pollution Control Board,"Residential, Rural and other Areas",5.0,10.0,55.0,,"Kamalanagar, Ananthapur",,2014-09-06
29.0,06-09-15,Kerala,Kochi,Kerala State Pollution Control Board,Industrial Area,2.0,21.0,24.0,,"Eloor, Kochi",,2015-09-06
757.0,06-10-14,Andhra Pradesh,Rajahmundry,Andhra Pradesh State Pollution Control Board,Industrial Area,14.0,18.0,102.0,,"Staff Club Building, M/s A.P. Paper Mill, Rajahmundry",,2014-10-06
389.0,06-10-15,Andhra Pradesh,Tirupati,Andhra Pradesh State Pollution Control Board,Sensitive Area,4.0,10.0,56.0,,"Regional Science Centre, Chittoor Bypass Road, Tirupati",,2015-10-06
748.0,06-11-14,Andhra Pradesh,Ananthapur,Andhra Pradesh State Pollution Control Board,"Residential, Rural and other Areas",5.0,10.0,56.0,,"Kamalanagar, Ananthapur",,2014-11-06
193.0,06-11-15,Assam,Guwahati,Assam State Pollution Control Board,"Residential, Rural and other Areas",9.0,13.0,92.0,,"Head Office, Bamunimaidan, Guwahati",,2015-11-06
583.0,06-12-14,Andhra Pradesh,Guntur,Andhra Pradesh State Pollution Control Board,"Residential, Rural and other Areas",5.0,23.0,78.0,,"Near Hindu College, Market Road, Guntur",,2014-12-06
405.0,06-12-15,Karnataka,Bangalore,Karnataka State Pollution Control Board,Industrial Area,2.0,14.0,80.0,,"Peenya Industrial Area, Bangalore",,2015-12-06
757.0,07-01-14,Andhra Pradesh,Rajahmundry,Andhra Pradesh State Pollution Control Board,Industrial Area,7.0,16.0,72.0,,"Staff Club Building, M/s A.P. Paper Mill, Rajahmundry",,2014-01-07
233.0,07-01-15,Andhra Pradesh,Visakhapatnam,Andhra Pradesh State Pollution Control Board,Industrial Area,9.0,15.0,29.0,,"Industrial Estate, Marripalem, Visakhapatnam",,2015-01-07
520.0,07-02-14,Assam,Bongaigaon,Assam State Pollution Control Board,"Residential, Rural and other Areas",9.0,12.0,40.0,,"Barpara Office Building, Bongaigaon",,2014-02-07
233.0,07-02-15,Andhra Pradesh,Visakhapatnam,Andhra Pradesh State Pollution Control Board,Industrial Area,9.0,14.0,53.0,,"Industrial Estate, Marripalem, Visakhapatnam",,2015-02-07
748.0,07-03-14,Andhra Pradesh,Ananthapur,Andhra Pradesh State Pollution Control Board,"Residential, Rural and other Areas",5.0,10.0,77.0,,"Kamalanagar, Ananthapur",,2014-03-07
233.0,07-03-15,Andhra Pradesh,Visakhapatnam,Andhra Pradesh State Pollution Control Board,Industrial Area,6.0,10.0,91.0,,"Industrial Estate, Marripalem, Visakhapatnam",,2015-03-07
757.0,07-04-14,Andhra Pradesh,Rajahmundry,Andhra Pradesh State Pollution Control Board,Industrial Area,8.0,17.0,70.0,,"Staff Club Building, M/s A.P. Paper Mill, Rajahmundry",,2014-04-07
233.0,07-04-15,Andhra Pradesh,Visakhapatnam,Andhra Pradesh State Pollution Control Board,Industrial Area,6.0,13.0,54.0,,"Industrial Estate, Marripalem, Visakhapatnam",,2015-04-07
538.0,07-05-14,Assam,Dibrugarh,Assam State Pollution Control Board,"Residential, Rural and other Areas",4.0,12.0,84.0,,"Dibrugarh Office Building, Dibrugarh",,2014-05-07
233.0,07-05-15,Andhra Pradesh,Visakhapatnam,Andhra Pradesh State Pollution Control Board,Industrial Area,10.0,29.0,54.0,,"Industrial Estate, Marripalem, Visakhapatnam",,2015-05-07
748.0,07-06-14,Andhra Pradesh,Ananthapur,Andhra Pradesh State Pollution Control Board,"Residential, Rural and other Areas",5.0,10.0,94.0,,"Kamalanagar, Ananthapur",,2014-06-07
233.0,07-06-15,Andhra Pradesh,Visakhapatnam,Andhra Pradesh State Pollution Control Board,Industrial Area,7.0,22.0,41.0,,"Industrial Estate, Marripalem, Visakhapatnam",,2015-06-07
757.0,07-07-14,Andhra Pradesh,Rajahmundry,Andhra Pradesh State Pollution Control Board,Industrial Area,9.0,18.0,73.0,,"Staff Club Building, M/s A.P. Paper Mill, Rajahmundry",,2014-07-07
233.0,07-07-15,Andhra Pradesh,Visakhapatnam,Andhra Pradesh State Pollution Control Board,Industrial Area,9.0,23.0,38.0,,"Industrial Estate, Marripalem, Visakhapatnam",,2015-07-07
542.0,07-08-14,Assam,Bongaigaon,Assam State Pollution Control Board,"Residential, Rural and other Areas",8.0,12.0,27.0,,"Campus of Oil India Ltd. PS-6, Bongaigaon, Chirang",,2014-08-07
233.0,07-08-15,Andhra Pradesh,Visakhapatnam,Andhra Pradesh State Pollution Control Board,Industrial Area,8.0,17.0,56.0,,"Industrial Estate, Marripalem, Visakhapatnam",,2015-08-07
748.0,07-09-14,Andhra Pradesh,Ananthapur,Andhra Pradesh State Pollution Control Board,"Residential, Rural and other Areas",5.0,10.0,66.0,,"Kamalanagar, Ananthapur",,2014-09-07
233.0,07-09-15,Andhra Pradesh,Visakhapatnam,Andhra Pradesh State Pollution Control Board,Industrial Area,8.0,18.0,34.0,,"Industrial Estate, Marripalem, Visakhapatnam",,2015-09-07
750.0,07-10-14,Andhra Pradesh,Eluru,Andhra Pradesh State Pollution Control Board,"Residential, Rural and other Areas",,,88.0,,"ASRAM Diagnostic Center, Eluru",,2014-10-07
233.0,07-10-15,Andhra Pradesh,Visakhapatnam,Andhra Pradesh State Pollution Control Board,Industrial Area,7.0,20.0,64.0,,"Industrial Estate, Marripalem, Visakhapatnam",,2015-10-07
748.0,07-11-14,Andhra Pradesh,Ananthapur,Andhra Pradesh State Pollution Control Board,"Residential, Rural and other Areas",5.0,10.0,61.0,,"Kamalanagar, Ananthapur",,2014-11-07
233.0,07-11-15,Andhra Pradesh,Visakhapatnam,Andhra Pradesh State Pollution Control Board,Industrial Area,6.0,12.0,44.0,,"Industrial Estate, Marripalem, Visakhapatnam",,2015-11-07
750.0,07-12-14,Andhra Pradesh,Eluru,Andhra Pradesh State Pollution Control Board,"Residential, Rural and other Areas",,,80.0,,"ASRAM Diagnostic Center, Eluru",,2014-12-07
233.0,07-12-15,Andhra Pradesh,Visakhapatnam,Andhra Pradesh State Pollution Control Board,Industrial Area,8.0,20.0,52.0,,"Industrial Estate, Marripalem, Visakhapatnam",,2015-12-07
750.0,08-01-14,Andhra Pradesh,Eluru,Andhra Pradesh State Pollution Control Board,"Residential, Rural and other Areas",,,85.0,,"ASRAM Diagnostic Center, Eluru",,2014-01-08
389.0,08-01-15,Andhra Pradesh,Tirupati,Andhra Pradesh State Pollution Control Board,Sensitive Area,5.0,11.0,56.0,,"Regional Science Centre, Chittoor Bypass Road, Tirupati",,2015-01-08
519.0,08-02-14,Assam,Guwahati,Assam State Pollution Control Board,"Residential, Rural and other Areas",6.0,14.0,22.0,,"ITI Building, Gopinath Nagar, Guwahati",,2014-02-08
SAMP,08-02-15,Gujarat,Bharuch,Gujarat State Pollution Control Board,RIRUO,15.0,22.0,92.0,,"Dahez SEZ Part II Office,Bharuch",33.0,2015-02-08
748.0,08-03-14,Andhra Pradesh,Ananthapur,Andhra Pradesh State Pollution Control Board,"Residential, Rural and other Areas",5.0,10.0,60.0,,"Kamalanagar, Ananthapur",,2014-03-08
SAMP,08-03-15,Gujarat,Bharuch,Gujarat State Pollution Control Board,RIRUO,15.0,21.0,94.0,,"Dahez SEZ Part II Office,Bharuch",32.0,2015-03-08
750.0,08-04-14,Andhra Pradesh,Eluru,Andhra Pradesh State Pollution Control Board,"Residential, Rural and other Areas",,,94.0,,"ASRAM Diagnostic Center, Eluru",,2014-04-08
193.0,08-04-15,Assam,Guwahati,Assam State Pollution Control Board,"Residential, Rural and other Areas",11.0,19.0,237.0,,"Head Office, Bamunimaidan, Guwahati",,2015-04-08
787.0,08-05-14,Arunachal Pradesh,Itanagar,Arunachal Pradesh State Pollution Control Board,"Residential, Rural and other Areas",2.0,5.0,2.0,,Compound of PCCF's Office building,,2014-05-08
193.0,08-05-15,Assam,Guwahati,Assam State Pollution Control Board,"Residential, Rural and other Areas",7.0,13.0,93.0,,"Head Office, Bamunimaidan, Guwahati",,2015-05-08
748.0,08-06-14,Andhra Pradesh,Ananthapur,Andhra Pradesh State Pollution Control Board,"Residential, Rural and other Areas",5.0,11.0,55.0,,"Kamalanagar, Ananthapur",,2014-06-08
193.0,08-06-15,Assam,Guwahati,Assam State Pollution Control Board,"Residential, Rural and other Areas",8.0,13.0,66.0,,"Head Office, Bamunimaidan, Guwahati",,2015-06-08
750.0,08-07-14,Andhra Pradesh,Eluru,Andhra Pradesh State Pollution Control Board,"Residential, Rural and other Areas",,,92.0,,"ASRAM Diagnostic Center, Eluru",,2014-07-08
193.0,08-07-15,Assam,Guwahati,Assam State Pollution Control Board,"Residential, Rural and other Areas",7.0,11.0,73.0,,"Head Office, Bamunimaidan, Guwahati",,2015-07-08
742.0,08-08-14,Andhra Pradesh,Chittoor,Andhra Pradesh State Pollution Control Board,"Residential, Rural and other Areas",6.0,11.0,72.0,,"Near Nutrine Confectionery, Palamaner Road, Chittor",,2014-08-08
567.0,08-08-15,Assam,Silcher,Assam State Pollution Control Board,"Residential, Rural and other Areas",5.0,12.0,63.0,,"Office building of RLO, near Ithkola Market, Ghaniwala road",,2015-08-08
748.0,08-09-14,Andhra Pradesh,Ananthapur,Andhra Pradesh State Pollution Control Board,"Residential, Rural and other Areas",5.0,10.0,57.0,,"Kamalanagar, Ananthapur",,2014-09-08
193.0,08-09-15,Assam,Guwahati,Assam State Pollution Control Board,"Residential, Rural and other Areas",6.0,10.0,69.0,,"Head Office, Bamunimaidan, Guwahati",,2015-09-08
750.0,08-10-14,Andhra Pradesh,Eluru,Andhra Pradesh State Pollution Control Board,"Residential, Rural and other Areas",,,90.0,,"ASRAM Diagnostic Center, Eluru",,2014-10-08
193.0,08-10-15,Assam,Guwahati,Assam State Pollution Control Board,"Residential, Rural and other Areas",7.0,12.0,82.0,,"Head Office, Bamunimaidan, Guwahati",,2015-10-08
748.0,08-11-14,Andhra Pradesh,Ananthapur,Andhra Pradesh State Pollution Control Board,"Residential, Rural and other Areas",5.0,10.0,68.0,,"Kamalanagar, Ananthapur",,2014-11-08
462.0,08-11-15,Andhra Pradesh,Vijayawada,Andhra Pradesh State Pollution Control Board,"Residential, Rural and other Areas",5.0,51.0,99.0,,"Benz Circle, Vijayawada",,2015-11-08
787.0,08-12-14,Arunachal Pradesh,Itanagar,Arunachal Pradesh State Pollution Control Board,"Residential, Rural and other Areas",2.0,5.0,35.0,,Compound of PCCF's Office building,,2014-12-08
787.0,08-12-15,Arunachal Pradesh,Itanagar,Arunachal Pradesh State Pollution Control Board,"Residential, Rural and other Areas",9.0,11.0,108.0,,Compound of PCCF's Office building,,2015-12-08
751.0,09-01-14,Andhra Pradesh,Srikakulam,Andhra Pradesh State Pollution Control Board,Industrial Area,11.0,12.0,59.0,,"IDA, Pydibheemavaram, Srikakulam",,2014-01-09
193.0,09-01-15,Assam,Guwahati,Assam State Pollution Control Board,"Residential, Rural and other Areas",7.0,13.0,74.0,,"Head Office, Bamunimaidan, Guwahati",,2015-01-09
520.0,09-02-14,Assam,Bongaigaon,Assam State Pollution Control Board,"Residential, Rural and other Areas",5.0,11.0,62.0,,"Barpara Office Building, Bongaigaon",,2014-02-09
389.0,09-02-15,Andhra Pradesh,Tirupati,Andhra Pradesh State Pollution Control Board,Sensitive Area,5.0,11.0,56.0,,"Regional Science Centre, Chittoor Bypass Road, Tirupati",,2015-02-09
748.0,09-03-14,Andhra Pradesh,Ananthapur,Andhra Pradesh State Pollution Control Board,"Residential, Rural and other Areas",5.0,10.0,85.0,,"Kamalanagar, Ananthapur",,2014-03-09
193.0,09-03-15,Assam,Guwahati,Assam State Pollution Control Board,"Residential, Rural and other Areas",9.0,15.0,173.0,,"Head Office, Bamunimaidan, Guwahati",,2015-03-09
751.0,09-04-14,Andhra Pradesh,Srikakulam,Andhra Pradesh State Pollution Control Board,Industrial Area,11.0,21.0,49.0,,"IDA, Pydibheemavaram, Srikakulam",,2014-04-09
389.0,09-04-15,Andhra Pradesh,Tirupati,Andhra Pradesh State Pollution Control Board,Sensitive Area,5.0,11.0,59.0,,"Regional Science Centre, Chittoor Bypass Road, Tirupati",,2015-04-09
750.0,09-05-14,Andhra Pradesh,Eluru,Andhra Pradesh State Pollution Control Board,"Residential, Rural and other Areas",,,81.0,,"ASRAM Diagnostic Center, Eluru",,2014-05-09
538.0,09-05-15,Assam,Dibrugarh,Assam State Pollution Control Board,"Residential, Rural and other Areas",9.0,17.0,22.0,,"Dibrugarh Office Building, Dibrugarh",,2015-05-09
748.0,09-06-14,Andhra Pradesh,Ananthapur,Andhra Pradesh State Pollution Control Board,"Residential, Rural and other Areas",5.0,11.0,32.0,,"Kamalanagar, Ananthapur",,2014-06-09
389.0,09-06-15,Andhra Pradesh,Tirupati,Andhra Pradesh State Pollution Control Board,Sensitive Area,5.0,12.0,70.0,,"Regional Science Centre, Chittoor Bypass Road, Tirupati",,2015-06-09
750.0,09-07-14,Andhra Pradesh,Eluru,Andhra Pradesh State Pollution Control Board,"Residential, Rural and other Areas",,,83.0,,"ASRAM Diagnostic Center, Eluru",,2014-07-09
389.0,09-07-15,Andhra Pradesh,Tirupati,Andhra Pradesh State Pollution Control Board,Sensitive Area,5.0,12.0,75.0,,"Regional Science Centre, Chittoor Bypass Road, Tirupati",,2015-07-09
753.0,09-08-14,Andhra Pradesh,Ongole,Andhra Pradesh State Pollution Control Board,"Residential, Rural and other Areas",4.0,22.0,62.0,,"Near Court Centre, Ongole, Parkasam District",,2014-08-09
389.0,09-08-15,Andhra Pradesh,Tirupati,Andhra Pradesh State Pollution Control Board,Sensitive Area,5.0,12.0,62.0,,"Regional Science Centre, Chittoor Bypass Road, Tirupati",,2015-08-09
748.0,09-09-14,Andhra Pradesh,Ananthapur,Andhra Pradesh State Pollution Control Board,"Residential, Rural and other Areas",5.0,10.0,85.0,,"Kamalanagar, Ananthapur",,2014-09-09
193.0,09-09-15,Assam,Guwahati,Assam State Pollution Control Board,"Residential, Rural and other Areas",6.0,11.0,72.0,,"Head Office, Bamunimaidan, Guwahati",,2015-09-09
751.0,09-10-14,Andhra Pradesh,Srikakulam,Andhra Pradesh State Pollution Control Board,Industrial Area,12.0,18.0,59.0,,"IDA, Pydibheemavaram, Srikakulam",,2014-10-09
389.0,09-10-15,Andhra Pradesh,Tirupati,Andhra Pradesh State Pollution Control Board,Sensitive Area,4.0,10.0,57.0,,"Regional Science Centre, Chittoor Bypass Road, Tirupati",,2015-10-09
748.0,09-11-14,Andhra Pradesh,Ananthapur,Andhra Pradesh State Pollution Control Board,"Residential, Rural and other Areas",5.0,10.0,73.0,,"Kamalanagar, Ananthapur",,2014-11-09
193.0,09-11-15,Assam,Guwahati,Assam State Pollution Control Board,"Residential, Rural and other Areas",10.0,14.0,97.0,,"Head Office, Bamunimaidan, Guwahati",,2015-11-09
566.0,09-12-14,Assam,Daranga,Assam State Pollution Control Board,"Residential, Rural and other Areas",4.0,8.0,32.0,,"Daranga, Baska district, BATAD,Assam near Sandoop Jhankar town of Bhutan",,2014-12-09
389.0,09-12-15,Andhra Pradesh,Tirupati,Andhra Pradesh State Pollution Control Board,Sensitive Area,5.0,11.0,60.0,,"Regional Science Centre, Chittoor Bypass Road, Tirupati",,2015-12-09
36,1/1/1988,Goa,Ponda,Goa Pollution Control Board,,3.3,12.2,,84.0,,,1988-01-01
55,1/1/2003,Delhi,Delhi,Central Pollution Control Board,Industrial Area,,34.0,149.0,205.0,,,2003-01-01
233.0,1/1/2004,Andhra Pradesh,Visakhapatnam,Andhra Pradesh State Pollution Control Board,Industrial Area,13.0,37.0,98.0,141.0,"Industrial Estate, Marripalem, Visakhapatnam",,2004-01-01
,1/1/2005,Chandigarh,Chandigarh,,Industrial Areas,,24.0,108.0,223.0,Modern Foods,,2005-01-01
,1/1/2006,Andhra Pradesh,Visakhapatnam,,Industrial Areas,10.8,33.5,84.0,171.0,Industrial Estate,,2006-01-01
,1/1/2007,Andhra Pradesh,Visakhapatnam,,Industrial Areas,7.9,30.7,89.0,182.0,Industrial Estate,,2007-01-01
,1/1/2008,Andhra Pradesh,Visakhapatnam,,Industrial Areas,9.2,31.7,107.0,184.0,Industrial Estate,,2008-01-01
,1/1/2009,Andhra Pradesh,Visakhapatnam,,Residential and others,4.0,18.4,141.0,245.0,Ganapuram Area,,2009-01-01
464.0,1/1/2011,Chandigarh,Chandigarh,Chandigarh Pollution Control Committee,"Residential, Rural and other Areas",2.0,16.0,94.0,187.0,"Kaimbwala Village, Chandigarh",,2011-01-01
233.0,1/1/2012,Andhra Pradesh,Visakhapatnam,Andhra Pradesh State Pollution Control Board,Industrial Area,22.0,29.0,64.0,,"Industrial Estate, Marripalem, Visakhapatnam",,2012-01-01
58,1/10/2003,Delhi,Delhi,Central Pollution Control Board,Industrial Area,8.0,35.0,150.0,314.0,,,2003-10-01
233.0,1/10/2004,Andhra Pradesh,Visakhapatnam,Andhra Pradesh State Pollution Control Board,Industrial Area,9.0,28.0,81.0,122.0,"Industrial Estate, Marripalem, Visakhapatnam",,2004-10-01
,1/10/2005,Andhra Pradesh,Hyderabad,,Residential and others,4.2,22.4,82.0,255.0,Jubilee Hills,,2005-10-01
,1/10/2006,Andhra Pradesh,Visakhapatnam,,Industrial Areas,10.7,32.4,84.0,175.0,Industrial Estate,,2006-10-01
,1/10/2007,Andhra Pradesh,Hyderabad,,Industrial Areas,5.1,52.6,152.0,366.0,C.I.T.D. Balanagar,,2007-10-01
,1/10/2008,Andhra Pradesh,Hyderabad,,Industrial Areas,5.5,27.2,137.0,355.0,C.I.T.D. Balanagar,,2008-10-01
,1/10/2009,Andhra Pradesh,Hyderabad,,Industrial Areas,4.6,27.7,88.0,266.0,C.I.T.D. Balanagar,,2009-10-01
466.0,1/10/2010,Andhra Pradesh,Kurnool,Andhra Pradesh State Pollution Control Board,"Residential, Rural and other Areas",4.0,9.0,139.0,,"Mourya Inn, Kurnool",,2010-10-01
582.0,1/10/2011,Andhra Pradesh,Chittoor,Andhra Pradesh State Pollution Control Board,Sensitive Area,4.0,9.0,42.0,113.0,"GNC Toll Gate Tirumala , Chittoor Dist.",,2011-10-01
466.0,1/10/2012,Andhra Pradesh,Kurnool,Andhra Pradesh State Pollution Control Board,"Residential, Rural and other Areas",4.0,9.0,67.0,,"Mourya Inn, Kurnool",,2012-10-01
751.0,1/10/2013,Andhra Pradesh,Srikakulam,Andhra Pradesh State Pollution Control Board,Industrial Area,3.0,5.0,73.0,,"IDA, Pydibheemavaram, Srikakulam",,2013-10-01
84.0,1/11/2003,Madhya Pradesh,Nagda,Madhya Pradesh  Pollution Control Board,"Residential, Rural and other Areas",0.0,0.0,0.0,0.0,,,2003-11-01
303.0,1/11/2004,Maharashtra,Thane,Thane Municipal Corporation,"Residential, Rural and other Areas",8.0,13.5,,43.7,"Terrace Of Maternity Hospital,Dhobighat,Kopri, Thane East",,2004-11-01
,1/11/2005,Andhra Pradesh,Hyderabad,,Industrial Areas,4.7,32.2,114.0,315.0,C.I.T.D. Balanagar,,2005-11-01
,1/11/2006,Andhra Pradesh,Hyderabad,,Industrial Areas,3.5,10.0,83.0,154.0,Nacharam,,2006-11-01
,1/11/2007,Andhra Pradesh,Hyderabad,,Residential and others,5.6,34.7,103.0,289.0,Charminar,,2007-11-01
,1/11/2008,Andhra Pradesh,Hyderabad,,Residential and others,5.2,32.0,128.0,374.0,Charminar,,2008-11-01
,1/11/2009,Andhra Pradesh,Hyderabad,,Residential and others,5.0,28.5,98.0,299.0,Charminar,,2009-11-01
577.0,1/11/2010,Andhra Pradesh,Nalgonda,Andhra Pradesh State Pollution Control Board,"Residential, Rural and other Areas",5.0,26.0,114.0,,"Beside Regional Office, APPCB Nalgonda",,2010-11-01
394.0,1/11/2011,Andhra Pradesh,Hyderabad,Andhra Pradesh State Pollution Control Board,"Residential, Rural and other Areas",5.0,33.0,125.0,340.0,"Charminar, Hyderabad",,2011-11-01
583.0,1/11/2012,Andhra Pradesh,Guntur,Andhra Pradesh State Pollution Control Board,"Residential, Rural and other Areas",5.0,10.0,72.0,,"Near Hindu College, Market Road, Guntur",,2012-11-01
95.0,1/11/2013,Andhra Pradesh,Hyderabad,Andhra Pradesh State Pollution Control Board,Industrial Area,5.0,41.0,113.0,,"C.I.T.D., Balanagar, Plot no. A1 to A8, IDA, Hyderabad",,2013-11-01
95.0,1/12/2004,Andhra Pradesh,Hyderabad,Andhra Pradesh State Pollution Control Board,Industrial Area,7.3,48.5,82.7,186.7,"C.I.T.D., Balanagar, Plot no. A1 to A8, IDA, Hyderabad",,2004-12-01
,1/12/2005,Assam,Guwahati,,Residential and others,4.5,14.4,151.0,221.0,Paltanbazar,,2005-12-01
,1/12/2006,Andhra Pradesh,Vijayawada,,Residential and others,4.2,24.7,91.0,177.0,Benz Circle,,2006-12-01
,1/12/2007,Andhra Pradesh,Tirupati,,Sensitive Areas,4.0,9.0,24.0,76.0,Reg.Science Centre,,2007-12-01
,1/12/2008,Andhra Pradesh,Tirupati,,Sensitive Areas,4.0,9.0,30.0,95.0,Reg.Science Centre,,2008-12-01
,1/12/2009,Andhra Pradesh,Hyderabad,,Industrial Areas,5.3,18.3,76.0,127.0,Nacharam,,2009-12-01
150.0,1/12/2010,Andhra Pradesh,Hyderabad,National Environmental Engineering Research Institute,"Residential, Rural and other Areas",3.0,15.0,43.0,,"Tarnaka, NEERI Lab. IICT Campus, Hyderabad",,2010-12-01
582.0,1/12/2011,Andhra Pradesh,Chittoor,Andhra Pradesh State Pollution Control Board,Sensitive Area,4.0,9.0,39.0,113.0,"GNC Toll Gate Tirumala , Chittoor Dist.",,2011-12-01
577.0,1/12/2012,Andhra Pradesh,Nalgonda,Andhra Pradesh State Pollution Control Board,"Residential, Rural and other Areas",4.0,17.0,85.0,,"Beside Regional Office, APPCB Nalgonda",,2012-12-01
748.0,1/12/2013,Andhra Pradesh,Ananthapur,Andhra Pradesh State Pollution Control Board,"Residential, Rural and other Areas",4.0,9.0,70.0,,"Kamalanagar, Ananthapur",,2013-12-01
37,1/2/1988,Goa,Vasco,Goa Pollution Control Board,Industrial Area,2.7,10.5,,154.0,,,1988-02-01
58,1/2/2003,Delhi,Delhi,Central Pollution Control Board,Industrial Area,8.0,34.0,171.0,351.0,,,2003-02-01
95.0,1/2/2004,Andhra Pradesh,Hyderabad,Andhra Pradesh State Pollution Control Board,Industrial Area,12.9,55.8,143.7,370.7,"C.I.T.D., Balanagar, Plot no. A1 to A8, IDA, Hyderabad",,2004-02-01
,1/2/2005,Andhra Pradesh,Hyderabad,,Residential and others,6.0,69.7,28.0,131.0,ABIDS Circle,,2005-02-01
,1/2/2006,Andhra Pradesh,Hyderabad,,Residential and others,5.8,27.2,118.0,299.0,Paradise,,2006-02-01
,1/2/2007,Andhra Pradesh,Hyderabad,,Industrial Areas,5.7,40.7,136.0,367.0,C.I.T.D. Balanagar,,2007-02-01
,1/2/2008,Andhra Pradesh,Hyderabad,,Industrial Areas,5.2,31.7,105.0,311.0,C.I.T.D. Balanagar,,2008-02-01
,1/2/2009,Andhra Pradesh,Hyderabad,,Industrial Areas,5.4,28.0,101.0,289.0,C.I.T.D. Balanagar,,2009-02-01
583.0,1/2/2010,Andhra Pradesh,Guntur,Andhra Pradesh State Pollution Control Board,"Residential, Rural and other Areas",2.0,12.0,77.0,,"Near Hindu College, Market Road, Guntur",,2010-02-01
95.0,1/2/2011,Andhra Pradesh,Hyderabad,Andhra Pradesh State Pollution Control Board,Industrial Area,5.0,29.0,122.0,377.0,"C.I.T.D., Balanagar, Plot no. A1 to A8, IDA, Hyderabad",,2011-02-01
583.0,1/2/2012,Andhra Pradesh,Guntur,Andhra Pradesh State Pollution Control Board,"Residential, Rural and other Areas",5.0,10.0,75.0,,"Near Hindu College, Market Road, Guntur",,2012-02-01
387.0,1/2/2013,Andhra Pradesh,Visakhapatnam,Andhra Pradesh State Pollution Control Board,Sensitive Area,5.0,9.0,119.0,,"INS-Virabahu, Naval Area, Visakhapatnam",,2013-02-01
56,1/3/2003,Delhi,Delhi,Central Pollution Control Board,Industrial Area,4.0,22.0,119.0,324.0,,,2003-03-01
210.0,1/3/2004,Bihar,Patna,Bihar Sate Pollution Control Board,"Residential, Rural and other Areas",13.0,30.0,97.0,159.0,"Beltron Bhawan, Shastri Nagar, Patna",,2004-03-01
,1/3/2005,Andhra Pradesh,Hyderabad,,Industrial Areas,5.2,40.4,101.0,287.0,C.I.T.D. Balanagar,,2005-03-01
,1/3/2006,Andhra Pradesh,Hyderabad,,Industrial Areas,5.0,27.7,122.0,295.0,C.I.T.D. Balanagar,,2006-03-01
,1/3/2007,Andhra Pradesh,Hyderabad,,Residential and others,4.8,51.5,124.0,339.0,Charminar,,2007-03-01
,1/3/2008,Andhra Pradesh,Hyderabad,,Residential and others,5.4,29.8,156.0,360.0,Charminar,,2008-03-01
,1/3/2009,Andhra Pradesh,Hyderabad,,Residential and others,5.1,28.7,109.0,324.0,Charminar,,2009-03-01
582.0,1/3/2011,Andhra Pradesh,Chittoor,Andhra Pradesh State Pollution Control Board,Sensitive Area,4.0,9.0,38.0,102.0,"GNC Toll Gate Tirumala , Chittoor Dist.",,2011-03-01
577.0,1/3/2012,Andhra Pradesh,Nalgonda,Andhra Pradesh State Pollution Control Board,"Residential, Rural and other Areas",4.0,17.0,77.0,,"Beside Regional Office, APPCB Nalgonda",,2012-03-01
44.0,1/4/1988,Bihar,Dhanbad,Bihar Pollution Control Board,"Residential, Rural and other Areas",16.0,22.4,,294.0,,,1988-04-01
84.0,1/4/2003,Madhya Pradesh,Nagda,Madhya Pradesh  Pollution Control Board,"Residential, Rural and other Areas",0.0,0.0,0.0,0.0,,,2003-04-01
233.0,1/4/2004,Andhra Pradesh,Visakhapatnam,Andhra Pradesh State Pollution Control Board,Industrial Area,16.0,34.0,91.0,131.0,"Industrial Estate, Marripalem, Visakhapatnam",,2004-04-01
,1/4/2005,Andhra Pradesh,Hyderabad,,Residential and others,4.8,36.8,130.0,308.0,Charminar,,2005-04-01
,1/4/2006,Andhra Pradesh,Hyderabad,,Industrial Areas,5.5,27.6,150.0,353.0,Uppal,,2006-04-01
,1/4/2007,Andhra Pradesh,Hyderabad,,Industrial Areas,5.2,48.5,163.0,371.0,C.I.T.D. Balanagar,,2007-04-01
,1/4/2008,Andhra Pradesh,Hyderabad,,Industrial Areas,5.4,35.0,163.0,399.0,C.I.T.D. Balanagar,,2008-04-01
,1/4/2009,Andhra Pradesh,Hyderabad,,Industrial Areas,5.0,28.5,97.0,289.0,C.I.T.D. Balanagar,,2009-04-01
150.0,1/4/2010,Andhra Pradesh,Hyderabad,National Environmental Engineering Research Institute,"Residential, Rural and other Areas",6.0,24.0,107.0,,"Tarnaka, NEERI Lab. IICT Campus, Hyderabad",,2010-04-01
95.0,1/4/2011,Andhra Pradesh,Hyderabad,Andhra Pradesh State Pollution Control Board,Industrial Area,5.0,35.0,110.0,325.0,"C.I.T.D., Balanagar, Plot no. A1 to A8, IDA, Hyderabad",,2011-04-01
583.0,1/4/2012,Andhra Pradesh,Guntur,Andhra Pradesh State Pollution Control Board,"Residential, Rural and other Areas",5.0,10.0,74.0,,"Near Hindu College, Market Road, Guntur",,2012-04-01
751.0,1/4/2013,Andhra Pradesh,Srikakulam,Andhra Pradesh State Pollution Control Board,Industrial Area,2.0,5.0,168.0,,"IDA, Pydibheemavaram, Srikakulam",,2013-04-01
45.0,1/5/1988,Bihar,Jharia,Bihar Pollution Control Board,Industrial Area,43.1,55.6,,773.0,,,1988-05-01
95.0,1/5/2004,Andhra Pradesh,Hyderabad,Andhra Pradesh State Pollution Control Board,Industrial Area,10.4,48.9,124.7,285.7,"C.I.T.D., Balanagar, Plot no. A1 to A8, IDA, Hyderabad",,2004-05-01
,1/5/2005,Andhra Pradesh,Hyderabad,,Industrial Areas,8.0,23.8,49.0,106.0,Nacharam,,2005-05-01
,1/5/2006,Andhra Pradesh,Hyderabad,,Industrial Areas,5.1,33.3,154.0,359.0,C.I.T.D. Balanagar,,2006-05-01
,1/5/2007,Andhra Pradesh,Hyderabad,,Residential and others,5.0,38.6,108.0,291.0,Charminar,,2007-05-01
,1/5/2008,Andhra Pradesh,Hyderabad,,Residential and others,5.5,30.2,140.0,347.0,Charminar,,2008-05-01
,1/5/2009,Andhra Pradesh,Hyderabad,,Residential and others,5.1,28.7,110.0,315.0,Charminar,,2009-05-01
581.0,1/5/2010,Andhra Pradesh,Khammam,Andhra Pradesh State Pollution Control Board,"Residential, Rural and other Areas",2.0,11.0,81.0,,"CER Club,S.C.C.L. township, writter basti, Kothagudem, Khammam Dist.",,2010-05-01
582.0,1/5/2011,Andhra Pradesh,Chittoor,Andhra Pradesh State Pollution Control Board,Sensitive Area,4.0,9.0,41.0,105.0,"GNC Toll Gate Tirumala , Chittoor Dist.",,2011-05-01
95.0,1/5/2012,Andhra Pradesh,Hyderabad,Andhra Pradesh State Pollution Control Board,Industrial Area,5.0,22.0,104.0,,"C.I.T.D., Balanagar, Plot no. A1 to A8, IDA, Hyderabad",,2012-05-01
387.0,1/5/2013,Andhra Pradesh,Visakhapatnam,Andhra Pradesh State Pollution Control Board,Sensitive Area,4.0,9.0,103.0,,"INS-Virabahu, Naval Area, Visakhapatnam",,2013-05-01
55,1/6/2003,Delhi,Delhi,Central Pollution Control Board,Industrial Area,11.0,39.0,184.0,405.0,,,2003-06-01
193.0,1/6/2004,Assam,Guwahati,Assam State Pollution Control Board,"Residential, Rural and other Areas",2.7,19.5,175.0,,"Head Office, Bamunimaidan, Guwahati",,2004-06-01
,1/6/2005,Andhra Pradesh,Hyderabad,,Residential and others,5.3,36.4,142.0,398.0,Paradise,,2005-06-01
,1/6/2006,Andhra Pradesh,Hyderabad,,Industrial Areas,10.5,13.2,73.0,153.0,Nacharam,,2006-06-01
,1/6/2007,Andhra Pradesh,Tirupati,,Sensitive Areas,4.0,9.0,28.0,90.0,Reg.Science Centre,,2007-06-01
,1/6/2008,Maharashtra,Amravati,,Residential and others,9.7,15.7,76.0,,Rajkamal Square,,2008-06-01
,1/6/2009,Andhra Pradesh,Hyderabad,,Industrial Areas,3.3,14.8,68.0,120.0,Nacharam,,2009-06-01
389.0,1/6/2010,Andhra Pradesh,Tirupati,Andhra Pradesh State Pollution Control Board,Sensitive Area,4.0,9.0,38.0,,"Regional Science Centre, Chittoor Bypass Road, Tirupati",,2010-06-01
577.0,1/6/2011,Andhra Pradesh,Nalgonda,Andhra Pradesh State Pollution Control Board,"Residential, Rural and other Areas",5.0,23.0,80.0,,"Beside Regional Office, APPCB Nalgonda",,2011-06-01
581.0,1/6/2012,Andhra Pradesh,Khammam,Andhra Pradesh State Pollution Control Board,"Residential, Rural and other Areas",5.0,9.0,59.0,,"CER Club,S.C.C.L. township, writter basti, Kothagudem, Khammam Dist.",,2012-06-01
748.0,1/6/2013,Andhra Pradesh,Ananthapur,Andhra Pradesh State Pollution Control Board,"Residential, Rural and other Areas",4.0,9.0,71.0,,"Kamalanagar, Ananthapur",,2013-06-01
46.0,1/7/1988,Bihar,Sindri,Bihar Pollution Control Board,Industrial Area,25.8,24.7,,383.0,,,1988-07-01
58,1/7/2003,Delhi,Delhi,Central Pollution Control Board,Industrial Area,11.0,43.0,143.0,311.0,,,2003-07-01
233.0,1/7/2004,Andhra Pradesh,Visakhapatnam,Andhra Pradesh State Pollution Control Board,Industrial Area,12.0,31.0,87.0,142.0,"Industrial Estate, Marripalem, Visakhapatnam",,2004-07-01
,1/7/2005,Andhra Pradesh,Hyderabad,,Industrial Areas,5.7,40.7,140.0,408.0,C.I.T.D. Balanagar,,2005-07-01
,1/7/2006,Andhra Pradesh,Hyderabad,,Residential and others,5.2,28.5,129.0,315.0,Charminar,,2006-07-01
,1/7/2007,Andhra Pradesh,Visakhapatnam,,Industrial Areas,9.5,31.2,96.0,196.0,Industrial Estate,,2007-07-01
,1/7/2008,Andhra Pradesh,Hyderabad,,Residential and others,4.3,14.3,57.0,141.0,Jubilee Hills,,2008-07-01
,1/7/2009,Andhra Pradesh,Patancheru,,Residential and others,21.8,28.2,80.0,181.0,Police Station,,2009-07-01
583.0,1/7/2010,Andhra Pradesh,Guntur,Andhra Pradesh State Pollution Control Board,"Residential, Rural and other Areas",2.0,11.0,85.0,,"Near Hindu College, Market Road, Guntur",,2010-07-01
582.0,1/7/2011,Andhra Pradesh,Chittoor,Andhra Pradesh State Pollution Control Board,Sensitive Area,4.0,9.0,36.0,98.0,"GNC Toll Gate Tirumala , Chittoor Dist.",,2011-07-01
389.0,1/7/2012,Andhra Pradesh,Tirupati,Andhra Pradesh State Pollution Control Board,Sensitive Area,4.0,9.0,34.0,,"Regional Science Centre, Chittoor Bypass Road, Tirupati",,2012-07-01
751.0,1/7/2013,Andhra Pradesh,Srikakulam,Andhra Pradesh State Pollution Control Board,Industrial Area,2.0,5.0,85.0,,"IDA, Pydibheemavaram, Srikakulam",,2013-07-01
56,1/8/2003,Delhi,Delhi,Central Pollution Control Board,Industrial Area,8.0,32.0,201.0,431.0,,,2003-08-01
193.0,1/8/2004,Assam,Guwahati,Assam State Pollution Control Board,"Residential, Rural and other Areas",2.3,16.7,179.0,,"Head Office, Bamunimaidan, Guwahati",,2004-08-01
,1/8/2005,Bihar,Patna,,Residential and others,9.3,26.8,64.0,157.0,Beltron Bhawan,,2005-08-01
,1/8/2006,Andhra Pradesh,Hyderabad,,Industrial Areas,4.9,37.6,139.0,379.0,C.I.T.D. Balanagar,,2006-08-01
,1/8/2007,Andhra Pradesh,Hyderabad,,Industrial Areas,5.6,56.9,120.0,373.0,C.I.T.D. Balanagar,,2007-08-01
,1/8/2008,Andhra Pradesh,Hyderabad,,Industrial Areas,5.5,30.3,154.0,368.0,C.I.T.D. Balanagar,,2008-08-01
,1/8/2009,Andhra Pradesh,Hyderabad,,Industrial Areas,4.9,28.5,99.0,283.0,C.I.T.D. Balanagar,,2009-08-01
583.0,1/8/2010,Andhra Pradesh,Guntur,Andhra Pradesh State Pollution Control Board,"Residential, Rural and other Areas",2.0,12.0,97.0,,"Near Hindu College, Market Road, Guntur",,2010-08-01
95.0,1/8/2011,Andhra Pradesh,Hyderabad,Andhra Pradesh State Pollution Control Board,Industrial Area,5.0,32.0,113.0,370.0,"C.I.T.D., Balanagar, Plot no. A1 to A8, IDA, Hyderabad",,2011-08-01
95.0,1/8/2012,Andhra Pradesh,Hyderabad,Andhra Pradesh State Pollution Control Board,Industrial Area,5.0,24.0,92.0,,"C.I.T.D., Balanagar, Plot no. A1 to A8, IDA, Hyderabad",,2012-08-01
387.0,1/8/2013,Andhra Pradesh,Visakhapatnam,Andhra Pradesh State Pollution Control Board,Sensitive Area,4.0,9.0,37.0,,"INS-Virabahu, Naval Area, Visakhapatnam",,2013-08-01
55,1/9/2003,Delhi,Delhi,Central Pollution Control Board,Industrial Area,12.0,42.0,190.0,429.0,,,2003-09-01
95.0,1/9/2004,Andhra Pradesh,Hyderabad,Andhra Pradesh State Pollution Control Board,Industrial Area,7.6,50.1,88.0,221.3,"C.I.T.D., Balanagar, Plot no. A1 to A8, IDA, Hyderabad",,2004-09-01
,1/9/2005,Andhra Pradesh,Hyderabad,,Industrial Areas,11.2,25.9,68.0,148.0,Nacharam,,2005-09-01
,1/9/2006,Andhra Pradesh,Vijayawada,,Residential and others,5.3,32.2,77.0,182.0,Benz Circle,,2006-09-01
,1/9/2007,Andhra Pradesh,Hyderabad,,Industrial Areas,6.0,36.9,149.0,351.0,Uppal,,2007-09-01
,1/9/2008,Andhra Pradesh,Hyderabad,,Residential and others,5.4,32.3,129.0,346.0,Charminar,,2008-09-01
,1/9/2009,Andhra Pradesh,Hyderabad,,Residential and others,4.9,27.1,72.0,225.0,Charminar,,2009-09-01
581.0,1/9/2010,Andhra Pradesh,Khammam,Andhra Pradesh State Pollution Control Board,"Residential, Rural and other Areas",2.0,11.0,56.0,,"CER Club,S.C.C.L. township, writter basti, Kothagudem, Khammam Dist.",,2010-09-01
393.0,1/9/2011,Andhra Pradesh,Hyderabad,Andhra Pradesh State Pollution Control Board,"Residential, Rural and other Areas",4.8,33.2,114.0,307.0,"Paradise, Hyderabad",,2011-09-01
583.0,1/9/2012,Andhra Pradesh,Guntur,Andhra Pradesh State Pollution Control Board,"Residential, Rural and other Areas",5.0,10.0,72.0,,"Near Hindu College, Market Road, Guntur",,2012-09-01
748.0,1/9/2013,Andhra Pradesh,Ananthapur,Andhra Pradesh State Pollution Control Board,"Residential, Rural and other Areas",4.0,9.0,69.0,,"Kamalanagar, Ananthapur",,2013-09-01
757.0,10-01-14,Andhra Pradesh,Rajahmundry,Andhra Pradesh State Pollution Control Board,Industrial Area,10.0,16.0,61.0,,"Staff Club Building, M/s A.P. Paper Mill, Rajahmundry",,2014-01-10
233.0,10-01-15,Andhra Pradesh,Visakhapatnam,Andhra Pradesh State Pollution Control Board,Industrial Area,7.0,17.0,78.0,,"Industrial Estate, Marripalem, Visakhapatnam",,2015-01-10
542.0,10-02-14,Assam,Bongaigaon,Assam State Pollution Control Board,"Residential, Rural and other Areas",8.0,12.0,63.0,,"Campus of Oil India Ltd. PS-6, Bongaigaon, Chirang",,2014-02-10
233.0,10-02-15,Andhra Pradesh,Visakhapatnam,Andhra Pradesh State Pollution Control Board,Industrial Area,9.0,17.0,57.0,,"Industrial Estate, Marripalem, Visakhapatnam",,2015-02-10
748.0,10-03-14,Andhra Pradesh,Ananthapur,Andhra Pradesh State Pollution Control Board,"Residential, Rural and other Areas",4.0,16.0,45.0,,"Kamalanagar, Ananthapur",,2014-03-10
233.0,10-03-15,Andhra Pradesh,Visakhapatnam,Andhra Pradesh State Pollution Control Board,Industrial Area,6.0,11.0,62.0,,"Industrial Estate, Marripalem, Visakhapatnam",,2015-03-10
757.0,10-04-14,Andhra Pradesh,Rajahmundry,Andhra Pradesh State Pollution Control Board,Industrial Area,9.0,18.0,59.0,,"Staff Club Building, M/s A.P. Paper Mill, Rajahmundry",,2014-04-10
233.0,10-04-15,Andhra Pradesh,Visakhapatnam,Andhra Pradesh State Pollution Control Board,Industrial Area,8.0,22.0,50.0,,"Industrial Estate, Marripalem, Visakhapatnam",,2015-04-10
750.0,10-05-14,Andhra Pradesh,Eluru,Andhra Pradesh State Pollution Control Board,"Residential, Rural and other Areas",,,404.0,,"ASRAM Diagnostic Center, Eluru",,2014-05-10
233.0,10-05-15,Andhra Pradesh,Visakhapatnam,Andhra Pradesh State Pollution Control Board,Industrial Area,7.0,18.0,69.0,,"Industrial Estate, Marripalem, Visakhapatnam",,2015-05-10
748.0,10-06-14,Andhra Pradesh,Ananthapur,Andhra Pradesh State Pollution Control Board,"Residential, Rural and other Areas",4.0,15.0,48.0,,"Kamalanagar, Ananthapur",,2014-06-10
233.0,10-06-15,Andhra Pradesh,Visakhapatnam,Andhra Pradesh State Pollution Control Board,Industrial Area,7.0,17.0,36.0,,"Industrial Estate, Marripalem, Visakhapatnam",,2015-06-10
750.0,10-07-14,Andhra Pradesh,Eluru,Andhra Pradesh State Pollution Control Board,"Residential, Rural and other Areas",,,400.0,,"ASRAM Diagnostic Center, Eluru",,2014-07-10
233.0,10-07-15,Andhra Pradesh,Visakhapatnam,Andhra Pradesh State Pollution Control Board,Industrial Area,8.0,20.0,30.0,,"Industrial Estate, Marripalem, Visakhapatnam",,2015-07-10
542.0,10-08-14,Assam,Bongaigaon,Assam State Pollution Control Board,"Residential, Rural and other Areas",7.0,13.0,58.0,,"Campus of Oil India Ltd. PS-6, Bongaigaon, Chirang",,2014-08-10
233.0,10-08-15,Andhra Pradesh,Visakhapatnam,Andhra Pradesh State Pollution Control Board,Industrial Area,8.0,17.0,52.0,,"Industrial Estate, Marripalem, Visakhapatnam",,2015-08-10
748.0,10-09-14,Andhra Pradesh,Ananthapur,Andhra Pradesh State Pollution Control Board,"Residential, Rural and other Areas",4.0,15.0,62.0,,"Kamalanagar, Ananthapur",,2014-09-10
233.0,10-09-15,Andhra Pradesh,Visakhapatnam,Andhra Pradesh State Pollution Control Board,Industrial Area,5.0,11.0,61.0,,"Industrial Estate, Marripalem, Visakhapatnam",,2015-09-10
757.0,10-10-14,Andhra Pradesh,Rajahmundry,Andhra Pradesh State Pollution Control Board,Industrial Area,9.0,22.0,57.0,,"Staff Club Building, M/s A.P. Paper Mill, Rajahmundry",,2014-10-10
233.0,10-10-15,Andhra Pradesh,Visakhapatnam,Andhra Pradesh State Pollution Control Board,Industrial Area,8.0,20.0,82.0,,"Industrial Estate, Marripalem, Visakhapatnam",,2015-10-10
748.0,10-11-14,Andhra Pradesh,Ananthapur,Andhra Pradesh State Pollution Control Board,"Residential, Rural and other Areas",4.0,15.0,57.0,,"Kamalanagar, Ananthapur",,2014-11-10
595.0,10-11-15,Assam,Nagaon,Assam State Pollution Control Board,"Residential, Rural and other Areas",13.0,23.0,105.0,,"Water Resources Division Office Campus, Christian Patty, near Nagaon College",,2015-11-10
147.0,10-12-14,Kerala,Kochi,National Environmental Engineering Research Institute,"Residential, Rural and other Areas",2.0,7.0,28.0,,"MG Road Bank Ernakulum, Kochi",,2014-12-10
233.0,10-12-15,Andhra Pradesh,Visakhapatnam,Andhra Pradesh State Pollution Control Board,Industrial Area,7.0,18.0,71.0,,"Industrial Estate, Marripalem, Visakhapatnam",,2015-12-10
58,10/1/1987,Delhi,Delhi,Central Pollution Control Board,Industrial,27.3,13.2,,372.0,,,1987-01-10
44.0,10/1/1988,Bihar,Dhanbad,Bihar Pollution Control Board,"Residential, Rural and other Areas",23.0,17.7,,121.0,,,1988-01-10
56,10/1/2003,Delhi,Delhi,Central Pollution Control Board,Industrial Area,5.0,38.0,48.0,292.0,,,2003-01-10
95.0,10/1/2004,Andhra Pradesh,Hyderabad,Andhra Pradesh State Pollution Control Board,Industrial Area,4.6,26.6,53.3,236.0,"C.I.T.D., Balanagar, Plot no. A1 to A8, IDA, Hyderabad",,2004-01-10
,10/1/2005,Assam,Bongaigaon,,Residential and others,3.7,12.4,,31.0,Barpara Office Bldg,,2005-01-10
,10/1/2006,Andhra Pradesh,Vijayawada,,Residential and others,6.0,28.6,94.0,225.0,Benz Circle,,2006-01-10
,10/1/2007,Andhra Pradesh,Visakhapatnam,,Industrial Areas,9.2,32.6,93.0,192.0,Industrial Estate,,2007-01-10
,10/1/2008,Andhra Pradesh,Visakhapatnam,,Industrial Areas,21.6,15.6,59.0,118.0,Industrial Estate,,2008-01-10
,10/1/2009,Andhra Pradesh,Nalgonda,,Residential and others,4.6,24.2,106.0,215.0,RO APPCB,,2009-01-10
581.0,10/1/2010,Andhra Pradesh,Khammam,Andhra Pradesh State Pollution Control Board,"Residential, Rural and other Areas",2.0,10.0,59.0,,"CER Club,S.C.C.L. township, writter basti, Kothagudem, Khammam Dist.",,2010-01-10
577.0,10/1/2011,Andhra Pradesh,Nalgonda,Andhra Pradesh State Pollution Control Board,"Residential, Rural and other Areas",4.0,15.0,38.0,,"Beside Regional Office, APPCB Nalgonda",,2011-01-10
233.0,10/1/2012,Andhra Pradesh,Visakhapatnam,Andhra Pradesh State Pollution Control Board,Industrial Area,4.0,10.0,43.0,,"Industrial Estate, Marripalem, Visakhapatnam",,2012-01-10
751.0,10/1/2013,Andhra Pradesh,Srikakulam,Andhra Pradesh State Pollution Control Board,Industrial Area,16.0,27.0,58.0,,"IDA, Pydibheemavaram, Srikakulam",,2013-01-10
56,10/10/2003,Delhi,Delhi,Central Pollution Control Board,Industrial Area,6.0,34.0,194.0,530.0,,,2003-10-10
233.0,10/10/2004,Andhra Pradesh,Visakhapatnam,Andhra Pradesh State Pollution Control Board,Industrial Area,10.0,32.0,97.0,150.0,"Industrial Estate, Marripalem, Visakhapatnam",,2004-10-10
,10/10/2005,Assam,Bongaigaon,,Residential and others,,,104.0,155.0,Birjhoria Science Co,,2005-10-10
,10/10/2006,Andhra Pradesh,Hyderabad,,Residential and others,4.0,20.8,90.0,187.0,Mourya Inn,,2006-10-10
,10/10/2007,Andhra Pradesh,Hyderabad,,Industrial Areas,5.3,31.0,125.0,318.0,C.I.T.D. Balanagar,,2007-10-10
,10/10/2008,Andhra Pradesh,Hyderabad,,Industrial Areas,5.1,28.6,67.0,195.0,C.I.T.D. Balanagar,,2008-10-10
,10/10/2009,Andhra Pradesh,Hyderabad,,Industrial Areas,5.0,25.1,98.0,300.0,C.I.T.D. Balanagar,,2009-10-10
582.0,10/10/2010,Andhra Pradesh,Chittoor,Andhra Pradesh State Pollution Control Board,Sensitive Area,4.0,9.0,40.0,,"GNC Toll Gate Tirumala , Chittoor Dist.",,2010-10-10
583.0,10/10/2011,Andhra Pradesh,Guntur,Andhra Pradesh State Pollution Control Board,"Residential, Rural and other Areas",4.2,9.7,75.0,186.0,"Near Hindu College, Market Road, Guntur",,2011-10-10
578.0,10/10/2012,Andhra Pradesh,Kakinada,Andhra Pradesh State Pollution Control Board,"Residential, Rural and other Areas",,,62.0,,"Top of the Office Building Ramanayyapeta, Kakinada",,2012-10-10
387.0,10/10/2013,Andhra Pradesh,Visakhapatnam,Andhra Pradesh State Pollution Control Board,Sensitive Area,5.0,9.0,20.0,,"INS-Virabahu, Naval Area, Visakhapatnam",,2013-10-10
41.0,10/11/1988,Karnataka,Mysore,Karnataka Pollution Control Board,Industrial Area,12.2,3.8,,31.0,,,1988-11-10
145,10/11/2003,Delhi,Delhi,,Industrial Area,33.0,49.0,,563.0,,,2003-11-10
95.0,10/11/2004,Andhra Pradesh,Hyderabad,Andhra Pradesh State Pollution Control Board,Industrial Area,4.6,26.5,57.0,181.0,"C.I.T.D., Balanagar, Plot no. A1 to A8, IDA, Hyderabad",,2004-11-10
,10/11/2005,Chandigarh,Chandigarh,,Residential and others,,11.8,65.0,162.0,Kaimbwala Village,,2005-11-10
,10/11/2006,Andhra Pradesh,Hyderabad,,Industrial Areas,6.0,46.9,153.0,364.0,C.I.T.D. Balanagar,,2006-11-10
,10/11/2007,Andhra Pradesh,Hyderabad,,Residential and others,5.0,27.2,119.0,394.0,Charminar,,2007-11-10
,10/11/2008,Andhra Pradesh,Hyderabad,,Residential and others,4.9,28.7,88.0,256.0,Charminar,,2008-11-10
,10/11/2009,Andhra Pradesh,Hyderabad,,Residential and others,4.7,23.2,91.0,276.0,Charminar,,2009-11-10
583.0,10/11/2010,Andhra Pradesh,Guntur,Andhra Pradesh State Pollution Control Board,"Residential, Rural and other Areas",2.0,11.0,81.0,,"Near Hindu College, Market Road, Guntur",,2010-11-10
464.0,10/11/2011,Chandigarh,Chandigarh,Chandigarh Pollution Control Committee,"Residential, Rural and other Areas",2.0,21.2,37.0,86.0,"Kaimbwala Village, Chandigarh",,2011-11-10
583.0,10/11/2012,Andhra Pradesh,Guntur,Andhra Pradesh State Pollution Control Board,"Residential, Rural and other Areas",5.0,11.0,75.0,,"Near Hindu College, Market Road, Guntur",,2012-11-10
520.0,10/11/2013,Assam,Bongaigaon,Assam State Pollution Control Board,"Residential, Rural and other Areas",12.0,17.0,53.0,,"Barpara Office Building, Bongaigaon",,2013-11-10
46.0,10/12/1987,Bihar,Sindri,Bihar Pollution Control Board,Industrial,29.4,50.2,,303.0,,,1987-12-10
145,10/12/2003,Delhi,Delhi,,Industrial Area,33.0,48.0,,526.0,,,2003-12-10
393.0,10/12/2004,Andhra Pradesh,Hyderabad,Andhra Pradesh State Pollution Control Board,"Residential, Rural and other Areas",2.5,24.4,100.0,245.0,"Paradise, Hyderabad",,2004-12-10
,10/12/2005,Chandigarh,Chandigarh,,Industrial Areas,,14.0,190.0,378.0,Modern Foods,,2005-12-10
,10/12/2006,Andhra Pradesh,Hyderabad,,Industrial Areas,12.3,35.4,115.0,369.0,C.I.T.D. Balanagar,,2006-12-10
,10/12/2007,Andhra Pradesh,Hyderabad,,Industrial Areas,2.8,12.0,49.0,109.0,Nacharam,,2007-12-10
,10/12/2008,Gujarat,Ahmedabad,,Residential and others,11.9,17.3,69.0,180.0,Behrampura,,2008-12-10
,10/12/2009,Andhra Pradesh,Guntur,,Residential and others,4.0,9.0,81.0,195.0,Hindu College Guntur,,2009-12-10
582.0,10/12/2010,Andhra Pradesh,Chittoor,Andhra Pradesh State Pollution Control Board,Sensitive Area,4.0,9.0,42.0,,"GNC Toll Gate Tirumala , Chittoor Dist.",,2010-12-10
583.0,10/12/2011,Andhra Pradesh,Guntur,Andhra Pradesh State Pollution Control Board,"Residential, Rural and other Areas",4.4,9.7,75.0,187.0,"Near Hindu College, Market Road, Guntur",,2011-12-10
538.0,10/12/2012,Assam,Dibrugarh,Assam State Pollution Control Board,"Residential, Rural and other Areas",6.5,13.8,20.0,,"Dibrugarh Office Building, Dibrugarh",,2012-12-10
748.0,10/12/2013,Andhra Pradesh,Ananthapur,Andhra Pradesh State Pollution Control Board,"Residential, Rural and other Areas",4.0,15.0,57.0,,"Kamalanagar, Ananthapur",,2013-12-10
49,10/2/1987,Gujarat,Baroda,Gujarat Pollution Control Board,Industrial,23.0,41.4,,218.0,,,1987-02-10
51,10/2/1988,Gujarat,Baroda,Gujarat Pollution Control Board,Industrial Area,27.4,36.0,,166.0,,,1988-02-10
21,10/2/2004,Gujarat,Surat,Gujarat State Pollution Control Board,"Residential, Rural and other Areas",16.0,19.0,90.33,112.0,"S.V.R. Engg. College, Surat",,2004-02-10
,10/2/2005,Maharashtra,Thane,,Residential and others,4.3,10.3,,,Kopri,,2005-02-10
,10/2/2006,Andhra Pradesh,Hyderabad,,Residential and others,5.0,31.1,88.0,238.0,Paradise,,2006-02-10
,10/2/2007,Andhra Pradesh,Hyderabad,,Industrial Areas,5.4,32.2,86.0,219.0,Uppal,,2007-02-10
,10/2/2008,Andhra Pradesh,Hyderabad,,Industrial Areas,5.1,30.3,96.0,266.0,C.I.T.D. Balanagar,,2008-02-10
,10/2/2009,Andhra Pradesh,Hyderabad,,Industrial Areas,5.2,24.1,50.0,144.0,C.I.T.D. Balanagar,,2009-02-10
466.0,10/2/2010,Andhra Pradesh,Kurnool,Andhra Pradesh State Pollution Control Board,"Residential, Rural and other Areas",4.0,9.0,51.0,,"Mourya Inn, Kurnool",,2010-02-10
155,10/2/2011,Gujarat,Ahmedabad,National Environmental Engineering Research Institute,"Residential, Rural and other Areas",13.0,25.0,77.0,,"R.C. High School, Mirzapur, Ahmadabad",,2011-02-10
365.0,10/2/2012,Andhra Pradesh,Hyderabad,Andhra Pradesh State Pollution Control Board,"Residential, Rural and other Areas",4.0,15.0,81.0,,Jublee Hills Hyderabad,,2012-02-10
538.0,10/2/2013,Assam,Dibrugarh,Assam State Pollution Control Board,"Residential, Rural and other Areas",6.0,11.0,182.0,,"Dibrugarh Office Building, Dibrugarh",,2013-02-10
60,10/3/1987,Delhi,Delhi,Central Pollution Control Board,Residential,3.1,14.9,,414.0,,,1987-03-10
46.0,10/3/1988,Bihar,Sindri,Bihar Pollution Control Board,Industrial Area,29.9,18.9,,230.0,,,1988-03-10
55,10/3/2003,Delhi,Delhi,Central Pollution Control Board,Industrial Area,12.0,44.0,74.0,413.0,,,2003-03-10
78.0,10/3/2004,Karnataka,Bangalore,Karnataka State Pollution Control Board,"Residential, Rural and other Areas",7.0,57.0,35.33,95.0,"AMCO Batteries, Mysore Road, Bangalore",,2004-03-10
,10/3/2005,Andhra Pradesh,Hyderabad,,Industrial Areas,5.2,25.3,116.0,178.0,Nacharam,,2005-03-10
,10/3/2006,Andhra Pradesh,Patancheru,,Residential and others,11.8,12.8,38.0,110.0,Police Station,,2006-03-10
,10/3/2007,Andhra Pradesh,Hyderabad,,Industrial Areas,2.5,17.1,45.0,105.0,Nacharam,,2007-03-10
,10/3/2008,Andhra Pradesh,Hyderabad,,Industrial Areas,,62.7,49.0,92.0,Nacharam,,2008-03-10
,10/3/2009,Chandigarh,Chandigarh,,Residential and others,,8.3,106.0,186.0,Kaimbwala Village,,2009-03-10
586.0,10/3/2010,Assam,Margherita,Assam State Pollution Control Board,"Residential, Rural and other Areas",7.0,15.0,29.0,,"Coal India Office Complex, Margherita,Tinsukia,Assam",,2010-03-10
583.0,10/3/2011,Andhra Pradesh,Guntur,Andhra Pradesh State Pollution Control Board,"Residential, Rural and other Areas",4.4,9.6,73.0,184.0,"Near Hindu College, Market Road, Guntur",,2011-03-10
583.0,10/3/2012,Andhra Pradesh,Guntur,Andhra Pradesh State Pollution Control Board,"Residential, Rural and other Areas",4.0,11.0,73.0,,"Near Hindu College, Market Road, Guntur",,2012-03-10
748.0,10/3/2013,Andhra Pradesh,Ananthapur,Andhra Pradesh State Pollution Control Board,"Residential, Rural and other Areas",4.0,16.0,45.0,,"Kamalanagar, Ananthapur",,2013-03-10
59,10/4/1987,Delhi,Delhi,Central Pollution Control Board,Residential,14.2,14.6,,337.0,,,1987-04-10
23,10/4/1988,Gujarat,Surat,Gujarat Pollution Control Board,"Residential, Rural and other Areas",17.7,42.2,,478.0,,,1988-04-10
95.0,10/4/2004,Andhra Pradesh,Hyderabad,Andhra Pradesh State Pollution Control Board,Industrial Area,4.5,23.4,62.0,249.0,"C.I.T.D., Balanagar, Plot no. A1 to A8, IDA, Hyderabad",,2004-04-10
,10/4/2005,Andhra Pradesh,Hyderabad,,Industrial Areas,5.0,27.0,80.0,275.0,C.I.T.D. Balanagar,,2005-04-10
,10/4/2006,Andhra Pradesh,Hyderabad,,Industrial Areas,7.2,40.7,67.0,177.0,C.I.T.D. Balanagar,,2006-04-10
,10/4/2007,Andhra Pradesh,Hyderabad,,Industrial Areas,5.2,30.8,96.0,296.0,C.I.T.D. Balanagar,,2007-04-10
,10/4/2008,Andhra Pradesh,Hyderabad,,Industrial Areas,5.1,28.3,75.0,216.0,C.I.T.D. Balanagar,,2008-04-10
,10/4/2009,Andhra Pradesh,Hyderabad,,Industrial Areas,5.1,23.4,40.0,141.0,C.I.T.D. Balanagar,,2009-04-10
583.0,10/4/2010,Andhra Pradesh,Guntur,Andhra Pradesh State Pollution Control Board,"Residential, Rural and other Areas",2.0,11.0,81.0,,"Near Hindu College, Market Road, Guntur",,2010-04-10
464.0,10/4/2011,Chandigarh,Chandigarh,Chandigarh Pollution Control Committee,"Residential, Rural and other Areas",2.0,14.2,84.0,187.0,"Kaimbwala Village, Chandigarh",,2011-04-10
233.0,10/4/2012,Andhra Pradesh,Visakhapatnam,Andhra Pradesh State Pollution Control Board,Industrial Area,6.0,9.0,42.0,,"Industrial Estate, Marripalem, Visakhapatnam",,2012-04-10
542.0,10/4/2013,Assam,Bongaigaon,Assam State Pollution Control Board,"Residential, Rural and other Areas",6.0,15.0,38.0,,"Campus of Oil India Ltd. PS-6, Bongaigaon, Chirang",,2013-04-10
36,10/5/1987,Goa,Ponda,Goa Pollution Control Board,,5.0,8.4,,46.0,,,1987-05-10
21,10/5/1988,Gujarat,Surat,Gujarat Pollution Control Board,"Residential, Rural and other Areas",6.8,60.4,,134.0,,,1988-05-10
393.0,10/5/2004,Andhra Pradesh,Hyderabad,Andhra Pradesh State Pollution Control Board,"Residential, Rural and other Areas",2.4,22.6,66.3,198.0,"Paradise, Hyderabad",,2004-05-10
,10/5/2005,Andhra Pradesh,Hyderabad,,Industrial Areas,2.8,8.8,91.0,167.0,Nacharam,,2005-05-10
,10/5/2006,Andhra Pradesh,Hyderabad,,Industrial Areas,5.5,30.9,71.0,232.0,Uppal,,2006-05-10
,10/5/2007,Andhra Pradesh,Hyderabad,,Residential and others,5.2,31.7,88.0,260.0,Charminar,,2007-05-10
,10/5/2008,Andhra Pradesh,Hyderabad,,Residential and others,4.8,28.0,86.0,248.0,Charminar,,2008-05-10
,10/5/2009,Andhra Pradesh,Guntur,,Residential and others,4.0,9.0,86.0,215.0,Hindu College Guntur,,2009-05-10
582.0,10/5/2010,Andhra Pradesh,Chittoor,Andhra Pradesh State Pollution Control Board,Sensitive Area,4.0,9.0,40.0,,"GNC Toll Gate Tirumala , Chittoor Dist.",,2010-05-10
583.0,10/5/2011,Andhra Pradesh,Guntur,Andhra Pradesh State Pollution Control Board,"Residential, Rural and other Areas",4.6,9.7,73.0,183.0,"Near Hindu College, Market Road, Guntur",,2011-05-10
583.0,10/5/2012,Andhra Pradesh,Guntur,Andhra Pradesh State Pollution Control Board,"Residential, Rural and other Areas",4.0,11.0,74.0,,"Near Hindu College, Market Road, Guntur",,2012-05-10
538.0,10/5/2013,Assam,Dibrugarh,Assam State Pollution Control Board,"Residential, Rural and other Areas",3.0,9.0,25.0,,"Dibrugarh Office Building, Dibrugarh",,2013-05-10
4.0,10/6/1987,Uttar Pradesh,Agra,Uttar Pradesh  Pollution Control Board,Residential,10.5,6.5,,304.0,,,1987-06-10
30.0,10/6/1988,Kerala,Cochin,Kerala Pollution Control Board,Industrial Area,,,,98.0,,,1988-06-10
58,10/6/2003,Delhi,Delhi,Central Pollution Control Board,Industrial Area,12.0,34.0,80.0,242.0,,,2003-06-10
193.0,10/6/2004,Assam,Guwahati,Assam State Pollution Control Board,"Residential, Rural and other Areas",2.0,6.3,88.0,,"Head Office, Bamunimaidan, Guwahati",,2004-06-10
,10/6/2005,Assam,Guwahati,,Residential and others,4.0,15.3,49.0,92.0,Head Office,,2005-06-10
,10/6/2006,Andhra Pradesh,Hyderabad,,Residential and others,5.0,34.1,103.0,285.0,Charminar,,2006-06-10
,10/6/2007,Andhra Pradesh,Tirupati,,Sensitive Areas,4.0,9.0,23.0,83.0,Reg.Science Centre,,2007-06-10
,10/6/2008,Andhra Pradesh,Tirupati,,Sensitive Areas,4.0,9.0,48.0,134.0,Reg.Science Centre,,2008-06-10
,10/6/2009,Andhra Pradesh,Guntur,,Residential and others,4.0,9.0,92.0,232.0,Hindu College Guntur,,2009-06-10
580.0,10/6/2010,Andhra Pradesh,Nellore,Andhra Pradesh State Pollution Control Board,"Residential, Rural and other Areas",2.0,12.0,62.0,,"Venkatareddy nagar, Vedayapalem, Nellore",,2010-06-10
464.0,10/6/2011,Chandigarh,Chandigarh,Chandigarh Pollution Control Committee,"Residential, Rural and other Areas",2.0,9.6,92.0,172.0,"Kaimbwala Village, Chandigarh",,2011-06-10
542.0,10/6/2012,Assam,Bongaigaon,Assam State Pollution Control Board,"Residential, Rural and other Areas",4.8,11.0,32.0,,"Campus of Oil India Ltd. PS-6, Bongaigaon, Chirang",,2012-06-10
748.0,10/6/2013,Andhra Pradesh,Ananthapur,Andhra Pradesh State Pollution Control Board,"Residential, Rural and other Areas",4.0,15.0,48.0,,"Kamalanagar, Ananthapur",,2013-06-10
2.0,10/7/1987,Uttar Pradesh,Agra,Uttar Pradesh Pollution Control Board,Residential,5.2,3.8,,400.0,,,1987-07-10
61.0,10/7/1988,Punjab,Ludhiana,Punjab Pollution Control Board,Industrial Area,4.1,26.3,,353.0,,,1988-07-10
56,10/7/2003,Delhi,Delhi,Central Pollution Control Board,Industrial Area,4.0,29.0,105.0,348.0,,,2003-07-10
394.0,10/7/2004,Andhra Pradesh,Hyderabad,Andhra Pradesh State Pollution Control Board,"Residential, Rural and other Areas",2.5,22.2,103.0,190.7,"Charminar, Hyderabad",,2004-07-10
,10/7/2005,Andhra Pradesh,Hyderabad,,Industrial Areas,4.9,29.6,110.0,281.0,C.I.T.D. Balanagar,,2005-07-10
,10/7/2006,Andhra Pradesh,Hyderabad,,Industrial Areas,5.7,29.0,99.0,288.0,Uppal,,2006-07-10
,10/7/2007,Andhra Pradesh,Hyderabad,,Industrial Areas,3.7,9.6,39.0,107.0,Nacharam,,2007-07-10
,10/7/2008,Andhra Pradesh,Hyderabad,,Industrial Areas,,53.9,70.0,115.0,Nacharam,,2008-07-10
,10/7/2009,Andhra Pradesh,Ramagundam,,Residential and others,4.0,9.2,23.0,71.0,RTC Bus Depot,,2009-07-10
582.0,10/7/2010,Andhra Pradesh,Chittoor,Andhra Pradesh State Pollution Control Board,Sensitive Area,4.0,9.0,41.0,,"GNC Toll Gate Tirumala , Chittoor Dist.",,2010-07-10
203.0,10/7/2011,Andhra Pradesh,Hyderabad,Andhra Pradesh State Pollution Control Board,Industrial Area,4.0,26.0,78.0,180.0,"Uppal, Modern Foods & Industries IDA, Hyderabad",,2011-07-10
468.0,10/7/2012,Andhra Pradesh,Patancheru,Andhra Pradesh State Pollution Control Board,"Residential, Rural and other Areas",5.0,23.0,89.0,,"Police Station, Medak, Patencheru",,2012-07-10
566.0,10/7/2013,Assam,Daranga,Assam State Pollution Control Board,"Residential, Rural and other Areas",4.0,11.0,36.0,,"Daranga, Baska district, BATAD,Assam near Sandoop Jhankar town of Bhutan",,2013-07-10
44.0,10/8/1987,Bihar,Dhanbad,Bihar Pollution Control Board,Residential,12.7,23.2,,154.0,,,1987-08-10
43,10/8/1988,Haryana,Faridabad,Haryana Pollution Control Board,Industrial Area,29.2,12.3,,243.0,,,1988-08-10
55,10/8/2003,Delhi,Delhi,Central Pollution Control Board,Industrial Area,16.0,47.0,88.0,274.0,,,2003-08-10
95.0,10/8/2004,Andhra Pradesh,Hyderabad,Andhra Pradesh State Pollution Control Board,Industrial Area,4.5,27.6,90.0,227.0,"C.I.T.D., Balanagar, Plot no. A1 to A8, IDA, Hyderabad",,2004-08-10
,10/8/2005,Andhra Pradesh,Hyderabad,,Residential and others,5.6,35.6,104.0,232.0,Charminar,,2005-08-10
,10/8/2006,Andhra Pradesh,Hyderabad,,Residential and others,5.1,29.9,130.0,287.0,Charminar,,2006-08-10
,10/8/2007,Andhra Pradesh,Hyderabad,,Industrial Areas,5.1,28.8,112.0,339.0,C.I.T.D. Balanagar,,2007-08-10
,10/8/2008,Andhra Pradesh,Hyderabad,,Industrial Areas,5.1,27.8,89.0,249.0,C.I.T.D. Balanagar,,2008-08-10
,10/8/2009,Andhra Pradesh,Hyderabad,,Industrial Areas,5.1,27.0,67.0,235.0,C.I.T.D. Balanagar,,2009-08-10
582.0,10/8/2010,Andhra Pradesh,Chittoor,Andhra Pradesh State Pollution Control Board,Sensitive Area,4.0,9.0,40.0,,"GNC Toll Gate Tirumala , Chittoor Dist.",,2010-08-10
464.0,10/8/2011,Chandigarh,Chandigarh,Chandigarh Pollution Control Committee,"Residential, Rural and other Areas",2.0,5.6,53.0,149.0,"Kaimbwala Village, Chandigarh",,2011-08-10
583.0,10/8/2012,Andhra Pradesh,Guntur,Andhra Pradesh State Pollution Control Board,"Residential, Rural and other Areas",5.0,10.0,73.0,,"Near Hindu College, Market Road, Guntur",,2012-08-10
748.0,10/8/2013,Andhra Pradesh,Ananthapur,Andhra Pradesh State Pollution Control Board,"Residential, Rural and other Areas",4.0,15.0,62.0,,"Kamalanagar, Ananthapur",,2013-08-10
13,10/9/1987,West Bengal,Haldia,CMEC,Residential,,26.5,,138.0,,,1987-09-10
58,10/9/2003,Delhi,Delhi,Central Pollution Control Board,Industrial Area,15.0,39.0,140.0,453.0,,,2003-09-10
284.0,10/9/2004,Bihar,Patna,Bihar Sate Pollution Control Board,"Residential, Rural and other Areas",10.0,25.0,67.0,131.0,"Gandhi Maidan Test Centre,Patna",,2004-09-10
,10/9/2005,Andhra Pradesh,Hyderabad,,Industrial Areas,4.7,22.0,71.0,224.0,C.I.T.D. Balanagar,,2005-09-10
,10/9/2006,Andhra Pradesh,Hyderabad,,Industrial Areas,5.0,33.8,124.0,313.0,Uppal,,2006-09-10
,10/9/2007,Andhra Pradesh,Hyderabad,,Industrial Areas,3.4,11.0,59.0,130.0,Nacharam,,2007-09-10
,10/9/2008,Assam,Dibrugarh,,Residential and others,5.0,10.4,51.0,73.0,Dibrugarh Off. Bldg,,2008-09-10
,10/9/2009,Andhra Pradesh,Hyderabad,,Residential and others,4.9,25.2,94.0,281.0,Charminar,,2009-09-10
566.0,10/9/2010,Assam,Daranga,Assam State Pollution Control Board,"Residential, Rural and other Areas",5.0,15.0,11.0,,"Daranga, Baska district, BATAD,Assam near Sandoop Jhankar town of Bhutan",,2010-09-10
95.0,10/9/2011,Andhra Pradesh,Hyderabad,Andhra Pradesh State Pollution Control Board,Industrial Area,5.0,42.0,131.0,246.0,"C.I.T.D., Balanagar, Plot no. A1 to A8, IDA, Hyderabad",,2011-09-10
468.0,10/9/2012,Andhra Pradesh,Patancheru,Andhra Pradesh State Pollution Control Board,"Residential, Rural and other Areas",6.0,21.0,96.0,,"Police Station, Medak, Patencheru",,2012-09-10
566.0,10/9/2013,Assam,Daranga,Assam State Pollution Control Board,"Residential, Rural and other Areas",3.0,9.0,33.0,,"Daranga, Baska district, BATAD,Assam near Sandoop Jhankar town of Bhutan",,2013-09-10
748.0,11-01-14,Andhra Pradesh,Ananthapur,Andhra Pradesh State Pollution Control Board,"Residential, Rural and other Areas",4.0,9.0,63.0,,"Kamalanagar, Ananthapur",,2014-01-11
SAMP,11-01-15,Gujarat,Bharuch,Gujarat State Pollution Control Board,RIRUO,14.0,21.0,93.0,,"Dahez SEZ Part II Office,Bharuch",26.0,2015-01-11
512.0,11-02-14,Maharashtra,Aurangabad,Maharashtra State Pollution Control Board,Sensitive Area,9.0,28.0,122.0,,"Bibi-Ka-Maqbara, Aurangabad",,2014-02-11
389.0,11-02-15,Andhra Pradesh,Tirupati,Andhra Pradesh State Pollution Control Board,Sensitive Area,5.0,11.0,61.0,,"Regional Science Centre, Chittoor Bypass Road, Tirupati",,2015-02-11
748.0,11-03-14,Andhra Pradesh,Ananthapur,Andhra Pradesh State Pollution Control Board,"Residential, Rural and other Areas",4.0,9.0,78.0,,"Kamalanagar, Ananthapur",,2014-03-11
193.0,11-03-15,Assam,Guwahati,Assam State Pollution Control Board,"Residential, Rural and other Areas",10.0,17.0,184.0,,"Head Office, Bamunimaidan, Guwahati",,2015-03-11
757.0,11-04-14,Andhra Pradesh,Rajahmundry,Andhra Pradesh State Pollution Control Board,Industrial Area,6.0,11.0,61.0,,"Staff Club Building, M/s A.P. Paper Mill, Rajahmundry",,2014-04-11
389.0,11-04-15,Andhra Pradesh,Tirupati,Andhra Pradesh State Pollution Control Board,Sensitive Area,4.0,11.0,63.0,,"Regional Science Centre, Chittoor Bypass Road, Tirupati",,2015-04-11
520.0,11-05-14,Assam,Bongaigaon,Assam State Pollution Control Board,"Residential, Rural and other Areas",7.0,13.0,54.0,,"Barpara Office Building, Bongaigaon",,2014-05-11
193.0,11-05-15,Assam,Guwahati,Assam State Pollution Control Board,"Residential, Rural and other Areas",6.0,13.0,95.0,,"Head Office, Bamunimaidan, Guwahati",,2015-05-11
748.0,11-06-14,Andhra Pradesh,Ananthapur,Andhra Pradesh State Pollution Control Board,"Residential, Rural and other Areas",4.0,9.0,66.0,,"Kamalanagar, Ananthapur",,2014-06-11
193.0,11-06-15,Assam,Guwahati,Assam State Pollution Control Board,"Residential, Rural and other Areas",6.0,13.0,68.0,,"Head Office, Bamunimaidan, Guwahati",,2015-06-11
757.0,11-07-14,Andhra Pradesh,Rajahmundry,Andhra Pradesh State Pollution Control Board,Industrial Area,8.0,14.0,59.0,,"Staff Club Building, M/s A.P. Paper Mill, Rajahmundry",,2014-07-11
538.0,11-07-15,Assam,Dibrugarh,Assam State Pollution Control Board,"Residential, Rural and other Areas",7.0,14.0,178.0,,"Dibrugarh Office Building, Dibrugarh",,2015-07-11
538.0,11-08-14,Assam,Dibrugarh,Assam State Pollution Control Board,"Residential, Rural and other Areas",6.0,12.0,54.0,,"Dibrugarh Office Building, Dibrugarh",,2014-08-11
193.0,11-08-15,Assam,Guwahati,Assam State Pollution Control Board,"Residential, Rural and other Areas",5.0,10.0,63.0,,"Head Office, Bamunimaidan, Guwahati",,2015-08-11
583.0,11-09-14,Andhra Pradesh,Guntur,Andhra Pradesh State Pollution Control Board,"Residential, Rural and other Areas",5.0,20.0,75.0,,"Near Hindu College, Market Road, Guntur",,2014-09-11
193.0,11-09-15,Assam,Guwahati,Assam State Pollution Control Board,"Residential, Rural and other Areas",7.0,11.0,74.0,,"Head Office, Bamunimaidan, Guwahati",,2015-09-11
748.0,11-10-14,Andhra Pradesh,Ananthapur,Andhra Pradesh State Pollution Control Board,"Residential, Rural and other Areas",4.0,9.0,67.0,,"Kamalanagar, Ananthapur",,2014-10-11
29.0,11-10-15,Kerala,Kochi,Kerala State Pollution Control Board,Industrial Area,2.0,28.0,90.0,,"Eloor, Kochi",,2015-10-11
583.0,11-11-14,Andhra Pradesh,Guntur,Andhra Pradesh State Pollution Control Board,"Residential, Rural and other Areas",5.0,21.0,76.0,,"Near Hindu College, Market Road, Guntur",,2014-11-11
233.0,11-11-15,Andhra Pradesh,Visakhapatnam,Andhra Pradesh State Pollution Control Board,Industrial Area,23.0,39.0,124.0,,"Industrial Estate, Marripalem, Visakhapatnam",,2015-11-11
520.0,11-12-14,Assam,Bongaigaon,Assam State Pollution Control Board,"Residential, Rural and other Areas",6.0,13.0,50.0,,"Barpara Office Building, Bongaigaon",,2014-12-11
193.0,11-12-15,Assam,Guwahati,Assam State Pollution Control Board,"Residential, Rural and other Areas",7.0,22.0,94.0,,"Head Office, Bamunimaidan, Guwahati",,2015-12-11
58,11/1/1987,Delhi,Delhi,Central Pollution Control Board,Industrial,7.5,8.2,,601.0,,,1987-01-11
45.0,11/1/1988,Bihar,Jharia,Bihar Pollution Control Board,Industrial Area,27.5,29.3,,562.0,,,1988-01-11
95.0,11/1/2004,Andhra Pradesh,Hyderabad,Andhra Pradesh State Pollution Control Board,Industrial Area,4.7,37.8,63.7,195.0,"C.I.T.D., Balanagar, Plot no. A1 to A8, IDA, Hyderabad",,2004-01-11
,11/1/2005,Andhra Pradesh,Hyderabad,,Industrial Areas,6.4,35.7,181.0,307.0,Uppal,,2005-01-11
,11/1/2006,Andhra Pradesh,Hyderabad,,Industrial Areas,5.3,36.5,61.0,237.0,C.I.T.D. Balanagar,,2006-01-11
,11/1/2007,Andhra Pradesh,Visakhapatnam,,Industrial Areas,8.3,29.4,87.0,172.0,Industrial Estate,,2007-01-11
,11/1/2008,Andhra Pradesh,Visakhapatnam,,Industrial Areas,8.6,55.4,86.0,147.0,Industrial Estate,,2008-01-11
,11/1/2009,Gujarat,Ahmedabad,,Residential and others,21.6,27.3,120.0,241.0,R.C. High School,,2009-01-11
583.0,11/1/2010,Andhra Pradesh,Guntur,Andhra Pradesh State Pollution Control Board,"Residential, Rural and other Areas",2.0,11.0,70.0,,"Near Hindu College, Market Road, Guntur",,2010-01-11
583.0,11/1/2011,Andhra Pradesh,Guntur,Andhra Pradesh State Pollution Control Board,"Residential, Rural and other Areas",4.6,9.6,77.0,197.0,"Near Hindu College, Market Road, Guntur",,2011-01-11
233.0,11/1/2012,Andhra Pradesh,Visakhapatnam,Andhra Pradesh State Pollution Control Board,Industrial Area,18.0,10.0,66.0,,"Industrial Estate, Marripalem, Visakhapatnam",,2012-01-11
387.0,11/1/2013,Andhra Pradesh,Visakhapatnam,Andhra Pradesh State Pollution Control Board,Sensitive Area,15.0,18.0,30.0,,"INS-Virabahu, Naval Area, Visakhapatnam",,2013-01-11
58,11/10/2003,Delhi,Delhi,Central Pollution Control Board,Industrial Area,15.0,45.0,213.0,513.0,,,2003-10-11
233.0,11/10/2004,Andhra Pradesh,Visakhapatnam,Andhra Pradesh State Pollution Control Board,Industrial Area,11.0,33.0,95.0,144.0,"Industrial Estate, Marripalem, Visakhapatnam",,2004-10-11
,11/10/2005,Andhra Pradesh,Hyderabad,,Industrial Areas,4.9,31.6,138.0,305.0,C.I.T.D. Balanagar,,2005-10-11
,11/10/2006,Andhra Pradesh,Hyderabad,,Residential and others,4.0,17.6,66.0,155.0,Mourya Inn,,2006-10-11
,11/10/2007,Andhra Pradesh,Kurnool,,Residential and others,4.0,11.2,61.0,73.0,Mourya Inn,,2007-10-11
,11/10/2008,Andhra Pradesh,Hyderabad,,Industrial Areas,4.8,29.2,116.0,328.0,Uppal,,2008-10-11
,11/10/2009,Andhra Pradesh,Guntur,,Residential and others,4.0,9.0,84.0,229.0,Hindu College Guntur,,2009-10-11
583.0,11/10/2010,Andhra Pradesh,Guntur,Andhra Pradesh State Pollution Control Board,"Residential, Rural and other Areas",2.0,11.0,71.0,,"Near Hindu College, Market Road, Guntur",,2010-10-11
203.0,11/10/2011,Andhra Pradesh,Hyderabad,Andhra Pradesh State Pollution Control Board,Industrial Area,5.0,34.0,185.0,306.0,"Uppal, Modern Foods & Industries IDA, Hyderabad",,2011-10-11
467.0,11/10/2012,Andhra Pradesh,Visakhapatnam,Andhra Pradesh State Pollution Control Board,"Residential, Rural and other Areas",4.0,11.0,46.0,,"Ganapuram Area, Visakhapatnam",,2012-10-11
751.0,11/10/2013,Andhra Pradesh,Srikakulam,Andhra Pradesh State Pollution Control Board,Industrial Area,23.0,29.0,82.0,,"IDA, Pydibheemavaram, Srikakulam",,2013-10-11
56,11/11/2003,Delhi,Delhi,Central Pollution Control Board,Industrial Area,11.0,49.0,144.0,387.0,,,2003-11-11
106.0,11/11/2004,Chandigarh,Chandigarh,Chandigarh Pollution Control Committee,Industrial Area,4.0,55.0,154.0,265.0,"Modern Foods, Industrial Area, Chandigarh",,2004-11-11
,11/11/2005,Andhra Pradesh,Tirupati,,Sensitive Areas,5.5,9.7,37.0,70.0,Reg.Science Centre,,2005-11-11
,11/11/2006,Andhra Pradesh,Hyderabad,,Residential and others,4.9,27.8,110.0,286.0,Charminar,,2006-11-11
,11/11/2007,Andhra Pradesh,Hyderabad,,Residential and others,5.0,31.5,104.0,303.0,Paradise,,2007-11-11
,11/11/2008,Andhra Pradesh,Hyderabad,,Industrial Areas,5.3,13.1,42.0,73.0,Nacharam,,2008-11-11
,11/11/2009,Andhra Pradesh,Guntur,,Residential and others,4.0,9.0,77.0,205.0,Hindu College Guntur,,2009-11-11
582.0,11/11/2010,Andhra Pradesh,Chittoor,Andhra Pradesh State Pollution Control Board,Sensitive Area,4.0,9.0,35.0,,"GNC Toll Gate Tirumala , Chittoor Dist.",,2010-11-11
582.0,11/11/2011,Andhra Pradesh,Chittoor,Andhra Pradesh State Pollution Control Board,Sensitive Area,4.0,9.0,37.0,88.0,"GNC Toll Gate Tirumala , Chittoor Dist.",,2011-11-11
577.0,11/11/2012,Andhra Pradesh,Nalgonda,Andhra Pradesh State Pollution Control Board,"Residential, Rural and other Areas",4.0,16.0,81.0,,"Beside Regional Office, APPCB Nalgonda",,2012-11-11
520.0,11/11/2013,Assam,Bongaigaon,Assam State Pollution Control Board,"Residential, Rural and other Areas",7.0,13.0,54.0,,"Barpara Office Building, Bongaigaon",,2013-11-11
55,11/12/2003,Delhi,Delhi,Central Pollution Control Board,Industrial Area,13.0,45.0,165.0,385.0,,,2003-12-11
264.0,11/12/2004,Chandigarh,Chandigarh,Chandigarh Pollution Control Committee,"Residential, Rural and other Areas",6.0,36.0,162.0,236.0,"Punjab Engineering College, Sector-12, Chandigarh",,2004-12-11
,11/12/2005,Andhra Pradesh,Hyderabad,,Residential and others,5.6,28.1,107.0,271.0,Charminar,,2005-12-11
,11/12/2006,Karnataka,Bangalore,,Residential and others,12.9,28.8,15.0,67.0,AMCO Batteries,,2006-12-11
,11/12/2007,Andhra Pradesh,Hyderabad,,Industrial Areas,2.5,12.5,42.0,94.0,Nacharam,,2007-12-11
,11/12/2008,Andhra Pradesh,Hyderabad,,Industrial Areas,5.2,28.2,112.0,320.0,C.I.T.D. Balanagar,,2008-12-11
,11/12/2009,Assam,Guwahati,,Residential and others,8.3,15.5,175.0,271.0,Gopinath Nagar,,2009-12-11
468.0,11/12/2010,Andhra Pradesh,Patancheru,Andhra Pradesh State Pollution Control Board,"Residential, Rural and other Areas",8.0,20.0,56.0,,"Police Station, Medak, Patencheru",,2010-12-11
464.0,11/12/2011,Chandigarh,Chandigarh,Chandigarh Pollution Control Committee,"Residential, Rural and other Areas",2.0,13.8,153.0,376.0,"Kaimbwala Village, Chandigarh",,2011-12-11
583.0,11/12/2012,Andhra Pradesh,Guntur,Andhra Pradesh State Pollution Control Board,"Residential, Rural and other Areas",5.0,13.0,77.0,,"Near Hindu College, Market Road, Guntur",,2012-12-11
748.0,11/12/2013,Andhra Pradesh,Ananthapur,Andhra Pradesh State Pollution Control Board,"Residential, Rural and other Areas",4.0,15.0,42.0,,"Kamalanagar, Ananthapur",,2013-12-11
60,11/2/1987,Delhi,Delhi,Central Pollution Control Board,Residential,10.5,14.2,,435.0,,,1987-02-11
44.0,11/2/1988,Bihar,Dhanbad,Bihar Pollution Control Board,"Residential, Rural and other Areas",17.5,17.7,,175.0,,,1988-02-11
393.0,11/2/2004,Andhra Pradesh,Hyderabad,Andhra Pradesh State Pollution Control Board,"Residential, Rural and other Areas",3.0,30.2,,,"Paradise, Hyderabad",,2004-02-11
,11/2/2005,Andhra Pradesh,Hyderabad,,Industrial Areas,3.2,6.7,41.0,97.0,Nacharam,,2005-02-11
,11/2/2006,Andhra Pradesh,Hyderabad,,Residential and others,5.0,30.7,103.0,306.0,Charminar,,2006-02-11
,11/2/2007,Andhra Pradesh,Hyderabad,,Industrial Areas,4.7,33.5,98.0,281.0,Uppal,,2007-02-11
,11/2/2008,Andhra Pradesh,Hyderabad,,Industrial Areas,5.1,27.2,93.0,237.0,C.I.T.D. Balanagar,,2008-02-11
,11/2/2009,Andhra Pradesh,Guntur,,Residential and others,4.0,9.0,81.0,218.0,Hindu College Guntur,,2009-02-11
583.0,11/2/2010,Andhra Pradesh,Guntur,Andhra Pradesh State Pollution Control Board,"Residential, Rural and other Areas",2.0,11.0,74.0,,"Near Hindu College, Market Road, Guntur",,2010-02-11
582.0,11/2/2011,Andhra Pradesh,Chittoor,Andhra Pradesh State Pollution Control Board,Sensitive Area,4.0,9.0,26.0,58.0,"GNC Toll Gate Tirumala , Chittoor Dist.",,2011-02-11
234.0,11/2/2012,Andhra Pradesh,Visakhapatnam,Andhra Pradesh State Pollution Control Board,"Residential, Rural and other Areas",4.0,9.0,15.0,,"Panchayat Raj office, Mindi, Visakhapatnam",,2012-02-11
587.0,11/2/2013,Assam,Lakhimpur,Assam State Pollution Control Board,"Residential, Rural and other Areas",9.0,20.0,50.0,,"Bazar Patti, North Lakhimpur Town,Lakhimpur, Assam",,2013-02-11
59,11/3/1987,Delhi,Delhi,Central Pollution Control Board,Residential,3.9,14.3,,571.0,,,1987-03-11
22,11/3/1988,Gujarat,Surat,Gujarat Pollution Control Board,Industrial Area,17.9,25.0,,170.0,,,1988-03-11
56,11/3/2003,Delhi,Delhi,Central Pollution Control Board,Industrial Area,10.0,47.0,181.0,436.0,,,2003-03-11
193.0,11/3/2004,Assam,Guwahati,Assam State Pollution Control Board,"Residential, Rural and other Areas",3.2,9.5,167.0,,"Head Office, Bamunimaidan, Guwahati",,2004-03-11
,11/3/2005,Andhra Pradesh,Tirupati,,Sensitive Areas,5.0,11.2,30.0,60.0,Reg.Science Centre,,2005-03-11
,11/3/2006,Assam,Dibrugarh,,Residential and others,7.8,17.3,63.0,156.0,Dibrugarh Off. Bldg,,2006-03-11
,11/3/2007,Andhra Pradesh,Hyderabad,,Residential and others,5.0,30.4,82.0,271.0,Charminar,,2007-03-11
,11/3/2008,Andhra Pradesh,Hyderabad,,Industrial Areas,,15.0,76.0,146.0,Nacharam,,2008-03-11
,11/3/2009,Andhra Pradesh,Guntur,,Residential and others,4.0,9.0,79.0,205.0,Hindu College Guntur,,2009-03-11
150.0,11/3/2010,Andhra Pradesh,Hyderabad,National Environmental Engineering Research Institute,"Residential, Rural and other Areas",3.0,22.0,26.0,,"Tarnaka, NEERI Lab. IICT Campus, Hyderabad",,2010-03-11
577.0,11/3/2011,Andhra Pradesh,Nalgonda,Andhra Pradesh State Pollution Control Board,"Residential, Rural and other Areas",4.0,15.0,82.0,,"Beside Regional Office, APPCB Nalgonda",,2011-03-11
95.0,11/3/2012,Andhra Pradesh,Hyderabad,Andhra Pradesh State Pollution Control Board,Industrial Area,5.0,28.0,53.0,,"C.I.T.D., Balanagar, Plot no. A1 to A8, IDA, Hyderabad",,2012-03-11
748.0,11/3/2013,Andhra Pradesh,Ananthapur,Andhra Pradesh State Pollution Control Board,"Residential, Rural and other Areas",4.0,16.0,58.0,,"Kamalanagar, Ananthapur",,2013-03-11
21,11/4/1987,Gujarat,Surat,Gujarat Pollution Control Board,Residential,12.6,9.9,,209.0,,,1987-04-11
4.0,11/4/1988,Uttar Pradesh,Agra,Uttar Pradesh  Pollution Control Board,"Residential, Rural and other Areas",38.5,12.6,,438.0,,,1988-04-11
55,11/4/2003,Delhi,Delhi,Central Pollution Control Board,Industrial Area,13.0,51.0,163.0,438.0,,,2003-04-11
393.0,11/4/2004,Andhra Pradesh,Hyderabad,Andhra Pradesh State Pollution Control Board,"Residential, Rural and other Areas",3.4,37.5,,,"Paradise, Hyderabad",,2004-04-11
,11/4/2005,Andhra Pradesh,Hyderabad,,Industrial Areas,5.8,34.2,135.0,401.0,Uppal,,2005-04-11
,11/4/2006,Andhra Pradesh,Hyderabad,,Industrial Areas,5.0,32.6,83.0,257.0,C.I.T.D. Balanagar,,2006-04-11
,11/4/2007,Andhra Pradesh,Hyderabad,,Industrial Areas,,22.6,24.0,68.0,Nacharam,,2007-04-11
,11/4/2008,Andhra Pradesh,Hyderabad,,Industrial Areas,5.2,28.0,100.0,290.0,C.I.T.D. Balanagar,,2008-04-11
,11/4/2009,Andhra Pradesh,Hyderabad,,Industrial Areas,5.4,27.5,101.0,298.0,C.I.T.D. Balanagar,,2009-04-11
466.0,11/4/2010,Andhra Pradesh,Kurnool,Andhra Pradesh State Pollution Control Board,"Residential, Rural and other Areas",4.0,9.0,56.0,,"Mourya Inn, Kurnool",,2010-04-11
582.0,11/4/2011,Andhra Pradesh,Chittoor,Andhra Pradesh State Pollution Control Board,Sensitive Area,4.0,9.0,34.0,82.0,"GNC Toll Gate Tirumala , Chittoor Dist.",,2011-04-11
233.0,11/4/2012,Andhra Pradesh,Visakhapatnam,Andhra Pradesh State Pollution Control Board,Industrial Area,44.0,21.0,82.0,,"Industrial Estate, Marripalem, Visakhapatnam",,2012-04-11
193.0,11/4/2013,Assam,Guwahati,Assam State Pollution Control Board,"Residential, Rural and other Areas",8.0,18.0,133.0,,"Head Office, Bamunimaidan, Guwahati",,2013-04-11
58,11/5/2003,Delhi,Delhi,Central Pollution Control Board,Industrial Area,18.0,52.0,341.0,536.0,,,2003-05-11
95.0,11/5/2004,Andhra Pradesh,Hyderabad,Andhra Pradesh State Pollution Control Board,Industrial Area,4.6,35.9,75.0,213.0,"C.I.T.D., Balanagar, Plot no. A1 to A8, IDA, Hyderabad",,2004-05-11
,11/5/2005,Andhra Pradesh,Hyderabad,,Industrial Areas,4.8,23.4,83.0,228.0,C.I.T.D. Balanagar,,2005-05-11
,11/5/2006,Andhra Pradesh,Hyderabad,,Residential and others,5.0,29.2,110.0,302.0,Charminar,,2006-05-11
,11/5/2007,Andhra Pradesh,Hyderabad,,Residential and others,5.0,41.6,105.0,304.0,Charminar,,2007-05-11
,11/5/2008,Andhra Pradesh,Hyderabad,,Industrial Areas,3.7,16.1,99.0,172.0,Nacharam,,2008-05-11
,11/5/2009,Andhra Pradesh,Hyderabad,,Industrial Areas,4.2,15.8,46.0,104.0,Nacharam,,2009-05-11
581.0,11/5/2010,Andhra Pradesh,Khammam,Andhra Pradesh State Pollution Control Board,"Residential, Rural and other Areas",2.0,10.0,70.0,,"CER Club,S.C.C.L. township, writter basti, Kothagudem, Khammam Dist.",,2010-05-11
464.0,11/5/2011,Chandigarh,Chandigarh,Chandigarh Pollution Control Committee,"Residential, Rural and other Areas",2.0,13.0,95.0,211.0,"Kaimbwala Village, Chandigarh",,2011-05-11
583.0,11/5/2012,Andhra Pradesh,Guntur,Andhra Pradesh State Pollution Control Board,"Residential, Rural and other Areas",5.0,14.0,74.0,,"Near Hindu College, Market Road, Guntur",,2012-05-11
751.0,11/5/2013,Andhra Pradesh,Srikakulam,Andhra Pradesh State Pollution Control Board,Industrial Area,26.0,31.0,64.0,,"IDA, Pydibheemavaram, Srikakulam",,2013-05-11
14,11/6/1987,West Bengal,Haldia,CMEC,Industrial,0.9,30.8,,210.0,,,1987-06-11
56,11/6/2003,Delhi,Delhi,Central Pollution Control Board,Industrial Area,9.0,45.0,159.0,437.0,,,2003-06-11
284.0,11/6/2004,Bihar,Patna,Bihar Sate Pollution Control Board,"Residential, Rural and other Areas",12.0,53.0,81.0,159.0,"Gandhi Maidan Test Centre,Patna",,2004-06-11
,11/6/2005,Andhra Pradesh,Hyderabad,,Residential and others,4.3,22.0,46.0,136.0,Jubilee Hills,,2005-06-11
,11/6/2006,Andhra Pradesh,Patancheru,,Residential and others,14.1,14.3,30.0,103.0,Police Station,,2006-06-11
,11/6/2007,Andhra Pradesh,Hyderabad,,Industrial Areas,5.4,31.0,131.0,358.0,C.I.T.D. Balanagar,,2007-06-11
,11/6/2008,Andhra Pradesh,Tirupati,,Sensitive Areas,4.0,9.0,32.0,133.0,Reg.Science Centre,,2008-06-11
,11/6/2009,Andhra Pradesh,Nalgonda,,Residential and others,4.5,23.8,119.0,252.0,RO APPCB,,2009-06-11
468.0,11/6/2010,Andhra Pradesh,Patancheru,Andhra Pradesh State Pollution Control Board,"Residential, Rural and other Areas",9.0,22.0,68.0,,"Police Station, Medak, Patencheru",,2010-06-11
459.0,11/6/2011,Karnataka,Gulbarga,Karnataka State Pollution Control Board,Sensitive Area,4.0,20.0,63.0,,"Government Hospital, Gulbarga",,2011-06-11
95.0,11/6/2012,Andhra Pradesh,Hyderabad,Andhra Pradesh State Pollution Control Board,Industrial Area,5.0,45.0,153.0,,"C.I.T.D., Balanagar, Plot no. A1 to A8, IDA, Hyderabad",,2012-06-11
748.0,11/6/2013,Andhra Pradesh,Ananthapur,Andhra Pradesh State Pollution Control Board,"Residential, Rural and other Areas",4.0,15.0,64.0,,"Kamalanagar, Ananthapur",,2013-06-11
55,11/7/2003,Delhi,Delhi,Central Pollution Control Board,Industrial Area,12.0,44.0,124.0,610.0,,,2003-07-11
233.0,11/7/2004,Andhra Pradesh,Visakhapatnam,Andhra Pradesh State Pollution Control Board,Industrial Area,10.0,33.0,83.0,124.0,"Industrial Estate, Marripalem, Visakhapatnam",,2004-07-11
,11/7/2005,Andhra Pradesh,Hyderabad,,Industrial Areas,4.7,25.1,89.0,287.0,C.I.T.D. Balanagar,,2005-07-11
,11/7/2006,Andhra Pradesh,Hyderabad,,Industrial Areas,5.0,35.4,122.0,360.0,C.I.T.D. Balanagar,,2006-07-11
,11/7/2007,Andhra Pradesh,Patancheru,,Residential and others,10.7,35.2,294.0,773.0,Police Station,,2007-07-11
,11/7/2008,Andhra Pradesh,Visakhapatnam,,Industrial Areas,11.2,76.7,74.0,151.0,Industrial Estate,,2008-07-11
,11/7/2009,Assam,Guwahati,,Residential and others,12.5,22.5,113.0,219.0,Gopinath Nagar,,2009-07-11
577.0,11/7/2010,Andhra Pradesh,Nalgonda,Andhra Pradesh State Pollution Control Board,"Residential, Rural and other Areas",4.0,19.0,77.0,,"Beside Regional Office, APPCB Nalgonda",,2010-07-11
583.0,11/7/2011,Andhra Pradesh,Guntur,Andhra Pradesh State Pollution Control Board,"Residential, Rural and other Areas",4.7,9.8,75.0,185.0,"Near Hindu College, Market Road, Guntur",,2011-07-11
468.0,11/7/2012,Andhra Pradesh,Patancheru,Andhra Pradesh State Pollution Control Board,"Residential, Rural and other Areas",7.0,25.0,104.0,,"Police Station, Medak, Patencheru",,2012-07-11
751.0,11/7/2013,Andhra Pradesh,Srikakulam,Andhra Pradesh State Pollution Control Board,Industrial Area,25.0,39.0,55.0,,"IDA, Pydibheemavaram, Srikakulam",,2013-07-11
62.0,11/8/2003,Punjab,Ludhiana,Punjab Pollution Control Board,"Residential, Rural and other Areas",16.0,57.0,324.0,,,,2003-08-11
217.0,11/8/2004,Assam,Guwahati,Assam State Pollution Control Board,"Residential, Rural and other Areas",4.3,18.3,233.0,,"Paltanbazar, Guwahati",,2004-08-11
,11/8/2005,Andhra Pradesh,Vijayawada,,Residential and others,6.0,29.9,82.0,174.0,Benz Circle,,2005-08-11
,11/8/2006,Andhra Pradesh,Hyderabad,,Residential and others,4.9,28.9,114.0,257.0,Charminar,,2006-08-11
,11/8/2007,Andhra Pradesh,Kurnool,,Residential and others,4.0,10.7,63.0,73.0,Mourya Inn,,2007-08-11
,11/8/2008,Andhra Pradesh,Hyderabad,,Industrial Areas,5.1,28.5,125.0,364.0,C.I.T.D. Balanagar,,2008-08-11
,11/8/2009,Andhra Pradesh,Hyderabad,,Industrial Areas,5.2,27.3,129.0,307.0,C.I.T.D. Balanagar,,2009-08-11
581.0,11/8/2010,Andhra Pradesh,Khammam,Andhra Pradesh State Pollution Control Board,"Residential, Rural and other Areas",2.0,11.0,58.0,,"CER Club,S.C.C.L. township, writter basti, Kothagudem, Khammam Dist.",,2010-08-11
582.0,11/8/2011,Andhra Pradesh,Chittoor,Andhra Pradesh State Pollution Control Board,Sensitive Area,4.0,9.0,40.0,98.0,"GNC Toll Gate Tirumala , Chittoor Dist.",,2011-08-11
583.0,11/8/2012,Andhra Pradesh,Guntur,Andhra Pradesh State Pollution Control Board,"Residential, Rural and other Areas",5.0,14.0,75.0,,"Near Hindu College, Market Road, Guntur",,2012-08-11
577.0,11/8/2013,Andhra Pradesh,Nalgonda,Andhra Pradesh State Pollution Control Board,"Residential, Rural and other Areas",4.0,16.0,88.0,,"Beside Regional Office, APPCB Nalgonda",,2013-08-11
193.0,11/9/2004,Assam,Guwahati,Assam State Pollution Control Board,"Residential, Rural and other Areas",2.7,11.5,177.0,,"Head Office, Bamunimaidan, Guwahati",,2004-09-11
,11/9/2005,Andhra Pradesh,Hyderabad,,Industrial Areas,5.7,31.9,134.0,329.0,Uppal,,2005-09-11
,11/9/2006,Andhra Pradesh,Hyderabad,,Industrial Areas,5.2,32.3,108.0,305.0,C.I.T.D. Balanagar,,2006-09-11
,11/9/2007,Andhra Pradesh,Hyderabad,,Residential and others,5.1,34.1,100.0,312.0,Paradise,,2007-09-11
,11/9/2008,Andhra Pradesh,Hyderabad,,Industrial Areas,4.1,9.0,41.0,67.0,Nacharam,,2008-09-11
,11/9/2009,Andhra Pradesh,Hyderabad,,Industrial Areas,4.8,16.2,52.0,106.0,Nacharam,,2009-09-11
582.0,11/9/2010,Andhra Pradesh,Chittoor,Andhra Pradesh State Pollution Control Board,Sensitive Area,4.0,9.0,40.0,,"GNC Toll Gate Tirumala , Chittoor Dist.",,2010-09-11
583.0,11/9/2011,Andhra Pradesh,Guntur,Andhra Pradesh State Pollution Control Board,"Residential, Rural and other Areas",4.5,9.8,77.0,195.0,"Near Hindu College, Market Road, Guntur",,2011-09-11
468.0,11/9/2012,Andhra Pradesh,Patancheru,Andhra Pradesh State Pollution Control Board,"Residential, Rural and other Areas",6.0,18.0,92.0,,"Police Station, Medak, Patencheru",,2012-09-11
748.0,11/9/2013,Andhra Pradesh,Ananthapur,Andhra Pradesh State Pollution Control Board,"Residential, Rural and other Areas",4.0,15.0,60.0,,"Kamalanagar, Ananthapur",,2013-09-11
748.0,12-01-14,Andhra Pradesh,Ananthapur,Andhra Pradesh State Pollution Control Board,"Residential, Rural and other Areas",5.0,11.0,77.0,,"Kamalanagar, Ananthapur",,2014-01-12
389.0,12-01-15,Andhra Pradesh,Tirupati,Andhra Pradesh State Pollution Control Board,Sensitive Area,5.0,11.0,53.0,,"Regional Science Centre, Chittoor Bypass Road, Tirupati",,2015-01-12
566.0,12-02-14,Assam,Daranga,Assam State Pollution Control Board,"Residential, Rural and other Areas",6.0,11.0,46.0,,"Daranga, Baska district, BATAD,Assam near Sandoop Jhankar town of Bhutan",,2014-02-12
193.0,12-02-15,Assam,Guwahati,Assam State Pollution Control Board,"Residential, Rural and other Areas",7.0,14.0,83.0,,"Head Office, Bamunimaidan, Guwahati",,2015-02-12
542.0,12-03-14,Assam,Bongaigaon,Assam State Pollution Control Board,"Residential, Rural and other Areas",7.0,13.0,55.0,,"Campus of Oil India Ltd. PS-6, Bongaigaon, Chirang",,2014-03-12
193.0,12-03-15,Assam,Guwahati,Assam State Pollution Control Board,"Residential, Rural and other Areas",9.0,17.0,168.0,,"Head Office, Bamunimaidan, Guwahati",,2015-03-12
748.0,12-04-14,Andhra Pradesh,Ananthapur,Andhra Pradesh State Pollution Control Board,"Residential, Rural and other Areas",5.0,10.0,68.0,,"Kamalanagar, Ananthapur",,2014-04-12
30.0,12-04-15,Kerala,Kochi,Kerala State Pollution Control Board,Industrial Area,2.0,5.0,10.0,,"Irumpanam, Kochi",,2015-04-12
542.0,12-05-14,Assam,Bongaigaon,Assam State Pollution Control Board,"Residential, Rural and other Areas",6.0,12.0,57.0,,"Campus of Oil India Ltd. PS-6, Bongaigaon, Chirang",,2014-05-12
193.0,12-05-15,Assam,Guwahati,Assam State Pollution Control Board,"Residential, Rural and other Areas",6.0,13.0,95.0,,"Head Office, Bamunimaidan, Guwahati",,2015-05-12
748.0,12-06-14,Andhra Pradesh,Ananthapur,Andhra Pradesh State Pollution Control Board,"Residential, Rural and other Areas",6.0,11.0,76.0,,"Kamalanagar, Ananthapur",,2014-06-12
389.0,12-06-15,Andhra Pradesh,Tirupati,Andhra Pradesh State Pollution Control Board,Sensitive Area,5.0,11.0,73.0,,"Regional Science Centre, Chittoor Bypass Road, Tirupati",,2015-06-12
757.0,12-07-14,Andhra Pradesh,Rajahmundry,Andhra Pradesh State Pollution Control Board,Industrial Area,9.0,17.0,65.0,,"Staff Club Building, M/s A.P. Paper Mill, Rajahmundry",,2014-07-12
389.0,12-07-15,Andhra Pradesh,Tirupati,Andhra Pradesh State Pollution Control Board,Sensitive Area,5.0,11.0,76.0,,"Regional Science Centre, Chittoor Bypass Road, Tirupati",,2015-07-12
566.0,12-08-14,Assam,Daranga,Assam State Pollution Control Board,"Residential, Rural and other Areas",6.0,13.0,48.0,,"Daranga, Baska district, BATAD,Assam near Sandoop Jhankar town of Bhutan",,2014-08-12
389.0,12-08-15,Andhra Pradesh,Tirupati,Andhra Pradesh State Pollution Control Board,Sensitive Area,5.0,12.0,59.0,,"Regional Science Centre, Chittoor Bypass Road, Tirupati",,2015-08-12
748.0,12-09-14,Andhra Pradesh,Ananthapur,Andhra Pradesh State Pollution Control Board,"Residential, Rural and other Areas",7.0,13.0,77.0,,"Kamalanagar, Ananthapur",,2014-09-12
567.0,12-09-15,Assam,Silcher,Assam State Pollution Control Board,"Residential, Rural and other Areas",6.0,12.0,67.0,,"Office building of RLO, near Ithkola Market, Ghaniwala road",,2015-09-12
757.0,12-10-14,Andhra Pradesh,Rajahmundry,Andhra Pradesh State Pollution Control Board,Industrial Area,9.0,19.0,60.0,,"Staff Club Building, M/s A.P. Paper Mill, Rajahmundry",,2014-10-12
389.0,12-10-15,Andhra Pradesh,Tirupati,Andhra Pradesh State Pollution Control Board,Sensitive Area,4.0,10.0,57.0,,"Regional Science Centre, Chittoor Bypass Road, Tirupati",,2015-10-12
520.0,12-11-14,Assam,Bongaigaon,Assam State Pollution Control Board,"Residential, Rural and other Areas",7.0,13.0,43.0,,"Barpara Office Building, Bongaigaon",,2014-11-12
193.0,12-11-15,Assam,Guwahati,Assam State Pollution Control Board,"Residential, Rural and other Areas",10.0,13.0,101.0,,"Head Office, Bamunimaidan, Guwahati",,2015-11-12
748.0,12-12-14,Andhra Pradesh,Ananthapur,Andhra Pradesh State Pollution Control Board,"Residential, Rural and other Areas",7.0,12.0,73.0,,"Kamalanagar, Ananthapur",,2014-12-12
567.0,12-12-15,Assam,Silcher,Assam State Pollution Control Board,"Residential, Rural and other Areas",8.0,18.0,99.0,,"Office building of RLO, near Ithkola Market, Ghaniwala road",,2015-12-12
44.0,12/1/1987,Bihar,Dhanbad,Bihar Pollution Control Board,Residential,13.7,13.2,,175.0,,,1987-01-12
44.0,12/1/1988,Bihar,Dhanbad,Bihar Pollution Control Board,"Residential, Rural and other Areas",14.4,21.7,,226.0,,,1988-01-12
166.0,12/1/2003,Maharashtra,Nagpur,,"Residential, Rural and other Areas",4.0,45.0,,193.0,,,2003-01-12
233.0,12/1/2004,Andhra Pradesh,Visakhapatnam,Andhra Pradesh State Pollution Control Board,Industrial Area,11.0,31.0,89.0,140.0,"Industrial Estate, Marripalem, Visakhapatnam",,2004-01-12
,12/1/2005,Andhra Pradesh,Hyderabad,,Industrial Areas,7.2,27.7,77.0,126.0,Nacharam,,2005-01-12
,12/1/2006,Andhra Pradesh,Hyderabad,,Residential and others,4.0,15.1,91.0,188.0,Mourya Inn,,2006-01-12
,12/1/2007,Andhra Pradesh,Visakhapatnam,,Industrial Areas,10.3,30.9,138.0,294.0,Industrial Estate,,2007-01-12
,12/1/2008,Andhra Pradesh,Visakhapatnam,,Industrial Areas,10.8,26.1,82.0,178.0,Industrial Estate,,2008-01-12
,12/1/2009,Assam,Guwahati,,Residential and others,8.3,17.0,134.0,224.0,Gopinath Nagar,,2009-01-12
583.0,12/1/2010,Andhra Pradesh,Guntur,Andhra Pradesh State Pollution Control Board,"Residential, Rural and other Areas",2.0,11.0,73.0,,"Near Hindu College, Market Road, Guntur",,2010-01-12
464.0,12/1/2011,Chandigarh,Chandigarh,Chandigarh Pollution Control Committee,"Residential, Rural and other Areas",2.0,10.6,182.0,287.0,"Kaimbwala Village, Chandigarh",,2011-01-12
233.0,12/1/2012,Andhra Pradesh,Visakhapatnam,Andhra Pradesh State Pollution Control Board,Industrial Area,5.0,9.0,37.0,,"Industrial Estate, Marripalem, Visakhapatnam",,2012-01-12
751.0,12/1/2013,Andhra Pradesh,Srikakulam,Andhra Pradesh State Pollution Control Board,Industrial Area,15.0,21.0,84.0,,"IDA, Pydibheemavaram, Srikakulam",,2013-01-12
56,12/10/2003,Delhi,Delhi,Central Pollution Control Board,Industrial Area,9.0,43.0,163.0,335.0,,,2003-10-12
203.0,12/10/2004,Andhra Pradesh,Hyderabad,Andhra Pradesh State Pollution Control Board,Industrial Area,4.2,28.8,163.7,325.0,"Uppal, Modern Foods & Industries IDA, Hyderabad",,2004-10-12
,12/10/2005,Andhra Pradesh,Hyderabad,,Residential and others,5.2,28.0,138.0,343.0,Charminar,,2005-10-12
,12/10/2006,Andhra Pradesh,Hyderabad,,Sensitive Areas,4.6,12.7,81.0,154.0,Zoo Park,,2006-10-12
,12/10/2007,Andhra Pradesh,Hyderabad,,Industrial Areas,5.5,37.3,133.0,345.0,C.I.T.D. Balanagar,,2007-10-12
,12/10/2008,Andhra Pradesh,Hyderabad,,Industrial Areas,5.0,28.2,96.0,279.0,C.I.T.D. Balanagar,,2008-10-12
,12/10/2009,Andhra Pradesh,Hyderabad,,Industrial Areas,5.2,29.5,111.0,311.0,C.I.T.D. Balanagar,,2009-10-12
150.0,12/10/2010,Andhra Pradesh,Hyderabad,National Environmental Engineering Research Institute,"Residential, Rural and other Areas",3.0,12.0,22.0,,"Tarnaka, NEERI Lab. IICT Campus, Hyderabad",,2010-10-12
245.0,12/10/2011,Chhattisgarh,Bhilai,Chattisgarh Environment Conservation Board,Industrial Area,12.0,33.0,166.0,,"M.P. Laghu Udyog Nigam, Bhilai",,2011-10-12
233.0,12/10/2012,Andhra Pradesh,Visakhapatnam,Andhra Pradesh State Pollution Control Board,Industrial Area,14.0,14.0,127.0,,"Industrial Estate, Marripalem, Visakhapatnam",,2012-10-12
751.0,12/10/2013,Andhra Pradesh,Srikakulam,Andhra Pradesh State Pollution Control Board,Industrial Area,17.0,19.0,63.0,,"IDA, Pydibheemavaram, Srikakulam",,2013-10-12
55,12/11/2003,Delhi,Delhi,Central Pollution Control Board,Industrial Area,12.0,50.0,189.0,429.0,,,2003-11-12
106.0,12/11/2004,Chandigarh,Chandigarh,Chandigarh Pollution Control Committee,Industrial Area,22.0,52.0,139.0,276.0,"Modern Foods, Industrial Area, Chandigarh",,2004-11-12
,12/11/2005,Andhra Pradesh,Hyderabad,,Industrial Areas,4.6,31.9,102.0,281.0,C.I.T.D. Balanagar,,2005-11-12
,12/11/2006,Andhra Pradesh,Hyderabad,,Industrial Areas,5.5,32.0,115.0,329.0,C.I.T.D. Balanagar,,2006-11-12
,12/11/2007,Andhra Pradesh,Hyderabad,,Industrial Areas,2.8,13.6,66.0,107.0,Nacharam,,2007-11-12
,12/11/2008,Andhra Pradesh,Hyderabad,,Residential and others,5.2,27.8,112.0,323.0,Charminar,,2008-11-12
,12/11/2009,Andhra Pradesh,Hyderabad,,Industrial Areas,4.8,16.8,96.0,178.0,Nacharam,,2009-11-12
581.0,12/11/2010,Andhra Pradesh,Khammam,Andhra Pradesh State Pollution Control Board,"Residential, Rural and other Areas",2.0,11.0,56.0,,"CER Club,S.C.C.L. township, writter basti, Kothagudem, Khammam Dist.",,2010-11-12
95.0,12/11/2011,Andhra Pradesh,Hyderabad,Andhra Pradesh State Pollution Control Board,Industrial Area,5.0,108.0,145.0,286.0,"C.I.T.D., Balanagar, Plot no. A1 to A8, IDA, Hyderabad",,2011-11-12
583.0,12/11/2012,Andhra Pradesh,Guntur,Andhra Pradesh State Pollution Control Board,"Residential, Rural and other Areas",5.0,16.0,76.0,,"Near Hindu College, Market Road, Guntur",,2012-11-12
520.0,12/11/2013,Assam,Bongaigaon,Assam State Pollution Control Board,"Residential, Rural and other Areas",9.0,17.0,63.0,,"Barpara Office Building, Bongaigaon",,2013-11-12
58,12/12/2003,Delhi,Delhi,Central Pollution Control Board,Industrial Area,11.0,35.0,107.0,334.0,,,2003-12-12
210.0,12/12/2004,Bihar,Patna,Bihar Sate Pollution Control Board,"Residential, Rural and other Areas",12.0,25.0,72.0,134.0,"Beltron Bhawan, Shastri Nagar, Patna",,2004-12-12
,12/12/2005,Assam,Guwahati,,Residential and others,5.5,34.3,77.0,193.0,Fire Brigade Station,,2005-12-12
,12/12/2006,Andhra Pradesh,Hyderabad,,Residential and others,5.2,28.7,102.0,308.0,Charminar,,2006-12-12
,12/12/2007,Andhra Pradesh,Hyderabad,,Industrial Areas,5.2,33.3,124.0,334.0,C.I.T.D. Balanagar,,2007-12-12
,12/12/2008,Andhra Pradesh,Hyderabad,,Industrial Areas,5.2,29.2,107.0,306.0,C.I.T.D. Balanagar,,2008-12-12
,12/12/2009,Chandigarh,Chandigarh,,Residential and others,,13.3,26.0,67.0,Kaimbwala Village,,2009-12-12
577.0,12/12/2010,Andhra Pradesh,Nalgonda,Andhra Pradesh State Pollution Control Board,"Residential, Rural and other Areas",5.0,20.0,80.0,,"Beside Regional Office, APPCB Nalgonda",,2010-12-12
150.0,12/12/2011,Andhra Pradesh,Hyderabad,National Environmental Engineering Research Institute,"Residential, Rural and other Areas",3.0,41.0,7.0,,"Tarnaka, NEERI Lab. IICT Campus, Hyderabad",,2011-12-12
520.0,12/12/2012,Assam,Bongaigaon,Assam State Pollution Control Board,"Residential, Rural and other Areas",6.3,13.5,35.0,,"Barpara Office Building, Bongaigaon",,2012-12-12
748.0,12/12/2013,Andhra Pradesh,Ananthapur,Andhra Pradesh State Pollution Control Board,"Residential, Rural and other Areas",4.0,9.0,73.0,,"Kamalanagar, Ananthapur",,2013-12-12
36,12/2/1987,Goa,Ponda,Goa Pollution Control Board,,2.3,9.4,,59.0,,,1987-02-12
55,12/2/1988,Delhi,Delhi,Central Pollution Control Board,Industrial Area,,,,459.0,,,1988-02-12
60,12/2/2003,Delhi,Delhi,Central Pollution Control Board,"Residential, Rural and other Areas",8.0,27.0,93.0,285.0,,,2003-02-12
393.0,12/2/2004,Andhra Pradesh,Hyderabad,Andhra Pradesh State Pollution Control Board,"Residential, Rural and other Areas",2.7,37.1,127.3,358.7,"Paradise, Hyderabad",,2004-02-12
,12/2/2005,Andhra Pradesh,Hyderabad,,Industrial Areas,5.0,36.1,124.0,322.0,C.I.T.D. Balanagar,,2005-02-12
,12/2/2006,Andhra Pradesh,Hyderabad,,Industrial Areas,5.5,34.1,130.0,303.0,C.I.T.D. Balanagar,,2006-02-12
,12/2/2007,Andhra Pradesh,Hyderabad,,Industrial Areas,5.7,36.3,124.0,322.0,Uppal,,2007-02-12
,12/2/2008,Andhra Pradesh,Hyderabad,,Industrial Areas,5.0,28.8,109.0,309.0,C.I.T.D. Balanagar,,2008-02-12
,12/2/2009,Andhra Pradesh,Hyderabad,,Industrial Areas,4.6,26.5,101.0,303.0,C.I.T.D. Balanagar,,2009-02-12
582.0,12/2/2010,Andhra Pradesh,Chittoor,Andhra Pradesh State Pollution Control Board,Sensitive Area,4.0,9.0,34.0,,"GNC Toll Gate Tirumala , Chittoor Dist.",,2010-02-12
95.0,12/2/2011,Andhra Pradesh,Hyderabad,Andhra Pradesh State Pollution Control Board,Industrial Area,5.0,41.0,198.0,341.0,"C.I.T.D., Balanagar, Plot no. A1 to A8, IDA, Hyderabad",,2011-02-12
234.0,12/2/2012,Andhra Pradesh,Visakhapatnam,Andhra Pradesh State Pollution Control Board,"Residential, Rural and other Areas",4.0,9.0,20.0,,"Panchayat Raj office, Mindi, Visakhapatnam",,2012-02-12
587.0,12/2/2013,Assam,Lakhimpur,Assam State Pollution Control Board,"Residential, Rural and other Areas",6.0,14.0,107.0,,"Bazar Patti, North Lakhimpur Town,Lakhimpur, Assam",,2013-02-12
45.0,12/3/1987,Bihar,Jharia,Bihar Pollution Control Board,Industrial,31.7,21.6,,649.0,,,1987-03-12
46.0,12/3/1988,Bihar,Sindri,Bihar Pollution Control Board,Industrial Area,31.9,30.5,,381.0,,,1988-03-12
55,12/3/2003,Delhi,Delhi,Central Pollution Control Board,Industrial Area,14.0,45.0,197.0,576.0,,,2003-03-12
95.0,12/3/2004,Andhra Pradesh,Hyderabad,Andhra Pradesh State Pollution Control Board,Industrial Area,3.9,33.1,150.0,337.3,"C.I.T.D., Balanagar, Plot no. A1 to A8, IDA, Hyderabad",,2004-03-12
,12/3/2005,Andhra Pradesh,Hyderabad,,Industrial Areas,5.8,29.0,87.0,247.0,Uppal,,2005-03-12
,12/3/2006,Andhra Pradesh,Hyderabad,,Residential and others,4.9,26.2,120.0,336.0,Charminar,,2006-03-12
,12/3/2007,Andhra Pradesh,Hyderabad,,Residential and others,5.2,31.2,113.0,322.0,Charminar,,2007-03-12
,12/3/2008,Andhra Pradesh,Hyderabad,,Industrial Areas,3.1,13.0,83.0,127.0,Nacharam,,2008-03-12
,12/3/2009,Andhra Pradesh,Hyderabad,,Industrial Areas,3.5,14.7,49.0,162.0,Nacharam,,2009-03-12
389.0,12/3/2010,Andhra Pradesh,Tirupati,Andhra Pradesh State Pollution Control Board,Sensitive Area,4.0,9.0,50.0,,"Regional Science Centre, Chittoor Bypass Road, Tirupati",,2010-03-12
106.0,12/3/2011,Chandigarh,Chandigarh,Chandigarh Pollution Control Committee,Industrial Area,2.0,15.3,114.0,249.0,"Modern Foods, Industrial Area, Chandigarh",,2011-03-12
583.0,12/3/2012,Andhra Pradesh,Guntur,Andhra Pradesh State Pollution Control Board,"Residential, Rural and other Areas",5.0,15.0,75.0,,"Near Hindu College, Market Road, Guntur",,2012-03-12
748.0,12/3/2013,Andhra Pradesh,Ananthapur,Andhra Pradesh State Pollution Control Board,"Residential, Rural and other Areas",4.0,9.0,70.0,,"Kamalanagar, Ananthapur",,2013-03-12
46.0,12/4/1987,Bihar,Sindri,Bihar Pollution Control Board,Industrial,16.3,16.5,,341.0,,,1987-04-12
58,12/4/2003,Delhi,Delhi,Central Pollution Control Board,Industrial Area,,,211.0,,,,2003-04-12
233.0,12/4/2004,Andhra Pradesh,Visakhapatnam,Andhra Pradesh State Pollution Control Board,Industrial Area,10.0,31.0,109.0,166.0,"Industrial Estate, Marripalem, Visakhapatnam",,2004-04-12
,12/4/2005,Maharashtra,Thane,,Residential and others,5.5,10.8,,,Naupada,,2005-04-12
,12/4/2006,Andhra Pradesh,Hyderabad,,Residential and others,4.0,15.1,76.0,169.0,Mourya Inn,,2006-04-12
,12/4/2007,Andhra Pradesh,Hyderabad,,Industrial Areas,4.2,16.0,66.0,115.0,Nacharam,,2007-04-12
,12/4/2008,Andhra Pradesh,Hyderabad,,Industrial Areas,5.0,28.7,111.0,318.0,C.I.T.D. Balanagar,,2008-04-12
,12/4/2009,Andhra Pradesh,Hyderabad,,Industrial Areas,5.5,30.1,94.0,291.0,C.I.T.D. Balanagar,,2009-04-12
582.0,12/4/2010,Andhra Pradesh,Chittoor,Andhra Pradesh State Pollution Control Board,Sensitive Area,4.0,9.0,30.0,,"GNC Toll Gate Tirumala , Chittoor Dist.",,2010-04-12
150.0,12/4/2011,Andhra Pradesh,Hyderabad,National Environmental Engineering Research Institute,"Residential, Rural and other Areas",3.0,36.0,16.0,,"Tarnaka, NEERI Lab. IICT Campus, Hyderabad",,2011-04-12
233.0,12/4/2012,Andhra Pradesh,Visakhapatnam,Andhra Pradesh State Pollution Control Board,Industrial Area,4.0,9.0,91.0,,"Industrial Estate, Marripalem, Visakhapatnam",,2012-04-12
751.0,12/4/2013,Andhra Pradesh,Srikakulam,Andhra Pradesh State Pollution Control Board,Industrial Area,19.0,28.0,66.0,,"IDA, Pydibheemavaram, Srikakulam",,2013-04-12
61.0,12/5/1988,Punjab,Ludhiana,Punjab Pollution Control Board,Industrial Area,0.5,20.5,,339.0,,,1988-05-12
56,12/5/2003,Delhi,Delhi,Central Pollution Control Board,Industrial Area,10.0,49.0,207.0,461.0,,,2003-05-12
210.0,12/5/2004,Bihar,Patna,Bihar Sate Pollution Control Board,"Residential, Rural and other Areas",11.0,22.0,90.0,159.0,"Beltron Bhawan, Shastri Nagar, Patna",,2004-05-12
,12/5/2005,Andhra Pradesh,Hyderabad,,Industrial Areas,2.5,19.5,87.0,125.0,Nacharam,,2005-05-12
,12/5/2006,Andhra Pradesh,Hyderabad,,Industrial Areas,5.6,35.9,121.0,283.0,C.I.T.D. Balanagar,,2006-05-12
,12/5/2007,Andhra Pradesh,Hyderabad,,Residential and others,5.4,33.8,129.0,353.0,Charminar,,2007-05-12
,12/5/2008,Andhra Pradesh,Hyderabad,,Residential and others,5.3,28.5,111.0,315.0,Paradise,,2008-05-12
,12/5/2009,Andhra Pradesh,Hyderabad,,Residential and others,5.0,28.7,112.0,319.0,Charminar,,2009-05-12
155,12/5/2010,Gujarat,Ahmedabad,National Environmental Engineering Research Institute,"Residential, Rural and other Areas",16.0,19.0,74.0,,"R.C. High School, Mirzapur, Ahmadabad",,2010-05-12
95.0,12/5/2011,Andhra Pradesh,Hyderabad,Andhra Pradesh State Pollution Control Board,Industrial Area,5.0,43.0,186.0,341.0,"C.I.T.D., Balanagar, Plot no. A1 to A8, IDA, Hyderabad",,2011-05-12
578.0,12/5/2012,Andhra Pradesh,Kakinada,Andhra Pradesh State Pollution Control Board,"Residential, Rural and other Areas",,,58.0,,"Top of the Office Building Ramanayyapeta, Kakinada",,2012-05-12
520.0,12/5/2013,Assam,Bongaigaon,Assam State Pollution Control Board,"Residential, Rural and other Areas",6.0,15.0,55.0,,"Barpara Office Building, Bongaigaon",,2013-05-12
82.0,12/6/1988,Madhya Pradesh,Nagda,Madhya Pradesh  Pollution Control Board,Industrial Area,6.3,9.3,,95.0,,,1988-06-12
144,12/6/2003,Delhi,Delhi,,"Residential, Rural and other Areas",6.0,64.0,,505.0,,,2003-06-12
95.0,12/6/2004,Andhra Pradesh,Hyderabad,Andhra Pradesh State Pollution Control Board,Industrial Area,4.2,30.5,136.7,277.7,"C.I.T.D., Balanagar, Plot no. A1 to A8, IDA, Hyderabad",,2004-06-12
,12/6/2005,Andhra Pradesh,Hyderabad,,Industrial Areas,5.9,41.7,98.0,311.0,C.I.T.D. Balanagar,,2005-06-12
,12/6/2006,Andhra Pradesh,Hyderabad,,Residential and others,5.0,37.4,103.0,270.0,Charminar,,2006-06-12
,12/6/2007,Andhra Pradesh,Hyderabad,,Industrial Areas,5.3,36.7,122.0,313.0,C.I.T.D. Balanagar,,2007-06-12
,12/6/2008,Andhra Pradesh,Tirupati,,Sensitive Areas,4.0,9.0,33.0,128.0,Reg.Science Centre,,2008-06-12
,12/6/2009,Gujarat,Ahmedabad,,Residential and others,20.0,24.8,84.0,176.0,R.C. High School,,2009-06-12
582.0,12/6/2010,Andhra Pradesh,Chittoor,Andhra Pradesh State Pollution Control Board,Sensitive Area,4.0,9.0,,,"GNC Toll Gate Tirumala , Chittoor Dist.",,2010-06-12
464.0,12/6/2011,Chandigarh,Chandigarh,Chandigarh Pollution Control Committee,"Residential, Rural and other Areas",2.0,30.5,100.0,200.0,"Kaimbwala Village, Chandigarh",,2011-06-12
583.0,12/6/2012,Andhra Pradesh,Guntur,Andhra Pradesh State Pollution Control Board,"Residential, Rural and other Areas",5.0,15.0,77.0,,"Near Hindu College, Market Road, Guntur",,2012-06-12
748.0,12/6/2013,Andhra Pradesh,Ananthapur,Andhra Pradesh State Pollution Control Board,"Residential, Rural and other Areas",4.0,9.0,84.0,,"Kamalanagar, Ananthapur",,2013-06-12
22,12/7/1987,Gujarat,Surat,Gujarat Pollution Control Board,Industrial,21.9,27.8,,255.0,,,1987-07-12
31.0,12/7/1988,Kerala,Cochin,Kerala Pollution Control Board,Industrial Area,,,,127.0,,,1988-07-12
144,12/7/2003,Delhi,Delhi,,"Residential, Rural and other Areas",8.0,77.0,,613.0,,,2003-07-12
365.0,12/7/2004,Andhra Pradesh,Hyderabad,Andhra Pradesh State Pollution Control Board,"Residential, Rural and other Areas",2.4,18.6,120.7,245.3,Jublee Hills Hyderabad,,2004-07-12
,12/7/2005,Andhra Pradesh,Hyderabad,,Residential and others,5.1,30.6,126.0,296.0,Charminar,,2005-07-12
,12/7/2006,Andhra Pradesh,Hyderabad,,Residential and others,4.0,14.5,87.0,192.0,Mourya Inn,,2006-07-12
,12/7/2007,Andhra Pradesh,Hyderabad,,Industrial Areas,3.4,14.5,78.0,115.0,Nacharam,,2007-07-12
,12/7/2008,Andhra Pradesh,Hyderabad,,Industrial Areas,3.5,16.9,76.0,124.0,Nacharam,,2008-07-12
,12/7/2009,Assam,Guwahati,,Residential and others,9.3,16.3,212.0,263.0,Gopinath Nagar,,2009-07-12
150.0,12/7/2010,Andhra Pradesh,Hyderabad,National Environmental Engineering Research Institute,"Residential, Rural and other Areas",2.0,10.0,13.0,,"Tarnaka, NEERI Lab. IICT Campus, Hyderabad",,2010-07-12
150.0,12/7/2011,Andhra Pradesh,Hyderabad,National Environmental Engineering Research Institute,"Residential, Rural and other Areas",3.0,39.0,18.0,,"Tarnaka, NEERI Lab. IICT Campus, Hyderabad",,2011-07-12
233.0,12/7/2012,Andhra Pradesh,Visakhapatnam,Andhra Pradesh State Pollution Control Board,Industrial Area,6.0,10.0,105.0,,"Industrial Estate, Marripalem, Visakhapatnam",,2012-07-12
751.0,12/7/2013,Andhra Pradesh,Srikakulam,Andhra Pradesh State Pollution Control Board,Industrial Area,20.0,22.0,71.0,,"IDA, Pydibheemavaram, Srikakulam",,2013-07-12
77.0,12/8/1988,Karnataka,Bangalore,Karnataka Pollution Control Board,Industrial Area,22.2,4.5,,547.0,,,1988-08-12
55,12/8/2003,Delhi,Delhi,Central Pollution Control Board,Industrial Area,14.0,46.0,198.0,365.0,,,2003-08-12
95.0,12/8/2004,Andhra Pradesh,Hyderabad,Andhra Pradesh State Pollution Control Board,Industrial Area,4.4,35.1,133.7,362.3,"C.I.T.D., Balanagar, Plot no. A1 to A8, IDA, Hyderabad",,2004-08-12
,12/8/2005,Andhra Pradesh,Hyderabad,,Industrial Areas,4.6,60.0,136.0,348.0,C.I.T.D. Balanagar,,2005-08-12
,12/8/2006,Andhra Pradesh,Hyderabad,,Industrial Areas,6.2,31.1,187.0,448.0,C.I.T.D. Balanagar,,2006-08-12
,12/8/2007,Andhra Pradesh,Hyderabad,,Industrial Areas,5.3,37.7,131.0,356.0,C.I.T.D. Balanagar,,2007-08-12
,12/8/2008,Andhra Pradesh,Hyderabad,,Industrial Areas,5.1,26.7,101.0,289.0,Uppal,,2008-08-12
,12/8/2009,Andhra Pradesh,Hyderabad,,Industrial Areas,4.8,26.7,95.0,265.0,C.I.T.D. Balanagar,,2009-08-12
582.0,12/8/2010,Andhra Pradesh,Chittoor,Andhra Pradesh State Pollution Control Board,Sensitive Area,4.0,9.0,36.0,,"GNC Toll Gate Tirumala , Chittoor Dist.",,2010-08-12
95.0,12/8/2011,Andhra Pradesh,Hyderabad,Andhra Pradesh State Pollution Control Board,Industrial Area,5.0,40.0,146.0,332.0,"C.I.T.D., Balanagar, Plot no. A1 to A8, IDA, Hyderabad",,2011-08-12
234.0,12/8/2012,Andhra Pradesh,Visakhapatnam,Andhra Pradesh State Pollution Control Board,"Residential, Rural and other Areas",4.0,9.0,50.0,,"Panchayat Raj office, Mindi, Visakhapatnam",,2012-08-12
539.0,12/8/2013,Assam,Golaghat,Assam State Pollution Control Board,"Residential, Rural and other Areas",7.0,15.0,66.0,,"Golaghat Office Building, Golaghat",,2013-08-12
58,12/9/2003,Delhi,Delhi,Central Pollution Control Board,Industrial Area,12.0,32.0,127.0,,,,2003-09-12
393.0,12/9/2004,Andhra Pradesh,Hyderabad,Andhra Pradesh State Pollution Control Board,"Residential, Rural and other Areas",3.3,34.3,182.0,410.3,"Paradise, Hyderabad",,2004-09-12
,12/9/2005,Andhra Pradesh,Hyderabad,,Industrial Areas,6.5,16.4,64.0,122.0,Nacharam,,2005-09-12
,12/9/2006,Andhra Pradesh,Hyderabad,,Residential and others,4.8,28.2,108.0,328.0,Charminar,,2006-09-12
,12/9/2007,Andhra Pradesh,Hyderabad,,Residential and others,5.2,31.8,129.0,349.0,Charminar,,2007-09-12
,12/9/2008,Andhra Pradesh,Hyderabad,,Residential and others,5.1,26.2,106.0,314.0,Charminar,,2008-09-12
,12/9/2009,Andhra Pradesh,Hyderabad,,Residential and others,4.9,27.3,111.0,316.0,Charminar,,2009-09-12
583.0,12/9/2010,Andhra Pradesh,Guntur,Andhra Pradesh State Pollution Control Board,"Residential, Rural and other Areas",2.0,11.0,77.0,,"Near Hindu College, Market Road, Guntur",,2010-09-12
65.0,12/9/2011,Chhattisgarh,Bhilai,Chattisgarh Environment Conservation Board,"Residential, Rural and other Areas",9.75,22.75,94.14,,"Visak Hostel, Sector-4, Bhilai",,2011-09-12
482,12/9/2012,Jammu & Kashmir,Jammu,Jammu & Kashmir State Pollution Control Board,"Residential, Rural and other Areas",2.0,20.0,109.0,,"M.A. Stadium, Jewel Chowk, Jammu",,2012-09-12
748.0,12/9/2013,Andhra Pradesh,Ananthapur,Andhra Pradesh State Pollution Control Board,"Residential, Rural and other Areas",4.0,9.0,79.0,,"Kamalanagar, Ananthapur",,2013-09-12
56,13-01-03,Delhi,Delhi,Central Pollution Control Board,Industrial Area,,,248.0,412.0,,,2003-01-13
233.0,13-01-04,Andhra Pradesh,Visakhapatnam,Andhra Pradesh State Pollution Control Board,Industrial Area,5.0,24.0,75.0,118.0,"Industrial Estate, Marripalem, Visakhapatnam",,2004-01-13
,13-01-05,Andhra Pradesh,Hyderabad,,Residential and others,4.6,33.6,120.0,359.0,Paradise,,2005-01-13
,13-01-07,Andhra Pradesh,Hyderabad,,Industrial Areas,5.6,34.5,128.0,314.0,Uppal,,2007-01-13
465.0,13-01-10,Andhra Pradesh,Ramagundam,Andhra Pradesh State Pollution Control Board,"Residential, Rural and other Areas",9.0,50.0,47.0,,"RTC Bus Depot, Karim Nagar, Ramagundam",,2010-01-13
751.0,13-01-13,Andhra Pradesh,Srikakulam,Andhra Pradesh State Pollution Control Board,Industrial Area,2.0,5.0,212.0,,"IDA, Pydibheemavaram, Srikakulam",,2013-01-13
520.0,13-01-14,Assam,Bongaigaon,Assam State Pollution Control Board,"Residential, Rural and other Areas",6.0,14.0,46.0,,"Barpara Office Building, Bongaigaon",,2014-01-13
233.0,13-01-15,Andhra Pradesh,Visakhapatnam,Andhra Pradesh State Pollution Control Board,Industrial Area,9.0,23.0,35.0,,"Industrial Estate, Marripalem, Visakhapatnam",,2015-01-13
56,13-02-03,Delhi,Delhi,Central Pollution Control Board,Industrial Area,7.0,34.0,121.0,377.0,,,2003-02-13
95.0,13-02-04,Andhra Pradesh,Hyderabad,Andhra Pradesh State Pollution Control Board,Industrial Area,5.0,80.1,144.7,305.3,"C.I.T.D., Balanagar, Plot no. A1 to A8, IDA, Hyderabad",,2004-02-13
,13-02-05,Andhra Pradesh,Hyderabad,,Industrial Areas,8.2,26.5,53.0,121.0,Nacharam,,2005-02-13
,13-02-07,Andhra Pradesh,Hyderabad,,Industrial Areas,6.1,16.0,52.0,159.0,Nacharam,,2007-02-13
581.0,13-02-10,Andhra Pradesh,Khammam,Andhra Pradesh State Pollution Control Board,"Residential, Rural and other Areas",2.0,11.0,70.0,,"CER Club,S.C.C.L. township, writter basti, Kothagudem, Khammam Dist.",,2010-02-13
751.0,13-02-13,Andhra Pradesh,Srikakulam,Andhra Pradesh State Pollution Control Board,Industrial Area,3.0,5.0,17.0,,"IDA, Pydibheemavaram, Srikakulam",,2013-02-13
757.0,13-02-14,Andhra Pradesh,Rajahmundry,Andhra Pradesh State Pollution Control Board,Industrial Area,11.0,17.0,70.0,,"Staff Club Building, M/s A.P. Paper Mill, Rajahmundry",,2014-02-13
233.0,13-02-15,Andhra Pradesh,Visakhapatnam,Andhra Pradesh State Pollution Control Board,Industrial Area,8.0,13.0,70.0,,"Industrial Estate, Marripalem, Visakhapatnam",,2015-02-13
55,13-03-03,Delhi,Delhi,Central Pollution Control Board,Industrial Area,11.0,38.0,170.0,264.0,,,2003-03-13
22,13-03-04,Gujarat,Surat,Gujarat State Pollution Control Board,Industrial Area,26.0,36.0,127.0,156.0,"B.R.C. High School, Udhna, Surat",,2004-03-13
,13-03-05,Andhra Pradesh,Hyderabad,,Industrial Areas,5.0,40.5,107.0,416.0,C.I.T.D. Balanagar,,2005-03-13
,13-03-07,Andhra Pradesh,Hyderabad,,Industrial Areas,3.5,,42.0,114.0,Nacharam,,2007-03-13
582.0,13-03-10,Andhra Pradesh,Chittoor,Andhra Pradesh State Pollution Control Board,Sensitive Area,4.0,9.0,43.0,,"GNC Toll Gate Tirumala , Chittoor Dist.",,2010-03-13
751.0,13-03-13,Andhra Pradesh,Srikakulam,Andhra Pradesh State Pollution Control Board,Industrial Area,2.0,5.0,55.0,,"IDA, Pydibheemavaram, Srikakulam",,2013-03-13
757.0,13-03-14,Andhra Pradesh,Rajahmundry,Andhra Pradesh State Pollution Control Board,Industrial Area,11.0,20.0,56.0,,"Staff Club Building, M/s A.P. Paper Mill, Rajahmundry",,2014-03-13
233.0,13-03-15,Andhra Pradesh,Visakhapatnam,Andhra Pradesh State Pollution Control Board,Industrial Area,9.0,14.0,94.0,,"Industrial Estate, Marripalem, Visakhapatnam",,2015-03-13
95.0,13-04-04,Andhra Pradesh,Hyderabad,Andhra Pradesh State Pollution Control Board,Industrial Area,5.6,56.4,72.7,306.3,"C.I.T.D., Balanagar, Plot no. A1 to A8, IDA, Hyderabad",,2004-04-13
,13-04-05,Andhra Pradesh,Hyderabad,,Industrial Areas,4.3,13.0,23.0,102.0,Nacharam,,2005-04-13
,13-04-07,Andhra Pradesh,Visakhapatnam,,Industrial Areas,7.9,27.7,85.0,175.0,Industrial Estate,,2007-04-13
583.0,13-04-10,Andhra Pradesh,Guntur,Andhra Pradesh State Pollution Control Board,"Residential, Rural and other Areas",2.0,11.0,86.0,,"Near Hindu College, Market Road, Guntur",,2010-04-13
751.0,13-04-13,Andhra Pradesh,Srikakulam,Andhra Pradesh State Pollution Control Board,Industrial Area,5.0,9.0,75.0,,"IDA, Pydibheemavaram, Srikakulam",,2013-04-13
757.0,13-04-14,Andhra Pradesh,Rajahmundry,Andhra Pradesh State Pollution Control Board,Industrial Area,13.0,12.0,61.0,,"Staff Club Building, M/s A.P. Paper Mill, Rajahmundry",,2014-04-13
233.0,13-04-15,Andhra Pradesh,Visakhapatnam,Andhra Pradesh State Pollution Control Board,Industrial Area,7.0,11.0,30.0,,"Industrial Estate, Marripalem, Visakhapatnam",,2015-04-13
45.0,13-04-87,Bihar,Jharia,Bihar Pollution Control Board,Industrial,41.7,48.6,,621.0,,,1987-04-13
35,13-04-88,Himachal Pradesh,Shimla,Himachal Pradesh  Pollution Control Boar,"Residential, Rural and other Areas",,,,362.0,,,1988-04-13
55,13-05-03,Delhi,Delhi,Central Pollution Control Board,Industrial Area,11.0,47.0,170.0,533.0,,,2003-05-13
203.0,13-05-04,Andhra Pradesh,Hyderabad,Andhra Pradesh State Pollution Control Board,Industrial Area,4.6,37.7,83.3,231.3,"Uppal, Modern Foods & Industries IDA, Hyderabad",,2004-05-13
,13-05-05,Andhra Pradesh,Hyderabad,,Industrial Areas,4.6,24.6,100.0,351.0,C.I.T.D. Balanagar,,2005-05-13
,13-05-07,Andhra Pradesh,Hyderabad,,Residential and others,10.0,15.0,65.0,165.0,ABIDS Circle,,2007-05-13
582.0,13-05-10,Andhra Pradesh,Chittoor,Andhra Pradesh State Pollution Control Board,Sensitive Area,4.0,9.0,37.0,,"GNC Toll Gate Tirumala , Chittoor Dist.",,2010-05-13
748.0,13-05-13,Andhra Pradesh,Ananthapur,Andhra Pradesh State Pollution Control Board,"Residential, Rural and other Areas",4.0,15.0,60.0,,"Kamalanagar, Ananthapur",,2013-05-13
757.0,13-05-14,Andhra Pradesh,Rajahmundry,Andhra Pradesh State Pollution Control Board,Industrial Area,13.0,12.0,61.0,,"Staff Club Building, M/s A.P. Paper Mill, Rajahmundry",,2014-05-13
233.0,13-05-15,Andhra Pradesh,Visakhapatnam,Andhra Pradesh State Pollution Control Board,Industrial Area,5.0,12.0,76.0,,"Industrial Estate, Marripalem, Visakhapatnam",,2015-05-13
56,13-06-03,Delhi,Delhi,Central Pollution Control Board,Industrial Area,5.0,30.0,225.0,396.0,,,2003-06-13
233.0,13-06-04,Andhra Pradesh,Visakhapatnam,Andhra Pradesh State Pollution Control Board,Industrial Area,10.0,30.0,75.0,118.0,"Industrial Estate, Marripalem, Visakhapatnam",,2004-06-13
,13-06-05,Assam,Guwahati,,Residential and others,4.0,12.4,86.0,136.0,Fire Brigade Station,,2005-06-13
,13-06-07,Andhra Pradesh,Hyderabad,,Industrial Areas,,,43.0,113.0,Nacharam,,2007-06-13
581.0,13-06-10,Andhra Pradesh,Khammam,Andhra Pradesh State Pollution Control Board,"Residential, Rural and other Areas",2.0,12.0,56.0,,"CER Club,S.C.C.L. township, writter basti, Kothagudem, Khammam Dist.",,2010-06-13
748.0,13-06-13,Andhra Pradesh,Ananthapur,Andhra Pradesh State Pollution Control Board,"Residential, Rural and other Areas",4.0,15.0,137.0,,"Kamalanagar, Ananthapur",,2013-06-13
757.0,13-06-14,Andhra Pradesh,Rajahmundry,Andhra Pradesh State Pollution Control Board,Industrial Area,13.0,12.0,61.0,,"Staff Club Building, M/s A.P. Paper Mill, Rajahmundry",,2014-06-13
233.0,13-06-15,Andhra Pradesh,Visakhapatnam,Andhra Pradesh State Pollution Control Board,Industrial Area,11.0,20.0,84.0,,"Industrial Estate, Marripalem, Visakhapatnam",,2015-06-13
233.0,13-07-04,Andhra Pradesh,Visakhapatnam,Andhra Pradesh State Pollution Control Board,Industrial Area,10.0,33.0,67.0,105.0,"Industrial Estate, Marripalem, Visakhapatnam",,2004-07-13
,13-07-05,Assam,Guwahati,,Residential and others,4.0,10.3,69.0,113.0,Fire Brigade Station,,2005-07-13
,13-07-07,Andhra Pradesh,Visakhapatnam,,Industrial Areas,7.9,27.9,85.0,173.0,Industrial Estate,,2007-07-13
583.0,13-07-10,Andhra Pradesh,Guntur,Andhra Pradesh State Pollution Control Board,"Residential, Rural and other Areas",2.0,11.0,84.0,,"Near Hindu College, Market Road, Guntur",,2010-07-13
748.0,13-07-13,Andhra Pradesh,Ananthapur,Andhra Pradesh State Pollution Control Board,"Residential, Rural and other Areas",4.0,15.0,42.0,,"Kamalanagar, Ananthapur",,2013-07-13
757.0,13-07-14,Andhra Pradesh,Rajahmundry,Andhra Pradesh State Pollution Control Board,Industrial Area,7.0,16.0,78.0,,"Staff Club Building, M/s A.P. Paper Mill, Rajahmundry",,2014-07-13
233.0,13-07-15,Andhra Pradesh,Visakhapatnam,Andhra Pradesh State Pollution Control Board,Industrial Area,7.0,17.0,29.0,,"Industrial Estate, Marripalem, Visakhapatnam",,2015-07-13
47,13-07-87,Gujarat,Baroda,Gujarat Pollution Control Board,Residential,11.2,26.4,,228.0,,,1987-07-13
58,13-08-03,Delhi,Delhi,Central Pollution Control Board,Industrial Area,10.0,28.0,152.0,296.0,,,2003-08-13
95.0,13-08-04,Andhra Pradesh,Hyderabad,Andhra Pradesh State Pollution Control Board,Industrial Area,4.9,28.7,59.0,133.7,"C.I.T.D., Balanagar, Plot no. A1 to A8, IDA, Hyderabad",,2004-08-13
,13-08-05,Andhra Pradesh,Hyderabad,,Industrial Areas,5.3,28.8,33.0,167.0,C.I.T.D. Balanagar,,2005-08-13
,13-08-07,Andhra Pradesh,Visakhapatnam,,Industrial Areas,7.3,27.9,86.0,173.0,Industrial Estate,,2007-08-13
582.0,13-08-10,Andhra Pradesh,Chittoor,Andhra Pradesh State Pollution Control Board,Sensitive Area,4.0,9.0,,,"GNC Toll Gate Tirumala , Chittoor Dist.",,2010-08-13
583.0,13-08-13,Andhra Pradesh,Guntur,Andhra Pradesh State Pollution Control Board,"Residential, Rural and other Areas",4.0,14.0,63.0,,"Near Hindu College, Market Road, Guntur",,2013-08-13
750.0,13-08-14,Andhra Pradesh,Eluru,Andhra Pradesh State Pollution Control Board,"Residential, Rural and other Areas",,,90.0,,"ASRAM Diagnostic Center, Eluru",,2014-08-13
233.0,13-08-15,Andhra Pradesh,Visakhapatnam,Andhra Pradesh State Pollution Control Board,Industrial Area,6.0,15.0,45.0,,"Industrial Estate, Marripalem, Visakhapatnam",,2015-08-13
84.0,13-09-03,Madhya Pradesh,Nagda,Madhya Pradesh  Pollution Control Board,"Residential, Rural and other Areas",0.0,0.0,0.0,0.0,,,2003-09-13
95.0,13-09-04,Andhra Pradesh,Hyderabad,Andhra Pradesh State Pollution Control Board,Industrial Area,4.0,23.1,60.0,163.7,"C.I.T.D., Balanagar, Plot no. A1 to A8, IDA, Hyderabad",,2004-09-13
,13-09-05,Andhra Pradesh,Hyderabad,,Industrial Areas,5.4,26.6,60.0,175.0,C.I.T.D. Balanagar,,2005-09-13
,13-09-07,Andhra Pradesh,Visakhapatnam,,Industrial Areas,8.3,30.9,84.0,173.0,Industrial Estate,,2007-09-13
582.0,13-09-10,Andhra Pradesh,Chittoor,Andhra Pradesh State Pollution Control Board,Sensitive Area,4.0,9.0,66.0,,"GNC Toll Gate Tirumala , Chittoor Dist.",,2010-09-13
751.0,13-09-13,Andhra Pradesh,Srikakulam,Andhra Pradesh State Pollution Control Board,Industrial Area,,,,,"IDA, Pydibheemavaram, Srikakulam",,2013-09-13
751.0,13-09-14,Andhra Pradesh,Srikakulam,Andhra Pradesh State Pollution Control Board,Industrial Area,12.0,19.0,63.0,,"IDA, Pydibheemavaram, Srikakulam",,2014-09-13
233.0,13-09-15,Andhra Pradesh,Visakhapatnam,Andhra Pradesh State Pollution Control Board,Industrial Area,7.0,14.0,63.0,,"Industrial Estate, Marripalem, Visakhapatnam",,2015-09-13
55,13-10-03,Delhi,Delhi,Central Pollution Control Board,Industrial Area,12.0,43.0,115.0,556.0,,,2003-10-13
233.0,13-10-04,Andhra Pradesh,Visakhapatnam,Andhra Pradesh State Pollution Control Board,Industrial Area,12.0,33.0,93.0,143.0,"Industrial Estate, Marripalem, Visakhapatnam",,2004-10-13
,13-10-05,Andhra Pradesh,Hyderabad,,Industrial Areas,4.9,18.8,65.0,232.0,C.I.T.D. Balanagar,,2005-10-13
,13-10-07,Andhra Pradesh,Visakhapatnam,,Industrial Areas,7.5,31.0,84.0,171.0,Industrial Estate,,2007-10-13
580.0,13-10-10,Andhra Pradesh,Nellore,Andhra Pradesh State Pollution Control Board,"Residential, Rural and other Areas",2.0,12.0,66.0,,"Venkatareddy nagar, Vedayapalem, Nellore",,2010-10-13
751.0,13-10-13,Andhra Pradesh,Srikakulam,Andhra Pradesh State Pollution Control Board,Industrial Area,,,57.0,,"IDA, Pydibheemavaram, Srikakulam",,2013-10-13
757.0,13-10-14,Andhra Pradesh,Rajahmundry,Andhra Pradesh State Pollution Control Board,Industrial Area,12.0,21.0,61.0,,"Staff Club Building, M/s A.P. Paper Mill, Rajahmundry",,2014-10-13
233.0,13-10-15,Andhra Pradesh,Visakhapatnam,Andhra Pradesh State Pollution Control Board,Industrial Area,8.0,19.0,90.0,,"Industrial Estate, Marripalem, Visakhapatnam",,2015-10-13
58,13-11-03,Delhi,Delhi,Central Pollution Control Board,Industrial Area,15.0,42.0,208.0,439.0,,,2003-11-13
233.0,13-11-04,Andhra Pradesh,Visakhapatnam,Andhra Pradesh State Pollution Control Board,Industrial Area,8.0,29.0,118.0,165.0,"Industrial Estate, Marripalem, Visakhapatnam",,2004-11-13
,13-11-05,Andhra Pradesh,Hyderabad,,Industrial Areas,4.9,31.6,107.0,324.0,C.I.T.D. Balanagar,,2005-11-13
,13-11-07,Andhra Pradesh,Hyderabad,,Residential and others,4.8,32.1,104.0,319.0,Charminar,,2007-11-13
577.0,13-11-10,Andhra Pradesh,Nalgonda,Andhra Pradesh State Pollution Control Board,"Residential, Rural and other Areas",4.0,20.0,94.0,,"Beside Regional Office, APPCB Nalgonda",,2010-11-13
751.0,13-11-13,Andhra Pradesh,Srikakulam,Andhra Pradesh State Pollution Control Board,Industrial Area,19.0,25.0,81.0,,"IDA, Pydibheemavaram, Srikakulam",,2013-11-13
757.0,13-11-14,Andhra Pradesh,Rajahmundry,Andhra Pradesh State Pollution Control Board,Industrial Area,9.0,16.0,61.0,,"Staff Club Building, M/s A.P. Paper Mill, Rajahmundry",,2014-11-13
233.0,13-11-15,Andhra Pradesh,Visakhapatnam,Andhra Pradesh State Pollution Control Board,Industrial Area,8.0,25.0,88.0,,"Industrial Estate, Marripalem, Visakhapatnam",,2015-11-13
62.0,13-12-03,Punjab,Ludhiana,Punjab Pollution Control Board,"Residential, Rural and other Areas",14.0,53.0,185.0,,,,2003-12-13
95.0,13-12-04,Andhra Pradesh,Hyderabad,Andhra Pradesh State Pollution Control Board,Industrial Area,4.7,34.2,138.0,340.3,"C.I.T.D., Balanagar, Plot no. A1 to A8, IDA, Hyderabad",,2004-12-13
,13-12-05,Andhra Pradesh,Hyderabad,,Industrial Areas,,9.2,85.0,135.0,Nacharam,,2005-12-13
,13-12-07,Andhra Pradesh,Hyderabad,,Industrial Areas,3.5,15.3,74.0,133.0,Nacharam,,2007-12-13
582.0,13-12-10,Andhra Pradesh,Chittoor,Andhra Pradesh State Pollution Control Board,Sensitive Area,4.0,9.0,33.0,,"GNC Toll Gate Tirumala , Chittoor Dist.",,2010-12-13
751.0,13-12-13,Andhra Pradesh,Srikakulam,Andhra Pradesh State Pollution Control Board,Industrial Area,20.0,22.0,64.0,,"IDA, Pydibheemavaram, Srikakulam",,2013-12-13
757.0,13-12-14,Andhra Pradesh,Rajahmundry,Andhra Pradesh State Pollution Control Board,Industrial Area,7.0,15.0,67.0,,"Staff Club Building, M/s A.P. Paper Mill, Rajahmundry",,2014-12-13
233.0,13-12-15,Andhra Pradesh,Visakhapatnam,Andhra Pradesh State Pollution Control Board,Industrial Area,7.0,10.0,55.0,,"Industrial Estate, Marripalem, Visakhapatnam",,2015-12-13
,13/01/2006,Maharashtra,Aurangabad (MS),,Residential and others,8.8,36.2,,,S.B.E.S. College,,2006-01-13
560,13/01/2011,Daman & Diu,Daman,"Daman Diu, Dadra & Nagar Heveli Pollution Control Committee",Industrial Area,7.5,18.8,,43.0,"Kadaiya Industrial Area, Village- Kadaiya, Daman (Industrial Area)",,2011-01-13
95.0,13/01/2012,Andhra Pradesh,Hyderabad,Andhra Pradesh State Pollution Control Board,Industrial Area,5.0,38.0,177.0,,"C.I.T.D., Balanagar, Plot no. A1 to A8, IDA, Hyderabad",,2012-01-13
,13/02/2006,Maharashtra,Aurangabad (MS),,Sensitive Areas,4.2,16.3,,,Bibi-Ka-Maqbara,,2006-02-13
155,13/02/2011,Gujarat,Ahmedabad,National Environmental Engineering Research Institute,"Residential, Rural and other Areas",12.0,19.0,68.0,,"R.C. High School, Mirzapur, Ahmadabad",,2011-02-13
583.0,13/02/2012,Andhra Pradesh,Guntur,Andhra Pradesh State Pollution Control Board,"Residential, Rural and other Areas",6.0,11.0,77.0,,"Near Hindu College, Market Road, Guntur",,2012-02-13
,13/03/2006,Maharashtra,Aurangabad (MS),,Sensitive Areas,3.7,12.0,,,Bibi-Ka-Maqbara,,2006-03-13
155,13/03/2011,Gujarat,Ahmedabad,National Environmental Engineering Research Institute,"Residential, Rural and other Areas",12.0,23.0,75.0,,"R.C. High School, Mirzapur, Ahmadabad",,2011-03-13
389.0,13/03/2012,Andhra Pradesh,Tirupati,Andhra Pradesh State Pollution Control Board,Sensitive Area,4.0,9.0,33.0,,"Regional Science Centre, Chittoor Bypass Road, Tirupati",,2012-03-13
,13/04/2006,Maharashtra,Aurangabad (MS),,Residential and others,5.0,22.8,101.0,264.0,C.A.D.A. Office,,2006-04-13
60,13/04/2011,Delhi,Delhi,Central Pollution Control Board,"Residential, Rural and other Areas",4.0,52.0,172.0,,"Siri Fort, Delhi",,2011-04-13
581.0,13/04/2012,Andhra Pradesh,Khammam,Andhra Pradesh State Pollution Control Board,"Residential, Rural and other Areas",6.0,10.0,54.0,,"CER Club,S.C.C.L. township, writter basti, Kothagudem, Khammam Dist.",,2012-04-13
,13/05/2006,Maharashtra,Aurangabad (MS),,Residential and others,5.3,20.5,100.0,262.0,S.B.E.S. College,,2006-05-13
59,13/05/2011,Delhi,Delhi,Central Pollution Control Board,"Residential, Rural and other Areas",4.0,60.0,104.0,,"Janakpuri, Delhi",,2011-05-13
95.0,13/05/2012,Andhra Pradesh,Hyderabad,Andhra Pradesh State Pollution Control Board,Industrial Area,5.0,23.0,148.0,,"C.I.T.D., Balanagar, Plot no. A1 to A8, IDA, Hyderabad",,2012-05-13
,13/06/2006,Maharashtra,Aurangabad (MS),,Sensitive Areas,6.2,15.5,57.0,126.0,Bibi-Ka-Maqbara,,2006-06-13
558.0,13/06/2011,Dadra & Nagar Haveli,Khadoli,"Daman Diu, Dadra & Nagar Heveli Pollution Control Committee",Industrial Area,7.4,19.3,,166.0,"Khadoli Industrial Area, Village- Khadoli, Silvassa",,2011-06-13
583.0,13/06/2012,Andhra Pradesh,Guntur,Andhra Pradesh State Pollution Control Board,"Residential, Rural and other Areas",6.0,11.0,77.0,,"Near Hindu College, Market Road, Guntur",,2012-06-13
,13/07/2006,Maharashtra,Aurangabad (MS),,Residential and others,3.8,10.4,32.0,78.0,C.A.D.A. Office,,2006-07-13
531,13/07/2011,Delhi,Delhi,Central Pollution Control Board,"Residential, Rural and other Areas",4.0,37.0,135.0,,"Pritampura, Delhi",,2011-07-13
233.0,13/07/2012,Andhra Pradesh,Visakhapatnam,Andhra Pradesh State Pollution Control Board,Industrial Area,4.0,9.0,64.0,,"Industrial Estate, Marripalem, Visakhapatnam",,2012-07-13
,13/08/2006,Maharashtra,Tarapur,,Industrial Areas,4.0,35.0,155.0,162.0,MIDC Office Compound,,2006-08-13
558.0,13/08/2011,Dadra & Nagar Haveli,Khadoli,"Daman Diu, Dadra & Nagar Heveli Pollution Control Committee",Industrial Area,7.4,17.7,,28.0,"Khadoli Industrial Area, Village- Khadoli, Silvassa",,2011-08-13
578.0,13/08/2012,Andhra Pradesh,Kakinada,Andhra Pradesh State Pollution Control Board,"Residential, Rural and other Areas",,,60.0,,"Top of the Office Building Ramanayyapeta, Kakinada",,2012-08-13
,13/09/2006,Maharashtra,Chandrapur,,Residential and others,27.8,37.2,98.0,191.0,"SRO, Bapat Nagar",,2006-09-13
560,13/09/2011,Daman & Diu,Daman,"Daman Diu, Dadra & Nagar Heveli Pollution Control Committee",Industrial Area,7.5,19.3,,38.0,"Kadaiya Industrial Area, Village- Kadaiya, Daman (Industrial Area)",,2011-09-13
468.0,13/09/2012,Andhra Pradesh,Patancheru,Andhra Pradesh State Pollution Control Board,"Residential, Rural and other Areas",7.0,24.0,87.0,,"Police Station, Medak, Patencheru",,2012-09-13
,13/1/2006,Andhra Pradesh,Visakhapatnam,,Industrial Areas,12.6,33.5,98.0,202.0,Industrial Estate,,2006-01-13
,13/1/2008,Andhra Pradesh,Visakhapatnam,,Industrial Areas,8.9,32.7,109.0,203.0,Industrial Estate,,2008-01-13
,13/1/2009,Andhra Pradesh,Hyderabad,,Industrial Areas,4.7,25.7,74.0,214.0,Uppal,,2009-01-13
203.0,13/1/2011,Andhra Pradesh,Hyderabad,Andhra Pradesh State Pollution Control Board,Industrial Area,5.0,34.0,138.0,297.0,"Uppal, Modern Foods & Industries IDA, Hyderabad",,2011-01-13
641.0,13/1/2012,Maharashtra,Latur,Maharashtra State Pollution Control Board,Industrial Area,5.0,13.0,198.0,,"MIDC, Water Works, Latur",,2012-01-13
,13/10/2006,Andhra Pradesh,Hyderabad,,Residential and others,4.0,20.4,93.0,185.0,Mourya Inn,,2006-10-13
,13/10/2008,Andhra Pradesh,Hyderabad,,Industrial Areas,,105.6,75.0,103.0,Nacharam,,2008-10-13
,13/10/2009,Andhra Pradesh,Guntur,,Residential and others,4.0,9.0,83.0,214.0,Hindu College Guntur,,2009-10-13
577.0,13/10/2011,Andhra Pradesh,Nalgonda,Andhra Pradesh State Pollution Control Board,"Residential, Rural and other Areas",4.0,14.0,53.0,,"Beside Regional Office, APPCB Nalgonda",,2011-10-13
468.0,13/10/2012,Andhra Pradesh,Patancheru,Andhra Pradesh State Pollution Control Board,"Residential, Rural and other Areas",5.0,23.0,100.0,,"Police Station, Medak, Patencheru",,2012-10-13
,13/11/2006,Andhra Pradesh,Hyderabad,,Industrial Areas,5.0,33.1,94.0,292.0,C.I.T.D. Balanagar,,2006-11-13
,13/11/2008,Andhra Pradesh,Tirupati,,Sensitive Areas,4.0,9.0,39.0,132.0,Reg.Science Centre,,2008-11-13
,13/11/2009,Assam,Guwahati,,Residential and others,7.5,15.0,243.0,379.0,Gopinath Nagar,,2009-11-13
150.0,13/11/2011,Andhra Pradesh,Hyderabad,National Environmental Engineering Research Institute,"Residential, Rural and other Areas",3.0,35.0,3.0,,"Tarnaka, NEERI Lab. IICT Campus, Hyderabad",,2011-11-13
95.0,13/11/2012,Andhra Pradesh,Hyderabad,Andhra Pradesh State Pollution Control Board,Industrial Area,7.0,51.0,286.0,,"C.I.T.D., Balanagar, Plot no. A1 to A8, IDA, Hyderabad",,2012-11-13
,13/12/2006,Andhra Pradesh,Hyderabad,,Residential and others,4.0,15.0,95.0,199.0,Mourya Inn,,2006-12-13
,13/12/2008,Andhra Pradesh,Visakhapatnam,,Industrial Areas,31.0,31.9,84.0,167.0,Industrial Estate,,2008-12-13
,13/12/2009,Maharashtra,Mahad,,Industrial Areas,13.3,34.3,136.0,237.0,"EHS, Mahad",,2009-12-13
152.0,13/12/2011,Andhra Pradesh,Hyderabad,National Environmental Engineering Research Institute,"Residential, Rural and other Areas",4.0,41.0,21.0,,"ABIDS Circle General Post Office Building, Hyderabad",,2011-12-13
578.0,13/12/2012,Andhra Pradesh,Kakinada,Andhra Pradesh State Pollution Control Board,"Residential, Rural and other Areas",,,56.0,,"Top of the Office Building Ramanayyapeta, Kakinada",,2012-12-13
,13/2/2006,Andhra Pradesh,Vijayawada,,Industrial Areas,5.5,30.7,103.0,245.0,Autonagar,,2006-02-13
,13/2/2008,Andhra Pradesh,Hyderabad,,Industrial Areas,2.6,10.5,30.0,62.0,Nacharam,,2008-02-13
,13/2/2009,Andhra Pradesh,Patancheru,,Residential and others,16.2,25.0,105.0,225.0,Police Station,,2009-02-13
642.0,13/2/2012,Maharashtra,Latur,Maharashtra State Pollution Control Board,"Residential, Rural and other Areas",5.0,14.0,214.0,,"Shyamnagar, Terrence of Keshavraj Vidyalaya, Latur",,2012-02-13
,13/3/2006,Andhra Pradesh,Hyderabad,,Industrial Areas,2.6,8.6,54.0,82.0,Nacharam,,2006-03-13
,13/3/2008,Andhra Pradesh,Hyderabad,,Industrial Areas,2.9,11.8,56.0,100.0,Nacharam,,2008-03-13
,13/3/2009,Andhra Pradesh,Patancheru,,Residential and others,16.4,28.2,139.0,302.0,Police Station,,2009-03-13
577.0,13/3/2011,Andhra Pradesh,Nalgonda,Andhra Pradesh State Pollution Control Board,"Residential, Rural and other Areas",4.0,21.0,89.0,,"Beside Regional Office, APPCB Nalgonda",,2011-03-13
642.0,13/3/2012,Maharashtra,Latur,Maharashtra State Pollution Control Board,"Residential, Rural and other Areas",9.0,17.0,61.0,,"Shyamnagar, Terrence of Keshavraj Vidyalaya, Latur",,2012-03-13
,13/4/2006,Andhra Pradesh,Hyderabad,,Sensitive Areas,4.9,17.1,57.0,126.0,Zoo Park,,2006-04-13
,13/4/2008,Andhra Pradesh,Visakhapatnam,,Industrial Areas,8.5,31.3,60.0,129.0,Industrial Estate,,2008-04-13
,13/4/2009,Andhra Pradesh,Hyderabad,,Industrial Areas,2.7,18.1,72.0,218.0,Nacharam,,2009-04-13
582.0,13/4/2011,Andhra Pradesh,Chittoor,Andhra Pradesh State Pollution Control Board,Sensitive Area,4.0,9.0,39.0,107.0,"GNC Toll Gate Tirumala , Chittoor Dist.",,2011-04-13
641.0,13/4/2012,Maharashtra,Latur,Maharashtra State Pollution Control Board,Industrial Area,13.0,24.0,115.0,,"MIDC, Water Works, Latur",,2012-04-13
,13/5/2006,Andhra Pradesh,Patancheru,,Residential and others,13.0,15.6,56.0,130.0,Police Station,,2006-05-13
,13/5/2008,Andhra Pradesh,Patancheru,,Residential and others,5.3,32.8,130.0,379.0,Police Station,,2008-05-13
,13/5/2009,Andhra Pradesh,Tirupati,,Sensitive Areas,4.0,9.0,38.0,126.0,Reg.Science Centre,,2009-05-13
582.0,13/5/2011,Andhra Pradesh,Chittoor,Andhra Pradesh State Pollution Control Board,Sensitive Area,4.0,9.0,36.0,115.0,"GNC Toll Gate Tirumala , Chittoor Dist.",,2011-05-13
,13/6/2006,Andhra Pradesh,Hyderabad,,Industrial Areas,6.2,34.3,91.0,263.0,C.I.T.D. Balanagar,,2006-06-13
,13/6/2008,Andhra Pradesh,Patancheru,,Residential and others,6.7,12.3,88.0,159.0,Police Station,,2008-06-13
,13/6/2009,Andhra Pradesh,Hyderabad,,Residential and others,4.8,26.4,111.0,345.0,Charminar,,2009-06-13
583.0,13/6/2011,Andhra Pradesh,Guntur,Andhra Pradesh State Pollution Control Board,"Residential, Rural and other Areas",4.0,9.4,76.0,194.0,"Near Hindu College, Market Road, Guntur",,2011-06-13
,13/7/2006,Andhra Pradesh,Hyderabad,,Residential and others,4.0,22.1,79.0,153.0,Mourya Inn,,2006-07-13
,13/7/2008,Andhra Pradesh,Visakhapatnam,,Industrial Areas,14.2,14.5,66.0,175.0,Industrial Estate,,2008-07-13
,13/7/2009,Andhra Pradesh,Visakhapatnam,,Industrial Areas,4.3,10.2,68.0,111.0,Industrial Estate,,2009-07-13
468.0,13/7/2011,Andhra Pradesh,Patancheru,Andhra Pradesh State Pollution Control Board,"Residential, Rural and other Areas",5.0,19.0,59.0,,"Police Station, Medak, Patencheru",,2011-07-13
641.0,13/7/2012,Maharashtra,Latur,Maharashtra State Pollution Control Board,Industrial Area,5.0,12.0,35.0,,"MIDC, Water Works, Latur",,2012-07-13
,13/8/2006,Andhra Pradesh,Hyderabad,,Residential and others,5.3,31.2,97.0,284.0,Charminar,,2006-08-13
,13/8/2008,Andhra Pradesh,Hyderabad,,Residential and others,7.2,28.1,45.0,168.0,ABIDS Circle,,2008-08-13
,13/8/2009,Andhra Pradesh,Hyderabad,,Industrial Areas,4.2,16.7,37.0,137.0,Nacharam,,2009-08-13
95.0,13/8/2011,Andhra Pradesh,Hyderabad,Andhra Pradesh State Pollution Control Board,Industrial Area,5.0,22.0,44.0,149.0,"C.I.T.D., Balanagar, Plot no. A1 to A8, IDA, Hyderabad",,2011-08-13
642.0,13/8/2012,Maharashtra,Latur,Maharashtra State Pollution Control Board,"Residential, Rural and other Areas",4.0,25.0,142.0,,"Shyamnagar, Terrence of Keshavraj Vidyalaya, Latur",,2012-08-13
,13/9/2006,Andhra Pradesh,Hyderabad,,Residential and others,4.9,31.8,86.0,224.0,Charminar,,2006-09-13
,13/9/2008,Andhra Pradesh,Visakhapatnam,,Residential and others,5.9,22.0,48.0,139.0,Ganapuram Area,,2008-09-13
,13/9/2009,Andhra Pradesh,Nalgonda,,Residential and others,4.7,22.6,124.0,265.0,RO APPCB,,2009-09-13
582.0,13/9/2011,Andhra Pradesh,Chittoor,Andhra Pradesh State Pollution Control Board,Sensitive Area,4.0,9.0,37.0,95.0,"GNC Toll Gate Tirumala , Chittoor Dist.",,2011-09-13
55,14-01-03,Delhi,Delhi,Central Pollution Control Board,Industrial Area,14.0,41.0,187.0,304.0,,,2003-01-14
284.0,14-01-04,Bihar,Patna,Bihar Sate Pollution Control Board,"Residential, Rural and other Areas",15.0,75.0,128.0,181.0,"Gandhi Maidan Test Centre,Patna",,2004-01-14
,14-01-05,Andhra Pradesh,Hyderabad,,Residential and others,4.2,26.2,90.0,255.0,Jubilee Hills,,2005-01-14
,14-01-07,Andhra Pradesh,Hyderabad,,Industrial Areas,5.2,37.3,116.0,378.0,C.I.T.D. Balanagar,,2007-01-14
466.0,14-01-10,Andhra Pradesh,Kurnool,Andhra Pradesh State Pollution Control Board,"Residential, Rural and other Areas",4.0,9.0,160.0,,"Mourya Inn, Kurnool",,2010-01-14
387.0,14-01-13,Andhra Pradesh,Visakhapatnam,Andhra Pradesh State Pollution Control Board,Sensitive Area,4.0,9.0,55.0,,"INS-Virabahu, Naval Area, Visakhapatnam",,2013-01-14
750.0,14-01-14,Andhra Pradesh,Eluru,Andhra Pradesh State Pollution Control Board,"Residential, Rural and other Areas",,,101.0,,"ASRAM Diagnostic Center, Eluru",,2014-01-14
106.0,14-01-15,Chandigarh,Chandigarh,Chandigarh Pollution Control Committee,Industrial Area,2.0,42.0,64.0,,"Modern Foods, Industrial Area, Chandigarh",,2015-01-14
55,14-02-03,Delhi,Delhi,Central Pollution Control Board,Industrial Area,11.0,42.0,217.0,337.0,,,2003-02-14
210.0,14-02-04,Bihar,Patna,Bihar Sate Pollution Control Board,"Residential, Rural and other Areas",18.0,47.0,116.0,181.0,"Beltron Bhawan, Shastri Nagar, Patna",,2004-02-14
,14-02-05,Andhra Pradesh,Hyderabad,,Industrial Areas,5.3,41.8,108.0,331.0,C.I.T.D. Balanagar,,2005-02-14
,14-02-07,Andhra Pradesh,Hyderabad,,Industrial Areas,5.5,41.5,105.0,317.0,C.I.T.D. Balanagar,,2007-02-14
466.0,14-02-10,Andhra Pradesh,Kurnool,Andhra Pradesh State Pollution Control Board,"Residential, Rural and other Areas",4.0,9.0,126.0,,"Mourya Inn, Kurnool",,2010-02-14
748.0,14-02-13,Andhra Pradesh,Ananthapur,Andhra Pradesh State Pollution Control Board,"Residential, Rural and other Areas",4.0,9.0,70.0,,"Kamalanagar, Ananthapur",,2013-02-14
583.0,14-02-14,Andhra Pradesh,Guntur,Andhra Pradesh State Pollution Control Board,"Residential, Rural and other Areas",5.0,21.0,74.0,,"Near Hindu College, Market Road, Guntur",,2014-02-14
193.0,14-02-15,Assam,Guwahati,Assam State Pollution Control Board,"Residential, Rural and other Areas",7.0,13.0,94.0,,"Head Office, Bamunimaidan, Guwahati",,2015-02-14
61.0,14-03-03,Punjab,Ludhiana,Punjab Pollution Control Board,Industrial Area,11.0,27.0,158.0,,,,2003-03-14
233.0,14-03-04,Andhra Pradesh,Visakhapatnam,Andhra Pradesh State Pollution Control Board,Industrial Area,7.0,29.0,104.0,152.0,"Industrial Estate, Marripalem, Visakhapatnam",,2004-03-14
,14-03-05,Chandigarh,Chandigarh,,Residential and others,6.2,22.2,101.0,178.0,Kaimbwala Village,,2005-03-14
,14-03-07,Andhra Pradesh,Hyderabad,,Industrial Areas,5.1,34.9,94.0,305.0,C.I.T.D. Balanagar,,2007-03-14
150.0,14-03-10,Andhra Pradesh,Hyderabad,National Environmental Engineering Research Institute,"Residential, Rural and other Areas",4.0,20.0,108.0,,"Tarnaka, NEERI Lab. IICT Campus, Hyderabad",,2010-03-14
750.0,14-03-13,Andhra Pradesh,Eluru,Andhra Pradesh State Pollution Control Board,"Residential, Rural and other Areas",,,94.0,,"ASRAM Diagnostic Center, Eluru",,2013-03-14
538.0,14-03-14,Assam,Dibrugarh,Assam State Pollution Control Board,"Residential, Rural and other Areas",7.0,15.0,43.0,,"Dibrugarh Office Building, Dibrugarh",,2014-03-14
567.0,14-03-15,Assam,Silcher,Assam State Pollution Control Board,"Residential, Rural and other Areas",10.0,17.0,81.0,,"Office building of RLO, near Ithkola Market, Ghaniwala road",,2015-03-14
3.0,14-03-88,Uttar Pradesh,Agra,Uttar Pradesh Pollution Control Board,Industrial Area,7.6,5.8,,806.0,,,1988-03-14
327,14-04-04,Goa,Panaji,Goa State Pollution Control Board,"Residential, Rural and other Areas",2.0,5.3,,100.0,"Infront of Old GSPCB premises, Patto, Panaji, Goa",,2004-04-14
,14-04-05,Andhra Pradesh,Hyderabad,,Residential and others,4.7,77.4,157.0,348.0,Paradise,,2005-04-14
,14-04-07,Andhra Pradesh,Hyderabad,,Industrial Areas,5.2,35.8,113.0,371.0,C.I.T.D. Balanagar,,2007-04-14
583.0,14-04-10,Andhra Pradesh,Guntur,Andhra Pradesh State Pollution Control Board,"Residential, Rural and other Areas",2.0,9.0,81.0,,"Near Hindu College, Market Road, Guntur",,2010-04-14
146,14-04-13,Delhi,Delhi,National Environmental Engineering Research Institute,"Residential, Rural and other Areas",2.0,119.0,470.0,,"Town Hall, Ayurvedic Dispensary, Chandni Chowk, Delhi",,2013-04-14
750.0,14-04-14,Andhra Pradesh,Eluru,Andhra Pradesh State Pollution Control Board,"Residential, Rural and other Areas",,,111.0,,"ASRAM Diagnostic Center, Eluru",,2014-04-14
586.0,14-04-15,Assam,Margherita,Assam State Pollution Control Board,"Residential, Rural and other Areas",10.0,17.0,191.0,,"Coal India Office Complex, Margherita,Tinsukia,Assam",,2015-04-14
48,14-04-88,Gujarat,Baroda,Gujarat Pollution Control Board,"Residential, Rural and other Areas",10.1,28.8,,311.0,,,1988-04-14
58,14-05-03,Delhi,Delhi,Central Pollution Control Board,Industrial Area,12.0,34.0,123.0,315.0,,,2003-05-14
95.0,14-05-04,Andhra Pradesh,Hyderabad,Andhra Pradesh State Pollution Control Board,Industrial Area,5.5,42.4,85.0,196.7,"C.I.T.D., Balanagar, Plot no. A1 to A8, IDA, Hyderabad",,2004-05-14
,14-05-05,Bihar,Patna,,Residential and others,22.7,,126.0,533.0,Gandhi Maidan T C,,2005-05-14
,14-05-07,Andhra Pradesh,Hyderabad,,Industrial Areas,4.8,35.8,82.0,367.0,C.I.T.D. Balanagar,,2007-05-14
151.0,14-05-10,Andhra Pradesh,Hyderabad,National Environmental Engineering Research Institute,Industrial Area,2.0,14.0,41.0,,"Nacharam, Industrial Estate, Premises of IICT (APIDC), Hyderabad",,2010-05-14
95.0,14-05-13,Andhra Pradesh,Hyderabad,Andhra Pradesh State Pollution Control Board,Industrial Area,5.0,43.0,253.0,,"C.I.T.D., Balanagar, Plot no. A1 to A8, IDA, Hyderabad",,2013-05-14
750.0,14-05-14,Andhra Pradesh,Eluru,Andhra Pradesh State Pollution Control Board,"Residential, Rural and other Areas",,,111.0,,"ASRAM Diagnostic Center, Eluru",,2014-05-14
193.0,14-05-15,Assam,Guwahati,Assam State Pollution Control Board,"Residential, Rural and other Areas",6.0,12.0,93.0,,"Head Office, Bamunimaidan, Guwahati",,2015-05-14
84.0,14-06-03,Madhya Pradesh,Nagda,Madhya Pradesh  Pollution Control Board,"Residential, Rural and other Areas",0.0,0.0,0.0,0.0,,,2003-06-14
203.0,14-06-04,Andhra Pradesh,Hyderabad,Andhra Pradesh State Pollution Control Board,Industrial Area,4.2,29.6,60.7,145.0,"Uppal, Modern Foods & Industries IDA, Hyderabad",,2004-06-14
,14-06-05,Andhra Pradesh,Hyderabad,,Industrial Areas,4.9,28.6,101.0,386.0,C.I.T.D. Balanagar,,2005-06-14
,14-06-07,Andhra Pradesh,Hyderabad,,Industrial Areas,5.1,40.7,49.0,151.0,Uppal,,2007-06-14
151.0,14-06-10,Andhra Pradesh,Hyderabad,National Environmental Engineering Research Institute,Industrial Area,6.0,22.0,16.0,,"Nacharam, Industrial Estate, Premises of IICT (APIDC), Hyderabad",,2010-06-14
538.0,14-06-13,Assam,Dibrugarh,Assam State Pollution Control Board,"Residential, Rural and other Areas",6.0,16.0,146.0,,"Dibrugarh Office Building, Dibrugarh",,2013-06-14
567.0,14-06-14,Assam,Silcher,Assam State Pollution Control Board,"Residential, Rural and other Areas",7.0,12.5,72.0,,"Office building of RLO, near Ithkola Market, Ghaniwala road",,2014-06-14
77.0,14-06-15,Karnataka,Bangalore,Karnataka State Pollution Control Board,Industrial Area,6.0,19.0,124.0,,"Graphite India, White Field Road, Bangalore",,2015-06-14
58,14-07-03,Delhi,Delhi,Central Pollution Control Board,Industrial Area,9.0,22.0,63.0,127.0,,,2003-07-14
217.0,14-07-04,Assam,Guwahati,Assam State Pollution Control Board,"Residential, Rural and other Areas",3.2,10.9,187.0,,"Paltanbazar, Guwahati",,2004-07-14
,14-07-05,Andhra Pradesh,Hyderabad,,Residential and others,5.4,34.3,81.0,322.0,Charminar,,2005-07-14
,14-07-07,Andhra Pradesh,Hyderabad,,Industrial Areas,5.2,33.0,74.0,308.0,C.I.T.D. Balanagar,,2007-07-14
582.0,14-07-10,Andhra Pradesh,Chittoor,Andhra Pradesh State Pollution Control Board,Sensitive Area,4.0,9.0,46.0,,"GNC Toll Gate Tirumala , Chittoor Dist.",,2010-07-14
566.0,14-07-13,Assam,Daranga,Assam State Pollution Control Board,"Residential, Rural and other Areas",8.0,15.0,60.0,,"Daranga, Baska district, BATAD,Assam near Sandoop Jhankar town of Bhutan",,2013-07-14
520.0,14-07-14,Assam,Bongaigaon,Assam State Pollution Control Board,"Residential, Rural and other Areas",10.0,13.0,47.0,,"Barpara Office Building, Bongaigaon",,2014-07-14
193.0,14-07-15,Assam,Guwahati,Assam State Pollution Control Board,"Residential, Rural and other Areas",8.0,13.0,64.0,,"Head Office, Bamunimaidan, Guwahati",,2015-07-14
40.0,14-07-88,Karnataka,Mysore,Karnataka Pollution Control Board,Industrial Area,33.6,26.6,,50.0,,,1988-07-14
56,14-08-03,Delhi,Delhi,Central Pollution Control Board,Industrial Area,6.0,31.0,34.0,164.0,,,2003-08-14
394.0,14-08-04,Andhra Pradesh,Hyderabad,Andhra Pradesh State Pollution Control Board,"Residential, Rural and other Areas",2.4,20.5,72.7,174.0,"Charminar, Hyderabad",,2004-08-14
,14-08-05,Andhra Pradesh,Hyderabad,,Residential and others,5.3,24.1,60.0,232.0,Paradise,,2005-08-14
,14-08-07,Andhra Pradesh,Hyderabad,,Industrial Areas,5.2,29.9,75.0,222.0,Uppal,,2007-08-14
466.0,14-08-10,Andhra Pradesh,Kurnool,Andhra Pradesh State Pollution Control Board,"Residential, Rural and other Areas",4.0,9.0,80.0,,"Mourya Inn, Kurnool",,2010-08-14
520.0,14-08-13,Assam,Bongaigaon,Assam State Pollution Control Board,"Residential, Rural and other Areas",8.0,15.0,30.0,,"Barpara Office Building, Bongaigaon",,2013-08-14
542.0,14-08-14,Assam,Bongaigaon,Assam State Pollution Control Board,"Residential, Rural and other Areas",3.0,9.0,21.0,,"Campus of Oil India Ltd. PS-6, Bongaigaon, Chirang",,2014-08-14
193.0,14-08-15,Assam,Guwahati,Assam State Pollution Control Board,"Residential, Rural and other Areas",6.0,12.0,68.0,,"Head Office, Bamunimaidan, Guwahati",,2015-08-14
394.0,14-09-04,Andhra Pradesh,Hyderabad,Andhra Pradesh State Pollution Control Board,"Residential, Rural and other Areas",2.4,29.7,78.3,221.3,"Charminar, Hyderabad",,2004-09-14
,14-09-05,Andhra Pradesh,Hyderabad,,Residential and others,4.8,25.2,77.0,221.0,Charminar,,2005-09-14
,14-09-07,Andhra Pradesh,Hyderabad,,Industrial Areas,4.7,31.2,55.0,142.0,C.I.T.D. Balanagar,,2007-09-14
583.0,14-09-10,Andhra Pradesh,Guntur,Andhra Pradesh State Pollution Control Board,"Residential, Rural and other Areas",2.0,11.0,64.0,,"Near Hindu College, Market Road, Guntur",,2010-09-14
566.0,14-09-13,Assam,Daranga,Assam State Pollution Control Board,"Residential, Rural and other Areas",8.0,16.0,93.0,,"Daranga, Baska district, BATAD,Assam near Sandoop Jhankar town of Bhutan",,2013-09-14
598.0,14-09-14,Karnataka,Bangalore,Karnataka State Pollution Control Board,Sensitive Area,6.0,9.0,32.0,,"Department of Environmental Science, Jnanabharathi Campus, Bangalore University",,2014-09-14
193.0,14-09-15,Assam,Guwahati,Assam State Pollution Control Board,"Residential, Rural and other Areas",7.0,12.0,74.0,,"Head Office, Bamunimaidan, Guwahati",,2015-09-14
42,14-09-87,Haryana,Faridabad,Haryana Pollution Control Board,Residential,42.8,22.0,,,,,1987-09-14
58,14-10-03,Delhi,Delhi,Central Pollution Control Board,Industrial Area,12.0,34.0,129.0,417.0,,,2003-10-14
394.0,14-10-04,Andhra Pradesh,Hyderabad,Andhra Pradesh State Pollution Control Board,"Residential, Rural and other Areas",2.4,22.8,104.0,236.0,"Charminar, Hyderabad",,2004-10-14
,14-10-05,Andhra Pradesh,Hyderabad,,Residential and others,4.7,23.8,75.0,234.0,Charminar,,2005-10-14
,14-10-07,Andhra Pradesh,Hyderabad,,Industrial Areas,5.0,29.4,96.0,294.0,C.I.T.D. Balanagar,,2007-10-14
582.0,14-10-10,Andhra Pradesh,Chittoor,Andhra Pradesh State Pollution Control Board,Sensitive Area,4.0,9.0,41.0,,"GNC Toll Gate Tirumala , Chittoor Dist.",,2010-10-14
567.0,14-10-13,Assam,Silcher,Assam State Pollution Control Board,"Residential, Rural and other Areas",7.0,16.25,71.5,,"Office building of RLO, near Ithkola Market, Ghaniwala road",,2013-10-14
542.0,14-10-14,Assam,Bongaigaon,Assam State Pollution Control Board,"Residential, Rural and other Areas",6.0,13.0,59.0,,"Campus of Oil India Ltd. PS-6, Bongaigaon, Chirang",,2014-10-14
193.0,14-10-15,Assam,Guwahati,Assam State Pollution Control Board,"Residential, Rural and other Areas",7.0,11.0,80.0,,"Head Office, Bamunimaidan, Guwahati",,2015-10-14
56,14-11-03,Delhi,Delhi,Central Pollution Control Board,Industrial Area,8.0,39.0,175.0,464.0,,,2003-11-14
287.0,14-11-04,Maharashtra,Nagpur,Visveshwaraya National Institute Of Technology,"Residential, Rural and other Areas",9.2,25.1,84.3,266.7,Institution of Engineers.,,2004-11-14
,14-11-05,Andhra Pradesh,Hyderabad,,Residential and others,4.7,20.0,50.0,142.0,Jubilee Hills,,2005-11-14
,14-11-07,Andhra Pradesh,Hyderabad,,Industrial Areas,5.5,38.5,110.0,431.0,C.I.T.D. Balanagar,,2007-11-14
466.0,14-11-10,Andhra Pradesh,Kurnool,Andhra Pradesh State Pollution Control Board,"Residential, Rural and other Areas",4.0,9.0,60.0,,"Mourya Inn, Kurnool",,2010-11-14
542.0,14-11-13,Assam,Bongaigaon,Assam State Pollution Control Board,"Residential, Rural and other Areas",5.0,12.0,53.0,,"Campus of Oil India Ltd. PS-6, Bongaigaon, Chirang",,2013-11-14
538.0,14-11-14,Assam,Dibrugarh,Assam State Pollution Control Board,"Residential, Rural and other Areas",7.0,12.0,48.0,,"Dibrugarh Office Building, Dibrugarh",,2014-11-14
462.0,14-11-15,Andhra Pradesh,Vijayawada,Andhra Pradesh State Pollution Control Board,"Residential, Rural and other Areas",5.0,46.0,100.0,,"Benz Circle, Vijayawada",,2015-11-14
393.0,14-12-04,Andhra Pradesh,Hyderabad,Andhra Pradesh State Pollution Control Board,"Residential, Rural and other Areas",3.3,41.3,146.3,324.0,"Paradise, Hyderabad",,2004-12-14
,14-12-05,Andhra Pradesh,Hyderabad,,Industrial Areas,6.7,32.0,145.0,375.0,C.I.T.D. Balanagar,,2005-12-14
,14-12-07,Andhra Pradesh,Hyderabad,,Industrial Areas,5.6,34.9,121.0,365.0,C.I.T.D. Balanagar,,2007-12-14
583.0,14-12-10,Andhra Pradesh,Guntur,Andhra Pradesh State Pollution Control Board,"Residential, Rural and other Areas",2.0,11.0,73.0,,"Near Hindu College, Market Road, Guntur",,2010-12-14
566.0,14-12-13,Assam,Daranga,Assam State Pollution Control Board,"Residential, Rural and other Areas",5.0,16.0,46.0,,"Daranga, Baska district, BATAD,Assam near Sandoop Jhankar town of Bhutan",,2013-12-14
29.0,14-12-14,Kerala,Kochi,Kerala State Pollution Control Board,Industrial Area,2.0,29.0,55.0,,"Eloor, Kochi",,2014-12-14
193.0,14-12-15,Assam,Guwahati,Assam State Pollution Control Board,"Residential, Rural and other Areas",7.0,23.0,86.0,,"Head Office, Bamunimaidan, Guwahati",,2015-12-14
,14/01/2006,Maharashtra,Aurangabad (MS),,Residential and others,9.0,36.0,,,S.B.E.S. College,,2006-01-14
58,14/01/2011,Delhi,Delhi,Central Pollution Control Board,Industrial Area,4.0,54.0,375.0,,"Shahadra, Delhi",,2011-01-14
466.0,14/01/2012,Andhra Pradesh,Kurnool,Andhra Pradesh State Pollution Control Board,"Residential, Rural and other Areas",4.0,9.0,75.0,,"Mourya Inn, Kurnool",,2012-01-14
,14/02/2006,Maharashtra,Aurangabad (MS),,Sensitive Areas,5.2,15.3,,,Bibi-Ka-Maqbara,,2006-02-14
558.0,14/02/2011,Dadra & Nagar Haveli,Khadoli,"Daman Diu, Dadra & Nagar Heveli Pollution Control Committee",Industrial Area,7.3,19.4,,42.0,"Khadoli Industrial Area, Village- Khadoli, Silvassa",,2011-02-14
578.0,14/02/2012,Andhra Pradesh,Kakinada,Andhra Pradesh State Pollution Control Board,"Residential, Rural and other Areas",,,58.0,,"Top of the Office Building Ramanayyapeta, Kakinada",,2012-02-14
,14/03/2006,Maharashtra,Aurangabad (MS),,Sensitive Areas,3.7,11.2,,,Bibi-Ka-Maqbara,,2006-03-14
558.0,14/03/2011,Dadra & Nagar Haveli,Khadoli,"Daman Diu, Dadra & Nagar Heveli Pollution Control Committee",Industrial Area,7.4,19.3,24.0,43.0,"Khadoli Industrial Area, Village- Khadoli, Silvassa",,2011-03-14
583.0,14/03/2012,Andhra Pradesh,Guntur,Andhra Pradesh State Pollution Control Board,"Residential, Rural and other Areas",6.0,11.0,73.0,,"Near Hindu College, Market Road, Guntur",,2012-03-14
,14/04/2006,Maharashtra,Aurangabad (MS),,Residential and others,4.3,18.5,87.0,245.0,S.B.E.S. College,,2006-04-14
558.0,14/04/2011,Dadra & Nagar Haveli,Khadoli,"Daman Diu, Dadra & Nagar Heveli Pollution Control Committee",Industrial Area,7.5,19.9,,43.0,"Khadoli Industrial Area, Village- Khadoli, Silvassa",,2011-04-14
466.0,14/04/2012,Andhra Pradesh,Kurnool,Andhra Pradesh State Pollution Control Board,"Residential, Rural and other Areas",4.0,9.0,84.0,,"Mourya Inn, Kurnool",,2012-04-14
,14/05/2006,Maharashtra,Nagpur,,Residential and others,9.9,33.0,31.0,170.0,Institution of Eng.,,2006-05-14
560,14/05/2011,Daman & Diu,Daman,"Daman Diu, Dadra & Nagar Heveli Pollution Control Committee",Industrial Area,7.8,20.3,,43.0,"Kadaiya Industrial Area, Village- Kadaiya, Daman (Industrial Area)",,2011-05-14
583.0,14/05/2012,Andhra Pradesh,Guntur,Andhra Pradesh State Pollution Control Board,"Residential, Rural and other Areas",6.0,11.0,76.0,,"Near Hindu College, Market Road, Guntur",,2012-05-14
,14/06/2006,Maharashtra,Aurangabad (MS),,Residential and others,4.3,16.5,74.0,172.0,C.A.D.A. Office,,2006-06-14
560,14/06/2011,Daman & Diu,Daman,"Daman Diu, Dadra & Nagar Heveli Pollution Control Committee",Industrial Area,7.3,19.3,,42.0,"Kadaiya Industrial Area, Village- Kadaiya, Daman (Industrial Area)",,2011-06-14
466.0,14/06/2012,Andhra Pradesh,Kurnool,Andhra Pradesh State Pollution Control Board,"Residential, Rural and other Areas",4.0,9.0,92.0,,"Mourya Inn, Kurnool",,2012-06-14
,14/07/2006,Maharashtra,Chandrapur,,Industrial Areas,25.8,40.5,90.0,141.0,M.I.D.C.,,2006-07-14
558.0,14/07/2011,Dadra & Nagar Haveli,Khadoli,"Daman Diu, Dadra & Nagar Heveli Pollution Control Committee",Industrial Area,7.4,18.7,,28.0,"Khadoli Industrial Area, Village- Khadoli, Silvassa",,2011-07-14
566.0,14/07/2012,Assam,Daranga,Assam State Pollution Control Board,"Residential, Rural and other Areas",7.0,16.3,41.0,,"Daranga, Baska district, BATAD,Assam near Sandoop Jhankar town of Bhutan",,2012-07-14
,14/08/2006,Maharashtra,Chandrapur,,Residential and others,28.5,37.8,96.0,124.0,Nagar Parishad,,2006-08-14
155,14/08/2011,Gujarat,Ahmedabad,National Environmental Engineering Research Institute,"Residential, Rural and other Areas",9.0,25.0,64.0,,"R.C. High School, Mirzapur, Ahmadabad",,2011-08-14
234.0,14/08/2012,Andhra Pradesh,Visakhapatnam,Andhra Pradesh State Pollution Control Board,"Residential, Rural and other Areas",4.0,9.0,29.0,,"Panchayat Raj office, Mindi, Visakhapatnam",,2012-08-14
,14/09/2006,Maharashtra,Aurangabad (MS),,Residential and others,4.3,15.5,37.0,83.0,C.A.D.A. Office,,2006-09-14
59,14/09/2011,Delhi,Delhi,Central Pollution Control Board,"Residential, Rural and other Areas",4.0,46.0,79.0,,"Janakpuri, Delhi",,2011-09-14
578.0,14/09/2012,Andhra Pradesh,Kakinada,Andhra Pradesh State Pollution Control Board,"Residential, Rural and other Areas",,,57.0,,"Top of the Office Building Ramanayyapeta, Kakinada",,2012-09-14
,14/1/2006,Assam,Guwahati,,Residential and others,8.8,31.8,227.0,268.0,Fire Brigade Station,,2006-01-14
,14/1/2008,Andhra Pradesh,Hyderabad,,Industrial Areas,4.8,24.7,94.0,225.0,C.I.T.D. Balanagar,,2008-01-14
,14/1/2009,Andhra Pradesh,Hyderabad,,Industrial Areas,4.7,25.2,85.0,255.0,C.I.T.D. Balanagar,,2009-01-14
95.0,14/1/2011,Andhra Pradesh,Hyderabad,Andhra Pradesh State Pollution Control Board,Industrial Area,5.0,40.0,114.0,309.0,"C.I.T.D., Balanagar, Plot no. A1 to A8, IDA, Hyderabad",,2011-01-14
641.0,14/1/2012,Maharashtra,Latur,Maharashtra State Pollution Control Board,Industrial Area,4.0,12.0,137.0,,"MIDC, Water Works, Latur",,2012-01-14
,14/10/2006,Andhra Pradesh,Hyderabad,,Residential and others,5.2,30.3,136.0,334.0,Charminar,,2006-10-14
,14/10/2008,Andhra Pradesh,Hyderabad,,Industrial Areas,5.1,28.6,98.0,280.0,C.I.T.D. Balanagar,,2008-10-14
,14/10/2009,Andhra Pradesh,Hyderabad,,Industrial Areas,4.9,24.0,97.0,289.0,C.I.T.D. Balanagar,,2009-10-14
95.0,14/10/2011,Andhra Pradesh,Hyderabad,Andhra Pradesh State Pollution Control Board,Industrial Area,5.0,38.0,95.0,216.0,"C.I.T.D., Balanagar, Plot no. A1 to A8, IDA, Hyderabad",,2011-10-14
234.0,14/10/2012,Andhra Pradesh,Visakhapatnam,Andhra Pradesh State Pollution Control Board,"Residential, Rural and other Areas",4.0,9.0,43.0,,"Panchayat Raj office, Mindi, Visakhapatnam",,2012-10-14
,14/11/2006,Andhra Pradesh,Patancheru,,Residential and others,13.5,14.0,28.0,102.0,Police Station,,2006-11-14
,14/11/2008,Andhra Pradesh,Hyderabad,,Industrial Areas,5.2,29.2,109.0,316.0,C.I.T.D. Balanagar,,2008-11-14
,14/11/2009,Andhra Pradesh,Hyderabad,,Industrial Areas,4.9,27.0,76.0,233.0,C.I.T.D. Balanagar,,2009-11-14
582.0,14/11/2011,Andhra Pradesh,Chittoor,Andhra Pradesh State Pollution Control Board,Sensitive Area,4.0,9.0,31.0,80.0,"GNC Toll Gate Tirumala , Chittoor Dist.",,2011-11-14
583.0,14/11/2012,Andhra Pradesh,Guntur,Andhra Pradesh State Pollution Control Board,"Residential, Rural and other Areas",5.0,13.0,74.0,,"Near Hindu College, Market Road, Guntur",,2012-11-14
,14/12/2006,Andhra Pradesh,Hyderabad,,Industrial Areas,5.7,33.6,136.0,406.0,Uppal,,2006-12-14
,14/12/2008,Andhra Pradesh,Hyderabad,,Industrial Areas,5.0,28.0,109.0,304.0,C.I.T.D. Balanagar,,2008-12-14
,14/12/2009,Andhra Pradesh,Hyderabad,,Industrial Areas,5.5,28.9,122.0,353.0,C.I.T.D. Balanagar,,2009-12-14
106.0,14/12/2011,Chandigarh,Chandigarh,Chandigarh Pollution Control Committee,Industrial Area,2.0,24.3,127.0,232.0,"Modern Foods, Industrial Area, Chandigarh",,2011-12-14
234.0,14/12/2012,Andhra Pradesh,Visakhapatnam,Andhra Pradesh State Pollution Control Board,"Residential, Rural and other Areas",4.0,9.0,44.0,,"Panchayat Raj office, Mindi, Visakhapatnam",,2012-12-14
,14/2/2006,Andhra Pradesh,Hyderabad,,Industrial Areas,11.3,69.2,175.0,467.0,C.I.T.D. Balanagar,,2006-02-14
,14/2/2008,Andhra Pradesh,Hyderabad,,Industrial Areas,5.4,29.8,103.0,272.0,Uppal,,2008-02-14
,14/2/2009,Andhra Pradesh,Hyderabad,,Industrial Areas,4.7,28.5,113.0,324.0,C.I.T.D. Balanagar,,2009-02-14
150.0,14/2/2011,Andhra Pradesh,Hyderabad,National Environmental Engineering Research Institute,"Residential, Rural and other Areas",3.0,28.0,41.0,,"Tarnaka, NEERI Lab. IICT Campus, Hyderabad",,2011-02-14
642.0,14/2/2012,Maharashtra,Latur,Maharashtra State Pollution Control Board,"Residential, Rural and other Areas",5.0,18.0,101.0,,"Shyamnagar, Terrence of Keshavraj Vidyalaya, Latur",,2012-02-14
,14/3/2006,Andhra Pradesh,Hyderabad,,Industrial Areas,5.1,22.0,91.0,264.0,C.I.T.D. Balanagar,,2006-03-14
,14/3/2008,Andhra Pradesh,Hyderabad,,Industrial Areas,5.2,37.1,159.0,382.0,C.I.T.D. Balanagar,,2008-03-14
,14/3/2009,Andhra Pradesh,Hyderabad,,Industrial Areas,4.6,27.4,115.0,341.0,C.I.T.D. Balanagar,,2009-03-14
582.0,14/3/2011,Andhra Pradesh,Chittoor,Andhra Pradesh State Pollution Control Board,Sensitive Area,4.0,9.0,44.0,115.0,"GNC Toll Gate Tirumala , Chittoor Dist.",,2011-03-14
,14/4/2006,Andhra Pradesh,Hyderabad,,Industrial Areas,8.5,37.8,97.0,283.0,C.I.T.D. Balanagar,,2006-04-14
,14/4/2008,Andhra Pradesh,Hyderabad,,Industrial Areas,5.2,33.3,107.0,306.0,C.I.T.D. Balanagar,,2008-04-14
,14/4/2009,Andhra Pradesh,Hyderabad,,Industrial Areas,4.7,25.8,106.0,295.0,C.I.T.D. Balanagar,,2009-04-14
577.0,14/4/2011,Andhra Pradesh,Nalgonda,Andhra Pradesh State Pollution Control Board,"Residential, Rural and other Areas",4.0,18.0,64.0,,"Beside Regional Office, APPCB Nalgonda",,2011-04-14
641.0,14/4/2012,Maharashtra,Latur,Maharashtra State Pollution Control Board,Industrial Area,9.0,19.0,99.0,,"MIDC, Water Works, Latur",,2012-04-14
,14/5/2006,Andhra Pradesh,Vijayawada,,Residential and others,5.5,39.4,84.0,148.0,Benz Circle,,2006-05-14
,14/5/2008,Andhra Pradesh,Hyderabad,,Industrial Areas,5.2,32.6,140.0,424.0,C.I.T.D. Balanagar,,2008-05-14
,14/5/2009,Andhra Pradesh,Hyderabad,,Industrial Areas,5.2,26.4,106.0,316.0,C.I.T.D. Balanagar,,2009-05-14
203.0,14/5/2011,Andhra Pradesh,Hyderabad,Andhra Pradesh State Pollution Control Board,Industrial Area,5.0,37.0,117.0,528.0,"Uppal, Modern Foods & Industries IDA, Hyderabad",,2011-05-14
642.0,14/5/2012,Maharashtra,Latur,Maharashtra State Pollution Control Board,"Residential, Rural and other Areas",8.0,10.0,107.0,,"Shyamnagar, Terrence of Keshavraj Vidyalaya, Latur",,2012-05-14
,14/6/2006,Andhra Pradesh,Hyderabad,,Industrial Areas,,13.8,36.0,112.0,Nacharam,,2006-06-14
,14/6/2008,Andhra Pradesh,Hyderabad,,Industrial Areas,5.2,33.3,122.0,360.0,C.I.T.D. Balanagar,,2008-06-14
,14/6/2009,Andhra Pradesh,Hyderabad,,Industrial Areas,4.8,25.7,109.0,322.0,C.I.T.D. Balanagar,,2009-06-14
583.0,14/6/2011,Andhra Pradesh,Guntur,Andhra Pradesh State Pollution Control Board,"Residential, Rural and other Areas",4.0,9.4,72.0,184.0,"Near Hindu College, Market Road, Guntur",,2011-06-14
,14/7/2006,Andhra Pradesh,Hyderabad,,Residential and others,5.3,32.2,93.0,287.0,Charminar,,2006-07-14
,14/7/2008,Andhra Pradesh,Hyderabad,,Industrial Areas,,12.6,55.0,113.0,Nacharam,,2008-07-14
,14/7/2009,Andhra Pradesh,Hyderabad,,Industrial Areas,4.5,25.4,85.0,242.0,C.I.T.D. Balanagar,,2009-07-14
150.0,14/7/2011,Andhra Pradesh,Hyderabad,National Environmental Engineering Research Institute,"Residential, Rural and other Areas",3.0,35.0,104.0,,"Tarnaka, NEERI Lab. IICT Campus, Hyderabad",,2011-07-14
641.0,14/7/2012,Maharashtra,Latur,Maharashtra State Pollution Control Board,Industrial Area,7.0,15.0,46.0,,"MIDC, Water Works, Latur",,2012-07-14
,14/8/2006,Andhra Pradesh,Hyderabad,,Industrial Areas,5.4,29.8,67.0,219.0,C.I.T.D. Balanagar,,2006-08-14
,14/8/2008,Andhra Pradesh,Hyderabad,,Industrial Areas,5.1,34.0,98.0,289.0,C.I.T.D. Balanagar,,2008-08-14
,14/8/2009,Andhra Pradesh,Hyderabad,,Industrial Areas,5.0,25.8,81.0,236.0,C.I.T.D. Balanagar,,2009-08-14
465.0,14/8/2011,Andhra Pradesh,Ramagundam,Andhra Pradesh State Pollution Control Board,"Residential, Rural and other Areas",3.5,,25.0,54.0,"RTC Bus Depot, Karim Nagar, Ramagundam",,2011-08-14
642.0,14/8/2012,Maharashtra,Latur,Maharashtra State Pollution Control Board,"Residential, Rural and other Areas",4.0,30.0,86.0,,"Shyamnagar, Terrence of Keshavraj Vidyalaya, Latur",,2012-08-14
,14/9/2006,Andhra Pradesh,Hyderabad,,Industrial Areas,8.1,36.3,88.0,261.0,C.I.T.D. Balanagar,,2006-09-14
,14/9/2008,Andhra Pradesh,Hyderabad,,Industrial Areas,5.0,34.6,88.0,255.0,C.I.T.D. Balanagar,,2008-09-14
,14/9/2009,Andhra Pradesh,Hyderabad,,Industrial Areas,4.4,23.7,90.0,272.0,C.I.T.D. Balanagar,,2009-09-14
95.0,14/9/2011,Andhra Pradesh,Hyderabad,Andhra Pradesh State Pollution Control Board,Industrial Area,5.0,23.0,64.0,143.0,"C.I.T.D., Balanagar, Plot no. A1 to A8, IDA, Hyderabad",,2011-09-14
641.0,14/9/2012,Maharashtra,Latur,Maharashtra State Pollution Control Board,Industrial Area,16.0,30.0,32.0,,"MIDC, Water Works, Latur",,2012-09-14
58,15-01-03,Delhi,Delhi,Central Pollution Control Board,Industrial Area,9.0,36.0,239.0,510.0,,,2003-01-15
210.0,15-01-04,Bihar,Patna,Bihar Sate Pollution Control Board,"Residential, Rural and other Areas",13.0,44.0,95.0,157.0,"Beltron Bhawan, Shastri Nagar, Patna",,2004-01-15
,15-01-05,Andhra Pradesh,Hyderabad,,Industrial Areas,5.0,36.3,130.0,333.0,C.I.T.D. Balanagar,,2005-01-15
,15-01-07,Assam,Guwahati,,Residential and others,14.0,25.3,227.0,258.0,Gopinath Nagar,,2007-01-15
583.0,15-01-10,Andhra Pradesh,Guntur,Andhra Pradesh State Pollution Control Board,"Residential, Rural and other Areas",2.0,12.0,82.0,,"Near Hindu College, Market Road, Guntur",,2010-01-15
748.0,15-01-13,Andhra Pradesh,Ananthapur,Andhra Pradesh State Pollution Control Board,"Residential, Rural and other Areas",4.0,9.0,84.0,,"Kamalanagar, Ananthapur",,2013-01-15
587.0,15-01-14,Assam,Lakhimpur,Assam State Pollution Control Board,"Residential, Rural and other Areas",6.0,14.0,118.0,,"Bazar Patti, North Lakhimpur Town,Lakhimpur, Assam",,2014-01-15
567.0,15-01-15,Assam,Silcher,Assam State Pollution Control Board,"Residential, Rural and other Areas",7.0,15.0,64.0,,"Office building of RLO, near Ithkola Market, Ghaniwala road",,2015-01-15
84.0,15-02-03,Madhya Pradesh,Nagda,Madhya Pradesh  Pollution Control Board,"Residential, Rural and other Areas",0.0,0.0,0.0,0.0,,,2003-02-15
322.0,15-02-04,Odisha,Bhubaneswar,Odisha State Pollution Control Board,"Residential, Rural and other Areas",2.0,10.33,62.67,107.0,"SPCB Building, Bhubaneshwar",,2004-02-15
,15-02-05,Andhra Pradesh,Hyderabad,,Industrial Areas,4.7,33.5,160.0,476.0,Uppal,,2005-02-15
,15-02-07,Andhra Pradesh,Hyderabad,,Residential and others,5.2,30.8,163.0,392.0,Charminar,,2007-02-15
582.0,15-02-10,Andhra Pradesh,Chittoor,Andhra Pradesh State Pollution Control Board,Sensitive Area,4.0,9.0,44.0,,"GNC Toll Gate Tirumala , Chittoor Dist.",,2010-02-15
539.0,15-02-13,Assam,Golaghat,Assam State Pollution Control Board,"Residential, Rural and other Areas",6.0,12.0,108.0,,"Golaghat Office Building, Golaghat",,2013-02-15
566.0,15-02-14,Assam,Daranga,Assam State Pollution Control Board,"Residential, Rural and other Areas",6.0,17.0,126.0,,"Daranga, Baska district, BATAD,Assam near Sandoop Jhankar town of Bhutan",,2014-02-15
SAMP,15-02-15,Gujarat,Bharuch,Gujarat State Pollution Control Board,RIRUO,14.0,21.0,83.0,,"Dahez SEZ Part II Office,Bharuch",30.0,2015-02-15
84.0,15-03-03,Madhya Pradesh,Nagda,Madhya Pradesh  Pollution Control Board,"Residential, Rural and other Areas",0.0,0.0,0.0,0.0,,,2003-03-15
95.0,15-03-04,Andhra Pradesh,Hyderabad,Andhra Pradesh State Pollution Control Board,Industrial Area,6.6,59.9,87.7,253.7,"C.I.T.D., Balanagar, Plot no. A1 to A8, IDA, Hyderabad",,2004-03-15
,15-03-05,Andhra Pradesh,Hyderabad,,Industrial Areas,5.2,76.2,164.0,431.0,C.I.T.D. Balanagar,,2005-03-15
,15-03-07,Andhra Pradesh,Hyderabad,,Residential and others,4.9,30.5,130.0,338.0,Charminar,,2007-03-15
581.0,15-03-10,Andhra Pradesh,Khammam,Andhra Pradesh State Pollution Control Board,"Residential, Rural and other Areas",2.0,10.0,67.0,,"CER Club,S.C.C.L. township, writter basti, Kothagudem, Khammam Dist.",,2010-03-15
538.0,15-03-13,Assam,Dibrugarh,Assam State Pollution Control Board,"Residential, Rural and other Areas",8.0,17.0,143.0,,"Dibrugarh Office Building, Dibrugarh",,2013-03-15
748.0,15-03-14,Andhra Pradesh,Ananthapur,Andhra Pradesh State Pollution Control Board,"Residential, Rural and other Areas",5.0,10.0,73.0,,"Kamalanagar, Ananthapur",,2014-03-15
345,15-03-15,Delhi,Delhi,National Environmental Engineering Research Institute,Industrial Area,3.0,97.0,89.0,,"Mayapuri Industrial Area, Delhi",,2015-03-15
317.0,15-04-03,Nagaland,Dimapur,Nagaland State Pollution Control Board,"Residential, Rural and other Areas",,,62.0,82.0,,,2003-04-15
263.0,15-04-04,Chandigarh,Chandigarh,Chandigarh Pollution Control Committee,"Residential, Rural and other Areas",3.0,43.0,220.0,552.0,"Sector-17 C, Chandigarh",,2004-04-15
,15-04-05,Andhra Pradesh,Hyderabad,,Industrial Areas,6.9,38.8,81.0,318.0,C.I.T.D. Balanagar,,2005-04-15
,15-04-07,Andhra Pradesh,Hyderabad,,Residential and others,5.2,34.4,145.0,373.0,Charminar,,2007-04-15
150.0,15-04-10,Andhra Pradesh,Hyderabad,National Environmental Engineering Research Institute,"Residential, Rural and other Areas",3.0,17.0,106.0,,"Tarnaka, NEERI Lab. IICT Campus, Hyderabad",,2010-04-15
106.0,15-04-13,Chandigarh,Chandigarh,Chandigarh Pollution Control Committee,Industrial Area,,,102.0,,"Modern Foods, Industrial Area, Chandigarh",,2013-04-15
748.0,15-04-14,Andhra Pradesh,Ananthapur,Andhra Pradesh State Pollution Control Board,"Residential, Rural and other Areas",4.0,10.0,91.0,,"Kamalanagar, Ananthapur",,2014-04-15
106.0,15-04-15,Chandigarh,Chandigarh,Chandigarh Pollution Control Committee,Industrial Area,2.0,20.0,78.0,,"Modern Foods, Industrial Area, Chandigarh",,2015-04-15
63.0,15-04-87,Punjab,Ludhiana,Punjab Pollution Control Board,Residential,,,,445.0,,,1987-04-15
317.0,15-05-03,Nagaland,Dimapur,Nagaland State Pollution Control Board,"Residential, Rural and other Areas",,,52.0,102.0,,,2003-05-15
365.0,15-05-04,Andhra Pradesh,Hyderabad,Andhra Pradesh State Pollution Control Board,"Residential, Rural and other Areas",2.4,22.3,24.3,148.0,Jublee Hills Hyderabad,,2004-05-15
,15-05-05,Andhra Pradesh,Hyderabad,,Industrial Areas,4.6,18.8,113.0,343.0,C.I.T.D. Balanagar,,2005-05-15
,15-05-07,Andhra Pradesh,Hyderabad,,Residential and others,5.0,30.9,86.0,259.0,Charminar,,2007-05-15
581.0,15-05-10,Andhra Pradesh,Khammam,Andhra Pradesh State Pollution Control Board,"Residential, Rural and other Areas",2.0,12.0,58.0,,"CER Club,S.C.C.L. township, writter basti, Kothagudem, Khammam Dist.",,2010-05-15
520.0,15-05-13,Assam,Bongaigaon,Assam State Pollution Control Board,"Residential, Rural and other Areas",5.0,14.0,28.0,,"Barpara Office Building, Bongaigaon",,2013-05-15
583.0,15-05-14,Andhra Pradesh,Guntur,Andhra Pradesh State Pollution Control Board,"Residential, Rural and other Areas",4.0,23.0,75.0,,"Near Hindu College, Market Road, Guntur",,2014-05-15
193.0,15-05-15,Assam,Guwahati,Assam State Pollution Control Board,"Residential, Rural and other Areas",7.0,13.0,84.0,,"Head Office, Bamunimaidan, Guwahati",,2015-05-15
95.0,15-06-04,Andhra Pradesh,Hyderabad,Andhra Pradesh State Pollution Control Board,Industrial Area,5.2,29.2,53.0,166.0,"C.I.T.D., Balanagar, Plot no. A1 to A8, IDA, Hyderabad",,2004-06-15
,15-06-05,Assam,Guwahati,,Residential and others,4.8,19.8,117.0,181.0,Paltanbazar,,2005-06-15
,15-06-07,Andhra Pradesh,Hyderabad,,Residential and others,5.4,33.0,72.0,327.0,Charminar,,2007-06-15
582.0,15-06-10,Andhra Pradesh,Chittoor,Andhra Pradesh State Pollution Control Board,Sensitive Area,4.0,9.0,33.0,,"GNC Toll Gate Tirumala , Chittoor Dist.",,2010-06-15
193.0,15-06-13,Assam,Guwahati,Assam State Pollution Control Board,"Residential, Rural and other Areas",6.0,18.0,252.0,,"Head Office, Bamunimaidan, Guwahati",,2013-06-15
459.0,15-06-14,Karnataka,Gulbarga,Karnataka State Pollution Control Board,Sensitive Area,2.0,12.0,50.0,,"Government Hospital, Gulbarga",,2014-06-15
193.0,15-06-15,Assam,Guwahati,Assam State Pollution Control Board,"Residential, Rural and other Areas",8.0,13.0,70.0,,"Head Office, Bamunimaidan, Guwahati",,2015-06-15
56,15-07-03,Delhi,Delhi,Central Pollution Control Board,Industrial Area,5.0,38.0,89.0,232.0,,,2003-07-15
193.0,15-07-04,Assam,Guwahati,Assam State Pollution Control Board,"Residential, Rural and other Areas",2.0,6.7,104.0,,"Head Office, Bamunimaidan, Guwahati",,2004-07-15
,15-07-05,Assam,Guwahati,,Residential and others,4.0,14.1,80.0,131.0,Paltanbazar,,2005-07-15
,15-07-07,Andhra Pradesh,Hyderabad,,Residential and others,5.0,31.5,115.0,308.0,Charminar,,2007-07-15
150.0,15-07-10,Andhra Pradesh,Hyderabad,National Environmental Engineering Research Institute,"Residential, Rural and other Areas",6.0,22.0,57.0,,"Tarnaka, NEERI Lab. IICT Campus, Hyderabad",,2010-07-15
520.0,15-07-13,Assam,Bongaigaon,Assam State Pollution Control Board,"Residential, Rural and other Areas",7.0,14.0,35.0,,"Barpara Office Building, Bongaigaon",,2013-07-15
542.0,15-07-14,Assam,Bongaigaon,Assam State Pollution Control Board,"Residential, Rural and other Areas",7.0,12.0,53.0,,"Campus of Oil India Ltd. PS-6, Bongaigaon, Chirang",,2014-07-15
193.0,15-07-15,Assam,Guwahati,Assam State Pollution Control Board,"Residential, Rural and other Areas",5.0,10.0,63.0,,"Head Office, Bamunimaidan, Guwahati",,2015-07-15
317.0,15-08-03,Nagaland,Dimapur,Nagaland State Pollution Control Board,"Residential, Rural and other Areas",,,37.0,56.0,,,2003-08-15
210.0,15-08-04,Bihar,Patna,Bihar Sate Pollution Control Board,"Residential, Rural and other Areas",10.0,16.0,50.0,105.0,"Beltron Bhawan, Shastri Nagar, Patna",,2004-08-15
,15-08-05,Delhi,Delhi,,Residential and others,5.0,74.0,135.0,400.0,BSZ Marg,,2005-08-15
,15-08-07,Assam,Golaghat,,Residential and others,4.3,9.6,19.0,51.0,Golaghat Off. Bldg.,,2007-08-15
102,15-08-10,Gujarat,Ahmedabad,Gujarat State Pollution Control Board,"Residential, Rural and other Areas",14.0,19.0,80.0,,"Cadilla Bridge Narol, Ahmadabad",,2010-08-15
566.0,15-08-13,Assam,Daranga,Assam State Pollution Control Board,"Residential, Rural and other Areas",6.0,17.0,176.0,,"Daranga, Baska district, BATAD,Assam near Sandoop Jhankar town of Bhutan",,2013-08-15
538.0,15-08-14,Assam,Dibrugarh,Assam State Pollution Control Board,"Residential, Rural and other Areas",4.0,11.0,25.0,,"Dibrugarh Office Building, Dibrugarh",,2014-08-15
567.0,15-08-15,Assam,Silcher,Assam State Pollution Control Board,"Residential, Rural and other Areas",5.0,11.0,60.0,,"Office building of RLO, near Ithkola Market, Ghaniwala road",,2015-08-15
55,15-09-03,Delhi,Delhi,Central Pollution Control Board,Industrial Area,13.0,32.0,68.0,215.0,,,2003-09-15
210.0,15-09-04,Bihar,Patna,Bihar Sate Pollution Control Board,"Residential, Rural and other Areas",9.0,19.0,55.0,109.0,"Beltron Bhawan, Shastri Nagar, Patna",,2004-09-15
,15-09-05,Assam,Bongaigaon,,Residential and others,2.3,,,118.0,Barpara Office Bldg,,2005-09-15
,15-09-07,Andhra Pradesh,Hyderabad,,Residential and others,5.2,30.8,66.0,178.0,Charminar,,2007-09-15
582.0,15-09-10,Andhra Pradesh,Chittoor,Andhra Pradesh State Pollution Control Board,Sensitive Area,4.0,9.0,65.0,,"GNC Toll Gate Tirumala , Chittoor Dist.",,2010-09-15
488.0,15-09-13,Karnataka,Mangalore,Karnataka State Pollution Control Board,Industrial Area,9.0,5.0,50.0,,"Stides Premises, Baikampady Industrial Area, Mangalore",,2013-09-15
520.0,15-09-14,Assam,Bongaigaon,Assam State Pollution Control Board,"Residential, Rural and other Areas",7.0,14.0,37.0,,"Barpara Office Building, Bongaigaon",,2014-09-15
787.0,15-09-15,Arunachal Pradesh,Itanagar,Arunachal Pradesh State Pollution Control Board,"Residential, Rural and other Areas",,,149.0,,Compound of PCCF's Office building,,2015-09-15
1.0,15-09-88,Uttar Pradesh,Agra,Central Pollution Control Board,Sensitive,4.9,6.4,,147.0,,,1988-09-15
56,15-10-03,Delhi,Delhi,Central Pollution Control Board,Industrial Area,6.0,41.0,124.0,615.0,,,2003-10-15
95.0,15-10-04,Andhra Pradesh,Hyderabad,Andhra Pradesh State Pollution Control Board,Industrial Area,4.8,27.4,87.7,244.7,"C.I.T.D., Balanagar, Plot no. A1 to A8, IDA, Hyderabad",,2004-10-15
,15-10-05,Andhra Pradesh,Hyderabad,,Industrial Areas,4.6,26.6,61.0,194.0,C.I.T.D. Balanagar,,2005-10-15
,15-10-07,Andhra Pradesh,Hyderabad,,Residential and others,5.2,32.3,116.0,336.0,Charminar,,2007-10-15
520.0,15-10-10,Assam,Bongaigaon,Assam State Pollution Control Board,"Residential, Rural and other Areas",7.0,18.0,28.0,,"Barpara Office Building, Bongaigaon",,2010-10-15
520.0,15-10-13,Assam,Bongaigaon,Assam State Pollution Control Board,"Residential, Rural and other Areas",8.0,22.0,24.0,,"Barpara Office Building, Bongaigaon",,2013-10-15
748.0,15-10-14,Andhra Pradesh,Ananthapur,Andhra Pradesh State Pollution Control Board,"Residential, Rural and other Areas",4.0,16.0,62.0,,"Kamalanagar, Ananthapur",,2014-10-15
787.0,15-10-15,Arunachal Pradesh,Itanagar,Arunachal Pradesh State Pollution Control Board,"Residential, Rural and other Areas",6.0,2.0,49.0,,Compound of PCCF's Office building,,2015-10-15
144,15-11-03,Delhi,Delhi,,"Residential, Rural and other Areas",7.0,62.0,,563.0,,,2003-11-15
264.0,15-11-04,Chandigarh,Chandigarh,Chandigarh Pollution Control Committee,"Residential, Rural and other Areas",4.0,41.0,63.0,108.0,"Punjab Engineering College, Sector-12, Chandigarh",,2004-11-15
,15-11-05,Andhra Pradesh,Hyderabad,,Residential and others,5.1,31.6,131.0,357.0,Paradise,,2005-11-15
,15-11-07,Andhra Pradesh,Hyderabad,,Industrial Areas,3.1,12.4,49.0,111.0,Nacharam,,2007-11-15
582.0,15-11-10,Andhra Pradesh,Chittoor,Andhra Pradesh State Pollution Control Board,Sensitive Area,4.0,9.0,37.0,,"GNC Toll Gate Tirumala , Chittoor Dist.",,2010-11-15
539.0,15-11-13,Assam,Golaghat,Assam State Pollution Control Board,"Residential, Rural and other Areas",9.0,22.0,89.0,,"Golaghat Office Building, Golaghat",,2013-11-15
566.0,15-11-14,Assam,Daranga,Assam State Pollution Control Board,"Residential, Rural and other Areas",6.0,11.0,42.0,,"Daranga, Baska district, BATAD,Assam near Sandoop Jhankar town of Bhutan",,2014-11-15
623.0,15-11-15,Kerala,Malappuram,Kerala State Pollution Control Board,Industrial Area,2.0,16.0,40.0,,"Kakkanchery, near KINFRA, Malappuram",,2015-11-15
56,15-12-03,Delhi,Delhi,Central Pollution Control Board,Industrial Area,9.0,41.0,134.0,290.0,,,2003-12-15
210.0,15-12-04,Bihar,Patna,Bihar Sate Pollution Control Board,"Residential, Rural and other Areas",10.0,27.0,64.0,125.0,"Beltron Bhawan, Shastri Nagar, Patna",,2004-12-15
,15-12-05,Assam,Guwahati,,Residential and others,20.3,24.8,165.0,336.0,Fire Brigade Station,,2005-12-15
,15-12-07,Andhra Pradesh,Hyderabad,,Residential and others,5.1,31.1,116.0,350.0,Charminar,,2007-12-15
582.0,15-12-10,Andhra Pradesh,Chittoor,Andhra Pradesh State Pollution Control Board,Sensitive Area,4.0,9.0,38.0,,"GNC Toll Gate Tirumala , Chittoor Dist.",,2010-12-15
539.0,15-12-13,Assam,Golaghat,Assam State Pollution Control Board,"Residential, Rural and other Areas",9.0,22.0,89.0,,"Golaghat Office Building, Golaghat",,2013-12-15
520.0,15-12-14,Assam,Bongaigaon,Assam State Pollution Control Board,"Residential, Rural and other Areas",6.0,13.0,55.0,,"Barpara Office Building, Bongaigaon",,2014-12-15
787.0,15-12-15,Arunachal Pradesh,Itanagar,Arunachal Pradesh State Pollution Control Board,"Residential, Rural and other Areas",3.0,17.0,171.0,,Compound of PCCF's Office building,,2015-12-15
,15/01/2006,Maharashtra,Thane,,Residential and others,4.0,8.5,,,Kopri,,2006-01-15
558.0,15/01/2011,Dadra & Nagar Haveli,Khadoli,"Daman Diu, Dadra & Nagar Heveli Pollution Control Committee",Industrial Area,20.1,19.0,,44.0,"Khadoli Industrial Area, Village- Khadoli, Silvassa",,2011-01-15
577.0,15/01/2012,Andhra Pradesh,Nalgonda,Andhra Pradesh State Pollution Control Board,"Residential, Rural and other Areas",4.0,16.0,77.0,,"Beside Regional Office, APPCB Nalgonda",,2012-01-15
,15/02/2006,Maharashtra,Aurangabad (MS),,Residential and others,5.5,15.8,,,C.A.D.A. Office,,2006-02-15
560,15/02/2011,Daman & Diu,Daman,"Daman Diu, Dadra & Nagar Heveli Pollution Control Committee",Industrial Area,7.3,19.2,,41.0,"Kadaiya Industrial Area, Village- Kadaiya, Daman (Industrial Area)",,2011-02-15
583.0,15/02/2012,Andhra Pradesh,Guntur,Andhra Pradesh State Pollution Control Board,"Residential, Rural and other Areas",6.0,11.0,75.0,,"Near Hindu College, Market Road, Guntur",,2012-02-15
,15/03/2006,Maharashtra,Kolhapur,,Residential and others,9.5,41.5,,,Mahadwar Road,,2006-03-15
560,15/03/2011,Daman & Diu,Daman,"Daman Diu, Dadra & Nagar Heveli Pollution Control Committee",Industrial Area,7.4,19.3,24.0,42.0,"Kadaiya Industrial Area, Village- Kadaiya, Daman (Industrial Area)",,2011-03-15
581.0,15/03/2012,Andhra Pradesh,Khammam,Andhra Pradesh State Pollution Control Board,"Residential, Rural and other Areas",5.0,10.0,54.0,,"CER Club,S.C.C.L. township, writter basti, Kothagudem, Khammam Dist.",,2012-03-15
,15/04/2006,Maharashtra,Aurangabad (MS),,Residential and others,5.0,18.8,90.0,233.0,S.B.E.S. College,,2006-04-15
59,15/04/2011,Delhi,Delhi,Central Pollution Control Board,"Residential, Rural and other Areas",4.0,60.0,,,"Janakpuri, Delhi",,2011-04-15
95.0,15/04/2012,Andhra Pradesh,Hyderabad,Andhra Pradesh State Pollution Control Board,Industrial Area,5.0,24.0,89.0,,"C.I.T.D., Balanagar, Plot no. A1 to A8, IDA, Hyderabad",,2012-04-15
,15/05/2006,Maharashtra,Aurangabad (MS),,Sensitive Areas,4.8,14.3,92.0,192.0,Bibi-Ka-Maqbara,,2006-05-15
155,15/05/2011,Gujarat,Ahmedabad,National Environmental Engineering Research Institute,"Residential, Rural and other Areas",13.0,27.0,71.0,,"R.C. High School, Mirzapur, Ahmadabad",,2011-05-15
580.0,15/05/2012,Andhra Pradesh,Nellore,Andhra Pradesh State Pollution Control Board,"Residential, Rural and other Areas",6.0,10.0,54.0,,"Venkatareddy nagar, Vedayapalem, Nellore",,2012-05-15
,15/06/2006,Maharashtra,Aurangabad (MS),,Residential and others,6.2,23.3,63.0,166.0,C.A.D.A. Office,,2006-06-15
59,15/06/2011,Delhi,Delhi,Central Pollution Control Board,"Residential, Rural and other Areas",4.0,52.0,297.0,,"Janakpuri, Delhi",,2011-06-15
538.0,15/06/2012,Assam,Dibrugarh,Assam State Pollution Control Board,"Residential, Rural and other Areas",4.0,10.3,21.0,,"Dibrugarh Office Building, Dibrugarh",,2012-06-15
,15/07/2006,Maharashtra,Chandrapur,,Residential and others,24.2,34.2,118.0,177.0,Nagar Parishad,,2006-07-15
59,15/07/2011,Delhi,Delhi,Central Pollution Control Board,"Residential, Rural and other Areas",4.0,39.0,119.0,,"Janakpuri, Delhi",,2011-07-15
583.0,15/07/2012,Andhra Pradesh,Guntur,Andhra Pradesh State Pollution Control Board,"Residential, Rural and other Areas",6.0,11.0,74.0,,"Near Hindu College, Market Road, Guntur",,2012-07-15
,15/08/2006,Maharashtra,Kolhapur,,Residential and others,7.3,32.3,,,S.T. Stand,,2006-08-15
629,15/08/2011,Goa,Usgao,Goa State Pollution Control Board,"Residential, Rural and other Areas",10.0,14.0,97.0,45.83,"Usgao Plae, Junction",,2011-08-15
578.0,15/08/2012,Andhra Pradesh,Kakinada,Andhra Pradesh State Pollution Control Board,"Residential, Rural and other Areas",,,55.0,,"Top of the Office Building Ramanayyapeta, Kakinada",,2012-08-15
,15/09/2006,Maharashtra,Aurangabad (MS),,Residential and others,3.3,13.3,38.0,118.0,S.B.E.S. College,,2006-09-15
146,15/09/2011,Delhi,Delhi,National Environmental Engineering Research Institute,"Residential, Rural and other Areas",2.0,32.0,86.0,,"Town Hall, Ayurvedic Dispensary, Chandni Chowk, Delhi",,2011-09-15
583.0,15/09/2012,Andhra Pradesh,Guntur,Andhra Pradesh State Pollution Control Board,"Residential, Rural and other Areas",5.0,10.0,74.0,,"Near Hindu College, Market Road, Guntur",,2012-09-15
,15/1/2006,Chandigarh,Chandigarh,,Industrial Areas,,21.9,182.0,325.0,Industrial Area,,2006-01-15
,15/1/2008,Andhra Pradesh,Hyderabad,,Residential and others,4.2,23.8,80.0,158.0,Paradise,,2008-01-15
,15/1/2009,Andhra Pradesh,Hyderabad,,Residential and others,5.0,26.5,89.0,257.0,Charminar,,2009-01-15
470.0,15/1/2011,Andhra Pradesh,Hyderabad,Andhra Pradesh State Pollution Control Board,Sensitive Area,4.2,19.3,147.0,220.0,"Zoo Park, Hyderabad",,2011-01-15
,15/10/2006,Andhra Pradesh,Ramagundam,,Residential and others,51.4,12.5,110.0,253.0,RTC Bus Depot,,2006-10-15
,15/10/2008,Andhra Pradesh,Hyderabad,,Industrial Areas,,44.5,51.0,79.0,Nacharam,,2008-10-15
,15/10/2009,Assam,Guwahati,,Residential and others,5.8,15.0,71.0,157.0,Gopinath Nagar,,2009-10-15
464.0,15/10/2011,Chandigarh,Chandigarh,Chandigarh Pollution Control Committee,"Residential, Rural and other Areas",2.0,22.3,169.0,282.0,"Kaimbwala Village, Chandigarh",,2011-10-15
583.0,15/10/2012,Andhra Pradesh,Guntur,Andhra Pradesh State Pollution Control Board,"Residential, Rural and other Areas",5.0,11.0,76.0,,"Near Hindu College, Market Road, Guntur",,2012-10-15
,15/11/2006,Assam,Dibrugarh,,Residential and others,7.3,13.0,31.0,68.0,Dibrugarh Off. Bldg,,2006-11-15
,15/11/2008,Andhra Pradesh,Hyderabad,,Residential and others,4.9,27.0,105.0,302.0,Charminar,,2008-11-15
,15/11/2009,Andhra Pradesh,Hyderabad,,Industrial Areas,2.3,12.8,20.0,67.0,Nacharam,,2009-11-15
577.0,15/11/2011,Andhra Pradesh,Nalgonda,Andhra Pradesh State Pollution Control Board,"Residential, Rural and other Areas",4.0,17.0,89.0,,"Beside Regional Office, APPCB Nalgonda",,2011-11-15
577.0,15/11/2012,Andhra Pradesh,Nalgonda,Andhra Pradesh State Pollution Control Board,"Residential, Rural and other Areas",5.0,17.0,102.0,,"Beside Regional Office, APPCB Nalgonda",,2012-11-15
,15/12/2006,Andhra Pradesh,Hyderabad,,Residential and others,4.7,41.6,99.0,299.0,Charminar,,2006-12-15
,15/12/2008,Andhra Pradesh,Hyderabad,,Industrial Areas,2.4,11.2,60.0,99.0,Nacharam,,2008-12-15
,15/12/2009,Andhra Pradesh,Hyderabad,,Residential and others,5.4,31.0,108.0,313.0,Charminar,,2009-12-15
150.0,15/12/2011,Andhra Pradesh,Hyderabad,National Environmental Engineering Research Institute,"Residential, Rural and other Areas",4.0,39.0,23.0,,"Tarnaka, NEERI Lab. IICT Campus, Hyderabad",,2011-12-15
583.0,15/12/2012,Andhra Pradesh,Guntur,Andhra Pradesh State Pollution Control Board,"Residential, Rural and other Areas",5.0,17.0,73.0,,"Near Hindu College, Market Road, Guntur",,2012-12-15
,15/2/2006,Andhra Pradesh,Hyderabad,,Residential and others,5.4,50.3,159.0,373.0,Paradise,,2006-02-15
,15/2/2008,Andhra Pradesh,Hyderabad,,Residential and others,5.7,31.4,102.0,240.0,Paradise,,2008-02-15
,15/2/2009,Andhra Pradesh,Hyderabad,,Residential and others,5.1,28.0,111.0,318.0,Charminar,,2009-02-15
582.0,15/2/2011,Andhra Pradesh,Chittoor,Andhra Pradesh State Pollution Control Board,Sensitive Area,4.0,9.0,35.0,106.0,"GNC Toll Gate Tirumala , Chittoor Dist.",,2011-02-15
,15/3/2006,Andhra Pradesh,Tirupati,,Sensitive Areas,4.0,9.0,45.0,114.0,Reg.Science Centre,,2006-03-15
,15/3/2008,Andhra Pradesh,Hyderabad,,Residential and others,5.1,33.6,63.0,162.0,Charminar,,2008-03-15
,15/3/2009,Andhra Pradesh,Hyderabad,,Industrial Areas,3.0,18.5,89.0,243.0,Nacharam,,2009-03-15
583.0,15/3/2011,Andhra Pradesh,Guntur,Andhra Pradesh State Pollution Control Board,"Residential, Rural and other Areas",4.0,12.5,74.0,191.0,"Near Hindu College, Market Road, Guntur",,2011-03-15
,15/4/2006,Andhra Pradesh,Hyderabad,,Residential and others,5.5,31.8,82.0,274.0,Paradise,,2006-04-15
,15/4/2008,Andhra Pradesh,Hyderabad,,Residential and others,5.3,37.7,93.0,290.0,Charminar,,2008-04-15
,15/4/2009,Andhra Pradesh,Hyderabad,,Residential and others,5.3,27.0,117.0,348.0,Charminar,,2009-04-15
583.0,15/4/2011,Andhra Pradesh,Guntur,Andhra Pradesh State Pollution Control Board,"Residential, Rural and other Areas",4.0,9.9,70.0,181.0,"Near Hindu College, Market Road, Guntur",,2011-04-15
,15/5/2006,Andhra Pradesh,Hyderabad,,Industrial Areas,5.2,31.4,92.0,272.0,Uppal,,2006-05-15
,15/5/2008,Andhra Pradesh,Hyderabad,,Industrial Areas,4.5,15.5,65.0,131.0,Nacharam,,2008-05-15
,15/5/2009,Andhra Pradesh,Hyderabad,,Industrial Areas,,8.1,38.0,129.0,Nacharam,,2009-05-15
95.0,15/5/2011,Andhra Pradesh,Hyderabad,Andhra Pradesh State Pollution Control Board,Industrial Area,5.0,32.0,158.0,303.0,"C.I.T.D., Balanagar, Plot no. A1 to A8, IDA, Hyderabad",,2011-05-15
642.0,15/5/2012,Maharashtra,Latur,Maharashtra State Pollution Control Board,"Residential, Rural and other Areas",6.0,17.0,155.0,,"Shyamnagar, Terrence of Keshavraj Vidyalaya, Latur",,2012-05-15
,15/6/2006,Andhra Pradesh,Hyderabad,,Industrial Areas,5.9,33.5,113.0,294.0,Uppal,,2006-06-15
,15/6/2008,Andhra Pradesh,Hyderabad,,Industrial Areas,,19.1,61.0,96.0,Nacharam,,2008-06-15
,15/6/2009,Andhra Pradesh,Hyderabad,,Industrial Areas,3.0,12.8,30.0,150.0,Nacharam,,2009-06-15
95.0,15/6/2011,Andhra Pradesh,Hyderabad,Andhra Pradesh State Pollution Control Board,Industrial Area,5.0,30.0,70.0,245.0,"C.I.T.D., Balanagar, Plot no. A1 to A8, IDA, Hyderabad",,2011-06-15
641.0,15/6/2012,Maharashtra,Latur,Maharashtra State Pollution Control Board,Industrial Area,6.0,10.0,41.0,,"MIDC, Water Works, Latur",,2012-06-15
,15/7/2006,Andhra Pradesh,Hyderabad,,Industrial Areas,5.5,31.2,77.0,235.0,C.I.T.D. Balanagar,,2006-07-15
,15/7/2008,Andhra Pradesh,Hyderabad,,Residential and others,5.2,34.8,128.0,372.0,Charminar,,2008-07-15
,15/7/2009,Andhra Pradesh,Guntur,,Residential and others,4.0,9.0,75.0,180.0,Hindu College Guntur,,2009-07-15
95.0,15/7/2011,Andhra Pradesh,Hyderabad,Andhra Pradesh State Pollution Control Board,Industrial Area,5.0,25.0,38.0,121.0,"C.I.T.D., Balanagar, Plot no. A1 to A8, IDA, Hyderabad",,2011-07-15
,15/8/2006,Andhra Pradesh,Hyderabad,,Residential and others,4.0,22.6,56.0,128.0,Mourya Inn,,2006-08-15
,15/8/2008,Assam,Dibrugarh,,Residential and others,4.3,9.6,29.0,51.0,Dibrugarh Off. Bldg,,2008-08-15
,15/8/2009,Gujarat,Ahmedabad,,Industrial Areas,18.3,21.6,92.0,200.0,Shardaban Hospital,,2009-08-15
389.0,15/8/2011,Andhra Pradesh,Tirupati,Andhra Pradesh State Pollution Control Board,Sensitive Area,4.0,9.0,36.0,95.0,"Regional Science Centre, Chittoor Bypass Road, Tirupati",,2011-08-15
,15/9/2006,Assam,Bongaigaon,,Residential and others,4.5,6.7,16.0,37.0,Barpara Office Bldg,,2006-09-15
,15/9/2008,Andhra Pradesh,Hyderabad,,Residential and others,4.7,28.3,109.0,309.0,Charminar,,2008-09-15
,15/9/2009,Andhra Pradesh,Hyderabad,,Residential and others,8.0,37.2,48.0,268.0,ABIDS Circle,,2009-09-15
582.0,15/9/2011,Andhra Pradesh,Chittoor,Andhra Pradesh State Pollution Control Board,Sensitive Area,4.0,9.0,34.0,97.0,"GNC Toll Gate Tirumala , Chittoor Dist.",,2011-09-15
641.0,15/9/2012,Maharashtra,Latur,Maharashtra State Pollution Control Board,Industrial Area,16.0,15.0,38.0,,"MIDC, Water Works, Latur",,2012-09-15
56,16-01-03,Delhi,Delhi,Central Pollution Control Board,Industrial Area,7.0,31.0,168.0,349.0,,,2003-01-16
95.0,16-01-04,Andhra Pradesh,Hyderabad,Andhra Pradesh State Pollution Control Board,Industrial Area,6.8,110.3,122.3,270.7,"C.I.T.D., Balanagar, Plot no. A1 to A8, IDA, Hyderabad",,2004-01-16
,16-01-05,Maharashtra,Nagpur,,Residential and others,9.0,24.6,47.0,205.0,Govt. Poly. College,,2005-01-16
,16-01-07,Andhra Pradesh,Hyderabad,,Industrial Areas,5.5,56.7,105.0,334.0,C.I.T.D. Balanagar,,2007-01-16
583.0,16-01-10,Andhra Pradesh,Guntur,Andhra Pradesh State Pollution Control Board,"Residential, Rural and other Areas",2.0,12.0,85.0,,"Near Hindu College, Market Road, Guntur",,2010-01-16
95.0,16-01-13,Andhra Pradesh,Hyderabad,Andhra Pradesh State Pollution Control Board,Industrial Area,5.0,64.0,231.0,,"C.I.T.D., Balanagar, Plot no. A1 to A8, IDA, Hyderabad",,2013-01-16
748.0,16-01-14,Andhra Pradesh,Ananthapur,Andhra Pradesh State Pollution Control Board,"Residential, Rural and other Areas",4.0,9.0,86.0,,"Kamalanagar, Ananthapur",,2014-01-16
233.0,16-01-15,Andhra Pradesh,Visakhapatnam,Andhra Pradesh State Pollution Control Board,Industrial Area,9.0,15.0,30.0,,"Industrial Estate, Marripalem, Visakhapatnam",,2015-01-16
95.0,16-02-04,Andhra Pradesh,Hyderabad,Andhra Pradesh State Pollution Control Board,Industrial Area,11.4,80.8,153.0,289.3,"C.I.T.D., Balanagar, Plot no. A1 to A8, IDA, Hyderabad",,2004-02-16
,16-02-05,Andhra Pradesh,Hyderabad,,Industrial Areas,10.8,22.1,79.0,182.0,Nacharam,,2005-02-16
,16-02-07,Andhra Pradesh,Hyderabad,,Industrial Areas,5.4,33.3,117.0,316.0,C.I.T.D. Balanagar,,2007-02-16
583.0,16-02-10,Andhra Pradesh,Guntur,Andhra Pradesh State Pollution Control Board,"Residential, Rural and other Areas",2.0,15.0,92.0,,"Near Hindu College, Market Road, Guntur",,2010-02-16
748.0,16-02-13,Andhra Pradesh,Ananthapur,Andhra Pradesh State Pollution Control Board,"Residential, Rural and other Areas",4.0,9.0,85.0,,"Kamalanagar, Ananthapur",,2013-02-16
583.0,16-02-14,Andhra Pradesh,Guntur,Andhra Pradesh State Pollution Control Board,"Residential, Rural and other Areas",5.0,21.0,78.0,,"Near Hindu College, Market Road, Guntur",,2014-02-16
233.0,16-02-15,Andhra Pradesh,Visakhapatnam,Andhra Pradesh State Pollution Control Board,Industrial Area,7.0,10.0,64.0,,"Industrial Estate, Marripalem, Visakhapatnam",,2015-02-16
193.0,16-03-04,Assam,Guwahati,Assam State Pollution Control Board,"Residential, Rural and other Areas",2.8,14.2,201.0,,"Head Office, Bamunimaidan, Guwahati",,2004-03-16
,16-03-05,Bihar,Patna,,Residential and others,22.0,33.0,98.0,155.0,Beltron Bhawan,,2005-03-16
,16-03-07,Andhra Pradesh,Hyderabad,,Industrial Areas,5.7,35.8,137.0,283.0,C.I.T.D. Balanagar,,2007-03-16
583.0,16-03-10,Andhra Pradesh,Guntur,Andhra Pradesh State Pollution Control Board,"Residential, Rural and other Areas",2.0,10.0,92.0,,"Near Hindu College, Market Road, Guntur",,2010-03-16
750.0,16-03-13,Andhra Pradesh,Eluru,Andhra Pradesh State Pollution Control Board,"Residential, Rural and other Areas",,,97.0,,"ASRAM Diagnostic Center, Eluru",,2013-03-16
750.0,16-03-14,Andhra Pradesh,Eluru,Andhra Pradesh State Pollution Control Board,"Residential, Rural and other Areas",,,105.0,,"ASRAM Diagnostic Center, Eluru",,2014-03-16
233.0,16-03-15,Andhra Pradesh,Visakhapatnam,Andhra Pradesh State Pollution Control Board,Industrial Area,7.0,11.0,53.0,,"Industrial Estate, Marripalem, Visakhapatnam",,2015-03-16
4.0,16-03-88,Uttar Pradesh,Agra,Uttar Pradesh  Pollution Control Board,"Residential, Rural and other Areas",16.5,8.7,,628.0,,,1988-03-16
58,16-04-03,Delhi,Delhi,Central Pollution Control Board,Industrial Area,8.0,26.0,100.0,281.0,,,2003-04-16
203.0,16-04-04,Andhra Pradesh,Hyderabad,Andhra Pradesh State Pollution Control Board,Industrial Area,4.4,51.8,81.3,288.7,"Uppal, Modern Foods & Industries IDA, Hyderabad",,2004-04-16
,16-04-05,Chandigarh,Chandigarh,,Industrial Areas,,29.0,104.0,454.0,Modern Foods,,2005-04-16
,16-04-07,Andhra Pradesh,Hyderabad,,Industrial Areas,5.5,32.3,104.0,273.0,Uppal,,2007-04-16
582.0,16-04-10,Andhra Pradesh,Chittoor,Andhra Pradesh State Pollution Control Board,Sensitive Area,4.0,9.0,44.0,,"GNC Toll Gate Tirumala , Chittoor Dist.",,2010-04-16
751.0,16-04-13,Andhra Pradesh,Srikakulam,Andhra Pradesh State Pollution Control Board,Industrial Area,4.0,9.0,100.0,,"IDA, Pydibheemavaram, Srikakulam",,2013-04-16
757.0,16-04-14,Andhra Pradesh,Rajahmundry,Andhra Pradesh State Pollution Control Board,Industrial Area,7.0,9.0,62.0,,"Staff Club Building, M/s A.P. Paper Mill, Rajahmundry",,2014-04-16
233.0,16-04-15,Andhra Pradesh,Visakhapatnam,Andhra Pradesh State Pollution Control Board,Industrial Area,7.0,14.0,118.0,,"Industrial Estate, Marripalem, Visakhapatnam",,2015-04-16
144,16-05-03,Delhi,Delhi,,"Residential, Rural and other Areas",7.0,53.0,,420.0,,,2003-05-16
233.0,16-05-04,Andhra Pradesh,Visakhapatnam,Andhra Pradesh State Pollution Control Board,Industrial Area,9.0,33.0,100.0,150.0,"Industrial Estate, Marripalem, Visakhapatnam",,2004-05-16
,16-05-05,Assam,Guwahati,,Residential and others,4.3,17.3,121.0,184.0,Paltanbazar,,2005-05-16
,16-05-07,Andhra Pradesh,Hyderabad,,Industrial Areas,5.4,31.2,91.0,286.0,C.I.T.D. Balanagar,,2007-05-16
150.0,16-05-10,Andhra Pradesh,Hyderabad,National Environmental Engineering Research Institute,"Residential, Rural and other Areas",5.0,19.0,87.0,,"Tarnaka, NEERI Lab. IICT Campus, Hyderabad",,2010-05-16
750.0,16-05-13,Andhra Pradesh,Eluru,Andhra Pradesh State Pollution Control Board,"Residential, Rural and other Areas",,,108.0,,"ASRAM Diagnostic Center, Eluru",,2013-05-16
757.0,16-05-14,Andhra Pradesh,Rajahmundry,Andhra Pradesh State Pollution Control Board,Industrial Area,7.0,9.0,62.0,,"Staff Club Building, M/s A.P. Paper Mill, Rajahmundry",,2014-05-16
233.0,16-05-15,Andhra Pradesh,Visakhapatnam,Andhra Pradesh State Pollution Control Board,Industrial Area,5.0,11.0,70.0,,"Industrial Estate, Marripalem, Visakhapatnam",,2015-05-16
6.0,16-05-88,Uttar Pradesh,Anpara,Uttar Pradesh  Pollution Control Board,Industrial Area,53.4,53.9,,658.0,,,1988-05-16
55,16-06-03,Delhi,Delhi,Central Pollution Control Board,Industrial Area,12.0,39.0,150.0,607.0,,,2003-06-16
233.0,16-06-04,Andhra Pradesh,Visakhapatnam,Andhra Pradesh State Pollution Control Board,Industrial Area,12.0,33.0,77.0,126.0,"Industrial Estate, Marripalem, Visakhapatnam",,2004-06-16
,16-06-05,Assam,Guwahati,,Residential and others,4.0,11.2,80.0,126.0,Fire Brigade Station,,2005-06-16
,16-06-07,Andhra Pradesh,Hyderabad,,Industrial Areas,5.4,30.5,50.0,200.0,C.I.T.D. Balanagar,,2007-06-16
583.0,16-06-10,Andhra Pradesh,Guntur,Andhra Pradesh State Pollution Control Board,"Residential, Rural and other Areas",2.0,12.0,83.0,,"Near Hindu College, Market Road, Guntur",,2010-06-16
750.0,16-06-13,Andhra Pradesh,Eluru,Andhra Pradesh State Pollution Control Board,"Residential, Rural and other Areas",9.0,13.0,147.0,,"ASRAM Diagnostic Center, Eluru",,2013-06-16
757.0,16-06-14,Andhra Pradesh,Rajahmundry,Andhra Pradesh State Pollution Control Board,Industrial Area,7.0,9.0,62.0,,"Staff Club Building, M/s A.P. Paper Mill, Rajahmundry",,2014-06-16
233.0,16-06-15,Andhra Pradesh,Visakhapatnam,Andhra Pradesh State Pollution Control Board,Industrial Area,6.0,12.0,28.0,,"Industrial Estate, Marripalem, Visakhapatnam",,2015-06-16
55,16-07-03,Delhi,Delhi,Central Pollution Control Board,Industrial Area,13.0,51.0,73.0,130.0,,,2003-07-16
233.0,16-07-04,Andhra Pradesh,Visakhapatnam,Andhra Pradesh State Pollution Control Board,Industrial Area,8.0,31.0,80.0,133.0,"Industrial Estate, Marripalem, Visakhapatnam",,2004-07-16
,16-07-05,Andhra Pradesh,Hyderabad,,Industrial Areas,4.6,26.4,58.0,512.0,C.I.T.D. Balanagar,,2005-07-16
,16-07-07,Andhra Pradesh,Hyderabad,,Industrial Areas,5.3,27.7,52.0,272.0,C.I.T.D. Balanagar,,2007-07-16
582.0,16-07-10,Andhra Pradesh,Chittoor,Andhra Pradesh State Pollution Control Board,Sensitive Area,4.0,9.0,44.0,,"GNC Toll Gate Tirumala , Chittoor Dist.",,2010-07-16
750.0,16-07-13,Andhra Pradesh,Eluru,Andhra Pradesh State Pollution Control Board,"Residential, Rural and other Areas",4.0,17.0,111.0,,"ASRAM Diagnostic Center, Eluru",,2013-07-16
750.0,16-07-14,Andhra Pradesh,Eluru,Andhra Pradesh State Pollution Control Board,"Residential, Rural and other Areas",,,95.0,,"ASRAM Diagnostic Center, Eluru",,2014-07-16
233.0,16-07-15,Andhra Pradesh,Visakhapatnam,Andhra Pradesh State Pollution Control Board,Industrial Area,7.0,16.0,22.0,,"Industrial Estate, Marripalem, Visakhapatnam",,2015-07-16
146,16-08-03,Delhi,Delhi,,"Residential, Rural and other Areas",8.0,39.0,,114.0,,,2003-08-16
95.0,16-08-04,Andhra Pradesh,Hyderabad,Andhra Pradesh State Pollution Control Board,Industrial Area,4.7,29.0,50.7,130.3,"C.I.T.D., Balanagar, Plot no. A1 to A8, IDA, Hyderabad",,2004-08-16
,16-08-05,Andhra Pradesh,Hyderabad,,Industrial Areas,4.3,19.7,39.0,335.0,C.I.T.D. Balanagar,,2005-08-16
,16-08-07,Andhra Pradesh,Hyderabad,,Industrial Areas,4.9,39.4,54.0,336.0,C.I.T.D. Balanagar,,2007-08-16
582.0,16-08-10,Andhra Pradesh,Chittoor,Andhra Pradesh State Pollution Control Board,Sensitive Area,4.0,9.0,38.0,,"GNC Toll Gate Tirumala , Chittoor Dist.",,2010-08-16
751.0,16-08-13,Andhra Pradesh,Srikakulam,Andhra Pradesh State Pollution Control Board,Industrial Area,12.0,16.0,66.0,,"IDA, Pydibheemavaram, Srikakulam",,2013-08-16
750.0,16-08-14,Andhra Pradesh,Eluru,Andhra Pradesh State Pollution Control Board,"Residential, Rural and other Areas",,,99.0,,"ASRAM Diagnostic Center, Eluru",,2014-08-16
233.0,16-08-15,Andhra Pradesh,Visakhapatnam,Andhra Pradesh State Pollution Control Board,Industrial Area,6.0,17.0,67.0,,"Industrial Estate, Marripalem, Visakhapatnam",,2015-08-16
37,16-08-88,Goa,Vasco,Goa Pollution Control Board,Industrial Area,6.2,19.6,,94.0,,,1988-08-16
59,16-09-03,Delhi,Delhi,Central Pollution Control Board,"Residential, Rural and other Areas",11.0,45.0,79.0,175.0,,,2003-09-16
393.0,16-09-04,Andhra Pradesh,Hyderabad,Andhra Pradesh State Pollution Control Board,"Residential, Rural and other Areas",2.9,22.7,73.7,204.3,"Paradise, Hyderabad",,2004-09-16
,16-09-05,Andhra Pradesh,Hyderabad,,Industrial Areas,5.8,25.1,79.0,177.0,C.I.T.D. Balanagar,,2005-09-16
,16-09-07,Andhra Pradesh,Kurnool,,Residential and others,4.0,,,,Mourya Inn,,2007-09-16
150.0,16-09-10,Andhra Pradesh,Hyderabad,National Environmental Engineering Research Institute,"Residential, Rural and other Areas",4.0,19.0,30.0,,"Tarnaka, NEERI Lab. IICT Campus, Hyderabad",,2010-09-16
751.0,16-09-13,Andhra Pradesh,Srikakulam,Andhra Pradesh State Pollution Control Board,Industrial Area,10.0,15.0,48.0,,"IDA, Pydibheemavaram, Srikakulam",,2013-09-16
751.0,16-09-14,Andhra Pradesh,Srikakulam,Andhra Pradesh State Pollution Control Board,Industrial Area,13.0,20.0,53.0,,"IDA, Pydibheemavaram, Srikakulam",,2014-09-16
233.0,16-09-15,Andhra Pradesh,Visakhapatnam,Andhra Pradesh State Pollution Control Board,Industrial Area,6.0,14.0,41.0,,"Industrial Estate, Marripalem, Visakhapatnam",,2015-09-16
55,16-10-03,Delhi,Delhi,Central Pollution Control Board,Industrial Area,14.0,44.0,119.0,466.0,,,2003-10-16
233.0,16-10-04,Andhra Pradesh,Visakhapatnam,Andhra Pradesh State Pollution Control Board,Industrial Area,12.0,35.0,93.0,134.0,"Industrial Estate, Marripalem, Visakhapatnam",,2004-10-16
,16-10-05,Andhra Pradesh,Hyderabad,,Residential and others,5.4,28.6,81.0,212.0,Charminar,,2005-10-16
,16-10-07,Andhra Pradesh,Hyderabad,,Industrial Areas,5.2,30.1,113.0,365.0,C.I.T.D. Balanagar,,2007-10-16
466.0,16-10-10,Andhra Pradesh,Kurnool,Andhra Pradesh State Pollution Control Board,"Residential, Rural and other Areas",4.0,9.0,70.0,,"Mourya Inn, Kurnool",,2010-10-16
751.0,16-10-13,Andhra Pradesh,Srikakulam,Andhra Pradesh State Pollution Control Board,Industrial Area,21.0,27.0,55.0,,"IDA, Pydibheemavaram, Srikakulam",,2013-10-16
757.0,16-10-14,Andhra Pradesh,Rajahmundry,Andhra Pradesh State Pollution Control Board,Industrial Area,11.0,19.0,58.0,,"Staff Club Building, M/s A.P. Paper Mill, Rajahmundry",,2014-10-16
233.0,16-10-15,Andhra Pradesh,Visakhapatnam,Andhra Pradesh State Pollution Control Board,Industrial Area,7.0,18.0,86.0,,"Industrial Estate, Marripalem, Visakhapatnam",,2015-10-16
144,16-11-03,Delhi,Delhi,,"Residential, Rural and other Areas",11.0,59.0,,382.0,,,2003-11-16
393.0,16-11-04,Andhra Pradesh,Hyderabad,Andhra Pradesh State Pollution Control Board,"Residential, Rural and other Areas",3.1,28.5,,,"Paradise, Hyderabad",,2004-11-16
,16-11-05,Andhra Pradesh,Hyderabad,,Industrial Areas,4.8,36.9,117.0,379.0,C.I.T.D. Balanagar,,2005-11-16
,16-11-07,Andhra Pradesh,Hyderabad,,Industrial Areas,6.2,41.0,126.0,347.0,C.I.T.D. Balanagar,,2007-11-16
583.0,16-11-10,Andhra Pradesh,Guntur,Andhra Pradesh State Pollution Control Board,"Residential, Rural and other Areas",2.0,10.0,78.0,,"Near Hindu College, Market Road, Guntur",,2010-11-16
748.0,16-11-13,Andhra Pradesh,Ananthapur,Andhra Pradesh State Pollution Control Board,"Residential, Rural and other Areas",4.0,16.0,49.0,,"Kamalanagar, Ananthapur",,2013-11-16
757.0,16-11-14,Andhra Pradesh,Rajahmundry,Andhra Pradesh State Pollution Control Board,Industrial Area,10.0,17.0,54.0,,"Staff Club Building, M/s A.P. Paper Mill, Rajahmundry",,2014-11-16
233.0,16-11-15,Andhra Pradesh,Visakhapatnam,Andhra Pradesh State Pollution Control Board,Industrial Area,8.0,20.0,63.0,,"Industrial Estate, Marripalem, Visakhapatnam",,2015-11-16
3.0,16-11-87,Uttar Pradesh,Agra,Uttar Pradesh Pollution Control Board,Industrial,6.1,4.3,,401.0,,,1987-11-16
55,16-12-03,Delhi,Delhi,Central Pollution Control Board,Industrial Area,11.0,52.0,114.0,234.0,,,2003-12-16
393.0,16-12-04,Andhra Pradesh,Hyderabad,Andhra Pradesh State Pollution Control Board,"Residential, Rural and other Areas",3.3,35.6,161.0,565.0,"Paradise, Hyderabad",,2004-12-16
,16-12-05,Andhra Pradesh,Hyderabad,,Industrial Areas,4.8,33.5,140.0,367.0,C.I.T.D. Balanagar,,2005-12-16
,16-12-07,Andhra Pradesh,Hyderabad,,Industrial Areas,5.5,34.5,111.0,337.0,C.I.T.D. Balanagar,,2007-12-16
581.0,16-12-10,Andhra Pradesh,Khammam,Andhra Pradesh State Pollution Control Board,"Residential, Rural and other Areas",2.0,10.0,79.0,,"CER Club,S.C.C.L. township, writter basti, Kothagudem, Khammam Dist.",,2010-12-16
95.0,16-12-13,Andhra Pradesh,Hyderabad,Andhra Pradesh State Pollution Control Board,Industrial Area,5.0,34.0,266.0,,"C.I.T.D., Balanagar, Plot no. A1 to A8, IDA, Hyderabad",,2013-12-16
757.0,16-12-14,Andhra Pradesh,Rajahmundry,Andhra Pradesh State Pollution Control Board,Industrial Area,5.0,10.0,69.0,,"Staff Club Building, M/s A.P. Paper Mill, Rajahmundry",,2014-12-16
233.0,16-12-15,Andhra Pradesh,Visakhapatnam,Andhra Pradesh State Pollution Control Board,Industrial Area,7.0,17.0,78.0,,"Industrial Estate, Marripalem, Visakhapatnam",,2015-12-16
7.0,16-12-87,Uttar Pradesh,Anpara,Uttar Pradesh  Pollution Control Board,Industrial,68.9,39.7,,648.0,,,1987-12-16
1.0,16-12-88,Uttar Pradesh,Agra,Central Pollution Control Board,Sensitive,19.2,9.3,,352.0,,,1988-12-16
,16/01/2006,Maharashtra,Aurangabad (MS),,Sensitive Areas,4.3,22.3,,,Bibi-Ka-Maqbara,,2006-01-16
155,16/01/2011,Gujarat,Ahmedabad,National Environmental Engineering Research Institute,"Residential, Rural and other Areas",12.0,17.0,64.0,,"R.C. High School, Mirzapur, Ahmadabad",,2011-01-16
583.0,16/01/2012,Andhra Pradesh,Guntur,Andhra Pradesh State Pollution Control Board,"Residential, Rural and other Areas",5.0,11.0,77.0,,"Near Hindu College, Market Road, Guntur",,2012-01-16
,16/02/2006,Maharashtra,Aurangabad (MS),,Residential and others,5.0,23.0,,,C.A.D.A. Office,,2006-02-16
146,16/02/2011,Delhi,Delhi,National Environmental Engineering Research Institute,"Residential, Rural and other Areas",2.0,77.0,162.0,,"Town Hall, Ayurvedic Dispensary, Chandni Chowk, Delhi",,2011-02-16
578.0,16/02/2012,Andhra Pradesh,Kakinada,Andhra Pradesh State Pollution Control Board,"Residential, Rural and other Areas",,,57.0,,"Top of the Office Building Ramanayyapeta, Kakinada",,2012-02-16
,16/03/2006,Maharashtra,Aurangabad (MS),,Residential and others,4.2,22.0,,,C.A.D.A. Office,,2006-03-16
60,16/03/2011,Delhi,Delhi,Central Pollution Control Board,"Residential, Rural and other Areas",4.0,43.0,247.0,,"Siri Fort, Delhi",,2011-03-16
578.0,16/03/2012,Andhra Pradesh,Kakinada,Andhra Pradesh State Pollution Control Board,"Residential, Rural and other Areas",,,60.0,,"Top of the Office Building Ramanayyapeta, Kakinada",,2012-03-16
,16/04/2006,Maharashtra,Thane,,Residential and others,9.8,13.0,54.0,,Kopri,,2006-04-16
560,16/04/2011,Daman & Diu,Daman,"Daman Diu, Dadra & Nagar Heveli Pollution Control Committee",Industrial Area,7.5,19.6,,43.0,"Kadaiya Industrial Area, Village- Kadaiya, Daman (Industrial Area)",,2011-04-16
583.0,16/04/2012,Andhra Pradesh,Guntur,Andhra Pradesh State Pollution Control Board,"Residential, Rural and other Areas",6.0,11.0,75.0,,"Near Hindu College, Market Road, Guntur",,2012-04-16
,16/05/2006,Maharashtra,Chandrapur,,Industrial Areas,30.5,39.7,39.0,87.0,M.I.D.C.,,2006-05-16
558.0,16/05/2011,Dadra & Nagar Haveli,Khadoli,"Daman Diu, Dadra & Nagar Heveli Pollution Control Committee",Industrial Area,7.4,18.6,,38.0,"Khadoli Industrial Area, Village- Khadoli, Silvassa",,2011-05-16
583.0,16/05/2012,Andhra Pradesh,Guntur,Andhra Pradesh State Pollution Control Board,"Residential, Rural and other Areas",6.0,11.0,74.0,,"Near Hindu College, Market Road, Guntur",,2012-05-16
,16/06/2006,Maharashtra,Aurangabad (MS),,Residential and others,6.0,17.2,46.0,128.0,S.B.E.S. College,,2006-06-16
558.0,16/06/2011,Dadra & Nagar Haveli,Khadoli,"Daman Diu, Dadra & Nagar Heveli Pollution Control Committee",Industrial Area,7.4,19.3,,42.0,"Khadoli Industrial Area, Village- Khadoli, Silvassa",,2011-06-16
466.0,16/06/2012,Andhra Pradesh,Kurnool,Andhra Pradesh State Pollution Control Board,"Residential, Rural and other Areas",4.0,9.0,85.0,,"Mourya Inn, Kurnool",,2012-06-16
,16/07/2006,Maharashtra,Navi Mumbai,,Residential and others,8.3,11.5,16.0,,Nerul,,2006-07-16
560,16/07/2011,Daman & Diu,Daman,"Daman Diu, Dadra & Nagar Heveli Pollution Control Committee",Industrial Area,7.5,19.4,,25.0,"Kadaiya Industrial Area, Village- Kadaiya, Daman (Industrial Area)",,2011-07-16
233.0,16/07/2012,Andhra Pradesh,Visakhapatnam,Andhra Pradesh State Pollution Control Board,Industrial Area,4.0,10.0,59.0,,"Industrial Estate, Marripalem, Visakhapatnam",,2012-07-16
,16/08/2006,Maharashtra,Chandrapur,,Industrial Areas,36.2,46.2,136.0,163.0,M.I.D.C.,,2006-08-16
560,16/08/2011,Daman & Diu,Daman,"Daman Diu, Dadra & Nagar Heveli Pollution Control Committee",Industrial Area,7.3,20.1,,27.0,"Kadaiya Industrial Area, Village- Kadaiya, Daman (Industrial Area)",,2011-08-16
233.0,16/08/2012,Andhra Pradesh,Visakhapatnam,Andhra Pradesh State Pollution Control Board,Industrial Area,8.0,15.0,101.0,,"Industrial Estate, Marripalem, Visakhapatnam",,2012-08-16
,16/09/2006,Maharashtra,Aurangabad (MS),,Residential and others,2.8,15.7,38.0,120.0,S.B.E.S. College,,2006-09-16
560,16/09/2011,Daman & Diu,Daman,"Daman Diu, Dadra & Nagar Heveli Pollution Control Committee",Industrial Area,7.3,19.6,,39.0,"Kadaiya Industrial Area, Village- Kadaiya, Daman (Industrial Area)",,2011-09-16
233.0,16/09/2012,Andhra Pradesh,Visakhapatnam,Andhra Pradesh State Pollution Control Board,Industrial Area,4.0,11.0,75.0,,"Industrial Estate, Marripalem, Visakhapatnam",,2012-09-16
,16/1/2006,Andhra Pradesh,Hyderabad,,Industrial Areas,2.9,9.0,39.0,104.0,Nacharam,,2006-01-16
,16/1/2008,Andhra Pradesh,Hyderabad,,Industrial Areas,3.0,10.4,60.0,106.0,Nacharam,,2008-01-16
,16/1/2009,Andhra Pradesh,Hyderabad,,Industrial Areas,4.7,29.0,95.0,274.0,C.I.T.D. Balanagar,,2009-01-16
95.0,16/1/2011,Andhra Pradesh,Hyderabad,Andhra Pradesh State Pollution Control Board,Industrial Area,4.0,35.0,138.0,300.0,"C.I.T.D., Balanagar, Plot no. A1 to A8, IDA, Hyderabad",,2011-01-16
642.0,16/1/2012,Maharashtra,Latur,Maharashtra State Pollution Control Board,"Residential, Rural and other Areas",4.0,9.0,90.0,,"Shyamnagar, Terrence of Keshavraj Vidyalaya, Latur",,2012-01-16
,16/10/2006,Andhra Pradesh,Hyderabad,,Industrial Areas,5.1,41.7,128.0,399.0,C.I.T.D. Balanagar,,2006-10-16
,16/10/2008,Andhra Pradesh,Hyderabad,,Industrial Areas,5.0,28.8,101.0,298.0,C.I.T.D. Balanagar,,2008-10-16
,16/10/2009,Andhra Pradesh,Hyderabad,,Industrial Areas,4.3,39.9,220.0,458.0,C.I.T.D. Balanagar,,2009-10-16
150.0,16/10/2011,Andhra Pradesh,Hyderabad,National Environmental Engineering Research Institute,"Residential, Rural and other Areas",4.0,39.0,19.0,,"Tarnaka, NEERI Lab. IICT Campus, Hyderabad",,2011-10-16
578.0,16/10/2012,Andhra Pradesh,Kakinada,Andhra Pradesh State Pollution Control Board,"Residential, Rural and other Areas",,,58.0,,"Top of the Office Building Ramanayyapeta, Kakinada",,2012-10-16
,16/11/2006,Andhra Pradesh,Hyderabad,,Residential and others,4.0,17.7,76.0,155.0,Mourya Inn,,2006-11-16
,16/11/2008,Andhra Pradesh,Hyderabad,,Industrial Areas,5.2,27.8,104.0,307.0,C.I.T.D. Balanagar,,2008-11-16
,16/11/2009,Andhra Pradesh,Guntur,,Residential and others,4.0,9.0,81.0,209.0,Hindu College Guntur,,2009-11-16
583.0,16/11/2011,Andhra Pradesh,Guntur,Andhra Pradesh State Pollution Control Board,"Residential, Rural and other Areas",4.6,9.6,74.0,185.0,"Near Hindu College, Market Road, Guntur",,2011-11-16
578.0,16/11/2012,Andhra Pradesh,Kakinada,Andhra Pradesh State Pollution Control Board,"Residential, Rural and other Areas",,,53.0,,"Top of the Office Building Ramanayyapeta, Kakinada",,2012-11-16
,16/12/2006,Andhra Pradesh,Hyderabad,,Residential and others,4.0,14.8,92.0,191.0,Mourya Inn,,2006-12-16
,16/12/2008,Andhra Pradesh,Hyderabad,,Industrial Areas,5.1,28.3,102.0,304.0,C.I.T.D. Balanagar,,2008-12-16
,16/12/2009,Andhra Pradesh,Hyderabad,,Industrial Areas,5.8,28.9,105.0,284.0,C.I.T.D. Balanagar,,2009-12-16
95.0,16/12/2011,Andhra Pradesh,Hyderabad,Andhra Pradesh State Pollution Control Board,Industrial Area,5.0,37.0,189.0,350.0,"C.I.T.D., Balanagar, Plot no. A1 to A8, IDA, Hyderabad",,2011-12-16
233.0,16/12/2012,Andhra Pradesh,Visakhapatnam,Andhra Pradesh State Pollution Control Board,Industrial Area,11.0,10.0,60.0,,"Industrial Estate, Marripalem, Visakhapatnam",,2012-12-16
,16/2/2006,Andhra Pradesh,Hyderabad,,Industrial Areas,,10.8,65.0,183.0,Nacharam,,2006-02-16
,16/2/2008,Andhra Pradesh,Hyderabad,,Industrial Areas,5.2,27.3,125.0,330.0,C.I.T.D. Balanagar,,2008-02-16
,16/2/2009,Andhra Pradesh,Hyderabad,,Industrial Areas,4.9,28.3,111.0,317.0,C.I.T.D. Balanagar,,2009-02-16
95.0,16/2/2011,Andhra Pradesh,Hyderabad,Andhra Pradesh State Pollution Control Board,Industrial Area,4.0,30.0,144.0,360.0,"C.I.T.D., Balanagar, Plot no. A1 to A8, IDA, Hyderabad",,2011-02-16
,16/3/2006,Andhra Pradesh,Tirupati,,Sensitive Areas,4.0,9.2,46.0,115.0,Reg.Science Centre,,2006-03-16
,16/3/2008,Andhra Pradesh,Hyderabad,,Industrial Areas,5.1,32.9,79.0,289.0,C.I.T.D. Balanagar,,2008-03-16
,16/3/2009,Andhra Pradesh,Hyderabad,,Industrial Areas,5.2,27.7,104.0,312.0,C.I.T.D. Balanagar,,2009-03-16
582.0,16/3/2011,Andhra Pradesh,Chittoor,Andhra Pradesh State Pollution Control Board,Sensitive Area,4.0,9.0,42.0,114.0,"GNC Toll Gate Tirumala , Chittoor Dist.",,2011-03-16
641.0,16/3/2012,Maharashtra,Latur,Maharashtra State Pollution Control Board,Industrial Area,8.0,16.0,199.0,,"MIDC, Water Works, Latur",,2012-03-16
,16/4/2006,Andhra Pradesh,Hyderabad,,Industrial Areas,4.9,30.7,115.0,202.0,Uppal,,2006-04-16
,16/4/2008,Andhra Pradesh,Hyderabad,,Industrial Areas,2.8,12.7,55.0,109.0,Nacharam,,2008-04-16
,16/4/2009,Andhra Pradesh,Hyderabad,,Industrial Areas,5.2,25.5,115.0,334.0,C.I.T.D. Balanagar,,2009-04-16
583.0,16/4/2011,Andhra Pradesh,Guntur,Andhra Pradesh State Pollution Control Board,"Residential, Rural and other Areas",4.0,10.1,76.0,193.0,"Near Hindu College, Market Road, Guntur",,2011-04-16
642.0,16/4/2012,Maharashtra,Latur,Maharashtra State Pollution Control Board,"Residential, Rural and other Areas",5.0,12.0,205.0,,"Shyamnagar, Terrence of Keshavraj Vidyalaya, Latur",,2012-04-16
,16/5/2006,Andhra Pradesh,Hyderabad,,Industrial Areas,7.0,31.5,96.0,296.0,C.I.T.D. Balanagar,,2006-05-16
,16/5/2008,Andhra Pradesh,Hyderabad,,Industrial Areas,5.7,34.2,132.0,364.0,C.I.T.D. Balanagar,,2008-05-16
,16/5/2009,Andhra Pradesh,Hyderabad,,Industrial Areas,5.1,26.3,97.0,301.0,C.I.T.D. Balanagar,,2009-05-16
106.0,16/5/2011,Chandigarh,Chandigarh,Chandigarh Pollution Control Committee,Industrial Area,2.0,34.0,92.0,264.0,"Modern Foods, Industrial Area, Chandigarh",,2011-05-16
,16/6/2006,Andhra Pradesh,Hyderabad,,Industrial Areas,6.8,28.2,118.0,335.0,C.I.T.D. Balanagar,,2006-06-16
,16/6/2008,Andhra Pradesh,Hyderabad,,Industrial Areas,5.2,34.2,105.0,300.0,C.I.T.D. Balanagar,,2008-06-16
,16/6/2009,Andhra Pradesh,Hyderabad,,Industrial Areas,4.9,25.5,109.0,314.0,C.I.T.D. Balanagar,,2009-06-16
577.0,16/6/2011,Andhra Pradesh,Nalgonda,Andhra Pradesh State Pollution Control Board,"Residential, Rural and other Areas",4.0,23.0,83.0,,"Beside Regional Office, APPCB Nalgonda",,2011-06-16
641.0,16/6/2012,Maharashtra,Latur,Maharashtra State Pollution Control Board,Industrial Area,6.0,11.0,36.0,,"MIDC, Water Works, Latur",,2012-06-16
,16/7/2006,Andhra Pradesh,Hyderabad,,Residential and others,5.7,32.3,102.0,297.0,Charminar,,2006-07-16
,16/7/2008,Andhra Pradesh,Hyderabad,,Industrial Areas,5.2,34.2,113.0,346.0,C.I.T.D. Balanagar,,2008-07-16
,16/7/2009,Andhra Pradesh,Guntur,,Residential and others,4.0,9.0,80.0,193.0,Hindu College Guntur,,2009-07-16
284.0,16/7/2011,Bihar,Patna,Bihar Sate Pollution Control Board,"Residential, Rural and other Areas",7.0,37.0,63.0,,"Gandhi Maidan Test Centre,Patna",,2011-07-16
642.0,16/7/2012,Maharashtra,Latur,Maharashtra State Pollution Control Board,"Residential, Rural and other Areas",8.0,10.0,40.0,,"Shyamnagar, Terrence of Keshavraj Vidyalaya, Latur",,2012-07-16
,16/8/2006,Andhra Pradesh,Hyderabad,,Residential and others,5.5,35.8,98.0,298.0,Charminar,,2006-08-16
,16/8/2008,Andhra Pradesh,Hyderabad,,Industrial Areas,5.0,34.5,97.0,277.0,C.I.T.D. Balanagar,,2008-08-16
,16/8/2009,Andhra Pradesh,Hyderabad,,Industrial Areas,4.4,24.6,73.0,219.0,C.I.T.D. Balanagar,,2009-08-16
582.0,16/8/2011,Andhra Pradesh,Chittoor,Andhra Pradesh State Pollution Control Board,Sensitive Area,4.0,9.0,41.0,96.0,"GNC Toll Gate Tirumala , Chittoor Dist.",,2011-08-16
,16/9/2006,Andhra Pradesh,Hyderabad,,Residential and others,5.7,33.3,62.0,173.0,Charminar,,2006-09-16
,16/9/2008,Andhra Pradesh,Hyderabad,,Industrial Areas,5.1,28.8,94.0,273.0,C.I.T.D. Balanagar,,2008-09-16
,16/9/2009,Andhra Pradesh,Guntur,,Residential and others,4.0,9.0,98.0,249.0,Hindu College Guntur,,2009-09-16
150.0,16/9/2011,Andhra Pradesh,Hyderabad,National Environmental Engineering Research Institute,"Residential, Rural and other Areas",3.0,37.0,37.0,,"Tarnaka, NEERI Lab. IICT Campus, Hyderabad",,2011-09-16
55,17-01-03,Delhi,Delhi,Central Pollution Control Board,Industrial Area,13.0,39.0,192.0,323.0,,,2003-01-17
210.0,17-01-04,Bihar,Patna,Bihar Sate Pollution Control Board,"Residential, Rural and other Areas",12.0,34.0,96.0,157.0,"Beltron Bhawan, Shastri Nagar, Patna",,2004-01-17
,17-01-05,Andhra Pradesh,Hyderabad,,Industrial Areas,4.8,37.1,113.0,277.0,C.I.T.D. Balanagar,,2005-01-17
,17-01-07,Andhra Pradesh,Hyderabad,,Residential and others,5.0,42.0,119.0,343.0,Charminar,,2007-01-17
577.0,17-01-10,Andhra Pradesh,Nalgonda,Andhra Pradesh State Pollution Control Board,"Residential, Rural and other Areas",5.0,25.0,114.0,,"Beside Regional Office, APPCB Nalgonda",,2010-01-17
387.0,17-01-13,Andhra Pradesh,Visakhapatnam,Andhra Pradesh State Pollution Control Board,Sensitive Area,4.0,9.0,63.0,,"INS-Virabahu, Naval Area, Visakhapatnam",,2013-01-17
520.0,17-01-14,Assam,Bongaigaon,Assam State Pollution Control Board,"Residential, Rural and other Areas",8.0,15.0,99.0,,"Barpara Office Building, Bongaigaon",,2014-01-17
193.0,17-01-15,Assam,Guwahati,Assam State Pollution Control Board,"Residential, Rural and other Areas",7.0,14.0,64.0,,"Head Office, Bamunimaidan, Guwahati",,2015-01-17
58,17-02-03,Delhi,Delhi,Central Pollution Control Board,Industrial Area,8.0,26.0,99.0,385.0,,,2003-02-17
193.0,17-02-04,Assam,Guwahati,Assam State Pollution Control Board,"Residential, Rural and other Areas",2.7,13.7,207.0,,"Head Office, Bamunimaidan, Guwahati",,2004-02-17
,17-02-05,Andhra Pradesh,Hyderabad,,Residential and others,5.3,38.0,177.0,458.0,Paradise,,2005-02-17
,17-02-07,Andhra Pradesh,Hyderabad,,Residential and others,5.0,34.3,132.0,364.0,Charminar,,2007-02-17
583.0,17-02-10,Andhra Pradesh,Guntur,Andhra Pradesh State Pollution Control Board,"Residential, Rural and other Areas",2.0,15.0,87.0,,"Near Hindu College, Market Road, Guntur",,2010-02-17
777,17-02-13,Goa,Sanguem,Goa State Pollution Control Board,"Residential, Rural and other Areas",12.0,15.0,55.0,32.84,"Near Railway Station at Kalem, Sanguem",,2013-02-17
748.0,17-02-14,Andhra Pradesh,Ananthapur,Andhra Pradesh State Pollution Control Board,"Residential, Rural and other Areas",5.0,10.0,103.0,,"Kamalanagar, Ananthapur",,2014-02-17
193.0,17-02-15,Assam,Guwahati,Assam State Pollution Control Board,"Residential, Rural and other Areas",8.0,14.0,111.0,,"Head Office, Bamunimaidan, Guwahati",,2015-02-17
7.0,17-02-88,Uttar Pradesh,Anpara,Uttar Pradesh  Pollution Control Board,Industrial Area,57.7,42.6,,466.0,,,1988-02-17
58,17-03-03,Delhi,Delhi,Central Pollution Control Board,Industrial Area,13.0,32.0,98.0,264.0,,,2003-03-17
233.0,17-03-04,Andhra Pradesh,Visakhapatnam,Andhra Pradesh State Pollution Control Board,Industrial Area,11.0,32.0,102.0,162.0,"Industrial Estate, Marripalem, Visakhapatnam",,2004-03-17
,17-03-05,Andhra Pradesh,Hyderabad,,Industrial Areas,17.8,13.8,57.0,118.0,Nacharam,,2005-03-17
,17-03-07,Andhra Pradesh,Hyderabad,,Residential and others,5.0,32.8,157.0,381.0,Charminar,,2007-03-17
583.0,17-03-10,Andhra Pradesh,Guntur,Andhra Pradesh State Pollution Control Board,"Residential, Rural and other Areas",2.0,11.0,88.0,,"Near Hindu College, Market Road, Guntur",,2010-03-17
750.0,17-03-13,Andhra Pradesh,Eluru,Andhra Pradesh State Pollution Control Board,"Residential, Rural and other Areas",,,113.0,,"ASRAM Diagnostic Center, Eluru",,2013-03-17
566.0,17-03-14,Assam,Daranga,Assam State Pollution Control Board,"Residential, Rural and other Areas",6.0,18.0,126.0,,"Daranga, Baska district, BATAD,Assam near Sandoop Jhankar town of Bhutan",,2014-03-17
193.0,17-03-15,Assam,Guwahati,Assam State Pollution Control Board,"Residential, Rural and other Areas",10.0,16.0,203.0,,"Head Office, Bamunimaidan, Guwahati",,2015-03-17
56,17-04-03,Delhi,Delhi,Central Pollution Control Board,Industrial Area,5.0,16.0,231.0,,,,2003-04-17
95.0,17-04-04,Andhra Pradesh,Hyderabad,Andhra Pradesh State Pollution Control Board,Industrial Area,6.1,59.5,129.0,355.3,"C.I.T.D., Balanagar, Plot no. A1 to A8, IDA, Hyderabad",,2004-04-17
,17-04-05,Andhra Pradesh,Hyderabad,,Industrial Areas,4.6,68.8,71.0,462.0,Uppal,,2005-04-17
,17-04-07,Andhra Pradesh,Hyderabad,,Residential and others,5.1,27.2,109.0,325.0,Charminar,,2007-04-17
580.0,17-04-10,Andhra Pradesh,Nellore,Andhra Pradesh State Pollution Control Board,"Residential, Rural and other Areas",2.0,11.0,70.0,,"Venkatareddy nagar, Vedayapalem, Nellore",,2010-04-17
520.0,17-04-13,Assam,Bongaigaon,Assam State Pollution Control Board,"Residential, Rural and other Areas",6.0,13.0,23.0,,"Barpara Office Building, Bongaigaon",,2013-04-17
750.0,17-04-14,Andhra Pradesh,Eluru,Andhra Pradesh State Pollution Control Board,"Residential, Rural and other Areas",,,121.0,,"ASRAM Diagnostic Center, Eluru",,2014-04-17
193.0,17-04-15,Assam,Guwahati,Assam State Pollution Control Board,"Residential, Rural and other Areas",11.0,18.0,154.0,,"Head Office, Bamunimaidan, Guwahati",,2015-04-17
84.0,17-05-03,Madhya Pradesh,Nagda,Madhya Pradesh  Pollution Control Board,"Residential, Rural and other Areas",0.0,0.0,0.0,0.0,,,2003-05-17
95.0,17-05-04,Andhra Pradesh,Hyderabad,Andhra Pradesh State Pollution Control Board,Industrial Area,5.2,38.0,63.0,143.0,"C.I.T.D., Balanagar, Plot no. A1 to A8, IDA, Hyderabad",,2004-05-17
,17-05-05,Andhra Pradesh,Hyderabad,,Industrial Areas,2.4,18.7,54.0,118.0,Nacharam,,2005-05-17
,17-05-07,Andhra Pradesh,Hyderabad,,Residential and others,5.4,28.1,92.0,306.0,Charminar,,2007-05-17
583.0,17-05-10,Andhra Pradesh,Guntur,Andhra Pradesh State Pollution Control Board,"Residential, Rural and other Areas",2.0,11.0,85.0,,"Near Hindu College, Market Road, Guntur",,2010-05-17
539.0,17-05-13,Assam,Golaghat,Assam State Pollution Control Board,"Residential, Rural and other Areas",7.0,14.0,108.0,,"Golaghat Office Building, Golaghat",,2013-05-17
748.0,17-05-14,Andhra Pradesh,Ananthapur,Andhra Pradesh State Pollution Control Board,"Residential, Rural and other Areas",5.0,10.0,89.0,,"Kamalanagar, Ananthapur",,2014-05-17
29.0,17-05-15,Kerala,Kochi,Kerala State Pollution Control Board,Industrial Area,2.0,16.0,70.0,,"Eloor, Kochi",,2015-05-17
58,17-06-03,Delhi,Delhi,Central Pollution Control Board,Industrial Area,11.0,31.0,154.0,426.0,,,2003-06-17
95.0,17-06-04,Andhra Pradesh,Hyderabad,Andhra Pradesh State Pollution Control Board,Industrial Area,5.1,23.3,50.0,149.3,"C.I.T.D., Balanagar, Plot no. A1 to A8, IDA, Hyderabad",,2004-06-17
,17-06-05,Andhra Pradesh,Hyderabad,,Industrial Areas,4.9,27.3,55.0,491.0,C.I.T.D. Balanagar,,2005-06-17
,17-06-07,Andhra Pradesh,Hyderabad,,Industrial Areas,,,30.0,96.0,Nacharam,,2007-06-17
582.0,17-06-10,Andhra Pradesh,Chittoor,Andhra Pradesh State Pollution Control Board,Sensitive Area,4.0,9.0,38.0,,"GNC Toll Gate Tirumala , Chittoor Dist.",,2010-06-17
520.0,17-06-13,Assam,Bongaigaon,Assam State Pollution Control Board,"Residential, Rural and other Areas",9.0,17.0,43.0,,"Barpara Office Building, Bongaigaon",,2013-06-17
748.0,17-06-14,Andhra Pradesh,Ananthapur,Andhra Pradesh State Pollution Control Board,"Residential, Rural and other Areas",5.0,10.0,75.0,,"Kamalanagar, Ananthapur",,2014-06-17
193.0,17-06-15,Assam,Guwahati,Assam State Pollution Control Board,"Residential, Rural and other Areas",8.0,13.0,67.0,,"Head Office, Bamunimaidan, Guwahati",,2015-06-17
7.0,17-06-88,Uttar Pradesh,Anpara,Uttar Pradesh  Pollution Control Board,Industrial Area,33.2,33.7,,371.0,,,1988-06-17
58,17-07-03,Delhi,Delhi,Central Pollution Control Board,Industrial Area,7.0,21.0,70.0,134.0,,,2003-07-17
284.0,17-07-04,Bihar,Patna,Bihar Sate Pollution Control Board,"Residential, Rural and other Areas",10.0,18.0,52.0,116.0,"Gandhi Maidan Test Centre,Patna",,2004-07-17
,17-07-05,Andhra Pradesh,Hyderabad,,Residential and others,4.9,29.7,94.0,226.0,Paradise,,2005-07-17
,17-07-07,Andhra Pradesh,Hyderabad,,Residential and others,5.3,32.2,77.0,285.0,Charminar,,2007-07-17
468.0,17-07-10,Andhra Pradesh,Patancheru,Andhra Pradesh State Pollution Control Board,"Residential, Rural and other Areas",10.0,21.0,69.0,,"Police Station, Medak, Patencheru",,2010-07-17
520.0,17-07-13,Assam,Bongaigaon,Assam State Pollution Control Board,"Residential, Rural and other Areas",7.0,16.0,40.0,,"Barpara Office Building, Bongaigaon",,2013-07-17
748.0,17-07-14,Andhra Pradesh,Ananthapur,Andhra Pradesh State Pollution Control Board,"Residential, Rural and other Areas",5.0,10.0,50.0,,"Kamalanagar, Ananthapur",,2014-07-17
193.0,17-07-15,Assam,Guwahati,Assam State Pollution Control Board,"Residential, Rural and other Areas",6.0,10.0,63.0,,"Head Office, Bamunimaidan, Guwahati",,2015-07-17
146,17-08-03,Delhi,Delhi,,"Residential, Rural and other Areas",6.0,24.0,,212.0,,,2003-08-17
393.0,17-08-04,Andhra Pradesh,Hyderabad,Andhra Pradesh State Pollution Control Board,"Residential, Rural and other Areas",2.9,21.6,66.7,241.7,"Paradise, Hyderabad",,2004-08-17
,17-08-05,Assam,Guwahati,,Residential and others,5.3,21.7,78.0,134.0,Paltanbazar,,2005-08-17
,17-08-07,Andhra Pradesh,Hyderabad,,Residential and others,5.1,32.1,95.0,304.0,Charminar,,2007-08-17
581.0,17-08-10,Andhra Pradesh,Khammam,Andhra Pradesh State Pollution Control Board,"Residential, Rural and other Areas",2.0,10.0,56.0,,"CER Club,S.C.C.L. township, writter basti, Kothagudem, Khammam Dist.",,2010-08-17
750.0,17-08-13,Andhra Pradesh,Eluru,Andhra Pradesh State Pollution Control Board,"Residential, Rural and other Areas",4.0,15.0,114.0,,"ASRAM Diagnostic Center, Eluru",,2013-08-17
748.0,17-08-14,Andhra Pradesh,Ananthapur,Andhra Pradesh State Pollution Control Board,"Residential, Rural and other Areas",5.0,11.0,49.0,,"Kamalanagar, Ananthapur",,2014-08-17
193.0,17-08-15,Assam,Guwahati,Assam State Pollution Control Board,"Residential, Rural and other Areas",6.0,10.0,63.0,,"Head Office, Bamunimaidan, Guwahati",,2015-08-17
56,17-09-03,Delhi,Delhi,Central Pollution Control Board,Industrial Area,4.0,25.0,47.0,100.0,,,2003-09-17
95.0,17-09-04,Andhra Pradesh,Hyderabad,Andhra Pradesh State Pollution Control Board,Industrial Area,3.6,25.7,54.0,222.0,"C.I.T.D., Balanagar, Plot no. A1 to A8, IDA, Hyderabad",,2004-09-17
,17-09-05,Andhra Pradesh,Hyderabad,,Residential and others,5.0,23.8,91.0,251.0,Charminar,,2005-09-17
,17-09-07,Andhra Pradesh,Hyderabad,,Residential and others,5.3,31.5,68.0,207.0,Charminar,,2007-09-17
577.0,17-09-10,Andhra Pradesh,Nalgonda,Andhra Pradesh State Pollution Control Board,"Residential, Rural and other Areas",5.0,21.0,60.0,,"Beside Regional Office, APPCB Nalgonda",,2010-09-17
742.0,17-09-13,Andhra Pradesh,Chittoor,Andhra Pradesh State Pollution Control Board,"Residential, Rural and other Areas",5.0,10.0,62.0,,"Near Nutrine Confectionery, Palamaner Road, Chittor",,2013-09-17
748.0,17-09-14,Andhra Pradesh,Ananthapur,Andhra Pradesh State Pollution Control Board,"Residential, Rural and other Areas",5.0,11.0,63.0,,"Kamalanagar, Ananthapur",,2014-09-17
193.0,17-09-15,Assam,Guwahati,Assam State Pollution Control Board,"Residential, Rural and other Areas",7.0,12.0,76.0,,"Head Office, Bamunimaidan, Guwahati",,2015-09-17
58,17-10-03,Delhi,Delhi,Central Pollution Control Board,Industrial Area,15.0,39.0,125.0,337.0,,,2003-10-17
210.0,17-10-04,Bihar,Patna,Bihar Sate Pollution Control Board,"Residential, Rural and other Areas",9.0,16.0,53.0,105.0,"Beltron Bhawan, Shastri Nagar, Patna",,2004-10-17
,17-10-05,Chandigarh,Chandigarh,,Industrial Areas,,15.0,165.0,360.0,Modern Foods,,2005-10-17
,17-10-07,Andhra Pradesh,Hyderabad,,Industrial Areas,2.8,9.3,62.0,112.0,Nacharam,,2007-10-17
577.0,17-10-10,Andhra Pradesh,Nalgonda,Andhra Pradesh State Pollution Control Board,"Residential, Rural and other Areas",5.0,22.0,53.0,,"Beside Regional Office, APPCB Nalgonda",,2010-10-17
542.0,17-10-13,Assam,Bongaigaon,Assam State Pollution Control Board,"Residential, Rural and other Areas",7.0,14.0,41.0,,"Campus of Oil India Ltd. PS-6, Bongaigaon, Chirang",,2013-10-17
742.0,17-10-14,Andhra Pradesh,Chittoor,Andhra Pradesh State Pollution Control Board,"Residential, Rural and other Areas",6.0,11.0,61.0,,"Near Nutrine Confectionery, Palamaner Road, Chittor",,2014-10-17
193.0,17-10-15,Assam,Guwahati,Assam State Pollution Control Board,"Residential, Rural and other Areas",9.0,14.0,84.0,,"Head Office, Bamunimaidan, Guwahati",,2015-10-17
55,17-11-03,Delhi,Delhi,Central Pollution Control Board,Industrial Area,13.0,48.0,97.0,350.0,,,2003-11-17
264.0,17-11-04,Chandigarh,Chandigarh,Chandigarh Pollution Control Committee,"Residential, Rural and other Areas",8.0,30.0,85.0,142.0,"Punjab Engineering College, Sector-12, Chandigarh",,2004-11-17
,17-11-05,Andhra Pradesh,Vijayawada,,Residential and others,5.3,30.3,76.0,162.0,Benz Circle,,2005-11-17
,17-11-07,Andhra Pradesh,Hyderabad,,Residential and others,5.2,33.0,121.0,335.0,Charminar,,2007-11-17
462.0,17-11-10,Andhra Pradesh,Vijayawada,Andhra Pradesh State Pollution Control Board,"Residential, Rural and other Areas",6.0,14.0,62.0,,"Benz Circle, Vijayawada",,2010-11-17
149.0,17-11-13,Kerala,Kochi,National Environmental Engineering Research Institute,Industrial Area,2.0,4.5,41.0,,"FACT Udyogmandal, Ambalamughal, Kochi",,2013-11-17
748.0,17-11-14,Andhra Pradesh,Ananthapur,Andhra Pradesh State Pollution Control Board,"Residential, Rural and other Areas",4.0,9.0,71.0,,"Kamalanagar, Ananthapur",,2014-11-17
787.0,17-11-15,Arunachal Pradesh,Itanagar,Arunachal Pradesh State Pollution Control Board,"Residential, Rural and other Areas",3.0,7.0,98.0,,Compound of PCCF's Office building,,2015-11-17
58,17-12-03,Delhi,Delhi,Central Pollution Control Board,Industrial Area,,,83.0,,,,2003-12-17
203.0,17-12-04,Andhra Pradesh,Hyderabad,Andhra Pradesh State Pollution Control Board,Industrial Area,4.1,30.4,217.7,350.0,"Uppal, Modern Foods & Industries IDA, Hyderabad",,2004-12-17
,17-12-05,Andhra Pradesh,Hyderabad,,Residential and others,5.4,33.6,108.0,305.0,Charminar,,2005-12-17
,17-12-07,Andhra Pradesh,Hyderabad,,Industrial Areas,3.2,14.0,52.0,133.0,Nacharam,,2007-12-17
577.0,17-12-10,Andhra Pradesh,Nalgonda,Andhra Pradesh State Pollution Control Board,"Residential, Rural and other Areas",5.0,20.0,77.0,,"Beside Regional Office, APPCB Nalgonda",,2010-12-17
393.0,17-12-13,Andhra Pradesh,Hyderabad,Andhra Pradesh State Pollution Control Board,"Residential, Rural and other Areas",5.0,24.0,136.0,,"Paradise, Hyderabad",,2013-12-17
520.0,17-12-14,Assam,Bongaigaon,Assam State Pollution Control Board,"Residential, Rural and other Areas",5.0,11.0,30.0,,"Barpara Office Building, Bongaigaon",,2014-12-17
193.0,17-12-15,Assam,Guwahati,Assam State Pollution Control Board,"Residential, Rural and other Areas",9.0,24.0,103.0,,"Head Office, Bamunimaidan, Guwahati",,2015-12-17
,17/01/2006,Maharashtra,Aurangabad (MS),,Sensitive Areas,4.7,22.3,,,Bibi-Ka-Maqbara,,2006-01-17
558.0,17/01/2011,Dadra & Nagar Haveli,Khadoli,"Daman Diu, Dadra & Nagar Heveli Pollution Control Committee",Industrial Area,7.6,19.8,,158.0,"Khadoli Industrial Area, Village- Khadoli, Silvassa",,2011-01-17
580.0,17/01/2012,Andhra Pradesh,Nellore,Andhra Pradesh State Pollution Control Board,"Residential, Rural and other Areas",5.0,10.0,67.0,,"Venkatareddy nagar, Vedayapalem, Nellore",,2012-01-17
,17/02/2006,Maharashtra,Aurangabad (MS),,Residential and others,5.5,40.0,,,S.B.E.S. College,,2006-02-17
59,17/02/2011,Delhi,Delhi,Central Pollution Control Board,"Residential, Rural and other Areas",4.0,61.0,116.0,,"Janakpuri, Delhi",,2011-02-17
95.0,17/02/2012,Andhra Pradesh,Hyderabad,Andhra Pradesh State Pollution Control Board,Industrial Area,5.0,34.0,107.0,,"C.I.T.D., Balanagar, Plot no. A1 to A8, IDA, Hyderabad",,2012-02-17
,17/03/2006,Maharashtra,Aurangabad (MS),,Residential and others,4.5,15.5,,,S.B.E.S. College,,2006-03-17
59,17/03/2011,Delhi,Delhi,Central Pollution Control Board,"Residential, Rural and other Areas",4.0,60.0,165.0,,"Janakpuri, Delhi",,2011-03-17
95.0,17/03/2012,Andhra Pradesh,Hyderabad,Andhra Pradesh State Pollution Control Board,Industrial Area,4.0,23.0,135.0,,"C.I.T.D., Balanagar, Plot no. A1 to A8, IDA, Hyderabad",,2012-03-17
,17/04/2006,Maharashtra,Aurangabad (MS),,Sensitive Areas,4.7,14.8,141.0,304.0,Bibi-Ka-Maqbara,,2006-04-17
155,17/04/2011,Gujarat,Ahmedabad,National Environmental Engineering Research Institute,"Residential, Rural and other Areas",13.0,24.0,73.0,,"R.C. High School, Mirzapur, Ahmadabad",,2011-04-17
462.0,17/04/2012,Andhra Pradesh,Vijayawada,Andhra Pradesh State Pollution Control Board,"Residential, Rural and other Areas",7.0,11.0,101.0,,"Benz Circle, Vijayawada",,2012-04-17
,17/05/2006,Maharashtra,Aurangabad (MS),,Residential and others,5.3,18.0,99.0,219.0,C.A.D.A. Office,,2006-05-17
560,17/05/2011,Daman & Diu,Daman,"Daman Diu, Dadra & Nagar Heveli Pollution Control Committee",Industrial Area,7.5,20.3,,42.0,"Kadaiya Industrial Area, Village- Kadaiya, Daman (Industrial Area)",,2011-05-17
465.0,17/05/2012,Andhra Pradesh,Ramagundam,Andhra Pradesh State Pollution Control Board,"Residential, Rural and other Areas",2.0,5.0,73.0,,"RTC Bus Depot, Karim Nagar, Ramagundam",,2012-05-17
,17/06/2006,Maharashtra,Aurangabad (MS),,Residential and others,6.5,21.0,68.0,148.0,S.B.E.S. College,,2006-06-17
60,17/06/2011,Delhi,Delhi,Central Pollution Control Board,"Residential, Rural and other Areas",4.0,48.0,286.0,,"Siri Fort, Delhi",,2011-06-17
95.0,17/06/2012,Andhra Pradesh,Hyderabad,Andhra Pradesh State Pollution Control Board,Industrial Area,5.0,23.0,131.0,,"C.I.T.D., Balanagar, Plot no. A1 to A8, IDA, Hyderabad",,2012-06-17
,17/07/2006,Maharashtra,Aurangabad (MS),,Sensitive Areas,3.3,10.9,,,Bibi-Ka-Maqbara,,2006-07-17
155,17/07/2011,Gujarat,Ahmedabad,National Environmental Engineering Research Institute,"Residential, Rural and other Areas",12.0,22.0,81.0,,"R.C. High School, Mirzapur, Ahmadabad",,2011-07-17
95.0,17/07/2012,Andhra Pradesh,Hyderabad,Andhra Pradesh State Pollution Control Board,Industrial Area,4.0,22.0,42.0,,"C.I.T.D., Balanagar, Plot no. A1 to A8, IDA, Hyderabad",,2012-07-17
,17/08/2006,Maharashtra,Aurangabad (MS),,Residential and others,3.2,13.8,17.0,45.0,C.A.D.A. Office,,2006-08-17
558.0,17/08/2011,Dadra & Nagar Haveli,Khadoli,"Daman Diu, Dadra & Nagar Heveli Pollution Control Committee",Industrial Area,7.1,18.9,,28.0,"Khadoli Industrial Area, Village- Khadoli, Silvassa",,2011-08-17
583.0,17/08/2012,Andhra Pradesh,Guntur,Andhra Pradesh State Pollution Control Board,"Residential, Rural and other Areas",6.0,11.0,74.0,,"Near Hindu College, Market Road, Guntur",,2012-08-17
,17/09/2006,Maharashtra,Tarapur,,Industrial Areas,6.2,18.9,45.0,73.0,MIDC Office Compound,,2006-09-17
558.0,17/09/2011,Dadra & Nagar Haveli,Khadoli,"Daman Diu, Dadra & Nagar Heveli Pollution Control Committee",Industrial Area,7.4,18.9,,38.0,"Khadoli Industrial Area, Village- Khadoli, Silvassa",,2011-09-17
578.0,17/09/2012,Andhra Pradesh,Kakinada,Andhra Pradesh State Pollution Control Board,"Residential, Rural and other Areas",,,53.0,,"Top of the Office Building Ramanayyapeta, Kakinada",,2012-09-17
,17/1/2006,Assam,Guwahati,,Residential and others,4.0,26.0,241.0,366.0,Fire Brigade Station,,2006-01-17
,17/1/2008,Andhra Pradesh,Hyderabad,,Residential and others,5.3,31.2,178.0,364.0,Charminar,,2008-01-17
,17/1/2009,Andhra Pradesh,Hyderabad,,Residential and others,5.1,27.7,105.0,305.0,Charminar,,2009-01-17
582.0,17/1/2011,Andhra Pradesh,Chittoor,Andhra Pradesh State Pollution Control Board,Sensitive Area,4.0,9.0,44.0,114.0,"GNC Toll Gate Tirumala , Chittoor Dist.",,2011-01-17
642.0,17/1/2012,Maharashtra,Latur,Maharashtra State Pollution Control Board,"Residential, Rural and other Areas",4.0,9.0,89.0,,"Shyamnagar, Terrence of Keshavraj Vidyalaya, Latur",,2012-01-17
,17/10/2006,Andhra Pradesh,Vijayawada,,Industrial Areas,7.3,31.8,101.0,229.0,Autonagar,,2006-10-17
,17/10/2008,Andhra Pradesh,Hyderabad,,Residential and others,4.9,29.4,97.0,267.0,Charminar,,2008-10-17
,17/10/2009,Andhra Pradesh,Hyderabad,,Industrial Areas,36.7,60.7,189.0,473.0,C.I.T.D. Balanagar,,2009-10-17
583.0,17/10/2011,Andhra Pradesh,Guntur,Andhra Pradesh State Pollution Control Board,"Residential, Rural and other Areas",4.4,9.6,75.0,189.0,"Near Hindu College, Market Road, Guntur",,2011-10-17
468.0,17/10/2012,Andhra Pradesh,Patancheru,Andhra Pradesh State Pollution Control Board,"Residential, Rural and other Areas",6.0,23.0,98.0,,"Police Station, Medak, Patencheru",,2012-10-17
,17/11/2006,Andhra Pradesh,Hyderabad,,Industrial Areas,5.3,29.9,112.0,317.0,C.I.T.D. Balanagar,,2006-11-17
,17/11/2008,Andhra Pradesh,Patancheru,,Residential and others,19.0,28.2,74.0,158.0,Police Station,,2008-11-17
,17/11/2009,Andhra Pradesh,Guntur,,Residential and others,4.0,9.0,80.0,203.0,Hindu College Guntur,,2009-11-17
582.0,17/11/2011,Andhra Pradesh,Chittoor,Andhra Pradesh State Pollution Control Board,Sensitive Area,4.0,9.0,33.0,88.0,"GNC Toll Gate Tirumala , Chittoor Dist.",,2011-11-17
468.0,17/11/2012,Andhra Pradesh,Patancheru,Andhra Pradesh State Pollution Control Board,"Residential, Rural and other Areas",7.0,24.0,134.0,,"Police Station, Medak, Patencheru",,2012-11-17
,17/12/2006,Andhra Pradesh,Hyderabad,,Industrial Areas,5.5,36.9,122.0,359.0,C.I.T.D. Balanagar,,2006-12-17
,17/12/2008,Andhra Pradesh,Hyderabad,,Residential and others,5.3,28.3,108.0,314.0,Charminar,,2008-12-17
,17/12/2009,Andhra Pradesh,Hyderabad,,Residential and others,4.9,26.1,88.0,266.0,Paradise,,2009-12-17
577.0,17/12/2011,Andhra Pradesh,Nalgonda,Andhra Pradesh State Pollution Control Board,"Residential, Rural and other Areas",4.0,16.0,73.0,,"Beside Regional Office, APPCB Nalgonda",,2011-12-17
234.0,17/12/2012,Andhra Pradesh,Visakhapatnam,Andhra Pradesh State Pollution Control Board,"Residential, Rural and other Areas",4.0,9.0,42.0,,"Panchayat Raj office, Mindi, Visakhapatnam",,2012-12-17
,17/2/2006,Andhra Pradesh,Hyderabad,,Residential and others,5.1,57.9,165.0,382.0,Paradise,,2006-02-17
,17/2/2008,Andhra Pradesh,Hyderabad,,Industrial Areas,2.6,12.6,46.0,105.0,Nacharam,,2008-02-17
,17/2/2009,Andhra Pradesh,Hyderabad,,Residential and others,5.2,27.2,112.0,321.0,Charminar,,2009-02-17
582.0,17/2/2011,Andhra Pradesh,Chittoor,Andhra Pradesh State Pollution Control Board,Sensitive Area,4.0,9.0,41.0,121.0,"GNC Toll Gate Tirumala , Chittoor Dist.",,2011-02-17
641.0,17/2/2012,Maharashtra,Latur,Maharashtra State Pollution Control Board,Industrial Area,8.0,27.0,180.0,,"MIDC, Water Works, Latur",,2012-02-17
,17/3/2006,Andhra Pradesh,Hyderabad,,Industrial Areas,5.3,29.7,104.0,269.0,C.I.T.D. Balanagar,,2006-03-17
,17/3/2008,Andhra Pradesh,Hyderabad,,Industrial Areas,3.0,10.0,47.0,91.0,Nacharam,,2008-03-17
,17/3/2009,Andhra Pradesh,Hyderabad,,Residential and others,5.4,26.6,134.0,381.0,Charminar,,2009-03-17
95.0,17/3/2011,Andhra Pradesh,Hyderabad,Andhra Pradesh State Pollution Control Board,Industrial Area,5.0,35.0,144.0,331.0,"C.I.T.D., Balanagar, Plot no. A1 to A8, IDA, Hyderabad",,2011-03-17
641.0,17/3/2012,Maharashtra,Latur,Maharashtra State Pollution Control Board,Industrial Area,5.0,17.0,222.0,,"MIDC, Water Works, Latur",,2012-03-17
,17/4/2006,Andhra Pradesh,Hyderabad,,Residential and others,5.2,31.2,82.0,229.0,Charminar,,2006-04-17
,17/4/2008,Andhra Pradesh,Hyderabad,,Residential and others,5.5,36.1,105.0,302.0,Charminar,,2008-04-17
,17/4/2009,Andhra Pradesh,Hyderabad,,Industrial Areas,,,,,Nacharam,,2009-04-17
577.0,17/4/2011,Andhra Pradesh,Nalgonda,Andhra Pradesh State Pollution Control Board,"Residential, Rural and other Areas",4.0,20.0,68.0,,"Beside Regional Office, APPCB Nalgonda",,2011-04-17
642.0,17/4/2012,Maharashtra,Latur,Maharashtra State Pollution Control Board,"Residential, Rural and other Areas",7.0,17.0,174.0,,"Shyamnagar, Terrence of Keshavraj Vidyalaya, Latur",,2012-04-17
,17/5/2006,Andhra Pradesh,Vijayawada,,Residential and others,5.3,26.3,82.0,180.0,Benz Circle,,2006-05-17
,17/5/2008,Andhra Pradesh,Hyderabad,,Residential and others,5.4,35.8,118.0,334.0,Charminar,,2008-05-17
,17/5/2009,Andhra Pradesh,Hyderabad,,Residential and others,5.0,27.4,110.0,325.0,Charminar,,2009-05-17
465.0,17/5/2011,Andhra Pradesh,Ramagundam,Andhra Pradesh State Pollution Control Board,"Residential, Rural and other Areas",4.0,9.0,62.0,184.0,"RTC Bus Depot, Karim Nagar, Ramagundam",,2011-05-17
,17/6/2006,Andhra Pradesh,Hyderabad,,Residential and others,5.4,33.3,106.0,318.0,Charminar,,2006-06-17
,17/6/2008,Andhra Pradesh,Hyderabad,,Residential and others,5.4,34.5,126.0,364.0,Charminar,,2008-06-17
,17/6/2009,Andhra Pradesh,Hyderabad,,Residential and others,4.9,26.2,108.0,325.0,Charminar,,2009-06-17
210.0,17/6/2011,Bihar,Patna,Bihar Sate Pollution Control Board,"Residential, Rural and other Areas",2.0,18.0,61.0,,"Beltron Bhawan, Shastri Nagar, Patna",,2011-06-17
,17/7/2006,Andhra Pradesh,Hyderabad,,Industrial Areas,5.5,30.6,97.0,281.0,C.I.T.D. Balanagar,,2006-07-17
,17/7/2008,Andhra Pradesh,Hyderabad,,Industrial Areas,5.1,14.4,44.0,83.0,Nacharam,,2008-07-17
,17/7/2009,Andhra Pradesh,Hyderabad,,Industrial Areas,3.3,15.0,27.0,129.0,Nacharam,,2009-07-17
203.0,17/7/2011,Andhra Pradesh,Hyderabad,Andhra Pradesh State Pollution Control Board,Industrial Area,5.0,27.0,71.0,192.0,"Uppal, Modern Foods & Industries IDA, Hyderabad",,2011-07-17
642.0,17/7/2012,Maharashtra,Latur,Maharashtra State Pollution Control Board,"Residential, Rural and other Areas",5.0,12.0,48.0,,"Shyamnagar, Terrence of Keshavraj Vidyalaya, Latur",,2012-07-17
,17/8/2006,Andhra Pradesh,Hyderabad,,Industrial Areas,4.7,28.7,38.0,124.0,C.I.T.D. Balanagar,,2006-08-17
,17/8/2008,Andhra Pradesh,Hyderabad,,Residential and others,5.2,34.5,116.0,337.0,Charminar,,2008-08-17
,17/8/2009,Andhra Pradesh,Guntur,,Residential and others,4.0,9.0,109.0,265.0,Hindu College Guntur,,2009-08-17
577.0,17/8/2011,Andhra Pradesh,Nalgonda,Andhra Pradesh State Pollution Control Board,"Residential, Rural and other Areas",4.0,18.0,69.0,,"Beside Regional Office, APPCB Nalgonda",,2011-08-17
,17/9/2006,Karnataka,Bangalore,,Industrial Areas,,33.2,57.0,167.0,Peenya Indl. Area,,2006-09-17
,17/9/2008,Andhra Pradesh,Hyderabad,,Industrial Areas,5.5,17.6,29.0,69.0,Nacharam,,2008-09-17
,17/9/2009,Andhra Pradesh,Guntur,,Residential and others,4.0,9.0,92.0,234.0,Hindu College Guntur,,2009-09-17
464.0,17/9/2011,Chandigarh,Chandigarh,Chandigarh Pollution Control Committee,"Residential, Rural and other Areas",2.0,7.4,68.0,132.0,"Kaimbwala Village, Chandigarh",,2011-09-17
642.0,17/9/2012,Maharashtra,Latur,Maharashtra State Pollution Control Board,"Residential, Rural and other Areas",16.0,16.0,58.0,,"Shyamnagar, Terrence of Keshavraj Vidyalaya, Latur",,2012-09-17
84.0,18-01-03,Madhya Pradesh,Nagda,Madhya Pradesh  Pollution Control Board,"Residential, Rural and other Areas",0.0,0.0,0.0,0.0,,,2003-01-18
55,18-01-04,Delhi,Delhi,Central Pollution Control Board,"Residential, Rural and other Areas",,,208.0,428.0,"Nizamuddin, Delhi",,2004-01-18
,18-01-05,Andhra Pradesh,Hyderabad,,Residential and others,4.3,36.2,92.0,307.0,Charminar,,2005-01-18
,18-01-07,Andhra Pradesh,Kurnool,,Residential and others,4.0,21.1,96.0,182.0,Mourya Inn,,2007-01-18
150.0,18-01-10,Andhra Pradesh,Hyderabad,National Environmental Engineering Research Institute,"Residential, Rural and other Areas",4.0,17.0,90.0,,"Tarnaka, NEERI Lab. IICT Campus, Hyderabad",,2010-01-18
748.0,18-01-13,Andhra Pradesh,Ananthapur,Andhra Pradesh State Pollution Control Board,"Residential, Rural and other Areas",4.0,9.0,81.0,,"Kamalanagar, Ananthapur",,2013-01-18
542.0,18-01-14,Assam,Bongaigaon,Assam State Pollution Control Board,"Residential, Rural and other Areas",8.0,15.0,54.0,,"Campus of Oil India Ltd. PS-6, Bongaigaon, Chirang",,2014-01-18
SAMP,18-01-15,Gujarat,Bharuch,Gujarat State Pollution Control Board,RIRUO,13.0,21.0,76.0,,"Dahez SEZ Part II Office,Bharuch",25.0,2015-01-18
7.0,18-01-88,Uttar Pradesh,Anpara,Uttar Pradesh  Pollution Control Board,Industrial Area,68.0,44.3,,636.0,,,1988-01-18
60,18-02-03,Delhi,Delhi,Central Pollution Control Board,"Residential, Rural and other Areas",6.0,18.0,62.0,135.0,,,2003-02-18
327,18-02-04,Goa,Panaji,Goa State Pollution Control Board,"Residential, Rural and other Areas",6.0,24.1,,201.0,"Infront of Old GSPCB premises, Patto, Panaji, Goa",,2004-02-18
,18-02-05,Andhra Pradesh,Hyderabad,,Industrial Areas,4.6,32.1,108.0,360.0,C.I.T.D. Balanagar,,2005-02-18
,18-02-07,Andhra Pradesh,Vijayawada,,Residential and others,6.4,28.7,70.0,158.0,Benz Circle,,2007-02-18
577.0,18-02-10,Andhra Pradesh,Nalgonda,Andhra Pradesh State Pollution Control Board,"Residential, Rural and other Areas",4.0,25.0,97.0,,"Beside Regional Office, APPCB Nalgonda",,2010-02-18
748.0,18-02-13,Andhra Pradesh,Ananthapur,Andhra Pradesh State Pollution Control Board,"Residential, Rural and other Areas",4.0,9.0,81.0,,"Kamalanagar, Ananthapur",,2013-02-18
542.0,18-02-14,Assam,Bongaigaon,Assam State Pollution Control Board,"Residential, Rural and other Areas",7.0,13.0,53.0,,"Campus of Oil India Ltd. PS-6, Bongaigaon, Chirang",,2014-02-18
787.0,18-02-15,Arunachal Pradesh,Itanagar,Arunachal Pradesh State Pollution Control Board,"Residential, Rural and other Areas",2.0,5.0,133.0,,Compound of PCCF's Office building,,2015-02-18
56,18-03-03,Delhi,Delhi,Central Pollution Control Board,Industrial Area,,,130.0,230.0,,,2003-03-18
203.0,18-03-04,Andhra Pradesh,Hyderabad,Andhra Pradesh State Pollution Control Board,Industrial Area,3.8,63.4,123.7,270.0,"Uppal, Modern Foods & Industries IDA, Hyderabad",,2004-03-18
,18-03-05,Andhra Pradesh,Hyderabad,,Industrial Areas,5.0,40.6,101.0,275.0,Uppal,,2005-03-18
,18-03-07,Andhra Pradesh,Hyderabad,,Residential and others,4.9,30.6,102.0,302.0,Paradise,,2007-03-18
582.0,18-03-10,Andhra Pradesh,Chittoor,Andhra Pradesh State Pollution Control Board,Sensitive Area,4.0,9.0,44.0,,"GNC Toll Gate Tirumala , Chittoor Dist.",,2010-03-18
748.0,18-03-13,Andhra Pradesh,Ananthapur,Andhra Pradesh State Pollution Control Board,"Residential, Rural and other Areas",4.0,9.0,83.0,,"Kamalanagar, Ananthapur",,2013-03-18
520.0,18-03-14,Assam,Bongaigaon,Assam State Pollution Control Board,"Residential, Rural and other Areas",7.0,15.0,69.0,,"Barpara Office Building, Bongaigaon",,2014-03-18
193.0,18-03-15,Assam,Guwahati,Assam State Pollution Control Board,"Residential, Rural and other Areas",9.0,15.0,219.0,,"Head Office, Bamunimaidan, Guwahati",,2015-03-18
144,18-04-03,Delhi,Delhi,,"Residential, Rural and other Areas",10.0,53.0,,585.0,,,2003-04-18
304.0,18-04-04,Maharashtra,Thane,Thane Municipal Corporation,"Residential, Rural and other Areas",9.5,12.8,,46.3,"Terrace Of Shahu Market,Naupada, Thane West",,2004-04-18
,18-04-05,Andhra Pradesh,Hyderabad,,Industrial Areas,19.3,14.4,22.0,84.0,Nacharam,,2005-04-18
,18-04-07,Andhra Pradesh,Hyderabad,,Industrial Areas,5.4,34.4,56.0,179.0,C.I.T.D. Balanagar,,2007-04-18
151.0,18-04-10,Andhra Pradesh,Hyderabad,National Environmental Engineering Research Institute,Industrial Area,3.0,21.0,26.0,,"Nacharam, Industrial Estate, Premises of IICT (APIDC), Hyderabad",,2010-04-18
748.0,18-04-13,Andhra Pradesh,Ananthapur,Andhra Pradesh State Pollution Control Board,"Residential, Rural and other Areas",4.0,9.0,83.0,,"Kamalanagar, Ananthapur",,2013-04-18
566.0,18-04-14,Assam,Daranga,Assam State Pollution Control Board,"Residential, Rural and other Areas",6.0,17.0,60.0,,"Daranga, Baska district, BATAD,Assam near Sandoop Jhankar town of Bhutan",,2014-04-18
193.0,18-04-15,Assam,Guwahati,Assam State Pollution Control Board,"Residential, Rural and other Areas",10.0,17.0,219.0,,"Head Office, Bamunimaidan, Guwahati",,2015-04-18
7.0,18-04-88,Uttar Pradesh,Anpara,Uttar Pradesh  Pollution Control Board,Industrial Area,36.1,34.9,,642.0,,,1988-04-18
193.0,18-05-04,Assam,Guwahati,Assam State Pollution Control Board,"Residential, Rural and other Areas",2.3,11.1,198.0,,"Head Office, Bamunimaidan, Guwahati",,2004-05-18
,18-05-05,Andhra Pradesh,Hyderabad,,Industrial Areas,5.5,33.6,105.0,212.0,Uppal,,2005-05-18
,18-05-07,Assam,Bongaigaon,,Residential and others,3.8,10.8,42.0,103.0,Barpara Office Bldg,,2007-05-18
582.0,18-05-10,Andhra Pradesh,Chittoor,Andhra Pradesh State Pollution Control Board,Sensitive Area,4.0,9.0,31.0,,"GNC Toll Gate Tirumala , Chittoor Dist.",,2010-05-18
748.0,18-05-13,Andhra Pradesh,Ananthapur,Andhra Pradesh State Pollution Control Board,"Residential, Rural and other Areas",4.0,16.0,71.0,,"Kamalanagar, Ananthapur",,2013-05-18
685.0,18-05-14,Karnataka,Tumkur,Karnataka State Pollution Control Board,"Residential, Rural and other Areas",15.0,19.0,90.0,,"Tumkur University, Tumkur",,2014-05-18
193.0,18-05-15,Assam,Guwahati,Assam State Pollution Control Board,"Residential, Rural and other Areas",7.0,13.0,94.0,,"Head Office, Bamunimaidan, Guwahati",,2015-05-18
56,18-06-03,Delhi,Delhi,Central Pollution Control Board,Industrial Area,5.0,30.0,70.0,287.0,,,2003-06-18
203.0,18-06-04,Andhra Pradesh,Hyderabad,Andhra Pradesh State Pollution Control Board,Industrial Area,3.7,27.5,83.3,171.0,"Uppal, Modern Foods & Industries IDA, Hyderabad",,2004-06-18
,18-06-05,Andhra Pradesh,Hyderabad,,Residential and others,5.2,31.1,95.0,308.0,Charminar,,2005-06-18
,18-06-07,Andhra Pradesh,Hyderabad,,Industrial Areas,5.2,36.0,58.0,256.0,C.I.T.D. Balanagar,,2007-06-18
150.0,18-06-10,Andhra Pradesh,Hyderabad,National Environmental Engineering Research Institute,"Residential, Rural and other Areas",5.0,22.0,64.0,,"Tarnaka, NEERI Lab. IICT Campus, Hyderabad",,2010-06-18
748.0,18-06-13,Andhra Pradesh,Ananthapur,Andhra Pradesh State Pollution Control Board,"Residential, Rural and other Areas",4.0,16.0,93.0,,"Kamalanagar, Ananthapur",,2013-06-18
520.0,18-06-14,Assam,Bongaigaon,Assam State Pollution Control Board,"Residential, Rural and other Areas",6.0,12.0,46.0,,"Barpara Office Building, Bongaigaon",,2014-06-18
389.0,18-06-15,Andhra Pradesh,Tirupati,Andhra Pradesh State Pollution Control Board,Sensitive Area,5.0,11.0,69.0,,"Regional Science Centre, Chittoor Bypass Road, Tirupati",,2015-06-18
56,18-07-03,Delhi,Delhi,Central Pollution Control Board,Industrial Area,4.0,27.0,68.0,192.0,,,2003-07-18
210.0,18-07-04,Bihar,Patna,Bihar Sate Pollution Control Board,"Residential, Rural and other Areas",11.0,17.0,49.0,107.0,"Beltron Bhawan, Shastri Nagar, Patna",,2004-07-18
,18-07-05,Andhra Pradesh,Hyderabad,,Industrial Areas,2.6,18.6,45.0,111.0,Nacharam,,2005-07-18
,18-07-07,Assam,Bongaigaon,,Residential and others,4.3,5.6,13.0,15.0,Campus of Oil India,,2007-07-18
155,18-07-10,Gujarat,Ahmedabad,National Environmental Engineering Research Institute,"Residential, Rural and other Areas",16.0,20.0,90.0,,"R.C. High School, Mirzapur, Ahmadabad",,2010-07-18
748.0,18-07-13,Andhra Pradesh,Ananthapur,Andhra Pradesh State Pollution Control Board,"Residential, Rural and other Areas",4.0,16.0,40.0,,"Kamalanagar, Ananthapur",,2013-07-18
750.0,18-07-14,Andhra Pradesh,Eluru,Andhra Pradesh State Pollution Control Board,"Residential, Rural and other Areas",,,91.0,,"ASRAM Diagnostic Center, Eluru",,2014-07-18
567.0,18-07-15,Assam,Silcher,Assam State Pollution Control Board,"Residential, Rural and other Areas",6.0,12.0,75.0,,"Office building of RLO, near Ithkola Market, Ghaniwala road",,2015-07-18
55,18-08-03,Delhi,Delhi,Central Pollution Control Board,Industrial Area,13.0,48.0,29.0,114.0,,,2003-08-18
95.0,18-08-04,Andhra Pradesh,Hyderabad,Andhra Pradesh State Pollution Control Board,Industrial Area,5.0,25.1,100.3,305.7,"C.I.T.D., Balanagar, Plot no. A1 to A8, IDA, Hyderabad",,2004-08-18
,18-08-05,Assam,Guwahati,,Residential and others,4.0,14.7,62.0,119.0,Fire Brigade Station,,2005-08-18
,18-08-07,Assam,Bongaigaon,,Residential and others,2.8,9.7,41.0,78.0,Barpara Office Bldg,,2007-08-18
582.0,18-08-10,Andhra Pradesh,Chittoor,Andhra Pradesh State Pollution Control Board,Sensitive Area,4.0,9.0,40.0,,"GNC Toll Gate Tirumala , Chittoor Dist.",,2010-08-18
748.0,18-08-13,Andhra Pradesh,Ananthapur,Andhra Pradesh State Pollution Control Board,"Residential, Rural and other Areas",4.0,16.0,45.0,,"Kamalanagar, Ananthapur",,2013-08-18
587.0,18-08-14,Assam,Lakhimpur,Assam State Pollution Control Board,"Residential, Rural and other Areas",3.0,10.0,55.0,,"Bazar Patti, North Lakhimpur Town,Lakhimpur, Assam",,2014-08-18
193.0,18-08-15,Assam,Guwahati,Assam State Pollution Control Board,"Residential, Rural and other Areas",5.0,10.0,65.0,,"Head Office, Bamunimaidan, Guwahati",,2015-08-18
3.0,18-08-87,Uttar Pradesh,Agra,Uttar Pradesh Pollution Control Board,Industrial,4.8,4.0,,155.0,,,1987-08-18
55,18-09-03,Delhi,Delhi,Central Pollution Control Board,Industrial Area,14.0,45.0,83.0,148.0,,,2003-09-18
217.0,18-09-04,Assam,Guwahati,Assam State Pollution Control Board,"Residential, Rural and other Areas",3.7,12.1,213.0,,"Paltanbazar, Guwahati",,2004-09-18
,18-09-05,Andhra Pradesh,Hyderabad,,Industrial Areas,,12.4,25.0,102.0,Nacharam,,2005-09-18
,18-09-07,Assam,Guwahati,,Residential and others,8.0,12.5,42.0,62.0,Fire Brigade Station,,2007-09-18
582.0,18-09-10,Andhra Pradesh,Chittoor,Andhra Pradesh State Pollution Control Board,Sensitive Area,4.0,9.0,60.0,,"GNC Toll Gate Tirumala , Chittoor Dist.",,2010-09-18
748.0,18-09-13,Andhra Pradesh,Ananthapur,Andhra Pradesh State Pollution Control Board,"Residential, Rural and other Areas",4.0,16.0,45.0,,"Kamalanagar, Ananthapur",,2013-09-18
750.0,18-09-14,Andhra Pradesh,Eluru,Andhra Pradesh State Pollution Control Board,"Residential, Rural and other Areas",,,81.0,,"ASRAM Diagnostic Center, Eluru",,2014-09-18
389.0,18-09-15,Andhra Pradesh,Tirupati,Andhra Pradesh State Pollution Control Board,Sensitive Area,4.0,10.0,65.0,,"Regional Science Centre, Chittoor Bypass Road, Tirupati",,2015-09-18
95.0,18-10-04,Andhra Pradesh,Hyderabad,Andhra Pradesh State Pollution Control Board,Industrial Area,4.2,24.2,118.3,266.3,"C.I.T.D., Balanagar, Plot no. A1 to A8, IDA, Hyderabad",,2004-10-18
,18-10-05,Andhra Pradesh,Hyderabad,,Industrial Areas,2.5,14.2,68.0,169.0,Nacharam,,2005-10-18
,18-10-07,Andhra Pradesh,Hyderabad,,Residential and others,4.2,15.6,63.0,121.0,Jubilee Hills,,2007-10-18
583.0,18-10-10,Andhra Pradesh,Guntur,Andhra Pradesh State Pollution Control Board,"Residential, Rural and other Areas",2.0,11.0,84.0,,"Near Hindu College, Market Road, Guntur",,2010-10-18
748.0,18-10-13,Andhra Pradesh,Ananthapur,Andhra Pradesh State Pollution Control Board,"Residential, Rural and other Areas",4.0,16.0,62.0,,"Kamalanagar, Ananthapur",,2013-10-18
750.0,18-10-14,Andhra Pradesh,Eluru,Andhra Pradesh State Pollution Control Board,"Residential, Rural and other Areas",,,361.0,,"ASRAM Diagnostic Center, Eluru",,2014-10-18
187.0,18-10-15,Kerala,Kottayam,Kerala State Pollution Control Board,"Residential, Rural and other Areas",4.0,18.0,35.0,,Kottayam,,2015-10-18
58,18-11-03,Delhi,Delhi,Central Pollution Control Board,Industrial Area,,,120.0,,,,2003-11-18
394.0,18-11-04,Andhra Pradesh,Hyderabad,Andhra Pradesh State Pollution Control Board,"Residential, Rural and other Areas",3.3,29.7,87.3,348.7,"Charminar, Hyderabad",,2004-11-18
,18-11-05,Andhra Pradesh,Hyderabad,,Industrial Areas,4.5,24.5,118.0,301.0,C.I.T.D. Balanagar,,2005-11-18
,18-11-07,Andhra Pradesh,Hyderabad,,Industrial Areas,5.3,35.0,133.0,362.0,C.I.T.D. Balanagar,,2007-11-18
582.0,18-11-10,Andhra Pradesh,Chittoor,Andhra Pradesh State Pollution Control Board,Sensitive Area,4.0,9.0,46.0,,"GNC Toll Gate Tirumala , Chittoor Dist.",,2010-11-18
577.0,18-11-13,Andhra Pradesh,Nalgonda,Andhra Pradesh State Pollution Control Board,"Residential, Rural and other Areas",4.0,14.0,83.0,,"Beside Regional Office, APPCB Nalgonda",,2013-11-18
542.0,18-11-14,Assam,Bongaigaon,Assam State Pollution Control Board,"Residential, Rural and other Areas",7.0,13.0,63.0,,"Campus of Oil India Ltd. PS-6, Bongaigaon, Chirang",,2014-11-18
193.0,18-11-15,Assam,Guwahati,Assam State Pollution Control Board,"Residential, Rural and other Areas",8.0,13.0,75.0,,"Head Office, Bamunimaidan, Guwahati",,2015-11-18
38.0,18-11-87,Tamil Nadu,Madras,Tamil Nadu Pollution Control Board,Industrial,30.6,0.8,,157.0,,,1987-11-18
60,18-12-03,Delhi,Delhi,Central Pollution Control Board,"Residential, Rural and other Areas",7.0,34.0,64.0,164.0,,,2003-12-18
106.0,18-12-04,Chandigarh,Chandigarh,Chandigarh Pollution Control Committee,Industrial Area,8.0,63.0,235.0,412.0,"Modern Foods, Industrial Area, Chandigarh",,2004-12-18
,18-12-05,Andhra Pradesh,Hyderabad,,Industrial Areas,2.5,18.0,85.0,127.0,Nacharam,,2005-12-18
,18-12-07,Andhra Pradesh,Hyderabad,,Industrial Areas,5.5,33.7,115.0,356.0,C.I.T.D. Balanagar,,2007-12-18
465.0,18-12-10,Andhra Pradesh,Ramagundam,Andhra Pradesh State Pollution Control Board,"Residential, Rural and other Areas",2.0,10.0,117.0,,"RTC Bus Depot, Karim Nagar, Ramagundam",,2010-12-18
748.0,18-12-13,Andhra Pradesh,Ananthapur,Andhra Pradesh State Pollution Control Board,"Residential, Rural and other Areas",4.0,9.0,61.0,,"Kamalanagar, Ananthapur",,2013-12-18
748.0,18-12-14,Andhra Pradesh,Ananthapur,Andhra Pradesh State Pollution Control Board,"Residential, Rural and other Areas",5.0,11.0,75.0,,"Kamalanagar, Ananthapur",,2014-12-18
389.0,18-12-15,Andhra Pradesh,Tirupati,Andhra Pradesh State Pollution Control Board,Sensitive Area,4.0,10.0,56.0,,"Regional Science Centre, Chittoor Bypass Road, Tirupati",,2015-12-18
,18/01/2006,Maharashtra,Chandrapur,,Residential and others,20.0,27.0,174.0,234.0,Nagar Parishad,,2006-01-18
560,18/01/2011,Daman & Diu,Daman,"Daman Diu, Dadra & Nagar Heveli Pollution Control Committee",Industrial Area,7.5,18.5,,43.0,"Kadaiya Industrial Area, Village- Kadaiya, Daman (Industrial Area)",,2011-01-18
583.0,18/01/2012,Andhra Pradesh,Guntur,Andhra Pradesh State Pollution Control Board,"Residential, Rural and other Areas",5.0,11.0,75.0,,"Near Hindu College, Market Road, Guntur",,2012-01-18
,18/02/2006,Maharashtra,Aurangabad (MS),,Residential and others,5.8,44.0,,,S.B.E.S. College,,2006-02-18
560,18/02/2011,Daman & Diu,Daman,"Daman Diu, Dadra & Nagar Heveli Pollution Control Committee",Industrial Area,7.1,19.4,,42.0,"Kadaiya Industrial Area, Village- Kadaiya, Daman (Industrial Area)",,2011-02-18
581.0,18/02/2012,Andhra Pradesh,Khammam,Andhra Pradesh State Pollution Control Board,"Residential, Rural and other Areas",5.0,10.0,58.0,,"CER Club,S.C.C.L. township, writter basti, Kothagudem, Khammam Dist.",,2012-02-18
,18/03/2006,Maharashtra,Aurangabad (MS),,Residential and others,4.5,20.2,,,S.B.E.S. College,,2006-03-18
560,18/03/2011,Daman & Diu,Daman,"Daman Diu, Dadra & Nagar Heveli Pollution Control Committee",Industrial Area,7.5,19.7,24.0,43.0,"Kadaiya Industrial Area, Village- Kadaiya, Daman (Industrial Area)",,2011-03-18
577.0,18/03/2012,Andhra Pradesh,Nalgonda,Andhra Pradesh State Pollution Control Board,"Residential, Rural and other Areas",4.0,15.0,78.0,,"Beside Regional Office, APPCB Nalgonda",,2012-03-18
,18/04/2006,Maharashtra,Aurangabad (MS),,Sensitive Areas,5.0,15.8,93.0,248.0,Bibi-Ka-Maqbara,,2006-04-18
558.0,18/04/2011,Dadra & Nagar Haveli,Khadoli,"Daman Diu, Dadra & Nagar Heveli Pollution Control Committee",Industrial Area,7.5,19.9,,42.0,"Khadoli Industrial Area, Village- Khadoli, Silvassa",,2011-04-18
583.0,18/04/2012,Andhra Pradesh,Guntur,Andhra Pradesh State Pollution Control Board,"Residential, Rural and other Areas",6.0,11.0,75.0,,"Near Hindu College, Market Road, Guntur",,2012-04-18
,18/05/2006,Maharashtra,Aurangabad (MS),,Residential and others,6.3,36.8,89.0,239.0,C.A.D.A. Office,,2006-05-18
60,18/05/2011,Delhi,Delhi,Central Pollution Control Board,"Residential, Rural and other Areas",5.0,52.0,181.0,,"Siri Fort, Delhi",,2011-05-18
95.0,18/05/2012,Andhra Pradesh,Hyderabad,Andhra Pradesh State Pollution Control Board,Industrial Area,5.0,26.0,126.0,,"C.I.T.D., Balanagar, Plot no. A1 to A8, IDA, Hyderabad",,2012-05-18
,18/06/2006,Maharashtra,Navi Mumbai,,Industrial Areas,,,275.0,589.0,MPCB Central Lab,,2006-06-18
560,18/06/2011,Daman & Diu,Daman,"Daman Diu, Dadra & Nagar Heveli Pollution Control Committee",Industrial Area,7.4,19.6,,42.0,"Kadaiya Industrial Area, Village- Kadaiya, Daman (Industrial Area)",,2011-06-18
583.0,18/06/2012,Andhra Pradesh,Guntur,Andhra Pradesh State Pollution Control Board,"Residential, Rural and other Areas",6.0,11.0,71.0,,"Near Hindu College, Market Road, Guntur",,2012-06-18
,18/07/2006,Maharashtra,Aurangabad (MS),,Sensitive Areas,4.3,12.8,,,Bibi-Ka-Maqbara,,2006-07-18
558.0,18/07/2011,Dadra & Nagar Haveli,Khadoli,"Daman Diu, Dadra & Nagar Heveli Pollution Control Committee",Industrial Area,7.5,18.5,,29.0,"Khadoli Industrial Area, Village- Khadoli, Silvassa",,2011-07-18
465.0,18/07/2012,Andhra Pradesh,Ramagundam,Andhra Pradesh State Pollution Control Board,"Residential, Rural and other Areas",2.0,7.0,28.33,,"RTC Bus Depot, Karim Nagar, Ramagundam",,2012-07-18
,18/08/2006,Maharashtra,Aurangabad (MS),,Residential and others,4.2,13.7,46.0,157.0,S.B.E.S. College,,2006-08-18
560,18/08/2011,Daman & Diu,Daman,"Daman Diu, Dadra & Nagar Heveli Pollution Control Committee",Industrial Area,7.6,19.2,,27.0,"Kadaiya Industrial Area, Village- Kadaiya, Daman (Industrial Area)",,2011-08-18
519.0,18/08/2012,Assam,Guwahati,Assam State Pollution Control Board,"Residential, Rural and other Areas",6.8,10.5,42.0,,"ITI Building, Gopinath Nagar, Guwahati",,2012-08-18
,18/09/2006,Maharashtra,Aurangabad (MS),,Sensitive Areas,2.8,8.1,14.0,33.0,Bibi-Ka-Maqbara,,2006-09-18
155,18/09/2011,Gujarat,Ahmedabad,National Environmental Engineering Research Institute,"Residential, Rural and other Areas",9.0,17.0,50.0,,"R.C. High School, Mirzapur, Ahmadabad",,2011-09-18
583.0,18/09/2012,Andhra Pradesh,Guntur,Andhra Pradesh State Pollution Control Board,"Residential, Rural and other Areas",5.0,10.0,74.0,,"Near Hindu College, Market Road, Guntur",,2012-09-18
,18/1/2006,Andhra Pradesh,Vijayawada,,Residential and others,4.7,30.6,78.0,195.0,Benz Circle,,2006-01-18
,18/1/2008,Andhra Pradesh,Patancheru,,Residential and others,14.0,48.0,227.0,560.0,Police Station,,2008-01-18
,18/1/2009,Gujarat,Ahmedabad,,Residential and others,12.6,16.9,75.0,174.0,R.C. High School,,2009-01-18
464.0,18/1/2011,Chandigarh,Chandigarh,Chandigarh Pollution Control Committee,"Residential, Rural and other Areas",2.0,22.0,163.0,349.0,"Kaimbwala Village, Chandigarh",,2011-01-18
,18/10/2006,Andhra Pradesh,Hyderabad,,Sensitive Areas,5.0,17.6,58.0,151.0,Zoo Park,,2006-10-18
,18/10/2008,Andhra Pradesh,Patancheru,,Residential and others,12.3,23.5,50.0,129.0,Police Station,,2008-10-18
,18/10/2009,Andhra Pradesh,Hyderabad,,Industrial Areas,12.4,47.8,223.0,484.0,C.I.T.D. Balanagar,,2009-10-18
468.0,18/10/2011,Andhra Pradesh,Patancheru,Andhra Pradesh State Pollution Control Board,"Residential, Rural and other Areas",6.0,23.0,51.0,,"Police Station, Medak, Patencheru",,2011-10-18
583.0,18/10/2012,Andhra Pradesh,Guntur,Andhra Pradesh State Pollution Control Board,"Residential, Rural and other Areas",4.0,11.0,73.0,,"Near Hindu College, Market Road, Guntur",,2012-10-18
,18/11/2006,Assam,Golaghat,,Residential and others,4.5,13.0,56.0,85.0,Golaghat Off. Bldg.,,2006-11-18
,18/11/2008,Andhra Pradesh,Hyderabad,,Residential and others,4.9,28.3,102.0,304.0,Paradise,,2008-11-18
,18/11/2009,Andhra Pradesh,Hyderabad,,Industrial Areas,2.3,8.7,29.0,70.0,Nacharam,,2009-11-18
95.0,18/11/2011,Andhra Pradesh,Hyderabad,Andhra Pradesh State Pollution Control Board,Industrial Area,5.0,33.0,189.0,310.0,"C.I.T.D., Balanagar, Plot no. A1 to A8, IDA, Hyderabad",,2011-11-18
583.0,18/11/2012,Andhra Pradesh,Guntur,Andhra Pradesh State Pollution Control Board,"Residential, Rural and other Areas",4.0,14.0,75.0,,"Near Hindu College, Market Road, Guntur",,2012-11-18
,18/12/2006,Andhra Pradesh,Hyderabad,,Residential and others,5.2,38.9,110.0,301.0,Charminar,,2006-12-18
,18/12/2008,Andhra Pradesh,Hyderabad,,Industrial Areas,,11.9,69.0,111.0,Nacharam,,2008-12-18
,18/12/2009,Assam,Guwahati,,Residential and others,8.5,17.8,206.0,331.0,Gopinath Nagar,,2009-12-18
144,18/12/2011,Delhi,Delhi,National Environmental Engineering Research Institute,"Residential, Rural and other Areas",15.0,128.0,507.0,,"N.Y. SCHOOL, Sarojini Nagar, Delhi",,2011-12-18
583.0,18/12/2012,Andhra Pradesh,Guntur,Andhra Pradesh State Pollution Control Board,"Residential, Rural and other Areas",5.0,16.0,77.0,,"Near Hindu College, Market Road, Guntur",,2012-12-18
,18/2/2006,Andhra Pradesh,Hyderabad,,Industrial Areas,8.8,41.7,198.0,443.0,C.I.T.D. Balanagar,,2006-02-18
,18/2/2008,Andhra Pradesh,Hyderabad,,Industrial Areas,5.2,30.0,99.0,272.0,C.I.T.D. Balanagar,,2008-02-18
,18/2/2009,Andhra Pradesh,Hyderabad,,Industrial Areas,2.8,19.5,95.0,287.0,Nacharam,,2009-02-18
95.0,18/2/2011,Andhra Pradesh,Hyderabad,Andhra Pradesh State Pollution Control Board,Industrial Area,5.0,36.0,121.0,283.0,"C.I.T.D., Balanagar, Plot no. A1 to A8, IDA, Hyderabad",,2011-02-18
641.0,18/2/2012,Maharashtra,Latur,Maharashtra State Pollution Control Board,Industrial Area,6.0,22.0,135.0,,"MIDC, Water Works, Latur",,2012-02-18
,18/3/2006,Andhra Pradesh,Hyderabad,,Industrial Areas,5.1,24.6,59.0,191.0,Uppal,,2006-03-18
,18/3/2008,Andhra Pradesh,Hyderabad,,Residential and others,4.5,14.3,44.0,109.0,Jubilee Hills,,2008-03-18
,18/3/2009,Andhra Pradesh,Hyderabad,,Residential and others,4.8,28.3,58.0,299.0,ABIDS Circle,,2009-03-18
150.0,18/3/2011,Andhra Pradesh,Hyderabad,National Environmental Engineering Research Institute,"Residential, Rural and other Areas",4.0,43.0,120.0,,"Tarnaka, NEERI Lab. IICT Campus, Hyderabad",,2011-03-18
,18/4/2006,Andhra Pradesh,Hyderabad,,Industrial Areas,3.1,14.5,56.0,103.0,Nacharam,,2006-04-18
,18/4/2008,Assam,Bongaigaon,,Residential and others,8.8,16.5,74.0,119.0,Barpara Office Bldg,,2008-04-18
,18/4/2009,Andhra Pradesh,Patancheru,,Residential and others,17.4,25.4,72.0,149.0,Police Station,,2009-04-18
95.0,18/4/2011,Andhra Pradesh,Hyderabad,Andhra Pradesh State Pollution Control Board,Industrial Area,5.0,37.0,120.0,306.0,"C.I.T.D., Balanagar, Plot no. A1 to A8, IDA, Hyderabad",,2011-04-18
,18/5/2006,Andhra Pradesh,Hyderabad,,Industrial Areas,5.5,31.0,95.0,280.0,Uppal,,2006-05-18
,18/5/2008,Gujarat,Ahmedabad,,Residential and others,10.6,20.5,64.0,182.0,R.C. High School,,2008-05-18
,18/5/2009,Andhra Pradesh,Hyderabad,,Industrial Areas,3.5,16.3,29.0,125.0,Nacharam,,2009-05-18
582.0,18/5/2011,Andhra Pradesh,Chittoor,Andhra Pradesh State Pollution Control Board,Sensitive Area,4.0,9.0,39.0,122.0,"GNC Toll Gate Tirumala , Chittoor Dist.",,2011-05-18
641.0,18/5/2012,Maharashtra,Latur,Maharashtra State Pollution Control Board,Industrial Area,10.0,19.0,98.0,,"MIDC, Water Works, Latur",,2012-05-18
,18/6/2006,Andhra Pradesh,Hyderabad,,Industrial Areas,2.4,22.3,62.0,138.0,Nacharam,,2006-06-18
,18/6/2008,Andhra Pradesh,Hyderabad,,Industrial Areas,3.1,11.7,118.0,190.0,Nacharam,,2008-06-18
,18/6/2009,Assam,Bongaigaon,,Residential and others,5.8,19.0,35.0,53.0,Barpara Office Bldg,,2009-06-18
95.0,18/6/2011,Andhra Pradesh,Hyderabad,Andhra Pradesh State Pollution Control Board,Industrial Area,5.0,26.0,100.0,236.0,"C.I.T.D., Balanagar, Plot no. A1 to A8, IDA, Hyderabad",,2011-06-18
642.0,18/6/2012,Maharashtra,Latur,Maharashtra State Pollution Control Board,"Residential, Rural and other Areas",7.0,16.0,57.0,,"Shyamnagar, Terrence of Keshavraj Vidyalaya, Latur",,2012-06-18
,18/7/2006,Andhra Pradesh,Vijayawada,,Residential and others,5.5,39.4,77.0,197.0,Benz Circle,,2006-07-18
,18/7/2008,Andhra Pradesh,Tirupati,,Sensitive Areas,4.0,9.0,41.0,132.0,Reg.Science Centre,,2008-07-18
,18/7/2009,Assam,Guwahati,,Residential and others,7.5,13.5,30.0,71.0,Gopinath Nagar,,2009-07-18
583.0,18/7/2011,Andhra Pradesh,Guntur,Andhra Pradesh State Pollution Control Board,"Residential, Rural and other Areas",2.0,9.6,77.0,187.0,"Near Hindu College, Market Road, Guntur",,2011-07-18
,18/8/2006,Assam,Guwahati,,Residential and others,7.0,12.5,42.0,106.0,Fire Brigade Station,,2006-08-18
,18/8/2008,Andhra Pradesh,Hyderabad,,Industrial Areas,4.2,14.0,55.0,97.0,Nacharam,,2008-08-18
,18/8/2009,Andhra Pradesh,Guntur,,Residential and others,4.0,9.0,88.0,218.0,Hindu College Guntur,,2009-08-18
95.0,18/8/2011,Andhra Pradesh,Hyderabad,Andhra Pradesh State Pollution Control Board,Industrial Area,5.0,20.0,55.0,152.0,"C.I.T.D., Balanagar, Plot no. A1 to A8, IDA, Hyderabad",,2011-08-18
,18/9/2006,Andhra Pradesh,Hyderabad,,Industrial Areas,5.7,26.8,43.0,151.0,C.I.T.D. Balanagar,,2006-09-18
,18/9/2008,Andhra Pradesh,Patancheru,,Residential and others,12.7,18.7,54.0,121.0,Police Station,,2008-09-18
,18/9/2009,Assam,Bongaigaon,,Residential and others,6.3,15.8,49.0,94.0,Campus of Oil India,,2009-09-18
95.0,18/9/2011,Andhra Pradesh,Hyderabad,Andhra Pradesh State Pollution Control Board,Industrial Area,5.0,14.0,41.0,109.0,"C.I.T.D., Balanagar, Plot no. A1 to A8, IDA, Hyderabad",,2011-09-18
642.0,18/9/2012,Maharashtra,Latur,Maharashtra State Pollution Control Board,"Residential, Rural and other Areas",14.0,30.0,60.0,,"Shyamnagar, Terrence of Keshavraj Vidyalaya, Latur",,2012-09-18
95.0,19-01-04,Andhra Pradesh,Hyderabad,Andhra Pradesh State Pollution Control Board,Industrial Area,6.9,134.1,101.7,235.0,"C.I.T.D., Balanagar, Plot no. A1 to A8, IDA, Hyderabad",,2004-01-19
,19-01-05,Andhra Pradesh,Hyderabad,,Industrial Areas,6.0,7.0,71.0,123.0,Nacharam,,2005-01-19
,19-01-07,Andhra Pradesh,Patancheru,,Residential and others,20.7,23.3,50.0,143.0,Police Station,,2007-01-19
577.0,19-01-10,Andhra Pradesh,Nalgonda,Andhra Pradesh State Pollution Control Board,"Residential, Rural and other Areas",4.0,25.0,118.0,,"Beside Regional Office, APPCB Nalgonda",,2010-01-19
751.0,19-01-13,Andhra Pradesh,Srikakulam,Andhra Pradesh State Pollution Control Board,Industrial Area,2.0,5.0,41.0,,"IDA, Pydibheemavaram, Srikakulam",,2013-01-19
748.0,19-01-14,Andhra Pradesh,Ananthapur,Andhra Pradesh State Pollution Control Board,"Residential, Rural and other Areas",4.0,9.0,83.0,,"Kamalanagar, Ananthapur",,2014-01-19
233.0,19-01-15,Andhra Pradesh,Visakhapatnam,Andhra Pradesh State Pollution Control Board,Industrial Area,9.0,18.0,76.0,,"Industrial Estate, Marripalem, Visakhapatnam",,2015-01-19
55,19-02-03,Delhi,Delhi,Central Pollution Control Board,Industrial Area,9.0,38.0,71.0,205.0,,,2003-02-19
233.0,19-02-04,Andhra Pradesh,Visakhapatnam,Andhra Pradesh State Pollution Control Board,Industrial Area,12.0,29.0,92.0,145.0,"Industrial Estate, Marripalem, Visakhapatnam",,2004-02-19
,19-02-05,Andhra Pradesh,Hyderabad,,Industrial Areas,4.8,35.4,72.0,180.0,Uppal,,2005-02-19
,19-02-07,Andhra Pradesh,Hyderabad,,Industrial Areas,6.2,5.3,43.0,96.0,Nacharam,,2007-02-19
582.0,19-02-10,Andhra Pradesh,Chittoor,Andhra Pradesh State Pollution Control Board,Sensitive Area,4.0,9.0,44.0,,"GNC Toll Gate Tirumala , Chittoor Dist.",,2010-02-19
751.0,19-02-13,Andhra Pradesh,Srikakulam,Andhra Pradesh State Pollution Control Board,Industrial Area,2.0,5.0,147.0,,"IDA, Pydibheemavaram, Srikakulam",,2013-02-19
583.0,19-02-14,Andhra Pradesh,Guntur,Andhra Pradesh State Pollution Control Board,"Residential, Rural and other Areas",4.0,20.0,75.0,,"Near Hindu College, Market Road, Guntur",,2014-02-19
233.0,19-02-15,Andhra Pradesh,Visakhapatnam,Andhra Pradesh State Pollution Control Board,Industrial Area,5.0,10.0,52.0,,"Industrial Estate, Marripalem, Visakhapatnam",,2015-02-19
247,19-03-03,Gujarat,Bharuch,Gujarat Pollution Control Board,,0.0,0.0,0.0,0.0,,,2003-03-19
95.0,19-03-04,Andhra Pradesh,Hyderabad,Andhra Pradesh State Pollution Control Board,Industrial Area,5.4,58.4,85.0,221.3,"C.I.T.D., Balanagar, Plot no. A1 to A8, IDA, Hyderabad",,2004-03-19
,19-03-05,Andhra Pradesh,Hyderabad,,Industrial Areas,4.8,43.1,89.0,363.0,C.I.T.D. Balanagar,,2005-03-19
,19-03-07,Andhra Pradesh,Visakhapatnam,,Industrial Areas,7.6,28.5,96.0,191.0,Industrial Estate,,2007-03-19
151.0,19-03-10,Andhra Pradesh,Hyderabad,National Environmental Engineering Research Institute,Industrial Area,5.0,16.0,71.0,,"Nacharam, Industrial Estate, Premises of IICT (APIDC), Hyderabad",,2010-03-19
750.0,19-03-13,Andhra Pradesh,Eluru,Andhra Pradesh State Pollution Control Board,"Residential, Rural and other Areas",,,88.0,,"ASRAM Diagnostic Center, Eluru",,2013-03-19
748.0,19-03-14,Andhra Pradesh,Ananthapur,Andhra Pradesh State Pollution Control Board,"Residential, Rural and other Areas",5.0,10.0,68.0,,"Kamalanagar, Ananthapur",,2014-03-19
233.0,19-03-15,Andhra Pradesh,Visakhapatnam,Andhra Pradesh State Pollution Control Board,Industrial Area,12.0,18.0,93.0,,"Industrial Estate, Marripalem, Visakhapatnam",,2015-03-19
144,19-04-03,Delhi,Delhi,,"Residential, Rural and other Areas",12.0,41.0,,717.0,,,2003-04-19
95.0,19-04-04,Andhra Pradesh,Hyderabad,Andhra Pradesh State Pollution Control Board,Industrial Area,5.7,58.7,132.3,397.0,"C.I.T.D., Balanagar, Plot no. A1 to A8, IDA, Hyderabad",,2004-04-19
,19-04-05,Andhra Pradesh,Hyderabad,,Industrial Areas,4.9,18.4,85.0,294.0,C.I.T.D. Balanagar,,2005-04-19
,19-04-07,Andhra Pradesh,Visakhapatnam,,Industrial Areas,8.3,29.8,79.0,163.0,Industrial Estate,,2007-04-19
582.0,19-04-10,Andhra Pradesh,Chittoor,Andhra Pradesh State Pollution Control Board,Sensitive Area,4.0,9.0,40.0,,"GNC Toll Gate Tirumala , Chittoor Dist.",,2010-04-19
751.0,19-04-13,Andhra Pradesh,Srikakulam,Andhra Pradesh State Pollution Control Board,Industrial Area,5.0,9.0,113.0,,"IDA, Pydibheemavaram, Srikakulam",,2013-04-19
748.0,19-04-14,Andhra Pradesh,Ananthapur,Andhra Pradesh State Pollution Control Board,"Residential, Rural and other Areas",5.0,10.0,78.0,,"Kamalanagar, Ananthapur",,2014-04-19
233.0,19-04-15,Andhra Pradesh,Visakhapatnam,Andhra Pradesh State Pollution Control Board,Industrial Area,7.0,12.0,115.0,,"Industrial Estate, Marripalem, Visakhapatnam",,2015-04-19
56,19-05-03,Delhi,Delhi,Central Pollution Control Board,Industrial Area,8.0,36.0,179.0,647.0,,,2003-05-19
233.0,19-05-04,Andhra Pradesh,Visakhapatnam,Andhra Pradesh State Pollution Control Board,Industrial Area,9.0,32.0,84.0,129.0,"Industrial Estate, Marripalem, Visakhapatnam",,2004-05-19
,19-05-05,Andhra Pradesh,Hyderabad,,Industrial Areas,4.6,18.5,63.0,315.0,C.I.T.D. Balanagar,,2005-05-19
,19-05-07,Andhra Pradesh,Visakhapatnam,,Industrial Areas,8.3,30.5,89.0,181.0,Industrial Estate,,2007-05-19
465.0,19-05-10,Andhra Pradesh,Ramagundam,Andhra Pradesh State Pollution Control Board,"Residential, Rural and other Areas",2.0,5.0,47.0,,"RTC Bus Depot, Karim Nagar, Ramagundam",,2010-05-19
365.0,19-05-13,Andhra Pradesh,Hyderabad,Andhra Pradesh State Pollution Control Board,"Residential, Rural and other Areas",4.0,16.0,142.0,,Jublee Hills Hyderabad,,2013-05-19
748.0,19-05-14,Andhra Pradesh,Ananthapur,Andhra Pradesh State Pollution Control Board,"Residential, Rural and other Areas",5.0,10.0,65.0,,"Kamalanagar, Ananthapur",,2014-05-19
233.0,19-05-15,Andhra Pradesh,Visakhapatnam,Andhra Pradesh State Pollution Control Board,Industrial Area,8.0,19.0,78.0,,"Industrial Estate, Marripalem, Visakhapatnam",,2015-05-19
55,19-06-03,Delhi,Delhi,Central Pollution Control Board,Industrial Area,13.0,44.0,84.0,147.0,,,2003-06-19
233.0,19-06-04,Andhra Pradesh,Visakhapatnam,Andhra Pradesh State Pollution Control Board,Industrial Area,12.0,32.0,100.0,149.0,"Industrial Estate, Marripalem, Visakhapatnam",,2004-06-19
,19-06-05,Andhra Pradesh,Hyderabad,,Residential and others,4.9,21.9,35.0,106.0,Jubilee Hills,,2005-06-19
,19-06-07,Andhra Pradesh,Hyderabad,,Industrial Areas,,,34.0,85.0,Nacharam,,2007-06-19
577.0,19-06-10,Andhra Pradesh,Nalgonda,Andhra Pradesh State Pollution Control Board,"Residential, Rural and other Areas",5.0,24.0,67.0,,"Beside Regional Office, APPCB Nalgonda",,2010-06-19
750.0,19-06-13,Andhra Pradesh,Eluru,Andhra Pradesh State Pollution Control Board,"Residential, Rural and other Areas",8.0,11.0,188.0,,"ASRAM Diagnostic Center, Eluru",,2013-06-19
748.0,19-06-14,Andhra Pradesh,Ananthapur,Andhra Pradesh State Pollution Control Board,"Residential, Rural and other Areas",5.0,10.0,82.0,,"Kamalanagar, Ananthapur",,2014-06-19
233.0,19-06-15,Andhra Pradesh,Visakhapatnam,Andhra Pradesh State Pollution Control Board,Industrial Area,9.0,12.0,17.0,,"Industrial Estate, Marripalem, Visakhapatnam",,2015-06-19
84.0,19-07-03,Madhya Pradesh,Nagda,Madhya Pradesh  Pollution Control Board,"Residential, Rural and other Areas",0.0,0.0,0.0,0.0,,,2003-07-19
233.0,19-07-04,Andhra Pradesh,Visakhapatnam,Andhra Pradesh State Pollution Control Board,Industrial Area,11.0,35.0,96.0,149.0,"Industrial Estate, Marripalem, Visakhapatnam",,2004-07-19
,19-07-05,Andhra Pradesh,Hyderabad,,Industrial Areas,4.5,23.9,48.0,358.0,C.I.T.D. Balanagar,,2005-07-19
,19-07-07,Andhra Pradesh,Visakhapatnam,,Industrial Areas,7.4,27.5,85.0,170.0,Industrial Estate,,2007-07-19
583.0,19-07-10,Andhra Pradesh,Guntur,Andhra Pradesh State Pollution Control Board,"Residential, Rural and other Areas",2.0,11.0,73.0,,"Near Hindu College, Market Road, Guntur",,2010-07-19
750.0,19-07-13,Andhra Pradesh,Eluru,Andhra Pradesh State Pollution Control Board,"Residential, Rural and other Areas",4.0,17.0,50.0,,"ASRAM Diagnostic Center, Eluru",,2013-07-19
748.0,19-07-14,Andhra Pradesh,Ananthapur,Andhra Pradesh State Pollution Control Board,"Residential, Rural and other Areas",5.0,10.0,35.0,,"Kamalanagar, Ananthapur",,2014-07-19
233.0,19-07-15,Andhra Pradesh,Visakhapatnam,Andhra Pradesh State Pollution Control Board,Industrial Area,5.0,12.0,41.0,,"Industrial Estate, Marripalem, Visakhapatnam",,2015-07-19
58,19-08-03,Delhi,Delhi,Central Pollution Control Board,Industrial Area,13.0,31.0,87.0,281.0,,,2003-08-19
233.0,19-08-04,Andhra Pradesh,Visakhapatnam,Andhra Pradesh State Pollution Control Board,Industrial Area,11.0,32.0,84.0,124.0,"Industrial Estate, Marripalem, Visakhapatnam",,2004-08-19
,19-08-05,Andhra Pradesh,Hyderabad,,Residential and others,5.1,22.0,63.0,183.0,Charminar,,2005-08-19
,19-08-07,Andhra Pradesh,Hyderabad,,Residential and others,4.9,35.0,72.0,234.0,Paradise,,2007-08-19
583.0,19-08-10,Andhra Pradesh,Guntur,Andhra Pradesh State Pollution Control Board,"Residential, Rural and other Areas",2.0,11.0,72.0,,"Near Hindu College, Market Road, Guntur",,2010-08-19
751.0,19-08-13,Andhra Pradesh,Srikakulam,Andhra Pradesh State Pollution Control Board,Industrial Area,19.0,40.0,63.0,,"IDA, Pydibheemavaram, Srikakulam",,2013-08-19
748.0,19-08-14,Andhra Pradesh,Ananthapur,Andhra Pradesh State Pollution Control Board,"Residential, Rural and other Areas",5.0,10.0,52.0,,"Kamalanagar, Ananthapur",,2014-08-19
233.0,19-08-15,Andhra Pradesh,Visakhapatnam,Andhra Pradesh State Pollution Control Board,Industrial Area,5.0,9.0,63.0,,"Industrial Estate, Marripalem, Visakhapatnam",,2015-08-19
45.0,19-08-87,Bihar,Jharia,Bihar Pollution Control Board,Industrial,13.3,37.4,,379.0,,,1987-08-19
59,19-09-03,Delhi,Delhi,Central Pollution Control Board,"Residential, Rural and other Areas",12.0,46.0,69.0,269.0,,,2003-09-19
233.0,19-09-04,Andhra Pradesh,Visakhapatnam,Andhra Pradesh State Pollution Control Board,Industrial Area,11.0,32.0,84.0,129.0,"Industrial Estate, Marripalem, Visakhapatnam",,2004-09-19
,19-09-05,Assam,Guwahati,,Residential and others,4.0,13.4,71.0,124.0,Head Office,,2005-09-19
,19-09-07,Andhra Pradesh,Visakhapatnam,,Industrial Areas,8.7,32.4,92.0,186.0,Industrial Estate,,2007-09-19
234.0,19-09-10,Andhra Pradesh,Visakhapatnam,Andhra Pradesh State Pollution Control Board,"Residential, Rural and other Areas",4.0,27.0,53.0,,"Panchayat Raj office, Mindi, Visakhapatnam",,2010-09-19
742.0,19-09-13,Andhra Pradesh,Chittoor,Andhra Pradesh State Pollution Control Board,"Residential, Rural and other Areas",5.0,10.0,60.0,,"Near Nutrine Confectionery, Palamaner Road, Chittor",,2013-09-19
748.0,19-09-14,Andhra Pradesh,Ananthapur,Andhra Pradesh State Pollution Control Board,"Residential, Rural and other Areas",5.0,10.0,82.0,,"Kamalanagar, Ananthapur",,2014-09-19
234.0,19-09-15,Andhra Pradesh,Visakhapatnam,Andhra Pradesh State Pollution Control Board,"Residential, Rural and other Areas",5.0,12.0,50.0,,"Panchayat Raj office, Mindi, Visakhapatnam",,2015-09-19
393.0,19-10-04,Andhra Pradesh,Hyderabad,Andhra Pradesh State Pollution Control Board,"Residential, Rural and other Areas",2.9,23.3,98.3,320.0,"Paradise, Hyderabad",,2004-10-19
,19-10-05,Andhra Pradesh,Hyderabad,,Industrial Areas,4.8,35.4,115.0,311.0,C.I.T.D. Balanagar,,2005-10-19
,19-10-07,Andhra Pradesh,Tirupati,,Sensitive Areas,4.0,9.0,19.0,72.0,Reg.Science Centre,,2007-10-19
583.0,19-10-10,Andhra Pradesh,Guntur,Andhra Pradesh State Pollution Control Board,"Residential, Rural and other Areas",2.0,10.0,79.0,,"Near Hindu College, Market Road, Guntur",,2010-10-19
751.0,19-10-13,Andhra Pradesh,Srikakulam,Andhra Pradesh State Pollution Control Board,Industrial Area,18.0,25.0,56.0,,"IDA, Pydibheemavaram, Srikakulam",,2013-10-19
748.0,19-10-14,Andhra Pradesh,Ananthapur,Andhra Pradesh State Pollution Control Board,"Residential, Rural and other Areas",4.0,14.0,69.0,,"Kamalanagar, Ananthapur",,2014-10-19
233.0,19-10-15,Andhra Pradesh,Visakhapatnam,Andhra Pradesh State Pollution Control Board,Industrial Area,7.0,14.0,71.0,,"Industrial Estate, Marripalem, Visakhapatnam",,2015-10-19
56,19-11-03,Delhi,Delhi,Central Pollution Control Board,Industrial Area,9.0,44.0,155.0,440.0,,,2003-11-19
95.0,19-11-04,Andhra Pradesh,Hyderabad,Andhra Pradesh State Pollution Control Board,Industrial Area,4.3,34.0,86.0,261.7,"C.I.T.D., Balanagar, Plot no. A1 to A8, IDA, Hyderabad",,2004-11-19
,19-11-05,Andhra Pradesh,Visakhapatnam,,Industrial Areas,10.9,32.1,96.0,191.0,Industrial Estate,,2005-11-19
,19-11-07,Andhra Pradesh,Hyderabad,,Industrial Areas,3.4,12.2,44.0,82.0,Nacharam,,2007-11-19
150.0,19-11-10,Andhra Pradesh,Hyderabad,National Environmental Engineering Research Institute,"Residential, Rural and other Areas",5.0,19.0,24.0,,"Tarnaka, NEERI Lab. IICT Campus, Hyderabad",,2010-11-19
748.0,19-11-13,Andhra Pradesh,Ananthapur,Andhra Pradesh State Pollution Control Board,"Residential, Rural and other Areas",4.0,14.0,59.0,,"Kamalanagar, Ananthapur",,2013-11-19
583.0,19-11-14,Andhra Pradesh,Guntur,Andhra Pradesh State Pollution Control Board,"Residential, Rural and other Areas",5.0,22.0,101.0,,"Near Hindu College, Market Road, Guntur",,2014-11-19
233.0,19-11-15,Andhra Pradesh,Visakhapatnam,Andhra Pradesh State Pollution Control Board,Industrial Area,7.0,16.0,81.0,,"Industrial Estate, Marripalem, Visakhapatnam",,2015-11-19
55,19-12-03,Delhi,Delhi,Central Pollution Control Board,Industrial Area,12.0,49.0,127.0,281.0,,,2003-12-19
233.0,19-12-04,Andhra Pradesh,Visakhapatnam,Andhra Pradesh State Pollution Control Board,Industrial Area,11.0,32.0,93.0,135.0,"Industrial Estate, Marripalem, Visakhapatnam",,2004-12-19
,19-12-05,Assam,Guwahati,,Residential and others,4.5,25.3,125.0,262.0,Fire Brigade Station,,2005-12-19
,19-12-07,Andhra Pradesh,Hyderabad,,Industrial Areas,3.5,13.3,64.0,112.0,Nacharam,,2007-12-19
150.0,19-12-10,Andhra Pradesh,Hyderabad,National Environmental Engineering Research Institute,"Residential, Rural and other Areas",4.0,12.0,42.0,,"Tarnaka, NEERI Lab. IICT Campus, Hyderabad",,2010-12-19
95.0,19-12-13,Andhra Pradesh,Hyderabad,Andhra Pradesh State Pollution Control Board,Industrial Area,5.0,37.0,191.0,,"C.I.T.D., Balanagar, Plot no. A1 to A8, IDA, Hyderabad",,2013-12-19
757.0,19-12-14,Andhra Pradesh,Rajahmundry,Andhra Pradesh State Pollution Control Board,Industrial Area,10.0,21.0,65.0,,"Staff Club Building, M/s A.P. Paper Mill, Rajahmundry",,2014-12-19
233.0,19-12-15,Andhra Pradesh,Visakhapatnam,Andhra Pradesh State Pollution Control Board,Industrial Area,11.0,29.0,72.0,,"Industrial Estate, Marripalem, Visakhapatnam",,2015-12-19
,19/01/2006,Maharashtra,Aurangabad (MS),,Residential and others,5.0,31.8,,,C.A.D.A. Office,,2006-01-19
58,19/01/2011,Delhi,Delhi,Central Pollution Control Board,Industrial Area,5.0,42.0,331.0,,"Shahadra, Delhi",,2011-01-19
95.0,19/01/2012,Andhra Pradesh,Hyderabad,Andhra Pradesh State Pollution Control Board,Industrial Area,4.0,34.0,153.0,,"C.I.T.D., Balanagar, Plot no. A1 to A8, IDA, Hyderabad",,2012-01-19
,19/02/2006,Rajasthan,Jodhpur,,Residential and others,6.7,20.2,236.0,517.0,Shashtri Nagar,,2006-02-19
558.0,19/02/2011,Dadra & Nagar Haveli,Khadoli,"Daman Diu, Dadra & Nagar Heveli Pollution Control Committee",Industrial Area,7.3,19.3,,42.0,"Khadoli Industrial Area, Village- Khadoli, Silvassa",,2011-02-19
233.0,19/02/2012,Andhra Pradesh,Visakhapatnam,Andhra Pradesh State Pollution Control Board,Industrial Area,5.0,21.0,100.0,,"Industrial Estate, Marripalem, Visakhapatnam",,2012-02-19
,19/03/2006,Maharashtra,Thane,,Residential and others,9.8,14.0,,,Kopri,,2006-03-19
560,19/03/2011,Daman & Diu,Daman,"Daman Diu, Dadra & Nagar Heveli Pollution Control Committee",Industrial Area,7.4,19.6,24.0,42.0,"Kadaiya Industrial Area, Village- Kadaiya, Daman (Industrial Area)",,2011-03-19
583.0,19/03/2012,Andhra Pradesh,Guntur,Andhra Pradesh State Pollution Control Board,"Residential, Rural and other Areas",6.0,11.0,77.0,,"Near Hindu College, Market Road, Guntur",,2012-03-19
,19/04/2006,Maharashtra,Chandrapur,,Residential and others,17.5,27.0,133.0,227.0,"SRO, Bapat Nagar",,2006-04-19
560,19/04/2011,Daman & Diu,Daman,"Daman Diu, Dadra & Nagar Heveli Pollution Control Committee",Industrial Area,7.5,19.8,,43.0,"Kadaiya Industrial Area, Village- Kadaiya, Daman (Industrial Area)",,2011-04-19
577.0,19/04/2012,Andhra Pradesh,Nalgonda,Andhra Pradesh State Pollution Control Board,"Residential, Rural and other Areas",4.0,16.0,89.0,,"Beside Regional Office, APPCB Nalgonda",,2012-04-19
,19/05/2006,Maharashtra,Aurangabad (MS),,Residential and others,5.5,17.5,55.0,189.0,S.B.E.S. College,,2006-05-19
558.0,19/05/2011,Dadra & Nagar Haveli,Khadoli,"Daman Diu, Dadra & Nagar Heveli Pollution Control Committee",Industrial Area,7.2,18.3,,39.0,"Khadoli Industrial Area, Village- Khadoli, Silvassa",,2011-05-19
577.0,19/05/2012,Andhra Pradesh,Nalgonda,Andhra Pradesh State Pollution Control Board,"Residential, Rural and other Areas",4.0,13.0,61.0,,"Beside Regional Office, APPCB Nalgonda",,2012-05-19
,19/06/2006,Maharashtra,Aurangabad (MS),,Sensitive Areas,4.3,14.5,46.0,104.0,Bibi-Ka-Maqbara,,2006-06-19
155,19/06/2011,Gujarat,Ahmedabad,National Environmental Engineering Research Institute,"Residential, Rural and other Areas",14.0,27.0,81.0,,"R.C. High School, Mirzapur, Ahmadabad",,2011-06-19
462.0,19/06/2012,Andhra Pradesh,Vijayawada,Andhra Pradesh State Pollution Control Board,"Residential, Rural and other Areas",7.0,11.0,100.0,,"Benz Circle, Vijayawada",,2012-06-19
,19/07/2006,Maharashtra,Aurangabad (MS),,Residential and others,4.2,12.4,19.0,69.0,C.A.D.A. Office,,2006-07-19
560,19/07/2011,Daman & Diu,Daman,"Daman Diu, Dadra & Nagar Heveli Pollution Control Committee",Industrial Area,7.6,19.5,,26.0,"Kadaiya Industrial Area, Village- Kadaiya, Daman (Industrial Area)",,2011-07-19
465.0,19/07/2012,Andhra Pradesh,Ramagundam,Andhra Pradesh State Pollution Control Board,"Residential, Rural and other Areas",2.0,5.0,25.0,,"RTC Bus Depot, Karim Nagar, Ramagundam",,2012-07-19
,19/08/2006,Maharashtra,Aurangabad (MS),,Residential and others,2.7,13.7,43.0,149.0,S.B.E.S. College,,2006-08-19
59,19/08/2011,Delhi,Delhi,Central Pollution Control Board,"Residential, Rural and other Areas",4.0,26.0,136.0,,"Janakpuri, Delhi",,2011-08-19
233.0,19/08/2012,Andhra Pradesh,Visakhapatnam,Andhra Pradesh State Pollution Control Board,Industrial Area,5.0,18.0,123.0,,"Industrial Estate, Marripalem, Visakhapatnam",,2012-08-19
,19/09/2006,Maharashtra,Aurangabad (MS),,Sensitive Areas,4.3,10.0,23.0,45.0,Bibi-Ka-Maqbara,,2006-09-19
558.0,19/09/2011,Dadra & Nagar Haveli,Khadoli,"Daman Diu, Dadra & Nagar Heveli Pollution Control Committee",Industrial Area,7.5,19.0,,39.0,"Khadoli Industrial Area, Village- Khadoli, Silvassa",,2011-09-19
233.0,19/09/2012,Andhra Pradesh,Visakhapatnam,Andhra Pradesh State Pollution Control Board,Industrial Area,4.0,9.0,39.0,,"Industrial Estate, Marripalem, Visakhapatnam",,2012-09-19
,19/1/2006,Andhra Pradesh,Hyderabad,,Industrial Areas,,11.7,60.0,140.0,Nacharam,,2006-01-19
,19/1/2008,Andhra Pradesh,Visakhapatnam,,Industrial Areas,9.2,30.5,103.0,188.0,Industrial Estate,,2008-01-19
,19/1/2009,Andhra Pradesh,Patancheru,,Residential and others,19.4,27.4,185.0,373.0,Police Station,,2009-01-19
582.0,19/1/2011,Andhra Pradesh,Chittoor,Andhra Pradesh State Pollution Control Board,Sensitive Area,4.0,9.0,42.0,120.0,"GNC Toll Gate Tirumala , Chittoor Dist.",,2011-01-19
,19/10/2006,Andhra Pradesh,Hyderabad,,Residential and others,4.8,38.5,123.0,315.0,Paradise,,2006-10-19
,19/10/2008,Andhra Pradesh,Hyderabad,,Industrial Areas,,49.6,23.0,43.0,Nacharam,,2008-10-19
,19/10/2009,Andhra Pradesh,Guntur,,Residential and others,4.0,9.0,84.0,224.0,Hindu College Guntur,,2009-10-19
95.0,19/10/2011,Andhra Pradesh,Hyderabad,Andhra Pradesh State Pollution Control Board,Industrial Area,5.0,45.0,117.0,273.0,"C.I.T.D., Balanagar, Plot no. A1 to A8, IDA, Hyderabad",,2011-10-19
468.0,19/10/2012,Andhra Pradesh,Patancheru,Andhra Pradesh State Pollution Control Board,"Residential, Rural and other Areas",6.0,22.0,106.0,,"Police Station, Medak, Patencheru",,2012-10-19
,19/11/2006,Andhra Pradesh,Hyderabad,,Industrial Areas,5.1,35.3,107.0,271.0,C.I.T.D. Balanagar,,2006-11-19
,19/11/2008,Andhra Pradesh,Hyderabad,,Industrial Areas,3.4,17.8,48.0,85.0,Nacharam,,2008-11-19
,19/11/2009,Andhra Pradesh,Nalgonda,,Residential and others,4.3,21.6,104.0,231.0,RO APPCB,,2009-11-19
464.0,19/11/2011,Chandigarh,Chandigarh,Chandigarh Pollution Control Committee,"Residential, Rural and other Areas",2.0,6.7,137.0,253.0,"Kaimbwala Village, Chandigarh",,2011-11-19
468.0,19/11/2012,Andhra Pradesh,Patancheru,Andhra Pradesh State Pollution Control Board,"Residential, Rural and other Areas",6.0,19.0,121.0,,"Police Station, Medak, Patencheru",,2012-11-19
,19/12/2006,Andhra Pradesh,Hyderabad,,Sensitive Areas,4.5,18.8,76.0,130.0,Zoo Park,,2006-12-19
,19/12/2008,Andhra Pradesh,Visakhapatnam,,Industrial Areas,6.9,14.5,76.0,151.0,Industrial Estate,,2008-12-19
,19/12/2009,Assam,Guwahati,,Residential and others,9.0,19.3,172.0,307.0,Gopinath Nagar,,2009-12-19
468.0,19/12/2011,Andhra Pradesh,Patancheru,Andhra Pradesh State Pollution Control Board,"Residential, Rural and other Areas",6.0,21.0,103.0,,"Police Station, Medak, Patencheru",,2011-12-19
578.0,19/12/2012,Andhra Pradesh,Kakinada,Andhra Pradesh State Pollution Control Board,"Residential, Rural and other Areas",,,57.0,,"Top of the Office Building Ramanayyapeta, Kakinada",,2012-12-19
,19/2/2006,Andhra Pradesh,Hyderabad,,Industrial Areas,7.4,25.9,69.0,191.0,Nacharam,,2006-02-19
,19/2/2008,Andhra Pradesh,Visakhapatnam,,Industrial Areas,7.7,31.0,78.0,161.0,Industrial Estate,,2008-02-19
,19/2/2009,Andhra Pradesh,Visakhapatnam,,Industrial Areas,64.0,63.5,114.0,251.0,Industrial Estate,,2009-02-19
577.0,19/2/2011,Andhra Pradesh,Nalgonda,Andhra Pradesh State Pollution Control Board,"Residential, Rural and other Areas",4.0,21.0,86.0,,"Beside Regional Office, APPCB Nalgonda",,2011-02-19
,19/3/2006,Andhra Pradesh,Hyderabad,,Industrial Areas,5.0,25.1,83.0,209.0,Uppal,,2006-03-19
,19/3/2008,Andhra Pradesh,Hyderabad,,Industrial Areas,3.1,10.8,56.0,101.0,Nacharam,,2008-03-19
,19/3/2009,Andhra Pradesh,Visakhapatnam,,Industrial Areas,10.8,48.9,160.0,290.0,Industrial Estate,,2009-03-19
577.0,19/3/2011,Andhra Pradesh,Nalgonda,Andhra Pradesh State Pollution Control Board,"Residential, Rural and other Areas",4.0,21.0,84.0,,"Beside Regional Office, APPCB Nalgonda",,2011-03-19
642.0,19/3/2012,Maharashtra,Latur,Maharashtra State Pollution Control Board,"Residential, Rural and other Areas",4.0,12.0,165.0,,"Shyamnagar, Terrence of Keshavraj Vidyalaya, Latur",,2012-03-19
,19/4/2006,Andhra Pradesh,Hyderabad,,Residential and others,5.4,30.0,90.0,255.0,Charminar,,2006-04-19
,19/4/2008,Andhra Pradesh,Patancheru,,Residential and others,13.7,48.8,181.0,425.0,Police Station,,2008-04-19
,19/4/2009,Andhra Pradesh,Visakhapatnam,,Industrial Areas,7.7,30.3,56.0,224.0,Industrial Estate,,2009-04-19
583.0,19/4/2011,Andhra Pradesh,Guntur,Andhra Pradesh State Pollution Control Board,"Residential, Rural and other Areas",4.0,10.1,75.0,191.0,"Near Hindu College, Market Road, Guntur",,2011-04-19
,19/5/2006,Andhra Pradesh,Hyderabad,,Industrial Areas,5.6,26.5,117.0,293.0,C.I.T.D. Balanagar,,2006-05-19
,19/5/2008,Andhra Pradesh,Patancheru,,Residential and others,5.3,24.2,57.0,386.0,Police Station,,2008-05-19
,19/5/2009,Andhra Pradesh,Patancheru,,Residential and others,15.2,24.4,58.0,128.0,Police Station,,2009-05-19
583.0,19/5/2011,Andhra Pradesh,Guntur,Andhra Pradesh State Pollution Control Board,"Residential, Rural and other Areas",4.0,10.0,74.0,189.0,"Near Hindu College, Market Road, Guntur",,2011-05-19
641.0,19/5/2012,Maharashtra,Latur,Maharashtra State Pollution Control Board,Industrial Area,9.0,20.0,86.0,,"MIDC, Water Works, Latur",,2012-05-19
,19/6/2006,Andhra Pradesh,Hyderabad,,Residential and others,5.2,32.8,91.0,234.0,Charminar,,2006-06-19
,19/6/2008,Andhra Pradesh,Patancheru,,Residential and others,7.7,11.3,71.0,151.0,Police Station,,2008-06-19
,19/6/2009,Andhra Pradesh,Patancheru,,Residential and others,16.7,27.7,89.0,200.0,Police Station,,2009-06-19
150.0,19/6/2011,Andhra Pradesh,Hyderabad,National Environmental Engineering Research Institute,"Residential, Rural and other Areas",2.0,37.0,139.0,,"Tarnaka, NEERI Lab. IICT Campus, Hyderabad",,2011-06-19
642.0,19/6/2012,Maharashtra,Latur,Maharashtra State Pollution Control Board,"Residential, Rural and other Areas",4.0,13.0,123.0,,"Shyamnagar, Terrence of Keshavraj Vidyalaya, Latur",,2012-06-19
,19/7/2006,Andhra Pradesh,Hyderabad,,Residential and others,5.0,27.4,93.0,278.0,Paradise,,2006-07-19
,19/7/2008,Andhra Pradesh,Visakhapatnam,,Industrial Areas,8.3,19.8,42.0,92.0,Industrial Estate,,2008-07-19
,19/7/2009,Andhra Pradesh,Patancheru,,Residential and others,19.2,29.7,65.0,169.0,Police Station,,2009-07-19
583.0,19/7/2011,Andhra Pradesh,Guntur,Andhra Pradesh State Pollution Control Board,"Residential, Rural and other Areas",2.0,9.8,75.0,183.0,"Near Hindu College, Market Road, Guntur",,2011-07-19
,19/8/2006,Andhra Pradesh,Hyderabad,,Residential and others,5.2,30.7,76.0,245.0,Charminar,,2006-08-19
,19/8/2008,Andhra Pradesh,Hyderabad,,Residential and others,5.2,35.0,110.0,340.0,Charminar,,2008-08-19
,19/8/2009,Andhra Pradesh,Patancheru,,Residential and others,13.0,30.5,75.0,189.0,Police Station,,2009-08-19
582.0,19/8/2011,Andhra Pradesh,Chittoor,Andhra Pradesh State Pollution Control Board,Sensitive Area,4.0,9.0,42.0,100.0,"GNC Toll Gate Tirumala , Chittoor Dist.",,2011-08-19
,19/9/2006,Andhra Pradesh,Hyderabad,,Residential and others,4.0,19.6,51.0,114.0,Mourya Inn,,2006-09-19
,19/9/2008,Andhra Pradesh,Hyderabad,,Industrial Areas,5.3,16.9,42.0,79.0,Nacharam,,2008-09-19
,19/9/2009,Andhra Pradesh,Nalgonda,,Residential and others,4.8,24.6,92.0,202.0,RO APPCB,,2009-09-19
582.0,19/9/2011,Andhra Pradesh,Chittoor,Andhra Pradesh State Pollution Control Board,Sensitive Area,4.0,9.0,38.0,98.0,"GNC Toll Gate Tirumala , Chittoor Dist.",,2011-09-19
47,2/1/1987,Gujarat,Baroda,Gujarat Pollution Control Board,Residential,24.4,34.3,,301.0,,,1987-01-02
36,2/1/1988,Goa,Ponda,Goa Pollution Control Board,,8.7,16.1,,95.0,,,1988-01-02
84.0,2/1/2003,Madhya Pradesh,Nagda,Madhya Pradesh  Pollution Control Board,"Residential, Rural and other Areas",0.0,0.0,0.0,0.0,,,2003-01-02
233.0,2/1/2004,Andhra Pradesh,Visakhapatnam,Andhra Pradesh State Pollution Control Board,Industrial Area,9.0,33.0,96.0,140.0,"Industrial Estate, Marripalem, Visakhapatnam",,2004-01-02
,2/1/2005,Andhra Pradesh,Hyderabad,,Industrial Areas,12.0,29.8,23.0,62.0,Nacharam,,2005-01-02
,2/1/2006,Andhra Pradesh,Vijayawada,,Industrial Areas,4.9,25.5,101.0,257.0,Autonagar,,2006-01-02
,2/1/2007,Andhra Pradesh,Hyderabad,,Industrial Areas,,,91.0,132.0,Nacharam,,2007-01-02
,2/1/2008,Andhra Pradesh,Hyderabad,,Industrial Areas,3.6,17.2,76.0,135.0,Nacharam,,2008-01-02
,2/1/2009,Andhra Pradesh,Visakhapatnam,,Industrial Areas,13.9,39.8,62.0,156.0,Industrial Estate,,2009-01-02
465.0,2/1/2010,Andhra Pradesh,Ramagundam,Andhra Pradesh State Pollution Control Board,"Residential, Rural and other Areas",2.0,12.0,139.0,,"RTC Bus Depot, Karim Nagar, Ramagundam",,2010-01-02
577.0,2/1/2011,Andhra Pradesh,Nalgonda,Andhra Pradesh State Pollution Control Board,"Residential, Rural and other Areas",5.0,20.0,86.0,,"Beside Regional Office, APPCB Nalgonda",,2011-01-02
578.0,2/1/2012,Andhra Pradesh,Kakinada,Andhra Pradesh State Pollution Control Board,"Residential, Rural and other Areas",,,56.0,,"Top of the Office Building Ramanayyapeta, Kakinada",,2012-01-02
751.0,2/1/2013,Andhra Pradesh,Srikakulam,Andhra Pradesh State Pollution Control Board,Industrial Area,2.0,5.0,85.0,,"IDA, Pydibheemavaram, Srikakulam",,2013-01-02
55,2/10/2003,Delhi,Delhi,Central Pollution Control Board,Industrial Area,11.0,51.0,,245.0,,,2003-10-02
233.0,2/10/2004,Andhra Pradesh,Visakhapatnam,Andhra Pradesh State Pollution Control Board,Industrial Area,8.0,32.0,80.0,127.0,"Industrial Estate, Marripalem, Visakhapatnam",,2004-10-02
,2/10/2005,Andhra Pradesh,Hyderabad,,Industrial Areas,6.0,22.8,48.0,119.0,Nacharam,,2005-10-02
,2/10/2006,Andhra Pradesh,Hyderabad,,Industrial Areas,6.0,37.0,151.0,361.0,C.I.T.D. Balanagar,,2006-10-02
,2/10/2007,Andhra Pradesh,Hyderabad,,Industrial Areas,5.5,37.3,68.0,337.0,C.I.T.D. Balanagar,,2007-10-02
,2/10/2008,Andhra Pradesh,Hyderabad,,Industrial Areas,5.2,31.8,132.0,336.0,Uppal,,2008-10-02
,2/10/2009,Andhra Pradesh,Hyderabad,,Industrial Areas,4.9,27.7,138.0,366.0,C.I.T.D. Balanagar,,2009-10-02
583.0,2/10/2010,Andhra Pradesh,Guntur,Andhra Pradesh State Pollution Control Board,"Residential, Rural and other Areas",2.0,12.0,83.0,,"Near Hindu College, Market Road, Guntur",,2010-10-02
582.0,2/10/2011,Andhra Pradesh,Chittoor,Andhra Pradesh State Pollution Control Board,Sensitive Area,4.0,9.0,38.0,109.0,"GNC Toll Gate Tirumala , Chittoor Dist.",,2011-10-02
466.0,2/10/2012,Andhra Pradesh,Kurnool,Andhra Pradesh State Pollution Control Board,"Residential, Rural and other Areas",4.0,9.0,49.0,,"Mourya Inn, Kurnool",,2012-10-02
751.0,2/10/2013,Andhra Pradesh,Srikakulam,Andhra Pradesh State Pollution Control Board,Industrial Area,2.0,5.0,34.0,,"IDA, Pydibheemavaram, Srikakulam",,2013-10-02
63.0,2/11/1987,Punjab,Ludhiana,Punjab Pollution Control Board,Residential,,,,414.0,,,1987-11-02
18.0,2/11/1988,Rajasthan,Kota,Rajasthan Pollution Control Board,Sensitive,18.6,74.1,,191.0,,,1988-11-02
58,2/11/2003,Delhi,Delhi,Central Pollution Control Board,Industrial Area,14.0,38.0,119.0,343.0,,,2003-11-02
193.0,2/11/2004,Assam,Guwahati,Assam State Pollution Control Board,"Residential, Rural and other Areas",2.3,17.7,199.0,,"Head Office, Bamunimaidan, Guwahati",,2004-11-02
,2/11/2005,Andhra Pradesh,Hyderabad,,Industrial Areas,4.8,31.1,107.0,271.0,C.I.T.D. Balanagar,,2005-11-02
,2/11/2006,Andhra Pradesh,Hyderabad,,Residential and others,5.1,32.4,132.0,303.0,Charminar,,2006-11-02
,2/11/2007,Andhra Pradesh,Hyderabad,,Industrial Areas,6.4,14.5,42.0,104.0,Nacharam,,2007-11-02
,2/11/2008,Andhra Pradesh,Hyderabad,,Industrial Areas,2.4,7.7,43.0,93.0,Nacharam,,2008-11-02
,2/11/2009,Andhra Pradesh,Hyderabad,,Residential and others,5.2,28.3,119.0,343.0,Charminar,,2009-11-02
582.0,2/11/2010,Andhra Pradesh,Chittoor,Andhra Pradesh State Pollution Control Board,Sensitive Area,4.0,9.0,40.0,,"GNC Toll Gate Tirumala , Chittoor Dist.",,2010-11-02
95.0,2/11/2011,Andhra Pradesh,Hyderabad,Andhra Pradesh State Pollution Control Board,Industrial Area,5.0,28.0,149.0,334.0,"C.I.T.D., Balanagar, Plot no. A1 to A8, IDA, Hyderabad",,2011-11-02
566.0,2/11/2012,Assam,Daranga,Assam State Pollution Control Board,"Residential, Rural and other Areas",5.5,14.0,62.0,,"Daranga, Baska district, BATAD,Assam near Sandoop Jhankar town of Bhutan",,2012-11-02
520.0,2/11/2013,Assam,Bongaigaon,Assam State Pollution Control Board,"Residential, Rural and other Areas",6.0,13.0,46.0,,"Barpara Office Building, Bongaigaon",,2013-11-02
144,2/12/2003,Delhi,Delhi,,"Residential, Rural and other Areas",6.0,65.0,,339.0,,,2003-12-02
217.0,2/12/2004,Assam,Guwahati,Assam State Pollution Control Board,"Residential, Rural and other Areas",4.2,20.2,290.0,,"Paltanbazar, Guwahati",,2004-12-02
,2/12/2005,Bihar,Patna,,Residential and others,11.8,16.1,71.0,132.0,Beltron Bhawan,,2005-12-02
,2/12/2006,Andhra Pradesh,Hyderabad,,Industrial Areas,5.9,29.2,135.0,286.0,Uppal,,2006-12-02
,2/12/2007,Assam,Bongaigaon,,Residential and others,2.8,7.9,39.0,60.0,Barpara Office Bldg,,2007-12-02
,2/12/2008,Andhra Pradesh,Patancheru,,Residential and others,8.2,25.5,135.0,461.0,Police Station,,2008-12-02
,2/12/2009,Andhra Pradesh,Hyderabad,,Industrial Areas,3.2,7.7,71.0,212.0,Nacharam,,2009-12-02
468.0,2/12/2010,Andhra Pradesh,Patancheru,Andhra Pradesh State Pollution Control Board,"Residential, Rural and other Areas",10.0,21.0,96.0,,"Police Station, Medak, Patencheru",,2010-12-02
464.0,2/12/2011,Chandigarh,Chandigarh,Chandigarh Pollution Control Committee,"Residential, Rural and other Areas",2.0,14.0,49.0,83.0,"Kaimbwala Village, Chandigarh",,2011-12-02
95.0,2/12/2012,Andhra Pradesh,Hyderabad,Andhra Pradesh State Pollution Control Board,Industrial Area,5.0,25.0,124.0,,"C.I.T.D., Balanagar, Plot no. A1 to A8, IDA, Hyderabad",,2012-12-02
542.0,2/12/2013,Assam,Bongaigaon,Assam State Pollution Control Board,"Residential, Rural and other Areas",6.0,13.0,57.0,,"Campus of Oil India Ltd. PS-6, Bongaigaon, Chirang",,2013-12-02
48,2/2/1987,Gujarat,Baroda,Gujarat Pollution Control Board,Residential,19.6,25.4,,283.0,,,1987-02-02
45.0,2/2/1988,Bihar,Jharia,Bihar Pollution Control Board,Industrial Area,35.9,34.1,,670.0,,,1988-02-02
203.0,2/2/2004,Andhra Pradesh,Hyderabad,Andhra Pradesh State Pollution Control Board,Industrial Area,3.6,46.6,52.3,130.0,"Uppal, Modern Foods & Industries IDA, Hyderabad",,2004-02-02
,2/2/2005,Assam,Guwahati,,Residential and others,4.0,11.3,117.0,177.0,Head Office,,2005-02-02
,2/2/2006,Andhra Pradesh,Hyderabad,,Industrial Areas,6.2,24.1,54.0,172.0,Nacharam,,2006-02-02
,2/2/2007,Andhra Pradesh,Hyderabad,,Industrial Areas,5.6,36.4,113.0,327.0,Uppal,,2007-02-02
,2/2/2008,Andhra Pradesh,Hyderabad,,Industrial Areas,5.4,35.0,102.0,340.0,C.I.T.D. Balanagar,,2008-02-02
,2/2/2009,Andhra Pradesh,Hyderabad,,Industrial Areas,5.4,28.7,109.0,316.0,C.I.T.D. Balanagar,,2009-02-02
150.0,2/2/2010,Andhra Pradesh,Hyderabad,National Environmental Engineering Research Institute,"Residential, Rural and other Areas",7.0,35.0,124.0,,"Tarnaka, NEERI Lab. IICT Campus, Hyderabad",,2010-02-02
582.0,2/2/2011,Andhra Pradesh,Chittoor,Andhra Pradesh State Pollution Control Board,Sensitive Area,4.0,9.0,37.0,117.0,"GNC Toll Gate Tirumala , Chittoor Dist.",,2011-02-02
95.0,2/2/2012,Andhra Pradesh,Hyderabad,Andhra Pradesh State Pollution Control Board,Industrial Area,4.0,40.0,176.0,,"C.I.T.D., Balanagar, Plot no. A1 to A8, IDA, Hyderabad",,2012-02-02
542.0,2/2/2013,Assam,Bongaigaon,Assam State Pollution Control Board,"Residential, Rural and other Areas",6.0,14.0,52.0,,"Campus of Oil India Ltd. PS-6, Bongaigaon, Chirang",,2013-02-02
3.0,2/3/1987,Uttar Pradesh,Agra,Uttar Pradesh Pollution Control Board,Industrial,14.7,7.8,,274.0,,,1987-03-02
44.0,2/3/1988,Bihar,Dhanbad,Bihar Pollution Control Board,"Residential, Rural and other Areas",22.2,17.2,,265.0,,,1988-03-02
58,2/3/2003,Delhi,Delhi,Central Pollution Control Board,Industrial Area,8.0,26.0,97.0,200.0,,,2003-03-02
95.0,2/3/2004,Andhra Pradesh,Hyderabad,Andhra Pradesh State Pollution Control Board,Industrial Area,5.2,41.6,60.3,157.7,"C.I.T.D., Balanagar, Plot no. A1 to A8, IDA, Hyderabad",,2004-03-02
,2/3/2005,Andhra Pradesh,Hyderabad,,Residential and others,4.6,37.8,87.0,247.0,Charminar,,2005-03-02
,2/3/2006,Andhra Pradesh,Hyderabad,,Residential and others,4.0,34.0,82.0,197.0,Mourya Inn,,2006-03-02
,2/3/2007,Andhra Pradesh,Hyderabad,,Sensitive Areas,4.4,18.3,49.0,135.0,Zoo Park,,2007-03-02
,2/3/2008,Andhra Pradesh,Hyderabad,,Residential and others,5.1,35.0,68.0,174.0,Charminar,,2008-03-02
,2/3/2009,Andhra Pradesh,Hyderabad,,Industrial Areas,5.7,24.3,61.0,123.0,Nacharam,,2009-03-02
468.0,2/3/2011,Andhra Pradesh,Patancheru,Andhra Pradesh State Pollution Control Board,"Residential, Rural and other Areas",6.0,22.0,121.0,,"Police Station, Medak, Patencheru",,2011-03-02
578.0,2/3/2012,Andhra Pradesh,Kakinada,Andhra Pradesh State Pollution Control Board,"Residential, Rural and other Areas",,,55.0,,"Top of the Office Building Ramanayyapeta, Kakinada",,2012-03-02
748.0,2/3/2013,Andhra Pradesh,Ananthapur,Andhra Pradesh State Pollution Control Board,"Residential, Rural and other Areas",4.0,9.0,65.0,,"Kamalanagar, Ananthapur",,2013-03-02
49,2/4/1987,Gujarat,Baroda,Gujarat Pollution Control Board,Industrial,59.1,46.1,,255.0,,,1987-04-02
56,2/4/2003,Delhi,Delhi,Central Pollution Control Board,Industrial Area,7.0,32.0,129.0,407.0,,,2003-04-02
233.0,2/4/2004,Andhra Pradesh,Visakhapatnam,Andhra Pradesh State Pollution Control Board,Industrial Area,10.0,31.0,107.0,160.0,"Industrial Estate, Marripalem, Visakhapatnam",,2004-04-02
,2/4/2005,Andhra Pradesh,Hyderabad,,Industrial Areas,4.4,34.6,71.0,186.0,C.I.T.D. Balanagar,,2005-04-02
,2/4/2006,Andhra Pradesh,Vijayawada,,Industrial Areas,5.8,32.3,84.0,246.0,Autonagar,,2006-04-02
,2/4/2007,Andhra Pradesh,Hyderabad,,Industrial Areas,5.0,37.8,94.0,268.0,C.I.T.D. Balanagar,,2007-04-02
,2/4/2008,Andhra Pradesh,Hyderabad,,Industrial Areas,5.5,35.0,98.0,341.0,C.I.T.D. Balanagar,,2008-04-02
,2/4/2009,Andhra Pradesh,Hyderabad,,Industrial Areas,4.8,28.7,115.0,330.0,C.I.T.D. Balanagar,,2009-04-02
583.0,2/4/2010,Andhra Pradesh,Guntur,Andhra Pradesh State Pollution Control Board,"Residential, Rural and other Areas",2.0,14.0,94.0,,"Near Hindu College, Market Road, Guntur",,2010-04-02
582.0,2/4/2011,Andhra Pradesh,Chittoor,Andhra Pradesh State Pollution Control Board,Sensitive Area,4.0,9.0,38.0,119.0,"GNC Toll Gate Tirumala , Chittoor Dist.",,2011-04-02
581.0,2/4/2012,Andhra Pradesh,Khammam,Andhra Pradesh State Pollution Control Board,"Residential, Rural and other Areas",5.0,10.0,57.0,,"CER Club,S.C.C.L. township, writter basti, Kothagudem, Khammam Dist.",,2012-04-02
751.0,2/4/2013,Andhra Pradesh,Srikakulam,Andhra Pradesh State Pollution Control Board,Industrial Area,2.0,5.0,32.0,,"IDA, Pydibheemavaram, Srikakulam",,2013-04-02
9,2/5/1987,West Bengal,Howrah,West Bengal Pollution Control Board,Industrial,42.0,105.7,,507.0,,,1987-05-02
55,2/5/2003,Delhi,Delhi,Central Pollution Control Board,Industrial Area,11.0,42.0,155.0,192.0,,,2003-05-02
210.0,2/5/2004,Bihar,Patna,Bihar Sate Pollution Control Board,"Residential, Rural and other Areas",16.0,32.0,96.0,157.0,"Beltron Bhawan, Shastri Nagar, Patna",,2004-05-02
,2/5/2005,Chandigarh,Chandigarh,,Industrial Areas,5.0,17.0,153.0,403.0,Modern Foods,,2005-05-02
,2/5/2006,Andhra Pradesh,Vijayawada,,Residential and others,4.7,33.0,88.0,155.0,Benz Circle,,2006-05-02
,2/5/2007,Andhra Pradesh,Hyderabad,,Industrial Areas,7.0,12.1,86.0,172.0,Nacharam,,2007-05-02
,2/5/2008,Andhra Pradesh,Hyderabad,,Industrial Areas,2.8,11.2,44.0,109.0,Nacharam,,2008-05-02
,2/5/2009,Andhra Pradesh,Hyderabad,,Residential and others,5.5,26.5,120.0,344.0,Charminar,,2009-05-02
582.0,2/5/2010,Andhra Pradesh,Chittoor,Andhra Pradesh State Pollution Control Board,Sensitive Area,4.0,9.0,41.0,,"GNC Toll Gate Tirumala , Chittoor Dist.",,2010-05-02
95.0,2/5/2011,Andhra Pradesh,Hyderabad,Andhra Pradesh State Pollution Control Board,Industrial Area,5.0,32.0,147.0,353.0,"C.I.T.D., Balanagar, Plot no. A1 to A8, IDA, Hyderabad",,2011-05-02
154,2/5/2012,Gujarat,Ahmedabad,National Environmental Engineering Research Institute,Industrial Area,12.0,18.0,88.0,,"Shardaben Hospital, Saraspur, Ahmadabad",,2012-05-02
542.0,2/5/2013,Assam,Bongaigaon,Assam State Pollution Control Board,"Residential, Rural and other Areas",6.0,13.0,54.0,,"Campus of Oil India Ltd. PS-6, Bongaigaon, Chirang",,2013-05-02
58,2/6/2003,Delhi,Delhi,Central Pollution Control Board,Industrial Area,12.0,41.0,129.0,405.0,,,2003-06-02
95.0,2/6/2004,Andhra Pradesh,Hyderabad,Andhra Pradesh State Pollution Control Board,Industrial Area,5.1,86.2,126.7,317.0,"C.I.T.D., Balanagar, Plot no. A1 to A8, IDA, Hyderabad",,2004-06-02
,2/6/2005,Maharashtra,Thane,,Residential and others,6.7,10.9,49.0,,Kopri,,2005-06-02
,2/6/2006,Andhra Pradesh,Hyderabad,,Industrial Areas,,11.3,46.0,154.0,Nacharam,,2006-06-02
,2/6/2007,Assam,Bongaigaon,,Residential and others,4.0,12.0,74.0,212.0,Barpara Office Bldg,,2007-06-02
,2/6/2008,Andhra Pradesh,Patancheru,,Residential and others,4.2,19.2,152.0,334.0,Police Station,,2008-06-02
,2/6/2009,Andhra Pradesh,Hyderabad,,Industrial Areas,4.0,20.3,80.0,154.0,Nacharam,,2009-06-02
539.0,2/6/2010,Assam,Golaghat,Assam State Pollution Control Board,"Residential, Rural and other Areas",7.0,16.0,133.0,,"Golaghat Office Building, Golaghat",,2010-06-02
577.0,2/6/2011,Andhra Pradesh,Nalgonda,Andhra Pradesh State Pollution Control Board,"Residential, Rural and other Areas",4.0,18.0,72.0,,"Beside Regional Office, APPCB Nalgonda",,2011-06-02
583.0,2/6/2012,Andhra Pradesh,Guntur,Andhra Pradesh State Pollution Control Board,"Residential, Rural and other Areas",6.0,11.0,76.0,,"Near Hindu College, Market Road, Guntur",,2012-06-02
748.0,2/6/2013,Andhra Pradesh,Ananthapur,Andhra Pradesh State Pollution Control Board,"Residential, Rural and other Areas",4.0,9.0,71.0,,"Kamalanagar, Ananthapur",,2013-06-02
56,2/7/2003,Delhi,Delhi,Central Pollution Control Board,Industrial Area,7.0,33.0,131.0,397.0,,,2003-07-02
233.0,2/7/2004,Andhra Pradesh,Visakhapatnam,Andhra Pradesh State Pollution Control Board,Industrial Area,7.0,28.0,105.0,151.0,"Industrial Estate, Marripalem, Visakhapatnam",,2004-07-02
,2/7/2005,Andhra Pradesh,Hyderabad,,Industrial Areas,8.3,21.3,43.0,93.0,Nacharam,,2005-07-02
,2/7/2006,Andhra Pradesh,Hyderabad,,Sensitive Areas,4.9,15.6,91.0,178.0,Zoo Park,,2006-07-02
,2/7/2007,Andhra Pradesh,Hyderabad,,Industrial Areas,5.8,16.4,56.0,121.0,Nacharam,,2007-07-02
,2/7/2008,Andhra Pradesh,Hyderabad,,Industrial Areas,3.3,14.3,50.0,108.0,Nacharam,,2008-07-02
,2/7/2009,Andhra Pradesh,Visakhapatnam,,Industrial Areas,4.0,30.2,88.0,183.0,Industrial Estate,,2009-07-02
234.0,2/7/2010,Andhra Pradesh,Visakhapatnam,Andhra Pradesh State Pollution Control Board,"Residential, Rural and other Areas",5.0,20.0,61.0,,"Panchayat Raj office, Mindi, Visakhapatnam",,2010-07-02
210.0,2/7/2011,Bihar,Patna,Bihar Sate Pollution Control Board,"Residential, Rural and other Areas",2.0,36.0,215.0,,"Beltron Bhawan, Shastri Nagar, Patna",,2011-07-02
578.0,2/7/2012,Andhra Pradesh,Kakinada,Andhra Pradesh State Pollution Control Board,"Residential, Rural and other Areas",,,58.0,,"Top of the Office Building Ramanayyapeta, Kakinada",,2012-07-02
751.0,2/7/2013,Andhra Pradesh,Srikakulam,Andhra Pradesh State Pollution Control Board,Industrial Area,2.0,5.0,43.0,,"IDA, Pydibheemavaram, Srikakulam",,2013-07-02
84.0,2/8/2003,Madhya Pradesh,Nagda,Madhya Pradesh  Pollution Control Board,"Residential, Rural and other Areas",0.0,0.0,0.0,0.0,,,2003-08-02
77.0,2/8/2004,Karnataka,Bangalore,Karnataka State Pollution Control Board,Industrial Area,7.0,56.0,68.0,142.0,"Graphite India, White Field Road, Bangalore",,2004-08-02
,2/8/2005,Andhra Pradesh,Hyderabad,,Industrial Areas,4.4,29.2,113.0,317.0,Uppal,,2005-08-02
,2/8/2006,Andhra Pradesh,Hyderabad,,Residential and others,4.0,35.0,78.0,185.0,Mourya Inn,,2006-08-02
,2/8/2007,Andhra Pradesh,Hyderabad,,Industrial Areas,5.3,36.4,80.0,303.0,C.I.T.D. Balanagar,,2007-08-02
,2/8/2008,Andhra Pradesh,Hyderabad,,Industrial Areas,5.1,34.6,89.0,353.0,C.I.T.D. Balanagar,,2008-08-02
,2/8/2009,Andhra Pradesh,Hyderabad,,Industrial Areas,5.2,28.7,121.0,358.0,C.I.T.D. Balanagar,,2009-08-02
466.0,2/8/2010,Andhra Pradesh,Kurnool,Andhra Pradesh State Pollution Control Board,"Residential, Rural and other Areas",4.0,9.0,98.0,,"Mourya Inn, Kurnool",,2010-08-02
582.0,2/8/2011,Andhra Pradesh,Chittoor,Andhra Pradesh State Pollution Control Board,Sensitive Area,4.0,9.0,36.0,116.0,"GNC Toll Gate Tirumala , Chittoor Dist.",,2011-08-02
583.0,2/8/2012,Andhra Pradesh,Guntur,Andhra Pradesh State Pollution Control Board,"Residential, Rural and other Areas",6.0,11.0,74.0,,"Near Hindu College, Market Road, Guntur",,2012-08-02
542.0,2/8/2013,Assam,Bongaigaon,Assam State Pollution Control Board,"Residential, Rural and other Areas",6.0,14.0,55.0,,"Campus of Oil India Ltd. PS-6, Bongaigaon, Chirang",,2013-08-02
62.0,2/9/1987,Punjab,Ludhiana,Punjab Pollution Control Board,Residential,,,,346.0,,,1987-09-02
95.0,2/9/2004,Andhra Pradesh,Hyderabad,Andhra Pradesh State Pollution Control Board,Industrial Area,5.1,81.3,70.3,179.7,"C.I.T.D., Balanagar, Plot no. A1 to A8, IDA, Hyderabad",,2004-09-02
,2/9/2005,Andhra Pradesh,Hyderabad,,Residential and others,5.2,40.2,126.0,332.0,Paradise,,2005-09-02
,2/9/2006,Assam,Guwahati,,Residential and others,4.8,32.0,196.0,377.0,Fire Brigade Station,,2006-09-02
,2/9/2007,Andhra Pradesh,Hyderabad,,Sensitive Areas,5.2,16.6,48.0,147.0,Zoo Park,,2007-09-02
,2/9/2008,Andhra Pradesh,Hyderabad,,Residential and others,5.1,25.5,116.0,362.0,Charminar,,2008-09-02
,2/9/2009,Andhra Pradesh,Hyderabad,,Residential and others,5.0,29.2,117.0,343.0,Charminar,,2009-09-02
582.0,2/9/2010,Andhra Pradesh,Chittoor,Andhra Pradesh State Pollution Control Board,Sensitive Area,4.0,9.0,37.0,,"GNC Toll Gate Tirumala , Chittoor Dist.",,2010-09-02
577.0,2/9/2011,Andhra Pradesh,Nalgonda,Andhra Pradesh State Pollution Control Board,"Residential, Rural and other Areas",4.0,19.0,95.0,,"Beside Regional Office, APPCB Nalgonda",,2011-09-02
578.0,2/9/2012,Andhra Pradesh,Kakinada,Andhra Pradesh State Pollution Control Board,"Residential, Rural and other Areas",,,59.0,,"Top of the Office Building Ramanayyapeta, Kakinada",,2012-09-02
748.0,2/9/2013,Andhra Pradesh,Ananthapur,Andhra Pradesh State Pollution Control Board,"Residential, Rural and other Areas",4.0,9.0,68.0,,"Kamalanagar, Ananthapur",,2013-09-02
58,20-01-03,Delhi,Delhi,Central Pollution Control Board,Industrial Area,11.0,28.0,164.0,396.0,,,2003-01-20
193.0,20-01-04,Assam,Guwahati,Assam State Pollution Control Board,"Residential, Rural and other Areas",2.3,17.8,166.0,,"Head Office, Bamunimaidan, Guwahati",,2004-01-20
,20-01-05,Andhra Pradesh,Hyderabad,,Residential and others,4.5,34.4,117.0,348.0,Paradise,,2005-01-20
,20-01-07,Andhra Pradesh,Hyderabad,,Industrial Areas,7.2,66.6,169.0,433.0,C.I.T.D. Balanagar,,2007-01-20
150.0,20-01-10,Andhra Pradesh,Hyderabad,National Environmental Engineering Research Institute,"Residential, Rural and other Areas",4.0,19.0,72.0,,"Tarnaka, NEERI Lab. IICT Campus, Hyderabad",,2010-01-20
387.0,20-01-13,Andhra Pradesh,Visakhapatnam,Andhra Pradesh State Pollution Control Board,Sensitive Area,5.0,9.0,55.0,,"INS-Virabahu, Naval Area, Visakhapatnam",,2013-01-20
520.0,20-01-14,Assam,Bongaigaon,Assam State Pollution Control Board,"Residential, Rural and other Areas",6.0,14.0,56.0,,"Barpara Office Building, Bongaigaon",,2014-01-20
787.0,20-01-15,Arunachal Pradesh,Itanagar,Arunachal Pradesh State Pollution Control Board,"Residential, Rural and other Areas",2.0,5.0,96.0,,Compound of PCCF's Office building,,2015-01-20
58,20-02-03,Delhi,Delhi,Central Pollution Control Board,Industrial Area,11.0,28.0,92.0,453.0,,,2003-02-20
95.0,20-02-04,Andhra Pradesh,Hyderabad,Andhra Pradesh State Pollution Control Board,Industrial Area,9.8,75.8,114.7,259.3,"C.I.T.D., Balanagar, Plot no. A1 to A8, IDA, Hyderabad",,2004-02-20
,20-02-05,Maharashtra,Thane,,Residential and others,7.7,15.2,44.0,,Kopri,,2005-02-20
,20-02-07,Andhra Pradesh,Hyderabad,,Industrial Areas,5.1,35.5,110.0,340.0,C.I.T.D. Balanagar,,2007-02-20
466.0,20-02-10,Andhra Pradesh,Kurnool,Andhra Pradesh State Pollution Control Board,"Residential, Rural and other Areas",4.0,9.0,85.0,,"Mourya Inn, Kurnool",,2010-02-20
748.0,20-02-13,Andhra Pradesh,Ananthapur,Andhra Pradesh State Pollution Control Board,"Residential, Rural and other Areas",4.0,9.0,78.0,,"Kamalanagar, Ananthapur",,2013-02-20
748.0,20-02-14,Andhra Pradesh,Ananthapur,Andhra Pradesh State Pollution Control Board,"Residential, Rural and other Areas",5.0,10.0,87.0,,"Kamalanagar, Ananthapur",,2014-02-20
193.0,20-02-15,Assam,Guwahati,Assam State Pollution Control Board,"Residential, Rural and other Areas",9.0,14.0,93.0,,"Head Office, Bamunimaidan, Guwahati",,2015-02-20
55,20-03-03,Delhi,Delhi,Central Pollution Control Board,Industrial Area,12.0,42.0,143.0,243.0,,,2003-03-20
233.0,20-03-04,Andhra Pradesh,Visakhapatnam,Andhra Pradesh State Pollution Control Board,Industrial Area,11.0,35.0,91.0,141.0,"Industrial Estate, Marripalem, Visakhapatnam",,2004-03-20
,20-03-05,Andhra Pradesh,Hyderabad,,Residential and others,4.9,58.0,81.0,214.0,Charminar,,2005-03-20
,20-03-07,Andhra Pradesh,Hyderabad,,Industrial Areas,5.1,62.9,155.0,380.0,C.I.T.D. Balanagar,,2007-03-20
582.0,20-03-10,Andhra Pradesh,Chittoor,Andhra Pradesh State Pollution Control Board,Sensitive Area,4.0,9.0,42.0,,"GNC Toll Gate Tirumala , Chittoor Dist.",,2010-03-20
520.0,20-03-13,Assam,Bongaigaon,Assam State Pollution Control Board,"Residential, Rural and other Areas",7.0,16.0,46.0,,"Barpara Office Building, Bongaigaon",,2013-03-20
520.0,20-03-14,Assam,Bongaigaon,Assam State Pollution Control Board,"Residential, Rural and other Areas",7.0,16.0,73.0,,"Barpara Office Building, Bongaigaon",,2014-03-20
193.0,20-03-15,Assam,Guwahati,Assam State Pollution Control Board,"Residential, Rural and other Areas",11.0,18.0,232.0,,"Head Office, Bamunimaidan, Guwahati",,2015-03-20
106.0,20-04-04,Chandigarh,Chandigarh,Chandigarh Pollution Control Committee,Industrial Area,3.0,20.0,344.0,647.0,"Modern Foods, Industrial Area, Chandigarh",,2004-04-20
,20-04-05,Andhra Pradesh,Hyderabad,,Industrial Areas,5.1,24.9,75.0,240.0,C.I.T.D. Balanagar,,2005-04-20
,20-04-07,Andhra Pradesh,Hyderabad,,Industrial Areas,5.5,32.8,119.0,311.0,C.I.T.D. Balanagar,,2007-04-20
466.0,20-04-10,Andhra Pradesh,Kurnool,Andhra Pradesh State Pollution Control Board,"Residential, Rural and other Areas",4.0,9.0,93.0,,"Mourya Inn, Kurnool",,2010-04-20
748.0,20-04-13,Andhra Pradesh,Ananthapur,Andhra Pradesh State Pollution Control Board,"Residential, Rural and other Areas",4.0,9.0,83.0,,"Kamalanagar, Ananthapur",,2013-04-20
566.0,20-04-14,Assam,Daranga,Assam State Pollution Control Board,"Residential, Rural and other Areas",7.0,20.0,93.0,,"Daranga, Baska district, BATAD,Assam near Sandoop Jhankar town of Bhutan",,2014-04-20
193.0,20-04-15,Assam,Guwahati,Assam State Pollution Control Board,"Residential, Rural and other Areas",8.0,15.0,160.0,,"Head Office, Bamunimaidan, Guwahati",,2015-04-20
55,20-05-03,Delhi,Delhi,Central Pollution Control Board,Industrial Area,12.0,42.0,186.0,489.0,,,2003-05-20
193.0,20-05-04,Assam,Guwahati,Assam State Pollution Control Board,"Residential, Rural and other Areas",2.0,9.2,149.0,,"Head Office, Bamunimaidan, Guwahati",,2004-05-20
,20-05-05,Assam,Guwahati,,Residential and others,4.0,10.7,85.0,135.0,Paltanbazar,,2005-05-20
,20-05-07,Andhra Pradesh,Hyderabad,,Industrial Areas,4.9,32.1,71.0,260.0,C.I.T.D. Balanagar,,2007-05-20
582.0,20-05-10,Andhra Pradesh,Chittoor,Andhra Pradesh State Pollution Control Board,Sensitive Area,4.0,9.0,33.0,,"GNC Toll Gate Tirumala , Chittoor Dist.",,2010-05-20
520.0,20-05-13,Assam,Bongaigaon,Assam State Pollution Control Board,"Residential, Rural and other Areas",7.0,15.0,36.0,,"Barpara Office Building, Bongaigaon",,2013-05-20
542.0,20-05-14,Assam,Bongaigaon,Assam State Pollution Control Board,"Residential, Rural and other Areas",6.0,13.0,46.0,,"Campus of Oil India Ltd. PS-6, Bongaigaon, Chirang",,2014-05-20
193.0,20-05-15,Assam,Guwahati,Assam State Pollution Control Board,"Residential, Rural and other Areas",9.0,13.0,103.0,,"Head Office, Bamunimaidan, Guwahati",,2015-05-20
58,20-06-03,Delhi,Delhi,Central Pollution Control Board,Industrial Area,12.0,34.0,18.0,58.0,,,2003-06-20
394.0,20-06-04,Andhra Pradesh,Hyderabad,Andhra Pradesh State Pollution Control Board,"Residential, Rural and other Areas",3.8,17.1,110.0,338.0,"Charminar, Hyderabad",,2004-06-20
,20-06-05,Andhra Pradesh,Hyderabad,,Industrial Areas,5.1,26.5,73.0,168.0,Uppal,,2005-06-20
,20-06-07,Andhra Pradesh,Hyderabad,,Industrial Areas,6.1,33.5,40.0,225.0,C.I.T.D. Balanagar,,2007-06-20
466.0,20-06-10,Andhra Pradesh,Kurnool,Andhra Pradesh State Pollution Control Board,"Residential, Rural and other Areas",4.0,9.0,85.0,,"Mourya Inn, Kurnool",,2010-06-20
95.0,20-06-13,Andhra Pradesh,Hyderabad,Andhra Pradesh State Pollution Control Board,Industrial Area,5.0,29.0,91.0,,"C.I.T.D., Balanagar, Plot no. A1 to A8, IDA, Hyderabad",,2013-06-20
520.0,20-06-14,Assam,Bongaigaon,Assam State Pollution Control Board,"Residential, Rural and other Areas",6.0,11.0,18.0,,"Barpara Office Building, Bongaigaon",,2014-06-20
193.0,20-06-15,Assam,Guwahati,Assam State Pollution Control Board,"Residential, Rural and other Areas",7.0,10.0,67.0,,"Head Office, Bamunimaidan, Guwahati",,2015-06-20
95.0,20-07-04,Andhra Pradesh,Hyderabad,Andhra Pradesh State Pollution Control Board,Industrial Area,4.6,23.6,80.3,205.7,"C.I.T.D., Balanagar, Plot no. A1 to A8, IDA, Hyderabad",,2004-07-20
,20-07-05,Assam,Guwahati,,Residential and others,4.0,16.2,65.0,108.0,Head Office,,2005-07-20
,20-07-07,Andhra Pradesh,Hyderabad,,Industrial Areas,5.5,32.0,55.0,158.0,Uppal,,2007-07-20
583.0,20-07-10,Andhra Pradesh,Guntur,Andhra Pradesh State Pollution Control Board,"Residential, Rural and other Areas",2.0,11.0,76.0,,"Near Hindu College, Market Road, Guntur",,2010-07-20
95.0,20-07-13,Andhra Pradesh,Hyderabad,Andhra Pradesh State Pollution Control Board,Industrial Area,4.0,18.0,66.0,,"C.I.T.D., Balanagar, Plot no. A1 to A8, IDA, Hyderabad",,2013-07-20
750.0,20-07-14,Andhra Pradesh,Eluru,Andhra Pradesh State Pollution Control Board,"Residential, Rural and other Areas",,,82.0,,"ASRAM Diagnostic Center, Eluru",,2014-07-20
389.0,20-07-15,Andhra Pradesh,Tirupati,Andhra Pradesh State Pollution Control Board,Sensitive Area,5.0,11.0,72.0,,"Regional Science Centre, Chittoor Bypass Road, Tirupati",,2015-07-20
144,20-08-03,Delhi,Delhi,,"Residential, Rural and other Areas",6.0,24.0,,206.0,,,2003-08-20
203.0,20-08-04,Andhra Pradesh,Hyderabad,Andhra Pradesh State Pollution Control Board,Industrial Area,3.5,19.0,46.7,93.3,"Uppal, Modern Foods & Industries IDA, Hyderabad",,2004-08-20
,20-08-05,Chandigarh,Chandigarh,,Residential and others,,9.8,34.0,80.0,Kaimbwala Village,,2005-08-20
,20-08-07,Andhra Pradesh,Hyderabad,,Industrial Areas,4.9,30.0,53.0,137.0,C.I.T.D. Balanagar,,2007-08-20
581.0,20-08-10,Andhra Pradesh,Khammam,Andhra Pradesh State Pollution Control Board,"Residential, Rural and other Areas",2.0,10.0,51.0,,"CER Club,S.C.C.L. township, writter basti, Kothagudem, Khammam Dist.",,2010-08-20
750.0,20-08-13,Andhra Pradesh,Eluru,Andhra Pradesh State Pollution Control Board,"Residential, Rural and other Areas",5.0,16.0,59.0,,"ASRAM Diagnostic Center, Eluru",,2013-08-20
742.0,20-08-14,Andhra Pradesh,Chittoor,Andhra Pradesh State Pollution Control Board,"Residential, Rural and other Areas",6.0,11.0,65.0,,"Near Nutrine Confectionery, Palamaner Road, Chittor",,2014-08-20
389.0,20-08-15,Andhra Pradesh,Tirupati,Andhra Pradesh State Pollution Control Board,Sensitive Area,5.0,12.0,61.0,,"Regional Science Centre, Chittoor Bypass Road, Tirupati",,2015-08-20
84.0,20-09-03,Madhya Pradesh,Nagda,Madhya Pradesh  Pollution Control Board,"Residential, Rural and other Areas",0.0,0.0,0.0,0.0,,,2003-09-20
95.0,20-09-04,Andhra Pradesh,Hyderabad,Andhra Pradesh State Pollution Control Board,Industrial Area,3.6,24.7,68.3,192.0,"C.I.T.D., Balanagar, Plot no. A1 to A8, IDA, Hyderabad",,2004-09-20
,20-09-05,Andhra Pradesh,Hyderabad,,Residential and others,4.9,22.0,70.0,212.0,Paradise,,2005-09-20
,20-09-07,Andhra Pradesh,Hyderabad,,Industrial Areas,5.1,29.2,61.0,160.0,C.I.T.D. Balanagar,,2007-09-20
582.0,20-09-10,Andhra Pradesh,Chittoor,Andhra Pradesh State Pollution Control Board,Sensitive Area,4.0,9.0,57.0,,"GNC Toll Gate Tirumala , Chittoor Dist.",,2010-09-20
193.0,20-09-13,Assam,Guwahati,Assam State Pollution Control Board,"Residential, Rural and other Areas",7.0,15.0,110.0,,"Head Office, Bamunimaidan, Guwahati",,2013-09-20
750.0,20-09-14,Andhra Pradesh,Eluru,Andhra Pradesh State Pollution Control Board,"Residential, Rural and other Areas",,,84.0,,"ASRAM Diagnostic Center, Eluru",,2014-09-20
459.0,20-09-15,Karnataka,Gulbarga,Karnataka State Pollution Control Board,Sensitive Area,,,71.0,,"Government Hospital, Gulbarga",,2015-09-20
56,20-10-03,Delhi,Delhi,Central Pollution Control Board,Industrial Area,7.0,53.0,122.0,601.0,,,2003-10-20
210.0,20-10-04,Bihar,Patna,Bihar Sate Pollution Control Board,"Residential, Rural and other Areas",11.0,17.0,53.0,114.0,"Beltron Bhawan, Shastri Nagar, Patna",,2004-10-20
,20-10-05,Andhra Pradesh,Hyderabad,,Residential and others,5.4,27.3,102.0,320.0,Charminar,,2005-10-20
,20-10-07,Andhra Pradesh,Hyderabad,,Industrial Areas,5.1,32.4,76.0,279.0,C.I.T.D. Balanagar,,2007-10-20
150.0,20-10-10,Andhra Pradesh,Hyderabad,National Environmental Engineering Research Institute,"Residential, Rural and other Areas",4.0,19.0,23.0,,"Tarnaka, NEERI Lab. IICT Campus, Hyderabad",,2010-10-20
748.0,20-10-13,Andhra Pradesh,Ananthapur,Andhra Pradesh State Pollution Control Board,"Residential, Rural and other Areas",4.0,14.0,69.0,,"Kamalanagar, Ananthapur",,2013-10-20
750.0,20-10-14,Andhra Pradesh,Eluru,Andhra Pradesh State Pollution Control Board,"Residential, Rural and other Areas",,,363.0,,"ASRAM Diagnostic Center, Eluru",,2014-10-20
787.0,20-10-15,Arunachal Pradesh,Itanagar,Arunachal Pradesh State Pollution Control Board,"Residential, Rural and other Areas",3.0,,59.0,,Compound of PCCF's Office building,,2015-10-20
55,20-11-03,Delhi,Delhi,Central Pollution Control Board,Industrial Area,14.0,42.0,122.0,369.0,,,2003-11-20
95.0,20-11-04,Andhra Pradesh,Hyderabad,Andhra Pradesh State Pollution Control Board,Industrial Area,4.9,33.5,84.0,328.7,"C.I.T.D., Balanagar, Plot no. A1 to A8, IDA, Hyderabad",,2004-11-20
,20-11-05,Andhra Pradesh,Hyderabad,,Residential and others,5.4,26.1,108.0,280.0,Charminar,,2005-11-20
,20-11-07,Andhra Pradesh,Hyderabad,,Industrial Areas,5.6,35.9,101.0,309.0,C.I.T.D. Balanagar,,2007-11-20
582.0,20-11-10,Andhra Pradesh,Chittoor,Andhra Pradesh State Pollution Control Board,Sensitive Area,4.0,9.0,39.0,,"GNC Toll Gate Tirumala , Chittoor Dist.",,2010-11-20
577.0,20-11-13,Andhra Pradesh,Nalgonda,Andhra Pradesh State Pollution Control Board,"Residential, Rural and other Areas",4.0,14.0,87.0,,"Beside Regional Office, APPCB Nalgonda",,2013-11-20
748.0,20-11-14,Andhra Pradesh,Ananthapur,Andhra Pradesh State Pollution Control Board,"Residential, Rural and other Areas",4.0,9.0,77.0,,"Kamalanagar, Ananthapur",,2014-11-20
462.0,20-11-15,Andhra Pradesh,Vijayawada,Andhra Pradesh State Pollution Control Board,"Residential, Rural and other Areas",5.0,58.0,109.0,,"Benz Circle, Vijayawada",,2015-11-20
62.0,20-12-03,Punjab,Ludhiana,Punjab Pollution Control Board,"Residential, Rural and other Areas",16.0,55.0,369.0,,,,2003-12-20
95.0,20-12-04,Andhra Pradesh,Hyderabad,Andhra Pradesh State Pollution Control Board,Industrial Area,4.3,35.9,174.3,426.7,"C.I.T.D., Balanagar, Plot no. A1 to A8, IDA, Hyderabad",,2004-12-20
,20-12-05,Andhra Pradesh,Hyderabad,,Industrial Areas,7.0,29.5,119.0,274.0,C.I.T.D. Balanagar,,2005-12-20
,20-12-07,Andhra Pradesh,Hyderabad,,Industrial Areas,5.4,34.0,124.0,351.0,C.I.T.D. Balanagar,,2007-12-20
581.0,20-12-10,Andhra Pradesh,Khammam,Andhra Pradesh State Pollution Control Board,"Residential, Rural and other Areas",2.0,11.0,66.0,,"CER Club,S.C.C.L. township, writter basti, Kothagudem, Khammam Dist.",,2010-12-20
566.0,20-12-13,Assam,Daranga,Assam State Pollution Control Board,"Residential, Rural and other Areas",6.0,18.0,57.0,,"Daranga, Baska district, BATAD,Assam near Sandoop Jhankar town of Bhutan",,2013-12-20
566.0,20-12-14,Assam,Daranga,Assam State Pollution Control Board,"Residential, Rural and other Areas",7.0,13.0,48.0,,"Daranga, Baska district, BATAD,Assam near Sandoop Jhankar town of Bhutan",,2014-12-20
459.0,20-12-15,Karnataka,Gulbarga,Karnataka State Pollution Control Board,Sensitive Area,,,75.0,,"Government Hospital, Gulbarga",,2015-12-20
,20/01/2006,Maharashtra,Aurangabad (MS),,Residential and others,3.7,32.2,,,S.B.E.S. College,,2006-01-20
531,20/01/2011,Delhi,Delhi,Central Pollution Control Board,"Residential, Rural and other Areas",5.0,41.0,225.0,,"Pritampura, Delhi",,2011-01-20
466.0,20/01/2012,Andhra Pradesh,Kurnool,Andhra Pradesh State Pollution Control Board,"Residential, Rural and other Areas",4.0,9.0,62.0,,"Mourya Inn, Kurnool",,2012-01-20
,20/02/2006,Maharashtra,Aurangabad (MS),,Sensitive Areas,5.7,19.2,,,Bibi-Ka-Maqbara,,2006-02-20
144,20/02/2011,Delhi,Delhi,National Environmental Engineering Research Institute,"Residential, Rural and other Areas",3.0,79.0,99.0,,"N.Y. SCHOOL, Sarojini Nagar, Delhi",,2011-02-20
466.0,20/02/2012,Andhra Pradesh,Kurnool,Andhra Pradesh State Pollution Control Board,"Residential, Rural and other Areas",4.0,9.0,100.0,,"Mourya Inn, Kurnool",,2012-02-20
,20/03/2006,Maharashtra,Aurangabad (MS),,Sensitive Areas,3.2,13.2,,,Bibi-Ka-Maqbara,,2006-03-20
155,20/03/2011,Gujarat,Ahmedabad,National Environmental Engineering Research Institute,"Residential, Rural and other Areas",15.0,22.0,86.0,,"R.C. High School, Mirzapur, Ahmadabad",,2011-03-20
466.0,20/03/2012,Andhra Pradesh,Kurnool,Andhra Pradesh State Pollution Control Board,"Residential, Rural and other Areas",4.0,9.0,71.0,,"Mourya Inn, Kurnool",,2012-03-20
,20/04/2006,Maharashtra,Chandrapur,,Industrial Areas,22.8,31.5,43.0,80.0,M.I.D.C.,,2006-04-20
59,20/04/2011,Delhi,Delhi,Central Pollution Control Board,"Residential, Rural and other Areas",4.0,56.0,316.0,,"Janakpuri, Delhi",,2011-04-20
581.0,20/04/2012,Andhra Pradesh,Khammam,Andhra Pradesh State Pollution Control Board,"Residential, Rural and other Areas",5.0,10.0,58.0,,"CER Club,S.C.C.L. township, writter basti, Kothagudem, Khammam Dist.",,2012-04-20
,20/05/2006,Maharashtra,Aurangabad (MS),,Residential and others,5.5,17.7,51.0,177.0,S.B.E.S. College,,2006-05-20
531,20/05/2011,Delhi,Delhi,Central Pollution Control Board,"Residential, Rural and other Areas",4.0,40.0,257.0,,"Pritampura, Delhi",,2011-05-20
466.0,20/05/2012,Andhra Pradesh,Kurnool,Andhra Pradesh State Pollution Control Board,"Residential, Rural and other Areas",4.0,9.0,84.0,,"Mourya Inn, Kurnool",,2012-05-20
,20/06/2006,Maharashtra,Aurangabad (MS),,Sensitive Areas,3.3,12.2,54.0,117.0,Bibi-Ka-Maqbara,,2006-06-20
558.0,20/06/2011,Dadra & Nagar Haveli,Khadoli,"Daman Diu, Dadra & Nagar Heveli Pollution Control Committee",Industrial Area,7.5,19.6,,42.0,"Khadoli Industrial Area, Village- Khadoli, Silvassa",,2011-06-20
583.0,20/06/2012,Andhra Pradesh,Guntur,Andhra Pradesh State Pollution Control Board,"Residential, Rural and other Areas",6.0,11.0,72.0,,"Near Hindu College, Market Road, Guntur",,2012-06-20
,20/07/2006,Maharashtra,Aurangabad (MS),,Residential and others,5.0,13.7,15.0,60.0,C.A.D.A. Office,,2006-07-20
59,20/07/2011,Delhi,Delhi,Central Pollution Control Board,"Residential, Rural and other Areas",4.0,44.0,158.0,,"Janakpuri, Delhi",,2011-07-20
583.0,20/07/2012,Andhra Pradesh,Guntur,Andhra Pradesh State Pollution Control Board,"Residential, Rural and other Areas",6.0,11.0,71.0,,"Near Hindu College, Market Road, Guntur",,2012-07-20
,20/08/2006,Maharashtra,Tarapur,,Industrial Areas,4.0,16.8,79.0,116.0,MIDC Office Compound,,2006-08-20
558.0,20/08/2011,Dadra & Nagar Haveli,Khadoli,"Daman Diu, Dadra & Nagar Heveli Pollution Control Committee",Industrial Area,7.8,19.6,,27.0,"Khadoli Industrial Area, Village- Khadoli, Silvassa",,2011-08-20
583.0,20/08/2012,Andhra Pradesh,Guntur,Andhra Pradesh State Pollution Control Board,"Residential, Rural and other Areas",6.0,11.0,75.0,,"Near Hindu College, Market Road, Guntur",,2012-08-20
,20/09/2006,Maharashtra,Aurangabad (MS),,Residential and others,3.8,13.7,25.0,60.0,C.A.D.A. Office,,2006-09-20
560,20/09/2011,Daman & Diu,Daman,"Daman Diu, Dadra & Nagar Heveli Pollution Control Committee",Industrial Area,7.3,20.1,,38.0,"Kadaiya Industrial Area, Village- Kadaiya, Daman (Industrial Area)",,2011-09-20
462.0,20/09/2012,Andhra Pradesh,Vijayawada,Andhra Pradesh State Pollution Control Board,"Residential, Rural and other Areas",4.0,12.0,72.0,,"Benz Circle, Vijayawada",,2012-09-20
,20/1/2006,Assam,Guwahati,,Residential and others,4.0,23.3,257.0,377.0,Fire Brigade Station,,2006-01-20
,20/1/2008,Andhra Pradesh,Hyderabad,,Industrial Areas,2.6,6.7,68.0,132.0,Nacharam,,2008-01-20
,20/1/2009,Andhra Pradesh,Hyderabad,,Industrial Areas,4.8,28.6,111.0,319.0,C.I.T.D. Balanagar,,2009-01-20
95.0,20/1/2011,Andhra Pradesh,Hyderabad,Andhra Pradesh State Pollution Control Board,Industrial Area,5.0,32.0,119.0,336.0,"C.I.T.D., Balanagar, Plot no. A1 to A8, IDA, Hyderabad",,2011-01-20
641.0,20/1/2012,Maharashtra,Latur,Maharashtra State Pollution Control Board,Industrial Area,5.0,15.0,145.0,,"MIDC, Water Works, Latur",,2012-01-20
,20/10/2006,Andhra Pradesh,Tirupati,,Sensitive Areas,4.0,9.0,18.0,78.0,Reg.Science Centre,,2006-10-20
,20/10/2008,Andhra Pradesh,Hyderabad,,Industrial Areas,4.8,27.7,97.0,278.0,C.I.T.D. Balanagar,,2008-10-20
,20/10/2009,Andhra Pradesh,Guntur,,Residential and others,4.0,9.0,72.0,182.0,Hindu College Guntur,,2009-10-20
583.0,20/10/2011,Andhra Pradesh,Guntur,Andhra Pradesh State Pollution Control Board,"Residential, Rural and other Areas",4.4,9.5,77.0,197.0,"Near Hindu College, Market Road, Guntur",,2011-10-20
234.0,20/10/2012,Andhra Pradesh,Visakhapatnam,Andhra Pradesh State Pollution Control Board,"Residential, Rural and other Areas",10.0,9.0,40.0,,"Panchayat Raj office, Mindi, Visakhapatnam",,2012-10-20
,20/11/2006,Andhra Pradesh,Patancheru,,Residential and others,13.2,13.3,27.0,105.0,Police Station,,2006-11-20
,20/11/2008,Andhra Pradesh,Hyderabad,,Industrial Areas,5.3,27.7,115.0,324.0,C.I.T.D. Balanagar,,2008-11-20
,20/11/2009,Andhra Pradesh,Hyderabad,,Industrial Areas,4.9,24.5,102.0,295.0,C.I.T.D. Balanagar,,2009-11-20
577.0,20/11/2011,Andhra Pradesh,Nalgonda,Andhra Pradesh State Pollution Control Board,"Residential, Rural and other Areas",4.0,16.0,72.0,,"Beside Regional Office, APPCB Nalgonda",,2011-11-20
578.0,20/11/2012,Andhra Pradesh,Kakinada,Andhra Pradesh State Pollution Control Board,"Residential, Rural and other Areas",,,61.0,,"Top of the Office Building Ramanayyapeta, Kakinada",,2012-11-20
,20/12/2006,Andhra Pradesh,Hyderabad,,Industrial Areas,5.9,49.6,95.0,281.0,C.I.T.D. Balanagar,,2006-12-20
,20/12/2008,Andhra Pradesh,Hyderabad,,Industrial Areas,5.1,28.8,104.0,293.0,C.I.T.D. Balanagar,,2008-12-20
,20/12/2009,Andhra Pradesh,Hyderabad,,Industrial Areas,5.0,26.5,136.0,356.0,C.I.T.D. Balanagar,,2009-12-20
95.0,20/12/2011,Andhra Pradesh,Hyderabad,Andhra Pradesh State Pollution Control Board,Industrial Area,5.0,42.0,176.0,352.0,"C.I.T.D., Balanagar, Plot no. A1 to A8, IDA, Hyderabad",,2011-12-20
234.0,20/12/2012,Andhra Pradesh,Visakhapatnam,Andhra Pradesh State Pollution Control Board,"Residential, Rural and other Areas",6.0,9.0,34.0,,"Panchayat Raj office, Mindi, Visakhapatnam",,2012-12-20
,20/2/2006,Andhra Pradesh,Hyderabad,,Residential and others,5.1,32.5,128.0,341.0,Charminar,,2006-02-20
,20/2/2008,Andhra Pradesh,Hyderabad,,Industrial Areas,5.2,27.5,93.0,290.0,C.I.T.D. Balanagar,,2008-02-20
,20/2/2009,Andhra Pradesh,Hyderabad,,Industrial Areas,5.0,26.9,120.0,340.0,C.I.T.D. Balanagar,,2009-02-20
150.0,20/2/2011,Andhra Pradesh,Hyderabad,National Environmental Engineering Research Institute,"Residential, Rural and other Areas",18.0,45.0,26.0,,"Tarnaka, NEERI Lab. IICT Campus, Hyderabad",,2011-02-20
642.0,20/2/2012,Maharashtra,Latur,Maharashtra State Pollution Control Board,"Residential, Rural and other Areas",9.0,28.0,251.0,,"Shyamnagar, Terrence of Keshavraj Vidyalaya, Latur",,2012-02-20
,20/3/2006,Andhra Pradesh,Hyderabad,,Industrial Areas,5.5,30.8,95.0,257.0,C.I.T.D. Balanagar,,2006-03-20
,20/3/2008,Andhra Pradesh,Hyderabad,,Industrial Areas,5.6,34.7,97.0,284.0,C.I.T.D. Balanagar,,2008-03-20
,20/3/2009,Andhra Pradesh,Hyderabad,,Industrial Areas,5.4,28.1,114.0,334.0,C.I.T.D. Balanagar,,2009-03-20
642.0,20/3/2012,Maharashtra,Latur,Maharashtra State Pollution Control Board,"Residential, Rural and other Areas",5.0,20.0,89.0,,"Shyamnagar, Terrence of Keshavraj Vidyalaya, Latur",,2012-03-20
,20/4/2006,Andhra Pradesh,Hyderabad,,Sensitive Areas,4.8,16.9,74.0,175.0,Zoo Park,,2006-04-20
,20/4/2008,Andhra Pradesh,Hyderabad,,Industrial Areas,5.3,33.1,103.0,299.0,C.I.T.D. Balanagar,,2008-04-20
,20/4/2009,Andhra Pradesh,Hyderabad,,Industrial Areas,5.0,27.8,105.0,302.0,C.I.T.D. Balanagar,,2009-04-20
583.0,20/4/2011,Andhra Pradesh,Guntur,Andhra Pradesh State Pollution Control Board,"Residential, Rural and other Areas",4.0,10.2,71.0,180.0,"Near Hindu College, Market Road, Guntur",,2011-04-20
641.0,20/4/2012,Maharashtra,Latur,Maharashtra State Pollution Control Board,Industrial Area,6.0,13.0,74.0,,"MIDC, Water Works, Latur",,2012-04-20
,20/5/2006,Andhra Pradesh,Hyderabad,,Industrial Areas,5.3,30.9,97.0,297.0,Uppal,,2006-05-20
,20/5/2008,Andhra Pradesh,Hyderabad,,Industrial Areas,5.4,32.8,90.0,255.0,Uppal,,2008-05-20
,20/5/2009,Andhra Pradesh,Hyderabad,,Industrial Areas,5.2,26.3,88.0,267.0,C.I.T.D. Balanagar,,2009-05-20
582.0,20/5/2011,Andhra Pradesh,Chittoor,Andhra Pradesh State Pollution Control Board,Sensitive Area,4.0,9.0,37.0,115.0,"GNC Toll Gate Tirumala , Chittoor Dist.",,2011-05-20
,20/6/2006,Andhra Pradesh,Hyderabad,,Industrial Areas,6.1,33.7,96.0,292.0,C.I.T.D. Balanagar,,2006-06-20
,20/6/2008,Andhra Pradesh,Hyderabad,,Industrial Areas,5.2,33.2,107.0,312.0,C.I.T.D. Balanagar,,2008-06-20
,20/6/2009,Andhra Pradesh,Hyderabad,,Industrial Areas,5.0,24.7,110.0,322.0,C.I.T.D. Balanagar,,2009-06-20
95.0,20/6/2011,Andhra Pradesh,Hyderabad,Andhra Pradesh State Pollution Control Board,Industrial Area,5.0,18.0,82.0,270.0,"C.I.T.D., Balanagar, Plot no. A1 to A8, IDA, Hyderabad",,2011-06-20
,20/7/2006,Andhra Pradesh,Hyderabad,,Industrial Areas,5.5,30.6,82.0,254.0,C.I.T.D. Balanagar,,2006-07-20
,20/7/2008,Andhra Pradesh,Hyderabad,,Industrial Areas,5.2,34.0,104.0,302.0,C.I.T.D. Balanagar,,2008-07-20
,20/7/2009,Andhra Pradesh,Hyderabad,,Industrial Areas,5.0,26.0,96.0,292.0,C.I.T.D. Balanagar,,2009-07-20
95.0,20/7/2011,Andhra Pradesh,Hyderabad,Andhra Pradesh State Pollution Control Board,Industrial Area,5.0,23.0,46.0,168.0,"C.I.T.D., Balanagar, Plot no. A1 to A8, IDA, Hyderabad",,2011-07-20
641.0,20/7/2012,Maharashtra,Latur,Maharashtra State Pollution Control Board,Industrial Area,15.0,16.0,28.0,,"MIDC, Water Works, Latur",,2012-07-20
,20/8/2006,Andhra Pradesh,Vijayawada,,Residential and others,5.3,39.0,72.0,157.0,Benz Circle,,2006-08-20
,20/8/2008,Andhra Pradesh,Hyderabad,,Industrial Areas,5.0,34.2,102.0,312.0,C.I.T.D. Balanagar,,2008-08-20
,20/8/2009,Andhra Pradesh,Hyderabad,,Industrial Areas,5.1,25.5,63.0,177.0,C.I.T.D. Balanagar,,2009-08-20
468.0,20/8/2011,Andhra Pradesh,Patancheru,Andhra Pradesh State Pollution Control Board,"Residential, Rural and other Areas",6.0,25.0,51.0,,"Police Station, Medak, Patencheru",,2011-08-20
642.0,20/8/2012,Maharashtra,Latur,Maharashtra State Pollution Control Board,"Residential, Rural and other Areas",18.0,20.0,53.0,,"Shyamnagar, Terrence of Keshavraj Vidyalaya, Latur",,2012-08-20
,20/9/2006,Andhra Pradesh,Patancheru,,Residential and others,11.6,12.4,45.0,128.0,Police Station,,2006-09-20
,20/9/2008,Andhra Pradesh,Hyderabad,,Industrial Areas,5.0,31.1,76.0,222.0,C.I.T.D. Balanagar,,2008-09-20
,20/9/2009,Andhra Pradesh,Hyderabad,,Industrial Areas,4.7,23.3,94.0,269.0,C.I.T.D. Balanagar,,2009-09-20
583.0,20/9/2011,Andhra Pradesh,Guntur,Andhra Pradesh State Pollution Control Board,"Residential, Rural and other Areas",3.5,9.4,72.0,183.0,"Near Hindu College, Market Road, Guntur",,2011-09-20
56,21-01-03,Delhi,Delhi,Central Pollution Control Board,Industrial Area,7.0,31.0,204.0,569.0,,,2003-01-21
217.0,21-01-04,Assam,Guwahati,Assam State Pollution Control Board,"Residential, Rural and other Areas",3.5,25.5,250.0,,"Paltanbazar, Guwahati",,2004-01-21
,21-01-05,Andhra Pradesh,Hyderabad,,Industrial Areas,6.0,16.0,60.0,111.0,Nacharam,,2005-01-21
,21-01-07,Andhra Pradesh,Hyderabad,,Residential and others,5.2,49.2,133.0,401.0,Charminar,,2007-01-21
581.0,21-01-10,Andhra Pradesh,Khammam,Andhra Pradesh State Pollution Control Board,"Residential, Rural and other Areas",2.0,11.0,73.0,,"CER Club,S.C.C.L. township, writter basti, Kothagudem, Khammam Dist.",,2010-01-21
748.0,21-01-13,Andhra Pradesh,Ananthapur,Andhra Pradesh State Pollution Control Board,"Residential, Rural and other Areas",4.0,9.0,77.0,,"Kamalanagar, Ananthapur",,2013-01-21
748.0,21-01-14,Andhra Pradesh,Ananthapur,Andhra Pradesh State Pollution Control Board,"Residential, Rural and other Areas",4.0,9.0,92.0,,"Kamalanagar, Ananthapur",,2014-01-21
389.0,21-01-15,Andhra Pradesh,Tirupati,Andhra Pradesh State Pollution Control Board,Sensitive Area,5.0,11.0,58.0,,"Regional Science Centre, Chittoor Bypass Road, Tirupati",,2015-01-21
56,21-02-03,Delhi,Delhi,Central Pollution Control Board,Industrial Area,8.0,33.0,89.0,326.0,,,2003-02-21
22,21-02-04,Gujarat,Surat,Gujarat State Pollution Control Board,Industrial Area,23.0,33.0,119.0,156.0,"B.R.C. High School, Udhna, Surat",,2004-02-21
,21-02-05,Andhra Pradesh,Hyderabad,,Industrial Areas,5.5,37.8,86.0,309.0,C.I.T.D. Balanagar,,2005-02-21
,21-02-07,Andhra Pradesh,Hyderabad,,Residential and others,4.9,30.9,120.0,344.0,Charminar,,2007-02-21
150.0,21-02-10,Andhra Pradesh,Hyderabad,National Environmental Engineering Research Institute,"Residential, Rural and other Areas",7.0,21.0,90.0,,"Tarnaka, NEERI Lab. IICT Campus, Hyderabad",,2010-02-21
542.0,21-02-13,Assam,Bongaigaon,Assam State Pollution Control Board,"Residential, Rural and other Areas",6.0,13.0,54.0,,"Campus of Oil India Ltd. PS-6, Bongaigaon, Chirang",,2013-02-21
583.0,21-02-14,Andhra Pradesh,Guntur,Andhra Pradesh State Pollution Control Board,"Residential, Rural and other Areas",4.0,18.0,80.0,,"Near Hindu College, Market Road, Guntur",,2014-02-21
193.0,21-02-15,Assam,Guwahati,Assam State Pollution Control Board,"Residential, Rural and other Areas",7.0,13.0,101.0,,"Head Office, Bamunimaidan, Guwahati",,2015-02-21
58,21-03-03,Delhi,Delhi,Central Pollution Control Board,Industrial Area,9.0,30.0,77.0,340.0,,,2003-03-21
322.0,21-03-04,Odisha,Bhubaneswar,Odisha State Pollution Control Board,"Residential, Rural and other Areas",2.0,6.33,42.33,139.33,"SPCB Building, Bhubaneshwar",,2004-03-21
,21-03-05,Andhra Pradesh,Hyderabad,,Industrial Areas,9.8,14.7,51.0,130.0,Nacharam,,2005-03-21
,21-03-07,Andhra Pradesh,Hyderabad,,Industrial Areas,3.5,,69.0,146.0,Nacharam,,2007-03-21
577.0,21-03-10,Andhra Pradesh,Nalgonda,Andhra Pradesh State Pollution Control Board,"Residential, Rural and other Areas",5.0,24.0,82.0,,"Beside Regional Office, APPCB Nalgonda",,2010-03-21
748.0,21-03-13,Andhra Pradesh,Ananthapur,Andhra Pradesh State Pollution Control Board,"Residential, Rural and other Areas",4.0,9.0,82.0,,"Kamalanagar, Ananthapur",,2013-03-21
750.0,21-03-14,Andhra Pradesh,Eluru,Andhra Pradesh State Pollution Control Board,"Residential, Rural and other Areas",,,108.0,,"ASRAM Diagnostic Center, Eluru",,2014-03-21
193.0,21-03-15,Assam,Guwahati,Assam State Pollution Control Board,"Residential, Rural and other Areas",10.0,20.0,215.0,,"Head Office, Bamunimaidan, Guwahati",,2015-03-21
55,21-04-03,Delhi,Delhi,Central Pollution Control Board,Industrial Area,11.0,39.0,97.0,301.0,,,2003-04-21
263.0,21-04-04,Chandigarh,Chandigarh,Chandigarh Pollution Control Committee,"Residential, Rural and other Areas",2.0,8.0,282.0,465.0,"Sector-17 C, Chandigarh",,2004-04-21
,21-04-05,Andhra Pradesh,Hyderabad,,Residential and others,5.1,30.4,101.0,275.0,Charminar,,2005-04-21
,21-04-07,Andhra Pradesh,Hyderabad,,Residential and others,5.2,34.8,152.0,365.0,Charminar,,2007-04-21
582.0,21-04-10,Andhra Pradesh,Chittoor,Andhra Pradesh State Pollution Control Board,Sensitive Area,4.0,9.0,38.0,,"GNC Toll Gate Tirumala , Chittoor Dist.",,2010-04-21
677.0,21-04-13,Karnataka,Raichur,Karnataka State Pollution Control Board,"Residential, Rural and other Areas",9.0,13.0,59.0,,"KSPCB Office Premises, Raichur",,2013-04-21
520.0,21-04-14,Assam,Bongaigaon,Assam State Pollution Control Board,"Residential, Rural and other Areas",9.0,19.0,59.0,,"Barpara Office Building, Bongaigaon",,2014-04-21
389.0,21-04-15,Andhra Pradesh,Tirupati,Andhra Pradesh State Pollution Control Board,Sensitive Area,5.0,11.0,61.0,,"Regional Science Centre, Chittoor Bypass Road, Tirupati",,2015-04-21
58,21-05-03,Delhi,Delhi,Central Pollution Control Board,Industrial Area,14.0,41.0,,645.0,,,2003-05-21
95.0,21-05-04,Andhra Pradesh,Hyderabad,Andhra Pradesh State Pollution Control Board,Industrial Area,4.5,36.2,68.0,136.3,"C.I.T.D., Balanagar, Plot no. A1 to A8, IDA, Hyderabad",,2004-05-21
,21-05-05,Andhra Pradesh,Hyderabad,,Industrial Areas,4.7,45.7,153.0,427.0,C.I.T.D. Balanagar,,2005-05-21
,21-05-07,Andhra Pradesh,Hyderabad,,Residential and others,5.7,9.1,47.0,115.0,ABIDS Circle,,2007-05-21
150.0,21-05-10,Andhra Pradesh,Hyderabad,National Environmental Engineering Research Institute,"Residential, Rural and other Areas",8.0,31.0,97.0,,"Tarnaka, NEERI Lab. IICT Campus, Hyderabad",,2010-05-21
748.0,21-05-13,Andhra Pradesh,Ananthapur,Andhra Pradesh State Pollution Control Board,"Residential, Rural and other Areas",4.0,14.0,47.0,,"Kamalanagar, Ananthapur",,2013-05-21
520.0,21-05-14,Assam,Bongaigaon,Assam State Pollution Control Board,"Residential, Rural and other Areas",5.0,13.0,46.0,,"Barpara Office Building, Bongaigaon",,2014-05-21
193.0,21-05-15,Assam,Guwahati,Assam State Pollution Control Board,"Residential, Rural and other Areas",7.0,14.0,98.0,,"Head Office, Bamunimaidan, Guwahati",,2015-05-21
19.0,21-05-88,Rajasthan,Kota,Rajasthan Pollution Control Board,Industrial Area,3.9,50.2,,,,,1988-05-21
144,21-06-03,Delhi,Delhi,,"Residential, Rural and other Areas",6.0,36.0,,197.0,,,2003-06-21
95.0,21-06-04,Andhra Pradesh,Hyderabad,Andhra Pradesh State Pollution Control Board,Industrial Area,4.6,26.8,67.0,211.3,"C.I.T.D., Balanagar, Plot no. A1 to A8, IDA, Hyderabad",,2004-06-21
,21-06-05,Andhra Pradesh,Hyderabad,,Industrial Areas,4.9,15.2,32.0,376.0,C.I.T.D. Balanagar,,2005-06-21
,21-06-07,Andhra Pradesh,Hyderabad,,Residential and others,5.1,33.0,44.0,147.0,Charminar,,2007-06-21
151.0,21-06-10,Andhra Pradesh,Hyderabad,National Environmental Engineering Research Institute,Industrial Area,2.0,17.0,24.0,,"Nacharam, Industrial Estate, Premises of IICT (APIDC), Hyderabad",,2010-06-21
748.0,21-06-13,Andhra Pradesh,Ananthapur,Andhra Pradesh State Pollution Control Board,"Residential, Rural and other Areas",4.0,14.0,176.0,,"Kamalanagar, Ananthapur",,2013-06-21
542.0,21-06-14,Assam,Bongaigaon,Assam State Pollution Control Board,"Residential, Rural and other Areas",8.0,13.0,57.0,,"Campus of Oil India Ltd. PS-6, Bongaigaon, Chirang",,2014-06-21
389.0,21-06-15,Andhra Pradesh,Tirupati,Andhra Pradesh State Pollution Control Board,Sensitive Area,5.0,11.0,70.0,,"Regional Science Centre, Chittoor Bypass Road, Tirupati",,2015-06-21
55,21-07-03,Delhi,Delhi,Central Pollution Control Board,Industrial Area,9.0,33.0,53.0,105.0,,,2003-07-21
217.0,21-07-04,Assam,Guwahati,Assam State Pollution Control Board,"Residential, Rural and other Areas",3.3,15.0,221.0,,"Paltanbazar, Guwahati",,2004-07-21
,21-07-05,Andhra Pradesh,Hyderabad,,Industrial Areas,3.4,24.7,53.0,90.0,Nacharam,,2005-07-21
,21-07-07,Andhra Pradesh,Hyderabad,,Residential and others,4.9,26.4,80.0,248.0,Charminar,,2007-07-21
582.0,21-07-10,Andhra Pradesh,Chittoor,Andhra Pradesh State Pollution Control Board,Sensitive Area,4.0,9.0,40.0,,"GNC Toll Gate Tirumala , Chittoor Dist.",,2010-07-21
748.0,21-07-13,Andhra Pradesh,Ananthapur,Andhra Pradesh State Pollution Control Board,"Residential, Rural and other Areas",4.0,14.0,55.0,,"Kamalanagar, Ananthapur",,2013-07-21
520.0,21-07-14,Assam,Bongaigaon,Assam State Pollution Control Board,"Residential, Rural and other Areas",7.0,14.0,45.0,,"Barpara Office Building, Bongaigaon",,2014-07-21
193.0,21-07-15,Assam,Guwahati,Assam State Pollution Control Board,"Residential, Rural and other Areas",6.0,10.0,61.0,,"Head Office, Bamunimaidan, Guwahati",,2015-07-21
56,21-08-03,Delhi,Delhi,Central Pollution Control Board,Industrial Area,5.0,29.0,75.0,282.0,,,2003-08-21
284.0,21-08-04,Bihar,Patna,Bihar Sate Pollution Control Board,"Residential, Rural and other Areas",9.0,21.0,53.0,105.0,"Gandhi Maidan Test Centre,Patna",,2004-08-21
,21-08-05,Andhra Pradesh,Hyderabad,,Industrial Areas,4.4,19.5,52.0,349.0,C.I.T.D. Balanagar,,2005-08-21
,21-08-07,Andhra Pradesh,Hyderabad,,Industrial Areas,6.7,25.0,50.0,91.0,Nacharam,,2007-08-21
579.0,21-08-10,Andhra Pradesh,Warangal,Andhra Pradesh State Pollution Control Board,"Residential, Rural and other Areas",2.0,7.0,30.0,,"KUDA Office, Hanumakonda, Warangal Dist.",,2010-08-21
748.0,21-08-13,Andhra Pradesh,Ananthapur,Andhra Pradesh State Pollution Control Board,"Residential, Rural and other Areas",4.0,14.0,35.0,,"Kamalanagar, Ananthapur",,2013-08-21
520.0,21-08-14,Assam,Bongaigaon,Assam State Pollution Control Board,"Residential, Rural and other Areas",6.0,12.0,37.0,,"Barpara Office Building, Bongaigaon",,2014-08-21
193.0,21-08-15,Assam,Guwahati,Assam State Pollution Control Board,"Residential, Rural and other Areas",5.0,10.0,63.0,,"Head Office, Bamunimaidan, Guwahati",,2015-08-21
393.0,21-09-04,Andhra Pradesh,Hyderabad,Andhra Pradesh State Pollution Control Board,"Residential, Rural and other Areas",2.4,22.2,113.7,198.0,"Paradise, Hyderabad",,2004-09-21
,21-09-05,Andhra Pradesh,Hyderabad,,Industrial Areas,,22.1,20.0,124.0,Nacharam,,2005-09-21
,21-09-07,Andhra Pradesh,Hyderabad,,Residential and others,5.0,31.5,60.0,266.0,Charminar,,2007-09-21
583.0,21-09-10,Andhra Pradesh,Guntur,Andhra Pradesh State Pollution Control Board,"Residential, Rural and other Areas",2.0,11.0,73.0,,"Near Hindu College, Market Road, Guntur",,2010-09-21
748.0,21-09-13,Andhra Pradesh,Ananthapur,Andhra Pradesh State Pollution Control Board,"Residential, Rural and other Areas",4.0,14.0,42.0,,"Kamalanagar, Ananthapur",,2013-09-21
459.0,21-09-14,Karnataka,Gulbarga,Karnataka State Pollution Control Board,Sensitive Area,2.0,5.0,38.0,,"Government Hospital, Gulbarga",,2014-09-21
193.0,21-09-15,Assam,Guwahati,Assam State Pollution Control Board,"Residential, Rural and other Areas",7.0,11.0,77.0,,"Head Office, Bamunimaidan, Guwahati",,2015-09-21
55,21-10-03,Delhi,Delhi,Central Pollution Control Board,Industrial Area,15.0,48.0,154.0,422.0,,,2003-10-21
393.0,21-10-04,Andhra Pradesh,Hyderabad,Andhra Pradesh State Pollution Control Board,"Residential, Rural and other Areas",2.5,23.0,72.7,297.7,"Paradise, Hyderabad",,2004-10-21
,21-10-05,Andhra Pradesh,Hyderabad,,Industrial Areas,4.0,16.4,32.0,92.0,Nacharam,,2005-10-21
,21-10-07,Assam,Guwahati,,Residential and others,12.5,17.5,81.0,122.0,Fire Brigade Station,,2007-10-21
465.0,21-10-10,Andhra Pradesh,Ramagundam,Andhra Pradesh State Pollution Control Board,"Residential, Rural and other Areas",5.0,17.0,35.0,,"RTC Bus Depot, Karim Nagar, Ramagundam",,2010-10-21
520.0,21-10-13,Assam,Bongaigaon,Assam State Pollution Control Board,"Residential, Rural and other Areas",7.0,14.0,56.0,,"Barpara Office Building, Bongaigaon",,2013-10-21
542.0,21-10-14,Assam,Bongaigaon,Assam State Pollution Control Board,"Residential, Rural and other Areas",7.0,12.0,61.0,,"Campus of Oil India Ltd. PS-6, Bongaigaon, Chirang",,2014-10-21
520.0,21-10-15,Assam,Bongaigaon,Assam State Pollution Control Board,"Residential, Rural and other Areas",11.0,18.0,66.0,,"Barpara Office Building, Bongaigaon",,2015-10-21
58,21-11-03,Delhi,Delhi,Central Pollution Control Board,Industrial Area,13.0,38.0,263.0,,,,2003-11-21
393.0,21-11-04,Andhra Pradesh,Hyderabad,Andhra Pradesh State Pollution Control Board,"Residential, Rural and other Areas",3.2,32.1,,,"Paradise, Hyderabad",,2004-11-21
,21-11-05,Assam,Guwahati,,Residential and others,3.8,25.3,118.0,225.0,Fire Brigade Station,,2005-11-21
,21-11-07,Andhra Pradesh,Hyderabad,,Residential and others,5.2,31.7,118.0,333.0,Charminar,,2007-11-21
586.0,21-11-10,Assam,Margherita,Assam State Pollution Control Board,"Residential, Rural and other Areas",12.0,22.0,60.0,,"Coal India Office Complex, Margherita,Tinsukia,Assam",,2010-11-21
748.0,21-11-13,Andhra Pradesh,Ananthapur,Andhra Pradesh State Pollution Control Board,"Residential, Rural and other Areas",4.0,14.0,37.0,,"Kamalanagar, Ananthapur",,2013-11-21
538.0,21-11-14,Assam,Dibrugarh,Assam State Pollution Control Board,"Residential, Rural and other Areas",5.0,11.0,55.0,,"Dibrugarh Office Building, Dibrugarh",,2014-11-21
193.0,21-11-15,Assam,Guwahati,Assam State Pollution Control Board,"Residential, Rural and other Areas",7.0,13.0,76.0,,"Head Office, Bamunimaidan, Guwahati",,2015-11-21
95.0,21-12-04,Andhra Pradesh,Hyderabad,Andhra Pradesh State Pollution Control Board,Industrial Area,4.1,32.9,159.7,452.3,"C.I.T.D., Balanagar, Plot no. A1 to A8, IDA, Hyderabad",,2004-12-21
,21-12-05,Andhra Pradesh,Hyderabad,,Industrial Areas,4.4,17.5,,110.0,Nacharam,,2005-12-21
,21-12-07,Andhra Pradesh,Hyderabad,,Residential and others,5.4,31.2,107.0,346.0,Charminar,,2007-12-21
583.0,21-12-10,Andhra Pradesh,Guntur,Andhra Pradesh State Pollution Control Board,"Residential, Rural and other Areas",2.0,11.0,75.0,,"Near Hindu College, Market Road, Guntur",,2010-12-21
95.0,21-12-13,Andhra Pradesh,Hyderabad,Andhra Pradesh State Pollution Control Board,Industrial Area,5.0,35.0,258.0,,"C.I.T.D., Balanagar, Plot no. A1 to A8, IDA, Hyderabad",,2013-12-21
512.0,21-12-14,Maharashtra,Aurangabad,Maharashtra State Pollution Control Board,Sensitive Area,12.0,40.0,132.0,,"Bibi-Ka-Maqbara, Aurangabad",,2014-12-21
193.0,21-12-15,Assam,Guwahati,Assam State Pollution Control Board,"Residential, Rural and other Areas",8.0,22.0,85.0,,"Head Office, Bamunimaidan, Guwahati",,2015-12-21
,21/01/2006,Maharashtra,Aurangabad (MS),,Residential and others,4.5,29.5,,,S.B.E.S. College,,2006-01-21
560,21/01/2011,Daman & Diu,Daman,"Daman Diu, Dadra & Nagar Heveli Pollution Control Committee",Industrial Area,7.3,18.1,,42.0,"Kadaiya Industrial Area, Village- Kadaiya, Daman (Industrial Area)",,2011-01-21
95.0,21/01/2012,Andhra Pradesh,Hyderabad,Andhra Pradesh State Pollution Control Board,Industrial Area,5.0,39.0,135.0,,"C.I.T.D., Balanagar, Plot no. A1 to A8, IDA, Hyderabad",,2012-01-21
,21/02/2006,Maharashtra,Aurangabad (MS),,Sensitive Areas,6.0,31.3,,,Bibi-Ka-Maqbara,,2006-02-21
558.0,21/02/2011,Dadra & Nagar Haveli,Khadoli,"Daman Diu, Dadra & Nagar Heveli Pollution Control Committee",Industrial Area,7.5,19.4,,42.0,"Khadoli Industrial Area, Village- Khadoli, Silvassa",,2011-02-21
583.0,21/02/2012,Andhra Pradesh,Guntur,Andhra Pradesh State Pollution Control Board,"Residential, Rural and other Areas",6.0,11.0,78.0,,"Near Hindu College, Market Road, Guntur",,2012-02-21
,21/03/2006,Maharashtra,Aurangabad (MS),,Sensitive Areas,2.3,16.0,,,Bibi-Ka-Maqbara,,2006-03-21
558.0,21/03/2011,Dadra & Nagar Haveli,Khadoli,"Daman Diu, Dadra & Nagar Heveli Pollution Control Committee",Industrial Area,7.4,19.2,24.0,42.0,"Khadoli Industrial Area, Village- Khadoli, Silvassa",,2011-03-21
583.0,21/03/2012,Andhra Pradesh,Guntur,Andhra Pradesh State Pollution Control Board,"Residential, Rural and other Areas",6.0,11.0,76.0,,"Near Hindu College, Market Road, Guntur",,2012-03-21
,21/04/2006,Maharashtra,Aurangabad (MS),,Residential and others,4.5,18.0,102.0,249.0,S.B.E.S. College,,2006-04-21
558.0,21/04/2011,Dadra & Nagar Haveli,Khadoli,"Daman Diu, Dadra & Nagar Heveli Pollution Control Committee",Industrial Area,7.6,19.7,,42.0,"Khadoli Industrial Area, Village- Khadoli, Silvassa",,2011-04-21
95.0,21/04/2012,Andhra Pradesh,Hyderabad,Andhra Pradesh State Pollution Control Board,Industrial Area,5.0,43.0,97.0,,"C.I.T.D., Balanagar, Plot no. A1 to A8, IDA, Hyderabad",,2012-04-21
,21/05/2006,Maharashtra,Nagpur,,Residential and others,9.8,40.9,50.0,213.0,Institution of Eng.,,2006-05-21
560,21/05/2011,Daman & Diu,Daman,"Daman Diu, Dadra & Nagar Heveli Pollution Control Committee",Industrial Area,7.6,20.3,,42.0,"Kadaiya Industrial Area, Village- Kadaiya, Daman (Industrial Area)",,2011-05-21
583.0,21/05/2012,Andhra Pradesh,Guntur,Andhra Pradesh State Pollution Control Board,"Residential, Rural and other Areas",6.0,11.0,73.0,,"Near Hindu College, Market Road, Guntur",,2012-05-21
,21/06/2006,Maharashtra,Aurangabad (MS),,Residential and others,6.0,15.3,52.0,120.0,C.A.D.A. Office,,2006-06-21
560,21/06/2011,Daman & Diu,Daman,"Daman Diu, Dadra & Nagar Heveli Pollution Control Committee",Industrial Area,7.3,19.0,,42.0,"Kadaiya Industrial Area, Village- Kadaiya, Daman (Industrial Area)",,2011-06-21
468.0,21/06/2012,Andhra Pradesh,Patancheru,Andhra Pradesh State Pollution Control Board,"Residential, Rural and other Areas",6.0,22.0,112.0,,"Police Station, Medak, Patencheru",,2012-06-21
,21/07/2006,Maharashtra,Chandrapur,,Residential and others,22.8,38.0,121.0,160.0,Nagar Parishad,,2006-07-21
558.0,21/07/2011,Dadra & Nagar Haveli,Khadoli,"Daman Diu, Dadra & Nagar Heveli Pollution Control Committee",Industrial Area,7.3,18.1,,28.0,"Khadoli Industrial Area, Village- Khadoli, Silvassa",,2011-07-21
542.0,21/07/2012,Assam,Bongaigaon,Assam State Pollution Control Board,"Residential, Rural and other Areas",4.8,9.4,44.0,,"Campus of Oil India Ltd. PS-6, Bongaigaon, Chirang",,2012-07-21
,21/08/2006,Maharashtra,Aurangabad (MS),,Sensitive Areas,4.3,11.0,24.0,55.0,Bibi-Ka-Maqbara,,2006-08-21
155,21/08/2011,Gujarat,Ahmedabad,National Environmental Engineering Research Institute,"Residential, Rural and other Areas",10.0,19.0,50.0,,"R.C. High School, Mirzapur, Ahmadabad",,2011-08-21
583.0,21/08/2012,Andhra Pradesh,Guntur,Andhra Pradesh State Pollution Control Board,"Residential, Rural and other Areas",6.0,11.0,76.0,,"Near Hindu College, Market Road, Guntur",,2012-08-21
,21/09/2006,Maharashtra,Aurangabad (MS),,Residential and others,3.5,20.8,40.0,96.0,C.A.D.A. Office,,2006-09-21
60,21/09/2011,Delhi,Delhi,Central Pollution Control Board,"Residential, Rural and other Areas",4.0,40.0,99.0,,"Siri Fort, Delhi",,2011-09-21
95.0,21/09/2012,Andhra Pradesh,Hyderabad,Andhra Pradesh State Pollution Control Board,Industrial Area,5.0,22.0,99.0,,"C.I.T.D., Balanagar, Plot no. A1 to A8, IDA, Hyderabad",,2012-09-21
,21/1/2006,Andhra Pradesh,Vijayawada,,Residential and others,4.0,33.4,75.0,168.0,Benz Circle,,2006-01-21
,21/1/2008,Andhra Pradesh,Hyderabad,,Industrial Areas,5.3,32.2,75.0,325.0,C.I.T.D. Balanagar,,2008-01-21
,21/1/2009,Andhra Pradesh,Hyderabad,,Residential and others,5.1,27.8,111.0,325.0,Charminar,,2009-01-21
394.0,21/1/2011,Andhra Pradesh,Hyderabad,Andhra Pradesh State Pollution Control Board,"Residential, Rural and other Areas",5.0,31.0,122.0,355.0,"Charminar, Hyderabad",,2011-01-21
641.0,21/1/2012,Maharashtra,Latur,Maharashtra State Pollution Control Board,Industrial Area,5.0,21.0,99.0,,"MIDC, Water Works, Latur",,2012-01-21
,21/10/2006,Andhra Pradesh,Hyderabad,,Sensitive Areas,4.8,31.9,78.0,200.0,Zoo Park,,2006-10-21
,21/10/2008,Andhra Pradesh,Hyderabad,,Industrial Areas,,36.1,37.0,99.0,Nacharam,,2008-10-21
,21/10/2009,Andhra Pradesh,Hyderabad,,Residential and others,5.0,26.3,111.0,326.0,Paradise,,2009-10-21
150.0,21/10/2011,Andhra Pradesh,Hyderabad,National Environmental Engineering Research Institute,"Residential, Rural and other Areas",3.0,38.0,28.0,,"Tarnaka, NEERI Lab. IICT Campus, Hyderabad",,2011-10-21
583.0,21/10/2012,Andhra Pradesh,Guntur,Andhra Pradesh State Pollution Control Board,"Residential, Rural and other Areas",4.0,11.0,75.0,,"Near Hindu College, Market Road, Guntur",,2012-10-21
,21/11/2006,Andhra Pradesh,Hyderabad,,Residential and others,4.9,29.7,126.0,334.0,Charminar,,2006-11-21
,21/11/2008,Andhra Pradesh,Hyderabad,,Residential and others,5.3,27.2,94.0,275.0,Charminar,,2008-11-21
,21/11/2009,Andhra Pradesh,Hyderabad,,Residential and others,5.0,25.6,79.0,242.0,Charminar,,2009-11-21
583.0,21/11/2011,Andhra Pradesh,Guntur,Andhra Pradesh State Pollution Control Board,"Residential, Rural and other Areas",4.5,9.4,76.0,190.0,"Near Hindu College, Market Road, Guntur",,2011-11-21
583.0,21/11/2012,Andhra Pradesh,Guntur,Andhra Pradesh State Pollution Control Board,"Residential, Rural and other Areas",4.0,15.0,73.0,,"Near Hindu College, Market Road, Guntur",,2012-11-21
,21/12/2006,Andhra Pradesh,Hyderabad,,Residential and others,5.5,46.0,113.0,331.0,Charminar,,2006-12-21
,21/12/2008,Andhra Pradesh,Hyderabad,,Residential and others,5.1,26.8,101.0,287.0,Charminar,,2008-12-21
,21/12/2009,Andhra Pradesh,Hyderabad,,Residential and others,5.2,27.6,126.0,323.0,Charminar,,2009-12-21
577.0,21/12/2011,Andhra Pradesh,Nalgonda,Andhra Pradesh State Pollution Control Board,"Residential, Rural and other Areas",4.0,18.0,88.0,,"Beside Regional Office, APPCB Nalgonda",,2011-12-21
583.0,21/12/2012,Andhra Pradesh,Guntur,Andhra Pradesh State Pollution Control Board,"Residential, Rural and other Areas",5.0,17.0,76.0,,"Near Hindu College, Market Road, Guntur",,2012-12-21
,21/2/2006,Andhra Pradesh,Hyderabad,,Industrial Areas,13.8,36.8,156.0,375.0,C.I.T.D. Balanagar,,2006-02-21
,21/2/2008,Andhra Pradesh,Hyderabad,,Industrial Areas,5.3,31.4,102.0,300.0,Uppal,,2008-02-21
,21/2/2009,Andhra Pradesh,Hyderabad,,Residential and others,5.0,27.7,96.0,270.0,Charminar,,2009-02-21
582.0,21/2/2011,Andhra Pradesh,Chittoor,Andhra Pradesh State Pollution Control Board,Sensitive Area,4.0,9.0,40.0,114.0,"GNC Toll Gate Tirumala , Chittoor Dist.",,2011-02-21
642.0,21/2/2012,Maharashtra,Latur,Maharashtra State Pollution Control Board,"Residential, Rural and other Areas",9.0,22.0,146.0,,"Shyamnagar, Terrence of Keshavraj Vidyalaya, Latur",,2012-02-21
,21/3/2006,Andhra Pradesh,Hyderabad,,Residential and others,5.4,30.9,112.0,298.0,Paradise,,2006-03-21
,21/3/2008,Andhra Pradesh,Hyderabad,,Residential and others,5.5,33.8,72.0,209.0,Charminar,,2008-03-21
,21/3/2009,Andhra Pradesh,Hyderabad,,Residential and others,4.9,26.2,129.0,385.0,Charminar,,2009-03-21
583.0,21/3/2011,Andhra Pradesh,Guntur,Andhra Pradesh State Pollution Control Board,"Residential, Rural and other Areas",4.0,12.2,73.0,186.0,"Near Hindu College, Market Road, Guntur",,2011-03-21
,21/4/2006,Andhra Pradesh,Hyderabad,,Industrial Areas,6.3,29.5,105.0,299.0,C.I.T.D. Balanagar,,2006-04-21
,21/4/2008,Andhra Pradesh,Hyderabad,,Industrial Areas,2.9,12.8,50.0,130.0,Nacharam,,2008-04-21
,21/4/2009,Andhra Pradesh,Hyderabad,,Residential and others,5.1,26.8,114.0,334.0,Charminar,,2009-04-21
